url,title,description,urlToImage,date
https://www.mirror.co.uk/news/world-news/breaking-sri-lanka-attack-death-14599917,Sri Lanka attack death toll has gone down by more than 100 - Mirror Online,"Authorities now say 'around' 253 people died, a lower figure than the estimated 359 stated previously",https://i2-prod.mirror.co.uk/incoming/article14441592.ece/ALTERNATES/s1200/0_SRI-LANKA-ATTACKS.jpg,2019-04-25
https://montrealgazette.com/news/world/hundreds-of-ucla-cal-state-students-staff-under-quarantine-amid-measles-outbreak/wcm/198ed5a4-1a72-4d86-b00d-a53a1a92ab42,"Hundreds of UCLA, Cal State students, staff under quarantine amid measles outbreak - Montreal Gazette",LOS ANGELES — A quarantine order was issued Thursday for hundreds of students and staff at two Los Angeles universities who may have been exposed to measles and either have not been vaccinate…,https://postmediacanoe.files.wordpress.com/2019/04/la409-ap.jpg,2019-04-25
https://www.ottawamatters.com/local-news/quebec-officials-warn-of-possible-dam-failure-on-rouge-river-1392463,Quebec officials warn of possible dam failure on Rouge River - OttawaMatters.com,Read the full story and comment on OttawaMatters.,https://vmcdn.ca/f/files/shared/feeds/global/2019/01/surete-de-quebec.jpg;w=630,2019-04-25
https://www.cp24.com/sports/toronto-raptors-news/for-raptors-kyle-lowry-might-be-as-valuable-as-ever-1.4395189,"For Raptors, Kyle Lowry might be as valuable as ever - CP24 Toronto's Breaking News",The biggest play Kyle Lowry made in the first round of the Eastern Conference playoffs might have been overlooked.,https://www.cp24.com/polopoly_fs/1.3768072.1516419610!/httpImage/image.jpg_gen/derivatives/landscape_620/image.jpg,2019-04-25
https://www.dailymail.co.uk/news/article-6961137/Prince-William-kicks-day-two-New-Zealand-tour-visiting-Christchurch-massacre-sites.html,Prince William kicks off day two of his New Zealand tour visiting Christchurch massacre sites - Daily Mail,"The second day of the Duke of Cambridge's sombre and low-key visit to New Zealand included a visit to Christchurch Hospital, where five people remain in care after the shootings.",https://i.dailymail.co.uk/1s/2019/04/25/23/12727896-0-image-a-74_1556230241253.jpg,2019-04-25
https://www.abc.net.au/radionational/programs/breakfast/science-with-tegan-taylor/11048138,Science with Tegan Taylor: Caffeine giving solar cells a boost - ABC News,"Perhaps you started today with a cup of tea or coffee, hoping that little jolt of caffeine would give you an energy boost for the day. Well, it seems it's not only humans who benefit from caffeine.",https://www.abc.net.au/radionational/image/11048158-1x1-700x700.jpg,2019-04-25
https://www.cairnspost.com.au/news/world/world-health-organisation-issues-strict-guidelines-for-children-screen-time/video/c7afc875ce8947187c05ed487ab03bcc,World Health Organisation issues strict guidelines for children screen time - The Cairns Post,The World Health Organisation has urged parents to ban children under the age of two from watching television or staring at iPads or smartphones. Parents are being advised to limit screen time to no more than an hour a day for children aged two to four. The i…,https://content.api.news/v3/images/bin/9d63f011c6ce6cb7077a01b9106533da,2019-04-25
https://www.canberratimes.com.au/story/6091064/sri-lankan-bomber-investigated-for-terrorism-in-australia/,Sri Lankan bomber investigated for terrorism in Australia - The Canberra Times,"One of the Sri Lankan bombers who studied at an Australian university was investigated by the Joint Counter Terrorism Team in 2014, The Australian reports. Ab...",https://nnimgt-a.akamaihd.net/transform/v1/crop/frm/fdcx/doc7516n9cxwzp147usl5tz.jpg/r9_226_3758_2344_w1200_h678_fmax.jpg,2019-04-25
https://www.news.com.au/national/breaking-news/shorten-tries-to-ease-big-business-concern/news-story/f153f7b6d3325bd598869598fcf96c53,Shorten tries to ease big business concern - NEWS.com.au,"Bill Shorten has moved to reassure the corporate sector that Labor would work with big business, but was committed to its policies that are causing some concern.",https://www.news.com.au/wp-content/themes/vip/newscorpau-nca/assets/dist/img/common/placeholders/newscomau-major.png,2019-04-25
http://theconversation.com/why-the-idea-of-alien-life-now-seems-inevitable-and-possibly-imminent-115643,Why the idea of alien life now seems inevitable and possibly imminent - The Conversation AU,The ancient question 'Are we alone?' has graduated from being a philosophical musing to a testable hypothesis. We should be prepared for an answer.,https://images.theconversation.com/files/269753/original/file-20190417-139084-2drij5.jpg?ixlib=rb-1.1.0&rect=1%2C102%2C1037%2C518&q=45&auto=format&w=1356&h=668&fit=crop,2019-04-25
https://www.cnbc.com/2019/04/25/amazon-spending-800-mln-to-make-free-one-day-shipping-prime-default.html,Amazon to spend $800 million this quarter to make free one-day shipping the default for Prime members - CNBC,Prime members are soon going to see the default free two-day shipping go to one-day shipping.,https://fm.cnbc.com/applications/cnbc.com/resources/img/editorial/2019/04/22/105865387-1556000922564gettyimages-996189544.1910x1000.jpeg,2019-04-25
https://www.foxnews.com/us/state-judge-charged-with-helping-man-evade-immigration-agent,State judge charged with helping man evade immigration agent - Fox News,A Massachusetts judge has been indicted on obstruction of justice charges for allegedly helping a man in the country illegally to evade immigration officials.,https://static.foxnews.com/foxnews.com/content/uploads/2019/04/ContentBroker_contentid-88f89d96bc0f43dd98a4090f85019c10.png,2019-04-25
https://www.nhl.com/sharks/news/sharks-sign-forward-danil-yurtaikin/c-307023708,Sharks Sign Forward Danil Yurtaikin - NHL.com,"The San Jose Sharks announced today that they have signed free agent forward Danil Yurtaikin to a standard, entry-level contract.",https://nhl.bamcontent.com/images/photos/307028468/1024x576/cut.jpg,2019-04-25
https://www.harpersbazaar.com/celebrity/latest/a27275059/kate-middleton-prince-william-visit-meghan-markle-prince-harry-frogmore/,Prince William & Duchess Kate Have Visited Meghan at Frogmore Cottage - HarpersBAZAAR.com,Sources tell BAZAAR.com the Duke and Duchess of Cambridge were guests at Meghan and Harry’s new Windsor home on Easter Sunday.,"https://hips.hearstapps.com/hmg-prod.s3.amazonaws.com/images/hbz-meghan-markle-prince-harry-kate-middleton-prince-william-index-1556230206.jpg?crop=1xw:1xh;center,top&resize=1200:*",2019-04-25
https://www.investing.com/news/technology-news/uber-to-kick-off-investor-roadshow-with-ipo-terms-on-friday-1846772,Uber to kick off investor roadshow with IPO terms on Friday - Investing.com,Uber to kick off investor road show with IPO terms on Friday,https://i-invdn-com.akamaized.net/trkd-images/LYNXNPEF3O26O_L.jpg,2019-04-25
https://www.nytimes.com/2019/04/25/science/emperor-penguins-antarctica.html,An Emperor Penguin Colony in Antarctica Vanishes - The New York Times,"A colony in Halley Bay lost more than 10,000 chicks in 2016 and hasn’t recovered. Some adults have relocated.",https://static01.nyt.com/images/2019/04/25/science/25tb-penguins-1/25tb-penguins-1-facebookJumbo.jpg,2019-04-25
https://www.npr.org/2019/04/25/717225118/after-pentagon-ends-contract-top-secret-scientists-group-vows-to-carry-on,"After Pentagon Ends Contract, Top-Secret Scientists Group Vows To Carry On - NPR","The 60 or so members of the Jasons are normal academics by day. But each summer, they come together to study tough problems for the military, intelligence agencies and other parts of the government.",https://media.npr.org/assets/img/2019/04/25/guidestar_rqf7645_wide-d5137314a8eb76edf749f6c87dc7d6465039c944.jpg?s=1400,2019-04-25
https://www.dailymail.co.uk/news/article-6961379/GPs-missing-lung-cancer-symptoms-non-smokers-despite-making-one-seven-victims.html,GPs are ‘missing lung cancer symptoms’ in non-smokers despite them making up one-in-seven victims - Daily Mail,"Some 6,000 Brits who have never smoked die of lung cancer annually, and rates are increasing. Scientists predict that non-smokers will overtake smokers among sufferers within a decade.",https://i.dailymail.co.uk/1s/2019/04/25/22/12727128-0-image-a-76_1556229037078.jpg,2019-04-25
https://www.dailymail.co.uk/sport/football/article-6960881/Solskjaer-inquest-Woodward-hauls-Manchester-United-boss-crisis-talks.html,Solskjaer inquest: Woodward hauls Manchester United boss in for crisis talks - Daily Mail,EXCLUSIVE: Woodward called the lunchtime meeting at Carrington to discuss United's deepening problems after a seventh defeat in nine games in the derby against Manchester City.,https://i.dailymail.co.uk/1s/2019/04/25/21/12724614-0-image-a-28_1556224040347.jpg,2019-04-25
https://www.liverpoolecho.co.uk/sport/football/football-news/jurgen-klopp-pinpoints-man-city-16182880,Jurgen Klopp pinpoints where Man City could slip in title race and reveals dressing room mindset - Liverpool Echo,The Reds boss is staying positive as the Premier League season comes to a close,https://i2-prod.liverpoolecho.co.uk/incoming/article16161374.ece/ALTERNATES/s1200/0_JS180423768.jpg,2019-04-25
https://www.thesun.co.uk/news/brexit/8941203/brady-urges-pm-strip-backstop-from-eu-deal/,Sir Graham Brady urges PM to support bid to strip Irish backstop from Brexit deal - The Sun,The 1922 Committee chair has asked the PM to back an amendment to either limit the backstop by 12 months or 'remove it altogether',https://www.thesun.co.uk/wp-content/uploads/2019/04/tp-composite-politics2.jpg?strip=all&quality=100&w=1200&h=800&crop=1,2019-04-25
https://www.mirror.co.uk/3am/celebrity-news/pregnant-mrs-hinch-cancels-book-14626619,Pregnant Mrs Hinch cancels book tour to focus on baby’s health after hospital dash - Mirror Online,Cleaning sensation Sophie Hinchliffe - also known as Mrs Hinch - has apologised to fans for scrapping all her upcoming appearances,https://i2-prod.mirror.co.uk/incoming/article14229933.ece/ALTERNATES/s1200/2_This-Morning-TV-show-London-UK-03-Apr-2019.jpg,2019-04-25
https://www.telegraph.co.uk/politics/2019/04/25/huawei-row-government-dug-hole-hunting-5g-mole/,Huawei row: How the Government dug itself into a hole hunting for the 5G mole - Telegraph.co.uk,At a time when the Tories and Labour cannot even agree on a Brexit strategy amid national crisis - how strange that both parties should suddenly be united on the issue of launching a criminal inquiry into the Huawei leak.,https://www.telegraph.co.uk/content/dam/politics/2019/04/25/TELEMMGLPICT000194966387-xlarge_trans_NvBQzQNjv4BqL2PAfGWOBj0LpZQ6m31qIyomZDKJPGgkfFEN58E09AI.jpeg,2019-04-25
https://www.telegraph.co.uk/news/2019/04/25/france-must-work-emmanuel-macron-tells-yellow-vests/,"France must work more, Emmanuel Macron tells 'yellow vests' - The Telegraph","Emmanuel Macron promised &ldquo;significant&rdquo; tax cuts for France&rsquo;s middle classes while cutting public spending but told the French they must work like their &ldquo;neighbours&rdquo;, in a much-awaited response to five-months of &ldquo;yellow vest…",https://www.telegraph.co.uk/content/dam/news/2019/04/25/TELEMMGLPICT000195199352-xlarge_trans_NvBQzQNjv4BqpVlberWd9EgFPZtcLiMQfyf2A9a6I9YchsjMeADBa08.jpeg,2019-04-25
https://www.bbc.co.uk/news/world-africa-48050859,Cyclone Kenneth: Storm-battered Mozambique hit again - BBC News,Cyclone Kenneth makes landfall in north Mozambique just weeks after another storm killed hundreds.,https://ichef.bbci.co.uk/images/ic/1024x576/p077f3n8.jpg,2019-04-25
https://vancouversun.com/pmn/travel-pmn/measles-cases-up-in-california-spread-by-overseas-travel/wcm/31663a2d-2796-4ec5-9e56-3acf4214332c,Quarantines at 2 LA universities amid US measles outbreak - Vancouver Sun,LOS ANGELES — Hundreds of students and staff at two Los Angeles universities have been placed under quarantine because they may have been exposed to measles and either have not been vaccinate…,https://nationalpostcom.files.wordpress.com/2019/04/la409-ap.jpg,2019-04-25
https://www.sportsnet.ca/hockey/nhl/nhl-playoff-format-not-blame-round-1-surprises/,NHL playoff format not to blame for Round 1 surprises - Sportsnet.ca,"It’s hockey’s great cliché, that any team can win on any given night. The playoffs are going to confound us, no matter what the format.",https://assets1.sportsnet.ca/wp-content/uploads/2019/04/Cedric-Paquette.jpg,2019-04-25
https://www.cnbc.com/2019/04/25/dont-let-737-max-flight-cancellations-ruin-your-summer-travel.html,Here's how to make sure your summer travel plans aren't ruined by 737 Max flight cancellations - CNBC,Thousands of flights have been canceled since all of Boeing's 737 Max airplanes were grounded on March 13. Here are some tips to ensure a smooth trip.,https://fm.cnbc.com/applications/cnbc.com/resources/img/editorial/2019/03/23/105810644-1553375950815rts2e8mc.1910x1000.jpg,2019-04-25
https://www.smh.com.au/federal-election-2019/he-wants-as-little-scrutiny-as-possible-shorten-under-fire-for-dodging-major-election-debates-20190426-p51hf3.html,'He wants as little scrutiny as possible': Shorten under fire for dodging major election debates - Sydney Morning Herald,"""Bill Shorten is treating the Australian people in this campaign as if their sole purpose is to rubber-stamp him as prime minister.""","https://static.ffx.io/images/$zoom_0.3192,$multiply_1,$ratio_1.776846,$width_1059,$x_0,$y_0/t_crop_custom/w_800/q_86,f_auto/38cb10969f564b04c1698925f080a6efd4f5e884",2019-04-25
https://www.news.com.au/world/breaking-news/william-to-meet-christchurch-survivors/news-story/b872c46ebc5b810413db433d25377fc5,William speaks of grief in Christchurch - NEWS.com.au,Prince William has spoken of grief and defeating hate with love as he addressed Christchurch's Muslim community in one of the city's mosques.,https://www.news.com.au/wp-content/themes/vip/newscorpau-nca/assets/dist/img/common/placeholders/newscomau-major.png,2019-04-25
https://www.news.com.au/sport/football/eric-bautheacs-false-panenka-aleague-penalty-sparks-worldwide-debate/news-story/e38ff6fc2f5a0aed23395ee19aea240b,"A-League Eric Bautheac penalty video, reaction, did he mean it?, failed panenka, Brisbane Roar - NEWS.com.au","Eric Bautheac’s outrageous A-League penalty is making headlines worldwide, as debate rages as to whether he actually meant what has been dubbed a historic “false panenka”.",https://cdn.newsapi.com.au/image/v1/ca2ee26957a87d4745a48b74fcafe321?width=650,2019-04-25
https://hollywoodlife.com/2019/04/25/stefanie-sherk-dead-suicide-model-drowned-wife-demian-bichir/,Stefanie Sherk Dead: Demian Bichir's Wife's Passing Ruled A Suicide - Hollywood Life,"So heartbreaking. One day after actor Demian Bichir announced that his wife Stefanie Sherk had died, her passing has been ruled a suicide after she tried to drown herself in the family's backyard pool.",https://pmchollywoodlife.files.wordpress.com/2019/04/stefanie-sherk-gorgeous-blonde-model-37-drowned-herself-in-familye28099s-pool-death-ruled-a-suicide-ftr.jpg,2019-04-25
https://www.news.com.au/entertainment/movies/chris-pratt-refused-to-audition-for-guardians-of-the-galaxy/news-story/90dca7701f8c6db33e2a3083fb204771,Guardians of the Galaxy: Chris Pratt ‘refused to audition’ for role - NEWS.com.au,Chris Pratt almost wasn’t Peter Quill aka Star-Lord.,https://cdn.newsapi.com.au/image/v1/14e17c5b72d697d52671c0f07be86431?width=650,2019-04-25
https://www.abc.net.au/news/2019-04-26/north-korea-sends-us-$2m-bill-for-otto-warmbiers-care/11047890,North Korea sent United States $2.8m bill for Otto Warmbier's care prior to his comatose return - ABC News,Media reports reveal North Korea insisted the United States pay $US2 million dollars in medical costs before releasing detained American college student Otto Warmbier while he was in a coma in 2017.,https://www.abc.net.au/news/image/10860502-16x9-700x394.jpg,2019-04-25
https://www.fool.com.au/2019/04/26/how-id-invest-50000-into-etfs-on-the-asx/,How I'd invest $50000 into ETFs on the ASX - Motley Fool Australia,"This is how I would invest $50,000 into ETFs on the ASX today.",https://www.fool.com.au/wp-content/uploads/2017/04/Global-Investing-Currencies-16.9.jpg,2019-04-25
https://www.news.com.au/world/asia/sri-lanka-has-lowered-its-death-toll-by-nearly-onethird-to-253/news-story/09e4aaed283a3daed25c3494a9c4e76f,Sri Lanka bombings: Easter death toll revised by nearly one-third - NEWS.com.au,"Sri Lankan officials have lowered the death toll from the Easter suicide bombings by nearly one-third, to 253, as authorities hunted urgently for a least five more suspects and braced for the possibility of more attacks in the next few days.",https://cdn.newsapi.com.au/image/v1/1c6e8f0eab0abce91d96686e9f1c77cd?width=650,2019-04-25
https://www.theaustralian.com.au/world/joe-biden-sells-himself-as-the-antitrump-to-win-blue-collar-voters/news-story/3f25c92d57255f34940eca259e3403d3,Joe Biden sells himself as the anti-Trump to win blue collar voters - The Australian,"Subscribe to The Australian to get unrestricted digital access, home paper delivery, Apps for iPad and Android, member only +Rewards and much more...",,2019-04-25
https://www.gamespot.com/reviews/days-gone-review-of-bikes-and-men/1900-6417130/,Days Gone Review - Of Bikes And Men - GameSpot,"Days Gone has its exciting moments, but it fails to say anything interesting or meaningful about its story and characters.",https://static.gamespot.com/uploads/screen_kubrick/1575/15759911/3526526-days-gone-review-thumb-nologo.jpg,2019-04-25
https://www.foxnews.com/health/quarantine-orders-issued-at-2-los-angeles-universities-in-measles-outbreak,Measles outbreak sparks quarantine orders at 2 Los Angeles universities - Fox News,"Some students and employees at two Los Angeles universities have been quarantined due to possible contact with the measles virus, official said.",https://media2.foxnews.com/BrightCove/694940094001/2019/04/25/694940094001_6030033315001_6030030572001-vs.jpg,2019-04-25
https://www.cnn.com/2019/04/25/health/kissing-bug-delaware-case-cdc-study-trnd/index.html,'Kissing bug' case in Delaware raises alarm for summer - CNN,"A bloodsucking ""kissing bug"" bit a Delaware girl on the face last summer while she was watching television, and now the US Centers for Disease Control and Prevention is calling the incident the first confirmed identification of the bug in the state.",https://cdn.cnn.com/cnnnext/dam/assets/151106121746-chagas-triatomine-super-tease.jpg,2019-04-25
https://techcrunch.com/2019/04/25/amazon-beats-optimistic-profit-expectations-for-q1/,Amazon beats optimistic profit expectations for Q1 - TechCrunch,"Amazon announced today that it has beat Wall Street’s already optimistic Q1 projections. The e-commerce giant’s revenues have slowed a bit, contributing to moderate fluctuations in after-hours trading, but the company greatly benefits by ever-increasing profi…",https://techcrunch.com/wp-content/uploads/2019/02/GettyImages-1065011338.jpg?w=711,2019-04-25
https://arstechnica.com/information-technology/2019/04/amazon-primes-default-delivery-window-will-soon-shrink-to-one-day/,Amazon plans to make Prime shipping one-day by default - Ars Technica,"Still building up support for more products, ZIP codes before nationwide rollout.",https://cdn.arstechnica.net/wp-content/uploads/2019/04/GettyImages-1037736094-760x380.jpg,2019-04-25
https://www.forbes.com/sites/gordonkelly/2019/04/25/apple-new-iphone-11-x1-upgrade-iphone-xs-max-xr/,Apple's Shocking New iPhone Design Makes Sense - Forbes,"Apple's new iPhone is going to be ugly, but for a very good reason...",https://thumbor.forbes.com/thumbor/600x315/https%3A%2F%2Fblogs-images.forbes.com%2Fgordonkelly%2Ffiles%2F2019%2F04%2FScreenshot-2019-04-26-at-02.05.15.png,2019-04-25
https://pagesix.com/2019/04/25/stefanie-sherks-death-being-probed-as-possible-suicide/,Stefanie Sherk's death being probed as possible suicide - Page Six,"Her husband Demian Bichir, reportedly discovered her lifeless body weighed to the floor of their swimming pool.",https://nyppagesix.files.wordpress.com/2019/04/gettyimages-875735478.jpg?quality=90&strip=all&w=1200,2019-04-25
https://www.kctv5.com/news/investigations/kctv-obtains-recording-of-tyreek-hill-and-crystal-espinal-discussing/article_16991194-67ad-11e9-98f9-c7214b78938f.html,KCTV5 obtains recording of Tyreek Hill and Crystal Espinal discussing their son’s broken arm - KCTV Kansas City,KCTV5’s investigative department was sent a recording of Tyreek Hill and his fiancé discussing the police investigation and what they are telling police.,https://bloximages.newyork1.vip.townnews.com/kctv5.com/content/tncms/assets/v3/editorial/2/fd/2fd219e2-ca30-57e7-81fa-5938c48305a3/5cc23fac21fb3.image.jpg?resize=1120%2C630,2019-04-25
https://5newsonline.com/2019/04/25/coroner-releases-cause-of-death-for-5-year-old-illinois-boy/,Coroner Releases Cause Of Death For 5-Year-Old Illinois Boy - KFSM 5Newsonline,"CHICAGO (AP) — Police believe an Illinois couple who reported their 5-year-old son missing last week killed him days earlier by beating him and forcing him to stand in a cold shower for an extended period of time, according to court documents released Thursda…",https://localtvkfsm.files.wordpress.com/2019/04/s108163382.jpg?quality=85&strip=all&w=1200,2019-04-25
https://www.foxnews.com/us/coast-guard-lieutenant-accused-hit-list-tv-hosts-dem-politicians-release,"Coast Guard lieutenant accused of compiling hit list of TV hosts, Dem politicians, is granted release - Fox News","The charges against a Coast Guard lieutenant who investigators said espoused white nationalist views and compiled a hit list of prominent Democratic politicians and media personalities do not warrant keeping him in custody before trial, a federal magistrate r…",https://static.foxnews.com/foxnews.com/content/uploads/2019/04/ChristopherHasson.jpg,2019-04-25
https://www.express.co.uk/sport/football/1118791/Arsenal-Tottenham-Liverpool-Chelsea-West-Ham-Team-of-the-Year-Premier-League-alternative,"Arsenal star, Tottenham trio, Salah feature in alternative Premier League Team of the Year - Express",THE PFA announced their Premier League Team of the Year as voted by the professionals on Thursday morning. Here's Express Sport's alternative squad based on those not included.,https://cdn.images.express.co.uk/img/dynamic/67/750x445/1118791.jpg,2019-04-25
https://www.theguardian.com/football/2019/apr/25/manchester-city-liverpool-fa-youth-cup-final-match-report,Liverpool win FA Youth Cup after penalty shootout with Manchester City - The Guardian,Nabil Touaizi put Manchester City ahead only for Bobby Duncan’s 86th-minute equaliser to take the final to extra time and penalties,https://i.guim.co.uk/img/media/c8b27e7d3b5bf25fe0979334ce6136b900df1926/0_0_3530_2118/master/3530.jpg?width=1200&height=630&quality=85&auto=format&fit=crop&overlay-align=bottom%2Cleft&overlay-width=100p&overlay-base64=L2ltZy9zdGF0aWMvb3ZlcmxheXMvdGctZGVmYXVsdC5wbmc&s=2b7331d851c23b4eb638745399504deb,2019-04-25
https://www.bbc.co.uk/news/business-48058276,Amazon posts fourth quarter of record profit - BBC News,The online retailer and cloud computing provider said net profit more than doubled to $3.56bn.,https://ichef.bbci.co.uk/news/1024/branded_news/1378F/production/_106595797_gettyimages-1124860504.jpg,2019-04-25
http://www.cityam.com/276740/crossrail-open-central-section-between-october-2020-and,Crossrail sets opening date between October 2020 and March 2021 - City A.M.,"Crossrail will open to passengers between October 2020 and March 2021, about two years later than originally planned, its board revealed today.",http://www.cityam.com/assets/uploads/main-image/full_width_article_body_image/crossrail-project-reaches-new-milestone-with-completion-of-elizabeth-line-track-846840062-5cc1f8aebf71e.jpg,2019-04-25
https://www.thecragandcanyon.ca/news/local-news/north-vancouver-doctors-painful-ambulance-ride-led-to-ketamine-on-board/wcm/f761f545-9cf2-48ec-b0c1-ad610b3db4d7,North Vancouver doctor's painful ambulance ride led to ketamine on board - The Crag and Canyon,An emergency room physician designed a research study on ketamine while in the back of an ambulance,https://postmediavancouversun2.files.wordpress.com/2019/04/ketamine.jpg,2019-04-25
https://www.sportsnet.ca/basketball/nba/raptors-nick-nurse-kawhi-going-playoffs-beast-mode/,Raptors' Nick Nurse sees Kawhi's playoffs beast mode as 'contagious' - Sportsnet.ca,"It's safe to say Kawhi Leonard was great for the Toronto Raptors in the regular season, but how much was he holding back for the playoffs?",https://assets1.sportsnet.ca/wp-content/uploads/2019/04/Kawhi-3.jpg,2019-04-25
https://ottawacitizen.com/news/world/hundreds-of-ucla-cal-state-students-staff-under-quarantine-amid-measles-outbreak/wcm/198ed5a4-1a72-4d86-b00d-a53a1a92ab42,"Hundreds of UCLA, Cal State students, staff under quarantine amid measles outbreak - Ottawa Citizen",LOS ANGELES — A quarantine order was issued Thursday for hundreds of students and staff at two Los Angeles universities who may have been exposed to measles and either have not been vaccinate…,https://postmediacanoe.files.wordpress.com/2019/04/la409-ap.jpg,2019-04-25
https://www.theglobeandmail.com/business/article-air-canada-changes-flight-schedules-takes-steps-to-replace-boeing-73/,"Air Canada changes flight schedules, takes steps to replace Boeing 737 Max capacity through July - The Globe and Mail",Transport Canada ordered the grounding of all 737 Max jets on March 13 following the Ethiopian Airlines crash that killed all 157 passengers and crew on-board,https://www.theglobeandmail.com/resizer/lf2cipPruq1OtuKmg6jC7ShpUts=/1200x0/filters:quality(80)/arc-anglerfish-tgam-prod-tgam.s3.amazonaws.com/public/ZY27DBEXDVBDPK5EJZXIMIL7GI.JPG,2019-04-25
