url,title,description,urlToImage,date
https://techxplore.com/news/2019-04-caffeine-solar-cells-energy-boost.html,Caffeine gives solar cells an energy boost - Tech Xplore,"Scientists from the University of California, Los Angeles (UCLA) and Solargiga Energy in China have discovered that caffeine can help make a promising alternative to traditional solar cells more efficient at converting light to electricity. Their research, pu…",https://3c1703fe8d.site.internapcdn.net/newman/gfx/news/hires/2019/caffeinegive.jpg,2019-04-25
https://www.theaustralian.com.au/world/sri-lanka-terror-attack-wife-killed-family-police-during-raids/news-story/198666326a7b76f9397a82a3d2bc961b,Sri Lanka terror attack: Scott Morrison confirms suicide bomber spent time in Australia - The Australian,"Subscribe to The Australian to get unrestricted digital access, home paper delivery, Apps for iPad and Android, member only +Rewards and much more...",,2019-04-25
https://www.vooks.net/nintendos-fy-results-are-in-switch-surpasses-the-n64-in-sales/,"Nintendo’s FY 18/19 results are in, Switch surpasses the N64 in sales - Vooks",Right on the money,https://www.vooks.net/img/2016/02/Nintendo_HQ.jpg,2019-04-25
https://gizmodo.com/people-born-before-1989-may-need-another-measles-vaccin-1834304231,People Born Before 1989 May Need Another Measles Vaccine - Gizmodo,The U.S. is in the middle of the worst outbreak of measles since the disease was naturally eradicated from the county in 2000. But while the majority of victims are children whose parents decided not to vaccinate them or people who have chosen to go unvaccina…,"https://i.kinja-img.com/gawker-media/image/upload/s--6UNrNAJ1--/c_fill,fl_progressive,g_center,h_900,q_80,w_1600/lhjezrymkwaphrjtb66p.jpg",2019-04-25
https://www.nbcnews.com/news/crime-courts/boston-area-judge-charged-helping-undocumented-immigrant-out-courthouse-elude-n998546,Boston-area judge charged with helping undocumented immigrant escape courthouse to elude ICE - NBCNews.com,"A Massachusetts judge conspired with a court officer to help an undocumented immigrant slip out of a courthouse and elude immigration authorities, prosecutors say.",https://media2.s-nbcnews.com/j/newscms/2019_17/2138111/170830-immigration-ice-mn-1500_d2e337f462e74c72913623ffbd995b3e.nbcnews-fp-1200-630.jpg,2019-04-25
https://arstechnica.com/science/2019/04/nasa-safety-panel-offers-more-detail-on-dragon-anomaly-urges-patience/,"NASA safety panel offers more detail on Dragon anomaly, urges patience - Ars Technica","""Firing of eight SuperDracos resulted in an anomaly.""",https://cdn.arstechnica.net/wp-content/uploads/2019/04/46386616995_4dbca8e71c_k-760x380.jpg,2019-04-25
http://www.espn.com/nba/story/_/id/26603201/kings-nba-start-joint-investigation-walton,"Kings, NBA start joint investigation into Walton - ESPN",The allegations made in a civil suit that Kings coach Luke Walton sexually assaulted a woman in 2014 will be jointly investigated by the team and NBA.,https://a1.espncdn.com/combiner/i?img=%2Fphoto%2F2019%2F0412%2Fr528343_1296x729_16%2D9.jpg,2019-04-25
https://www.bleedinggreennation.com/2019/4/25/18515987/2019-nfl-mock-draft-espn-insider-mel-kiper-todd-mcshay-final-picks-philadelphia-eagles-hollywoood-cb,2019 NFL Mock Draft: ESPN’s Mel Kiper and Todd McShay make their final picks - Bleeding Green Nation,One last look.,https://cdn.vox-cdn.com/thumbor/jAJwaaAPJvrqsjDoGX_xb7BVfIE=/0x186:4950x2778/fit-in/1200x630/cdn.vox-cdn.com/uploads/chorus_asset/file/16190255/usa_today_11763461.jpg,2019-04-25
https://www.barrons.com/articles/chevron-occidental-anadarko-bidding-war-51556204226,"Chevron Will Beat Occidental in the Fight for Anadarko Petroleum, Investors Bet - Barron's","Investors are betting that Chevron will win the bidding war for Anadarko Petroleum. Chevron must lift its offer, the reasoning goes, but it doesn’t have to match one from Occidental Petroleum.",https://images.barrons.com/im-69539/social,2019-04-25
https://www.cnbc.com/video/2019/04/25/lululemon-ceo-were-going-after-guys-who-want-clothes-for-the-gym-and-for-work.html,Lululemon CEO: We're going after guys who want clothes for the gym and for work - CNBC,Lululemon CEO Calvin McDonald sits down for an exclusive interview with CNBC's Sara Eisen to discuss the company's plans for menswear and more.,https://fm.cnbc.com/applications/cnbc.com/resources/img/editorial/2019/04/25/105872214-190425sotslululemonshort.600x400.jpg,2019-04-25
https://www.foxnews.com/politics/white-house-declines-house-oversight-committee-invitation-for-stephen-miller-to-testify-on-trump-immigration-policies,White House declines Cummings' invitation for Stephen Miller to testify on Trump immigration policies - Fox News,The White House said Trump adviser Stephen Miller will not accept the House Oversight Committee’s invitation to appear before the panel on the administration’s immigration policy in the latest White House move to block congressional testimony by key officials.,https://media2.foxnews.com/BrightCove/694940094001/2019/02/17/694940094001_6003158547001_6003160755001-vs.jpg,2019-04-25
https://www.foxnews.com/science/bizarre-chimera-crab-fossil-discovered,'Utterly bizarre' chimera crab fossil discovered: 'Makes you wonder 'what else is out there' - Fox News,"Paleontologists have unearthed the fossil of an ancient crab that lived between 90 and 95 million years ago and is so ""utterly bizarre"" it literally perplexed the researchers.",https://static.foxnews.com/foxnews.com/content/uploads/2019/04/bizarre-crab-2.jpg,2019-04-25
https://www.ft.com/content/2d5a32e4-6750-11e9-9adc-98bf1d35a056,Emmanuel Macron announces tax cuts as part of reforms for France - Financial Times,President hopes plans will help him regain political initiative from ‘gilets jaunes’ protesters,https://www.ft.com/__origami/service/image/v2/images/raw/http%3A%2F%2Fprod-upp-image-read.ft.com%2Fcd497400-677c-11e9-b809-6f0d2f5705f6?source=next-opengraph&fit=scale-down&width=900,2019-04-25
https://www.bbc.co.uk/news/world-asia-48059328,Sri Lanka attacks: Death toll revised down by 'about 100' - BBC News,"Sri Lanka now puts the toll at ""about 253"" as the health ministry blames a calculation error.",https://ichef.bbci.co.uk/news/1024/branded_news/2561/production/_106596590_mediaitem106596589.jpg,2019-04-25
https://www.bbc.co.uk/news/uk-england-essex-48054948,Rayleigh stabbing: Off-duty police officer knifed multiple times - BBC News,"A man has been arrested on suspicion of attempted murder after the stabbing in Rayleigh, Essex.",https://ichef.bbci.co.uk/news/1024/branded_news/B00D/production/_106596054_637e4bca-c40b-4055-a37a-164878298fa6.jpg,2019-04-25
https://news.sky.com/story/james-bond-who-is-the-greatest-007-baddie-of-all-time-11703371,James Bond: Who is the greatest 007 baddie of all time? - Sky News,"As Rami Malek is confirmed for Bond 25, we take a look at some of the most infamous villains to have taken on 007.",https://e3.365dm.com/19/04/1600x900/skynews-james-bond-roger-moore_4650116.jpg?20190425171323,2019-04-25
https://www.bbc.co.uk/news/uk-48057838,UK warns against all but essential Sri Lanka travel - BBC News,"The UK advises against all but essential travel to Sri Lanka, where the bombings death toll is revised down by about 100.",https://ichef.bbci.co.uk/news/1024/branded_news/9901/production/_106596193_slcomposite.jpg,2019-04-25
https://www.theguardian.com/uk-news/2019/apr/25/tommy-robinson-stand-mep-manchester-event-community-leaders-condemn-anti-islam-activist,Tommy Robinson announces plans to stand as MEP - The Guardian,Manchester community leaders hit out at anti-Islam activist’s planned event in city,https://i.guim.co.uk/img/media/44d3771cfe7152994dcd3dbd6070e40a65049840/0_45_2201_1320/master/2201.jpg?width=1200&height=630&quality=85&auto=format&fit=crop&overlay-align=bottom%2Cleft&overlay-width=100p&overlay-base64=L2ltZy9zdGF0aWMvb3ZlcmxheXMvdGctZGVmYXVsdC5wbmc&s=56a688ec77eb19e3c8307d9b5b0bf5f7,2019-04-25
https://www.90min.com/posts/6353515-paul-pogba-is-manchester-united-s-best-player-that-s-exactly-why-he-has-to-leave-this-summer,Paul Pogba Is Manchester United's Best Player - That's Exactly Why He Has to Leave This Summer - 90min,,"https://images2.minutemediacdn.com/image/upload/c_fill,w_1200,h_630,f_auto,q_auto,g_auto/shape/cover/sport/manchester-united-v-manchester-city-premier-league-5cc1a76bd60884e63b000001.jpg",2019-04-25
https://www.telegraph.co.uk/news/2019/04/25/knife-crime-rises-record-levels-england-wales-homicides-hit/,Knife crime rises to record levels in England and Wales as homicides hit highest in a decade - The Telegraph,"Knife crime has risen to record levels in England and Wales with some areas seeing an increase of up to 35 per cent in a year, official figures show.",https://www.telegraph.co.uk/content/dam/news/2019/04/25/TELEMMGLPICT000194314895-xlarge_trans_NvBQzQNjv4BqDI1jieMJtrozPRHESlT58hMZi-QIlkzfWEIwEBBhCFE.jpeg,2019-04-25
https://www.cbc.ca/news/canada/toronto/brampton-ont-man-makes-public-appeal-to-hit-and-run-driver-1.5110523,Police bring severely injured man into media studio to make appeal to hit and run driver - CBC News,"A 21-year-old Brampton, Ont., man severely injured in a hit and run has made an appeal for the driver involved to come forward.",https://i.cbc.ca/1.5110536.1556203998!/fileImage/httpImage/image.jpg_gen/derivatives/16x9_620/toronto-peel-police-hit-and-run-victim.jpg,2019-04-25
https://www.sookenewsmirror.com/community/international-astronomy-day-lands-in-victoria/,International Astronomy Day lands in Victoria - Sooke News Mirror,<p>Activities run April 27 at the Royal B.C. Museum and Observatory Hill </p>,https://www.sookenewsmirror.com/wp-content/uploads/2019/04/16543769_web1_spacestationhero-1024x570.jpg,2019-04-25
https://www.thechronicleherald.ca/living/why-the-most-common-developmental-disability-in-canada-is-misdiagnosed-or-missed-and-the-devastating-results-305488/,Why the most common developmental disability in Canada is misdiagnosed or missed — and the devastating results - TheChronicleHerald.ca,"FASD is associated with a bewildering number of symptoms. But as Vanessa Hrvatin writes, the biggest barrier to early detection and treatment may be social not biological. 

This is the second in three-part series,  by Postmedia’s",https://www.thechronicleherald.ca/media/photologue/photos/cache/httpsapipddataservicescomlistsfeed6fa4e00b-4591-473d-a003-a875540c882a_medium,2019-04-25
https://www.gamespot.com/articles/nintendo-switch-has-officially-outsold-the-n64/1100-6466474/,Nintendo Switch Has Officially Outsold The N64 - GameSpot,"The hybrid console has sold 34.74 million units to date, overtaking the Nintendo 64's lifetime sales.",https://static.gamespot.com/uploads/screen_kubrick/1578/15787979/3512160-3495204973-32015.jpg,2019-04-25
http://www.tunisiesoir.com/science/research-new-device-encases-delicate-cells-into-protective-microgels-15764-2019/,Research: New device encases delicate cells into protective microgels - Tdnews,,http://www.tunisiesoir.com/wp-content/uploads/2019/04/190425104312_1_540x360.jpg,2019-04-25
https://www.sportsnet.ca/baseball/mlb/blue-jays-confidential-offering-free-unsolicited-guerrero-jr-advice/,"Blue Jays Confidential: Some free, unsolicited Guerrero Jr. advice - Sportsnet.ca","This week the panel recalls some other, much-hyped MLB debuts; discuss the reported death of the no-hitter; rank where Mike Trout is on their all-time great list & share some unsolicited advice for the front office on how to help Guerrero Jr. adapt to life as…",https://assets1.sportsnet.ca/wp-content/uploads/2019/04/1704050871_6029859901001_6029851963001-vs.jpg,2019-04-25
https://driving.ca/tesla/auto-news/news/tesla-losses-reach-us702-million-as-deliveries-dry-up,Tesla losses reach US$702 million as deliveries dry up - Driving,"Despite new innovations and promises, Tesla remains in the hole",https://postmediadriving.files.wordpress.com/2018/12/Tesla-Boring-Company-Tunnel.jpg?w=600&h=315&crop=1&quality=80,2019-04-25
https://www.sciencedaily.com/releases/2019/04/190425115639.htm,Caffeine gives solar cells an energy boost - Science Daily,Scientists have discovered that caffeine can help make a promising alternative to traditional solar cells more efficient at converting light to electricity. Their research may enable this cost-effective renewable energy technology to compete on the market wit…,/images/2019/04/190425115639_1_540x360.jpg,2019-04-25
https://www.gizmodo.com.au/2019/04/elon-musk-was-right-cheap-cameras-could-replace-lidar-on-self-driving-cars-researchers-find/,"Elon Musk Was Right: Cheap Cameras Could Replace LIDAR On Self-Driving Cars, Researchers Find - Gizmodo Australia","Among the many tidbits of wisdom that Elon Musk dropped at a Tesla company investor event early this week was the revelation that LIDAR, a laser-based scanning technology that images objects in 3D, was “friggin’ stupid”, and that “...anyone relying on LIDAR i…","https://i.kinja-img.com/gawker-media/image/upload/c_lfill,w_768,q_90/oa7ulwnahclxvyja1wmf.jpg",2019-04-25
https://www.couriermail.com.au/news/queensland/live-anzac-day-dawn-services-across-queensland/live-coverage/b605ebb49e2f74f23dbbf71d5bf6f228,Anzac Day 2019: Live from dawn services across Queensland - Courier Mail,"Subscribe to The Courier-Mail to get unrestricted digital access, home paper delivery, Apps for iPad and Android, member only +Rewards and much more...",,2019-04-25
https://www.chicagotribune.com/suburbs/lake-county-news-sun/news/ct-met-beach-park-hazmat-spill-20190425-story.html,Firefighter among 7 hospitalized with 'life-threatening injuries' after ammonia spill in Beach Park - Chicago Tribune,An ammonia spill in north suburban Beach Park sent at least 37 people to hospitals and prompted school closings and warnings for residents to stay inside.,https://www.trbimg.com/img-5cc1fdb9/turbine/ct-met-beach-park-hazmat-spill-20190425,2019-04-25
https://www.youtube.com/watch?v=uHXD4KJj3Fo,Colin Cowherd lists 5 predictions for the 2019 NFL Draft | NFL | THE HERD - The Herd with Colin Cowherd,Colin Cowherd talks NFL draft on today's show. Colin makes predictions for 5 teams ahead of the 2019 NFL draft. #TheHerd #NFL #NFLDraft #ColinCowherd SUBSCRI...,https://i.ytimg.com/vi/uHXD4KJj3Fo/maxresdefault.jpg,2019-04-25
https://www.usatoday.com/story/news/politics/2019/04/25/doj-charges-judge-obstruction-allowing-illegal-immigrant-escape-ice/3574450002/,Feds charge Mass. judge with obstruction for allowing an illegal immigrant to leave by the back door - USA TODAY,"The charges are an escalation in the Trump administration's strict immigration enforcement policy; they come during a battle over ""sanctuary cities.""","https://www.gannett-cdn.com/presto/2019/03/21/USAT/bfac2c94-24e4-4383-a735-2ec8769c69b3-XXX_IMG_IMMIGRATION_ARRESTS__1_1_DTJ6JMCK.JPG?crop=3222,1812,x1,y269&width=3200&height=1680&fit=bounds",2019-04-25
https://www.businessinsider.com/tesla-enthusiasts-and-analysts-enter-uncharted-territory-2019-4,Tesla just entered uncharted territory - Business Insider,Tesla isn't as big as it looks — but it's starting to experience the real car-company economics of vehicle production.,https://amp.businessinsider.com/images/5ab16f0e646cb727008b45f8-1136-568.jpg,2019-04-25
https://www.foxnews.com/world/kim-putin-summit-was-short-on-substance-but-had-symbolism-both-men-need-bill-richardson,"Kim-Putin summit was short on substance, but had symbolism both men need: Bill Richardson - Fox News","Former U.S. Ambassador to the U.N. Bill Richardson said on “America’s Newsroom” on Thursday that the first summit between Russian President Vladimir Putin and North Korean leader Kim Jong Un was short on substance, but long on the kind of symbolism that both …",https://static.foxnews.com/foxnews.com/content/uploads/2019/02/694940094001_5795650107001_5795640546001-vs.jpg,2019-04-25
https://www.cnet.com/news/see-nasa-super-soothing-view-of-clouds-rolling-across-mars/,See NASA's super soothing view of clouds rolling across Mars - CNET,I think I see a sheep.,https://cnet2.cbsistatic.com/img/aDk0oWHiBJg7mHWuIn526qY7x7I=/756x567/2019/04/25/c696c508-f383-48d6-ab36-ecacf51bf7bd/insightcloud1.jpg,2019-04-25
https://www.macrumors.com/2019/04/25/2019-iphone-renders-rear-glass-camera-bump/,Latest Renders of 2019 iPhone Show Camera Bump Integrated Into Rear Glass - Mac Rumors,"At least one of the iPhones coming in 2019 will feature a triple-lens camera arrangement, and while Apple experimented with multiple layouts, recent...",https://cdn.macrumors.com/article-new/2019/04/iphonerender2.jpg?retina,2019-04-25
https://www.cnet.com/news/avengers-endgame-no-postcredits-after-credits-scene-but-there-is-an-audio-stinger/,"Avengers: Endgame has no postcredits scene, but there is a tiny audio stinger - CNET",Spoiler-free answers (and some extremely minor speculation) below.,https://cnet1.cbsistatic.com/img/vpYVdo80_WIj4BHHJkRZRX5CWyA=/756x567/2019/04/08/2f21fde7-7fdc-4d1e-8f42-11971dff2724/black-widow-clip.jpg,2019-04-25
https://finance.yahoo.com/news/chipotle-receives-subpoena-related-ohio-illness-incident-120943872--finance.html,Latest subpoena sours Chipotle's quarterly beat - Yahoo Finance,"""Its not a new incident but (the subpoena) is enough to shake off some of the more skittish bulls on the story,"" said Maxim Group analyst Stephen Anderson.  Over the past three years, the company has faced a number of subpoenas regarding sicknesses linked to …",https://s.yimg.com/uu/api/res/1.2/aznajXxzP45C9co3ZT_PxA--~B/aD0zMDA7dz00NTA7c209MTthcHBpZD15dGFjaHlvbg--/http://media.zenfs.com/en_us/News/Reuters/2019-04-25T162818Z_3_LYNXNPEF3O178_RTROPTP_2_CHIPOTLE-RESULTS.JPG,2019-04-25
https://www.nbcnews.com/health/health-news/many-drivers-who-test-positive-marijuana-have-child-car-survey-n998496,"Many drivers who test positive for marijuana have a child in the car, survey finds - NBCNews.com","Nearly one in seven Washington state drivers traveling with kids tested positive for THC, the psychoactive ingredient in marijuana, researchers reported.",https://media2.s-nbcnews.com/j/newscms/2019_16/2828546/190419-cannabis-worker-ac-1049p_f12c736232b767634f6bccc3c0f9389d.nbcnews-fp-1200-630.jpg,2019-04-25
https://www.cbsnews.com/news/emperor-penguins-in-antarctica-colony-experience-total-breeding-failure-according-to-new-scientific-study/,"Emperor penguins in Antarctica colony experience ""total breeding failure"" according to new scientific study - CBS News","""There had been no previously recorded instances of total breeding failure at the site,"" study says",https://cbsnews2.cbsistatic.com/hub/i/r/2019/04/25/53278a36-178b-4bf4-be57-399a74de8840/thumbnail/1200x630g2/393fd2e6bcdab0b937fd7b46ecb5aa57/penguins-in-halley-bay.jpg,2019-04-25
https://www.washingtonpost.com/world/asia_pacific/north-korea-issued-2-million-bill-for-comatose-otto-warmbiers-care/2019/04/25/0e8022a0-66ad-11e9-a698-2a8f808c9cfb_story.html,North Korea issued $2 million bill for comatose Otto Warmbier’s care - The Washington Post,"The invoice was presented hours before Warmbier was flown home in 2017, two people familiar with the incident told The Washington Post. It’s unclear whether it was ever paid.",https://www.washingtonpost.com/resizer/uILx3H2A8jBsue0pOE3LSGx1730=/1484x0/arc-anglerfish-washpost-prod-washpost.s3.amazonaws.com/public/CHBY5STG2UI6TJUYFKHYBDE47M.jpg,2019-04-25
https://www.trustedreviews.com/reviews/ipad-mini-5,"iPad Mini 5 Review: A mighty, mini tablet - TrustedReviews","iPad Mini 5 review: This is the best small tablet you can buy, even if Apple hasn't changed the design much since the original.",https://ksassets.timeincuk.net/wp/uploads/sites/54/2019/04/ipadmini5-8-1024x683.jpg,2019-04-25
https://www.theguardian.com/news/2019/apr/25/iranian-minister-drops-offer-to-free-zaghari-ratcliffe-in-swap,Iranian minister drops offer to free Zaghari-Ratcliffe in swap - The Guardian,Foreign minister had claimed jailed British dual national could be released in swap deal,https://i.guim.co.uk/img/media/988f135b4c3e318f8b5648f04ba66872df2b928d/0_117_3500_2100/master/3500.jpg?width=1200&height=630&quality=85&auto=format&fit=crop&overlay-align=bottom%2Cleft&overlay-width=100p&overlay-base64=L2ltZy9zdGF0aWMvb3ZlcmxheXMvdGctZGVmYXVsdC5wbmc&s=f8549b0bf743f487a6f247e25cb40e91,2019-04-25
https://www.theguardian.com/world/2019/apr/25/worlds-oceans-are-becoming-stormier-researchers-discover,"World's oceans are becoming stormier, researchers discover - The Guardian","Data matches predictions that weather will get more extreme as planet warms, scientists say",https://i.guim.co.uk/img/media/922dde956e75b84547475875cc8e37efc6682453/0_346_5115_3070/master/5115.jpg?width=1200&height=630&quality=85&auto=format&fit=crop&overlay-align=bottom%2Cleft&overlay-width=100p&overlay-base64=L2ltZy9zdGF0aWMvb3ZlcmxheXMvdGctZGVmYXVsdC5wbmc&s=760b7458b14f25af398cb9b320d28265,2019-04-25
https://www.dailymail.co.uk/news/article-6960499/Im-victim-Mo-Farah-says-staff-Haile-Gebrselassies-hotel-stole-room.html,I'm the victim: Mo Farah says staff at Haile Gebrselassie's hotel stole from his room - Daily Mail,"Two of the world's greatest long-distance runners, Sir Mo Farah and Haile Gebrselassie escalated their tit-for-tat accusations on second day of a bizarre row ahead of Sunday's London Marathon.",https://i.dailymail.co.uk/1s/2019/04/24/17/12667194-0-image-a-19_1556121930989.jpg,2019-04-25
https://news.sky.com/story/policeman-seriously-injured-after-targeted-stabbing-in-essex-11703468,Off-duty policeman stabbed multiple times in 'targeted' attack in Essex - Sky News,"The victim was injured in the stomach, chest and arm following the incident in Essex on Wednesday evening.",https://e3.365dm.com/19/04/1600x900/skynews-church-road-rayleigh_4650203.jpg?20190425173140,2019-04-25
https://www.independent.co.uk/news/uk/politics/tommy-robinson-european-elections-mep-north-west-england-ukip-edl-far-right-a8886376.html,European elections: Tommy Robinson ‘standing as MEP for north-west England’ - The Independent,English Defence League co-founder is currently facing up to two years imprisonment in an ongoing court case,https://static.independent.co.uk/s3fs-public/thumbnails/image/2019/03/29/15/brexit-day-protests-18.jpg,2019-04-25
https://www.thesun.co.uk/tvandshowbiz/8938632/love-island-2019-still-open-filming-how-to-apply/,Love Island 2019 casting is STILL open just days before show starts filming – and here’s how you apply - The Sun,"It's just days until the show starts filming, but you can still apply to be on the show - and here's how",https://i1.wp.com/www.thesun.co.uk/wp-content/uploads/2019/04/NINTCHDBPICT000423826116.jpg?crop=1718px%2C468px%2C2383px%2C1590px&resize=1200%2C800&ssl=1,2019-04-25
https://www.thewestonmercury.co.uk/news/strong-winds-for-somerset-coast-says-met-office-1-6015828,Stormy weather forecasted for South West | Latest Weston-super-Mare and Somerset news - Weston Mercury,A weather warning has been issued for the West Country with gales forecast over the next 48 hours.,https://www.thewestonmercury.co.uk/polopoly_fs/1.6015829!/image/image.jpg,2019-04-25
https://www.express.co.uk/news/science/1118769/life-on-mars-revolutionary-nasa-find-ancient-remains-red-planet-spt,Life on Mars: How 'REVOLUTIONARY' NASA find uncovered 'ancient remains' on Red Planet - Express.co.uk,"THE search for life on Mars was given a boost thanks to a “revolutionary” find made by NASA’s Mars Global Surveyor spacecraft, a documentary revealed.",https://cdn.images.express.co.uk/img/dynamic/151/750x445/1118769.jpg,2019-04-25
https://www.cbc.ca/news/canada/hamilton/musitano-1.5110491,"Hamilton mobster Pat Musitano shot in Mississauga, Ont. - CBC News","Notorious Hamilton mobster Pat Musitano has been shot. It happened in Mississauga, Ont., Thursday morning. He was rushed to a trauma centre where he remains in life-threatening condition, police said.",https://i.cbc.ca/1.4097746.1537038754!/fileImage/httpImage/image.JPG_gen/derivatives/16x9_620/ham0915-angelo-musitano.JPG,2019-04-25
https://www.ctvnews.ca/canada/facebook-data-leak-province-by-province-breakdown-of-affected-canadians-1.4394945,Facebook data leak: Province-by-province breakdown of affected Canadians - CTV News,A damning report on a major leak of Facebook users' personal data has shed new light on the number of Canadians impacted and what kind of information was harvested from them.,https://www.ctvnews.ca/polopoly_fs/1.4370138.1554715304!/httpImage/image.jpg_gen/derivatives/landscape_620/image.jpg,2019-04-25
https://www.lakecountrycalendar.com/news/ubc-okanagan-study-makes-progess-into-tissue-regrowth-injections/,UBC Okanagan study makes progess into tissue regrowth injections - Lake Country Calendar,<p>School engineers and researchers deliver a new study in injectable tissues </p>,https://www.lakecountrycalendar.com/wp-content/uploads/2019/04/16560508_web1_Gamal-1024x680.jpg,2019-04-25
https://www.bluebirdbanter.com/2019/4/25/11290160/a-note-of-caution-on-the-expectations-for-vladimir-guerrero-jr-blue-jays,A note of caution on the expectations for Vladimir Guerrero Jr. - Bluebird Banter,Vladimir Guerrero Jr. is finally on his way to the big leagues. Everyone is excited to see the phenom who has been the consensus best hitting prospect in baseball for the better part of two years...,https://cdn.vox-cdn.com/thumbor/RdjEdUesUod0y8d57jmwnpVZJg4=/0x367:4426x2684/fit-in/1200x630/cdn.vox-cdn.com/uploads/chorus_asset/file/16191455/usa_today_12295610.jpg,2019-04-25
http://www.tunisiesoir.com/science/research-meet-callichimaera-perplexa-the-platypus-of-crabs-15778-2019/,"Research: Meet Callichimaera perplexa, the platypus of crabs - Tdnews",,http://www.tunisiesoir.com/wp-content/uploads/2019/04/190424153732_1_540x360.jpg,2019-04-25
