url,title,description,urlToImage,date
https://www.thetimes.co.uk/article/lung-cancer-caused-by-dirty-air-kills-thousands-of-non-smokers-wqkwtpkhm,Lung cancer caused by dirty air kills thousands of non-smokers - The Times,"Thousands of non-smokers are dying of lung cancer each year with air pollution a significant cause, researchers from Public Health England have said. Lung cancer in non-smokers kills more people...",http://www.thetimes.co.uk/imageserver/image/methode%2Ftimes%2Fprod%2Fweb%2Fbin%2F027920e8-679c-11e9-877f-447086620e98.jpg?crop=3905%2C2196%2C33%2C99,2019-04-25
https://readeverton.com/2019/04/25/how-we-think-everton-could-line-up-next-season/,How we think Everton could line-up next season - Read Everton,Read more…,https://production-354f.kxcdn.com/wp-content/uploads/sites/25/2019/04/1144154442-904x602.jpg,2019-04-25
https://www.theguardian.com/world/2019/apr/25/belt-and-road-summit-puts-spotlight-on-chinese-coal-funding,Belt and Road summit puts spotlight on Chinese coal funding - The Guardian,Environmentalists say Beijing is exporting a highly polluting model of growth,https://i.guim.co.uk/img/media/42bc35e4afbd1e9baaa4042dea101193cf38cb9b/0_233_3500_2100/master/3500.jpg?width=1200&height=630&quality=85&auto=format&fit=crop&overlay-align=bottom%2Cleft&overlay-width=100p&overlay-base64=L2ltZy9zdGF0aWMvb3ZlcmxheXMvdGctZGVmYXVsdC5wbmc&s=961920ab698153076133890250031121,2019-04-25
https://www.citynews1130.com/2019/04/25/quarantines-at-2-la-universities-amid-us-measles-outbreak/,Quarantines at 2 LA universities amid US measles outbreak - CityNews Vancouver,LOS ANGELES — A quarantine at two Los Angeles universities affected more than 200 students and staff who may have been exposed to measles and either have not been vaccinated or cannot verify that they are immune. The order issued in connection with the Univer…,https://www.citynews1130.com/wp-content/blogs.dir/sites/9/2019/04/CAJH101-426_2019_005644.jpg,2019-04-25
https://montrealgazette.com/news/local-news/tally-of-quebec-flooding-victims-on-the-rise-as-spring-thaw-spreads,Dam on Rouge River in danger of collapse as floodwaters rise - Montreal Gazette,"In Montreal, Mayor Valérie Plante urges residents to “remain vigilant” and continue their efforts to secure their homes.",https://postmediamontrealgazette2.files.wordpress.com/2019/04/0426-city-flooding-7625-when-will-this-run-0414-online-.jpg,2019-04-25
https://www.theglobeandmail.com/sports/article-marc-gasols-battle-with-joel-embiid-could-be-the-x-factor-in-76ers/,Marc Gasol's battle with Joel Embiid could be the x-factor in 76ers series - The Globe and Mail,"The big man didn’t play in any of Toronto and Philly’s regular-season matchups, and both teams have retooled ahead of the playoffs",https://www.theglobeandmail.com/resizer/Sz0ejVOjAFNhPbYimVrKes5K3DQ=/1200x0/filters:quality(80)/arc-anglerfish-tgam-prod-tgam.s3.amazonaws.com/public/KEF5PHAFOFDEVIFNMJLJP3MGDQ.JPG,2019-04-25
https://www.news-medical.net/news/20190426/Circadian-rhythm-plays-a-part-in-weight-loss.aspx,Circadian rhythm plays a part in weight loss - News-Medical.net,Weight watchers worldwide need to not only be careful about what to eat but also about the timing of the food intake finds a new study.,https://www.news-medical.net/image.axd?picture=2019%2f4%2fshutterstock_481512001.jpg,2019-04-25
https://www.news-medical.net/news/20190426/Bentham-Sciences-new-volume-delves-into-specific-avenues-of-applied-NMR-studies.aspx,Bentham Science's new volume delves into specific avenues of applied NMR studies - News-Medical.net,"Bentham Science's seventh volume of Applications of NMR Spectroscopy, published by Bentham Science Publishers covers NMR methods in proteomics and metabolomics, and nucleic acid biochemistry.",https://www.news-medical.net/image.axd?picture=2014%2f7%2f163926142-620x480.jpg,2019-04-25
https://www.afr.com/news/economy/monetary-policy/the-case-for-and-against-an-rba-rate-cut-20190426-p51hf9,The case for and against an RBA rate cut - The Australian Financial Review,There are good arguments for and against an imminent interest rate cut.,https://static.ffx.io/images/$zoom_1.2928%2C$multiply_0.7554296506137866%2C$ratio_1.777778%2C$width_1059%2C$x_0%2C$y_39/t_crop_custom/t_sharpen%2Cq_auto%2Cf_auto/da6ca93ac3f5b6b4cb08ebe574334b94ca9d2b58,2019-04-25
https://www.3aw.com.au/counter-terrorism-operation-in-north-melbourne/,Counter-terrorism operation in North Melbourne - 3AW,,https://www.3aw.com.au/wp-content/uploads/sites/12/2019/04/policesirens2-1.jpg?fit=640%2C360,2019-04-25
https://wwos.nine.com.au/afl/booing-in-afl-ok-within-limits-mcguire/7c4d55e1-c150-4189-83fd-5e48eb2faf10,AFL: Eddie McGuire changes tune on booing - Wide World of Sports,Initially called for a ban,http://prod.static9.net.au/fs/14ffc505-2396-4a71-970a-13bcd2e69207,2019-04-25
https://www.cricket.com.au/news/shane-watson-sydney-thunder-retirement-big-bash-league-bbl/2019-04-26,Watson says farewell to Big Bash League - cricket.com.au,Sydney Thunder’s all-time leading run-scorer retires from professional T20 cricket in Australia after decorated career,https://www.cricket.com.au/~/-/media/News/2019/04/26WattoMain.ashx?w=1600,2019-04-25
https://www.theaustralian.com.au/nation/politics/actu-spends-millions-on-ads-attacking-wages-unemployment/news-story/8783cbe440e4215b20e5d4ffe7a570af,"ACTU spends millions on ads attacking wages, unemployment - The Australian","Subscribe to The Australian to get unrestricted digital access, home paper delivery, Apps for iPad and Android, member only +Rewards and much more...",,2019-04-25
https://www.sbs.com.au/news/man-arrested-following-scuffle-with-media-at-fraser-anning-press-conference,Man arrested following scuffle with media at Fraser Anning press conference - SBS News,The 19-year-old has been charged by police after a scuffle at Senator Anning's press conference.,https://sl.sbs.com.au/public/image/file/a37fb4d3-f131-4a86-b059-18bcca61ce07/crop/16x9,2019-04-25
http://www.espn.com/nfl/story/_/id/26604887/cards-take-murray-1st-weigh-options-rosen,"Cards take Murray 1st, weigh options on Rosen - ESPN","Cardinals GM Steve Keim said it was a ""very easy"" decision taking QB Kyler Murray with the top pick. His next order of business -- deciding what to do with Josh Rosen.",https://a4.espncdn.com/combiner/i?img=%2Fphoto%2F2019%2F0302%2Fr509083_1296x729_16%2D9.jpg,2019-04-25
https://www.cnbc.com/2019/04/26/deutsche-bank-q1-earnings-2019.html,Deutsche Bank posts 67% profit rise after merger talks collapse - CNBC,"Deutsche Bank reported stronger-than-anticipated first-quarter net profit on Friday, less than 24 hours after abandoning merger talks with Commerzbank.",https://fm.cnbc.com/applications/cnbc.com/resources/img/editorial/2016/10/04/103989532-GettyImages-545058656.1910x1000.jpg,2019-04-25
https://www.cnet.com/news/nasa-urges-patience-as-spacex-investigates-the-crew-dragon-explosion/,NASA urges patience as SpaceX investigates the Crew Dragon explosion - CNET,Details remain scant but NASA insists the investigation into the crew capsule incident will take time.,https://cnet4.cbsistatic.com/img/Sn9GRyY_QFiJ3by0UUrWuyXvGe4=/756x567/2019/03/03/5dcb5dcc-30b8-4cad-8677-a0eb78c0f5b9/crew-dragon-closeup.jpg,2019-04-25
https://www.reuters.com/article/us-sri-lanka-blasts/sri-lankans-urged-to-avoid-mosques-churches-amid-fears-of-more-attacks-idUSKCN1S207V,"Sri Lankans urged to avoid mosques, churches amid fears of more attacks - Reuters","Sri Lankan President Maithripala Sirisena said on Friday police are looking for 140 people believed to have links with the Islamic State group, which has claimed responsibility for the Easter Sunday suicide bombings of churches and hotels.",https://s1.reutersmedia.net/resources/r/?m=02&d=20190426&t=2&i=1380779343&w=1200&r=LYNXNPEF3P061,2019-04-25
http://www.espn.com/nfl/story/_/id/26605795/de-bosa-long-coveted-49ers-taken-no-2,"DE Bosa, 'long coveted' by 49ers, taken at No. 2 - ESPN","Nick Bosa, widely regarded as the draft's top edge rusher, went to the 49ers with the No. 2 pick and joins offseason addition Dee Ford in the team's revamped pass rush.",https://a2.espncdn.com/combiner/i?img=%2Fphoto%2F2019%2F0228%2Fr505394_2_1296x729_16%2D9.jpg,2019-04-25
https://www.latimes.com/entertainment/movies/la-et-mn-avengers-endgame-marvel-marathon-20190425-story.html,‘Avengers: Endgame’: Our reporter braved the 65-hour Marvel movie marathon - Los Angeles Times,"Reporter Randy Lewis braves the Marvel movie marathon — 22 movies in 65 hours that culminates with ""Avengers: Endgame"" — at the El Capitan Theatre in Hollywood.",https://www.latimes.com/resizer/S0fLSsslVBbgqPIfEu0gglvMk-k=/1200x0/arc-anglerfish-arc2-prod-tronc.s3.amazonaws.com/public/PGJEZFIOUJCNDK6WRYEQRZ2KVM.jpg,2019-04-25
https://larrybrownsports.com/football/duke-coach-bizarre-quote-daniel-jones/493350,Duke coach has incredibly bizarre quote about Daniel Jones - Larry Brown Sports,"The New York Giants' new quarterback of the future has no swag whatsoever, according to his college coach.

Duke coach David Cutcliffe offered up one of the strangest quotes of draft night after his quarterback, Daniel Jones, was selected sixth overall by t…",https://larrybrownsports.com/wp-content/uploads/2019/04/daniel-jones.jpg,2019-04-25
https://www.cnn.com/2019/04/25/politics/gerry-connolly-subpoenas-white-house-cnntv/index.html,Connolly threatens to jail Trump officials who won't comply with subpoenas - CNN,Democratic Rep. Gerry Connolly on Thursday threatened jail time for White House officials who are declining to comply with congressional committees' efforts to conduct oversight of President Donald Trump's administration.,https://cdn.cnn.com/cnnnext/dam/assets/190311181656-gerry-connolly-super-tease.jpg,2019-04-25
https://9to5google.com/2019/04/25/google-fi-dark-mode/,Google Calendar and Google Fi readying dark modes - 9to5Google,"Ahead of Android Q’s release later this year, many of Google’s apps are preparing dark modes to provide a uniform experience when using the operating system. The latest is Fi — hot off …",https://9to5google.com/wp-content/uploads/sites/4/2018/11/google_fi_3.jpg?quality=82&strip=all&w=1600,2019-04-25
https://www.express.co.uk/news/royal/1119116/Meghan-Markle-news-Kate-Middleton-Duchess-sussex-royal-baby-latest-frogmore-prince-harry,Meghan Markle baby: Has Duchess ALREADY given birth? Kate and William SPOTTED at Frogmore - Express,"MEGHAN MARKLE, the Duchess of Sussex may have already given birth after Kate, the Duchess of Cambridge and Prince William were spotted visiting Frogmore Cottage on Easter Sunday.",https://cdn.images.express.co.uk/img/dynamic/106/750x445/1119116.jpg,2019-04-25
https://www.eadt.co.uk/news/met-office-and-weatherquest-warn-of-storm-hannah-hitting-suffolk-1-6017194,Storm Hannah set to hit Suffolk and Essex after passing yellow weather warning regions on south coast | Latest Suffolk and Essex News - East Anglian Daily Times,"Be prepared this weekend - the tail end of Storm Hannah could hit East Angliam, bringing heavy rain and strong winds.",https://www.eadt.co.uk/polopoly_fs/1.6017196!/image/image.jpg,2019-04-25
https://www.mirror.co.uk/3am/celebrity-news/taylor-swifts-new-single-me-14665720,Taylor Swift's new single 'ME!' comes with epic snake put down of past feuds - Mirror Online,Taylor Swift has dropped her new single 'ME!' with Panic! At The Disco frontman Brendon Urie and the snake stole the show,https://i2-prod.mirror.co.uk/incoming/article14665732.ece/ALTERNATES/s1200/0_Music-video-by-Taylor-Swift-performing-ME.jpg,2019-04-25
https://www.theguardian.com/music/2019/apr/26/peter-doherty-if-i-was-drug-free-id-be-a-force-to-be-reckoned-with,"Peter Doherty: 'If I was drug free, I'd be a force to be reckoned with' - The Guardian","The Libertines co-frontman is 40 – an age few expected him to reach. Yet he’s back with a new band, a seaside hotel and an unorthodox approach to dog-handling",https://i.guim.co.uk/img/media/160bdc3e5d9fe1ccc354d43c2b7895cdc754b5d8/0_1237_3456_2074/master/3456.jpg?width=1200&height=630&quality=85&auto=format&fit=crop&overlay-align=bottom%2Cleft&overlay-width=100p&overlay-base64=L2ltZy9zdGF0aWMvb3ZlcmxheXMvdGctZGVmYXVsdC5wbmc&s=f2e6870f8b146e8bb9d17e8d4687760f,2019-04-25
https://www.skysports.com/football/news/11661/11703192/tottenham-chelsea-arsenal-and-man-utd-assessing-the-race-for-the-champions-league,"Tottenham, Chelsea, Arsenal and Man Utd: Assessing the race for the Champions League - SkySports",The Premier League's midweek results mean the race for the top four looks poised to go down to the final day of the season.,https://e1.365dm.com/19/04/150x150/skysports-champions-league_4649969.jpg,2019-04-25
https://news.sky.com/story/cyclone-kenneth-mozambique-could-face-catastrophic-flooding-as-new-storm-makes-landfall-11703668,Cyclone Kenneth: Mozambique could face 'catastrophic flooding' as new storm makes landfall - Sky News,Part of the African nation - one of the poorest countries in the world - was left devastated by Cyclone Idai in March.,https://e3.365dm.com/19/04/1600x900/skynews-cyclone-kenneth-comoros_4650447.jpg?20190425224033,2019-04-25
https://www.telegraph.co.uk/news/2019/04/26/explosion-reported-port-talbot-steelworks/,Explosion reported at Port Talbot steelworks - The Telegraph,Two people have suffered injuries after an explosion rocked the UK's largest steelworks causing a fire to break out.,,2019-04-25
https://www.theguardian.com/world/2019/apr/26/more-afghan-civilians-killed-by-nato-led-forces-than-taliban-in-2019,More Afghan civilians killed by Nato-led forces than Taliban in 2019 - The Guardian,It is first time since UN began collecting figures that pro-government forces have caused majority of deaths,https://i.guim.co.uk/img/media/84ccb469a817604db020b85d618717c64a9587a2/0_78_5415_3249/master/5415.jpg?width=1200&height=630&quality=85&auto=format&fit=crop&overlay-align=bottom%2Cleft&overlay-width=100p&overlay-base64=L2ltZy9zdGF0aWMvb3ZlcmxheXMvdGctZGVmYXVsdC5wbmc&s=1fda6b3444472bef11637b2fc31f523b,2019-04-25
https://www.bbc.co.uk/news/uk-northern-ireland-48060153,Political talks plan for Northern Ireland expected - BBC News,It is understood the British and Irish governments plan new talks in the wake of Lyra McKee murder.,https://ichef.bbci.co.uk/news/1024/branded_news/8457/production/_106597833_stormont.jpg,2019-04-25
https://www.dailymail.co.uk/tvshowbiz/article-6961695/BAZ-BAMIGBOYE-never-Jane-Bond-says-Barbara-Broccoli.html,"BAZ BAMIGBOYE: We'll never have Jane Bond, says Barbara Broccoli - Daily Mail","BAZ BAMIGBOYE: Barbara Broccoli said with the Craig series of Bonds, 007 had evolved into ‘a very complex character; and his relationships are far more complex — so the women have evolved.",https://i.dailymail.co.uk/1s/2019/04/26/00/12731040-0-image-a-30_1556236105477.jpg,2019-04-25
https://torontosun.com/news/local-news/5-year-old-boy-missing-peel-police,"AMBER ALERT: 5-year-old boy, mother found safe and sound, report Peel police - Toronto Sun",** UPDATE AS OF 7 P.M.: Peel police report both the mother and child have been found safe and sound.An Amber Alert that was issued for a five-year-old boy last seen with his mother in Mississauga h…,https://postmediatorontosun.files.wordpress.com/2017/10/57248-33269.jpg,2019-04-25
https://www.ctvnews.ca/sci-tech/facebook-bans-personality-quiz-apps-after-cambridge-analytica-scandal-1.4395719,Facebook bans personality quiz apps after Cambridge Analytica scandal - CTV News,"Facebook is taking steps to ban personality quiz apps from its platform, more than a year after the Cambridge Analytica scandal.",https://www.ctvnews.ca/polopoly_fs/1.4374149.1554919978!/httpImage/image.jpg_gen/derivatives/landscape_620/image.jpg,2019-04-25
https://www.channelnewsasia.com/news/commentary/samsung-galaxy-fold-mistake-broke-plastic-protective-layer-11474474,Commentary: Samsung's gigantic mistake over the Galaxy Fold - CNA,"The Galaxy Fold was just a blunder in timing, says China commentator Tom McGregor.","https://cna-sg-res.cloudinary.com/image/upload/q_auto,f_auto/image/11466474/16x9/991/557/eea63e7a4f368dd9aa2757c99300f5b0/Cm/samsung-fold.jpg",2019-04-25
https://www.castanet.net/edition/news-story-254797-4-.htm,Capital state of emergency - Canada News - Castanet.net,Ottawa Mayor Jim Watson has declared a state of emergency over flooding along the Ottawa River and other waterways.,https://www.castanet.net/content/2019/4/ajw101543999_p3383008.jpg,2019-04-25
https://www.vcstar.com/story/news/2019/04/25/quarantine-ordered-l-a-universities-over-measles/3579884002/,Quarantine ordered at LA universities over measles - Ventura County Star,A quarantine has been ordered at UCLA and CSU Los Angeles for students and staff members who may have been exposed to measles.,"https://www.gannett-cdn.com/presto/2019/04/22/PTCN/c0ff458e-327e-441d-abad-86093fb37396-rash.jpg?crop=699,393,x1,y0&width=3200&height=1680&fit=bounds",2019-04-25
https://www.sbs.com.au/news/fraser-anning-supporter-charged-with-assault-and-intimidation-following-altercation-with-media,Fraser Anning supporter charged with assault and intimidation following altercation with media - SBS News,The 19-year-old has been charged by police after a scuffle at Senator Anning's press conference.,https://sl.sbs.com.au/public/image/file/a37fb4d3-f131-4a86-b059-18bcca61ce07/crop/16x9,2019-04-25
https://www.news.com.au/sport/sports-life/sam-oliver-wins-100k-in-defamation-suit-against-nine-network/news-story/fe914bb36b101abef4c4b33967c6e4ed,Nine Network lose defamation case to Britain’s Sam Oliver - NEWS.com.au,"An Englishman who was cleared of assaulting Australia’s former Rugby Sevens captain is entitled to $100,000 damages after being defamed by the Nine Network, a judge has ruled.",https://cdn.newsapi.com.au/image/v1/eb3374343ea5da095a8f9a3f163eeece?width=650,2019-04-25
https://wwos.nine.com.au/cricket/watson-calls-time-on-thunder-bbl-career/35e9620b-31e3-4aba-ab45-5fb64f838e4d,"Cricket: Shane Watson calls time on Sydney Thunder, BBL career - Wide World of Sports",'Amazing memories that I will savour forever',http://prod.static9.net.au/fs/91aba370-f1bf-4db9-b50a-f14fc70841e8,2019-04-25
https://www.abc.net.au/news/2019-04-26/should-the-rba-deploy-helicopters-for-a-money-drop-on-australia/11048102,Reserve Bank should call in the helicopters to drop money on Australian households: Citi - ABC News,Major global investment bank Citi argues the Reserve Bank and Federal Government should team up to drop helicopter money on households to head-off a severe economic slowdown and get inflation back on target.,https://www.abc.net.au/news/image/11049110-16x9-700x394.jpg,2019-04-25
https://www.abc.net.au/news/2019-04-26/counter-terrorism-operation-in-north-melbourne/11049274,Man arrested in counter-terrorism operation in West Melbourne - ABC News,Counter-terrorism officers arrest a man in North Melbourne but a police spokesperson says there is no current or impending threat to the community.,https://www.abc.net.au/news/image/11049502-16x9-700x394.jpg,2019-04-25
https://www.fool.com.au/2019/04/26/brokers-name-3-asx-shares-to-buy-today-37/,Brokers name 3 ASX shares to buy today - Motley Fool Australia,National Australia Bank Ltd (ASX:NAB) shares are one of three that brokers have named as buys...,https://www.fool.com.au/wp-content/uploads/2016/10/GettyImages-497346852.jpg,2019-04-25
https://www.theage.com.au/national/nsw/wonder-why-prisoners-re-offend-here-s-my-son-s-story-20190426-p51hgy.html,Wonder why prisoners re-offend? Here's my son's story - The Age,"Most prisoners get no rehabilitation or education. Even finding a book to read is chore in this revolving-door system for criminals, writes an inmate's father.","https://static.ffx.io/images/$zoom_0.61,$multiply_1,$ratio_1.777778,$width_1059,$x_0,$y_174/t_crop_custom/w_800/q_86,f_auto/d1d07221ab9600dca6b3ac8d1097dceb05cfc6eb",2019-04-25
https://www.cnn.com/2019/04/26/asia/kim-jong-un-vladivostok-intl/index.html,Kim Jong Un accuses US of acting in 'bad faith' - CNN,"North Korean leader Kim Jong Un told Russian President Vladimir Putin that he believes the United States acted in ""bad faith"" at the Hanoi summit, North Korean state media reported.",https://cdn.cnn.com/cnnnext/dam/assets/190425073551-kim-jong-un-vladimir-putin-super-tease.jpg,2019-04-25
https://www.cnn.com/2019/04/26/us/colorado-lakewood-i-70-fiery-crash/index.html,"Multiple people killed in fiery crash involving 12 cars and 3 semis in the Denver area, police say - CNN","A fiery crash involving 12 cars and three semis left multiple people dead and at least six others injured in Colorado, authorities said.",https://cdn.cnn.com/cnnnext/dam/assets/190425235935-colorado-fire-screengrab-02-super-tease.jpg,2019-04-25
http://www.nintendolife.com/news/2019/04/nintendos_president_wants_the_switch_game_library_to_continue_to_meet_consumers_diverse_tastes,"Nintendo's President Wants The Switch Game Library To ""Continue To Meet Consumers' Diverse Tastes"" - Nintendo Life",Something for everyone,http://images.nintendolife.com/news/2019/04/nintendos_president_wants_the_switch_game_library_to_continue_to_meet_consumers_diverse_tastes/large.jpg,2019-04-25
https://www.foxnews.com/politics/the-five-bernie-sanders-felon-voting-comments,'The Five' fired up over Bernie Sanders' latest felon voting comments - Fox News,"The panelists on ""The Five"" were fired up Thursday about presidential candidate Sen. Bernie Sanders, I-Vt., saying felons in prison, including the Boston Marathon bomber, should be able to vote.",https://media2.foxnews.com/BrightCove/694940094001/2019/04/25/694940094001_6030023797001_6030018844001-vs.jpg,2019-04-25
https://www.omaha.com/go/movies/reviews/review-avengers-endgame-is-not-only-the-biggest-superhero-movie/article_ae741512-e37d-5be7-b379-e1515ca16146.html,"Review: 'Avengers: Endgame' is not only the biggest superhero movie, but the best - Omaha World-Herald","Allow ""Avengers: Endgame"" to restore your faith in the superheroic.",https://bloximages.newyork1.vip.townnews.com/omaha.com/content/tncms/assets/v3/editorial/9/b6/9b6fd835-5215-5fdf-97b4-a6752bd6e32a/5cc07d082d686.image.jpg?crop=1132%2C848%2C30%2C139&resize=841%2C630&order=crop%2Cresize,2019-04-25
https://thehill.com/homenews/campaign/440775-trump-has-privately-expressed-concern-to-advisers-that-biden-could-beat-him,Trump has privately expressed concern to advisers that Biden could beat him: report - The Hill,An unnamed Republican strategist with insider knowledge on the White House told Politico report that Presid,https://thehill.com/sites/default/files/biden-trump-getty.jpg,2019-04-25
https://9to5mac.com/2019/04/25/ios-13-ipad-concept/,"iOS 13 concept imagines mouse support, enhanced multitasking, more for iPad [Gallery] - 9to5Mac","As we reported last week, iOS 13 is expected to bring some notable improvements to the iPad user experience. Now, a new concept imagines what iOS 13 might look like on the iPad, included new naviga…",https://9to5mac.com/wp-content/uploads/sites/6/2019/04/d2678f79372893.5cc0e0ab53161.jpeg?quality=82&strip=all&w=1600,2019-04-25
https://pagesix.com/2019/04/25/its-over-for-pete-davidson-and-kate-beckinsale/,It's over for Pete Davidson and Kate Beckinsale - Page Six,"“Even though Kate has been in Hollywood for a long time, she struggled with the attention on her relationship with Pete. He lives his life with his heart on his sleeve.”",https://nyppagesix.files.wordpress.com/2019/03/kate-pete.jpg?quality=90&strip=all&w=1200,2019-04-25
https://www.nbcnews.com/news/world/trump-pressure-will-fail-because-iran-has-ph-d-sanctions-n998711,"Trump pressure will fail because Iran has a 'Ph.D. in sanctions busting,' says Iran's Zarif - NBC News",Iranian Foreign Minister Javad Zarif said his country had decades of experience evading U.S. economic sanctions and would survive this latest round of pressure.,https://media2.s-nbcnews.com/j/newscms/2019_17/2835441/190425-mohammad-javad-zarif-se-555p_874e5d09c746c92581da3f82b9140c17.nbcnews-fp-1200-630.jpg,2019-04-25
https://www.wsmv.com/news/entertainment/taylor-swift-poses-with-fans-ahead-of-big-announcement/article_3856baba-51b0-5a2f-ba3e-078f278f1c17.html,"Taylor Swift releases colorful new song, video called 'ME!' - WSMV Nashville","NEW YORK (AP) — Taylor Swift released a colorful, upbeat single Friday morning, ending the weeks-long search the pop star set off when she teased fans with clues about a",https://bloximages.newyork1.vip.townnews.com/wsmv.com/content/tncms/assets/v3/editorial/2/78/278294b1-61c2-5994-a6ff-638928072898/5cc1f92c41f9f.image.jpg?resize=1120%2C630,2019-04-25
https://www.bbc.co.uk/news/uk-politics-48061793,Huawei row: Top civil servant demands leak inquiry co-operation - BBC News,Sir Mark Sedwill's letter to ministers comes amid pressure for a more robust response to the Huawei leaks.,https://ichef.bbci.co.uk/news/1024/branded_news/B733/production/_106599864_mediaitem106599862.jpg,2019-04-25
https://www.dailymail.co.uk/tvshowbiz/article-6961573/Britney-Spears-released-mental-health-facility-picked-boyfriend.html,Britney Spears has been released from mental health facility as she is picked up by her boyfriend - Daily Mail,Britney Spears has been released from the mental health facility where she has spent the last 30 days.,https://i.dailymail.co.uk/1s/2019/04/26/07/12740920-0-image-a-15_1556261973119.jpg,2019-04-25
