url,title,description,urlToImage
https://www.stuff.co.nz/business/112282617/home-access-for-couriers-part-of-tech-companies-push-into-delivery-sphere,Home access for couriers part of tech companies' push into delivery sphere - Stuff.co.nz,OPINION: Would you let a delivery person in while you were out?,https://resources.stuff.co.nz/content/dam/images/1/u/u/l/o/3/image.related.StuffLandscapeSixteenByNine.1420x800.1uultl.png/1556370215077.jpg
https://www.wsj.com/articles/this-biotech-is-going-to-the-dogs-11556373780,This Biotech Is Going to the Dogs - The Wall Street Journal,"Elanco Animal Health said it would acquire Aratana Therapeutics, a biotech that develops dog and cat medicine, in a stock deal valued at about $234 million. Elanco is going to have to learn some new tricks.",https://images.wsj.net/im-69927/social
https://www.bristolpost.co.uk/news/bristol-news/tesco-clubcard-deal-money-off-2805463,The secret Tesco ClubCard deal that will get you 50 percent off - Bristol Post,Details of the exciting promotion have been leaked,https://i2-prod.bristolpost.co.uk/incoming/article1926438.ece/ALTERNATES/s1200/0_Tesco-to-slash-Clubcard-rewards-for-28-million-credit-card-customers.jpg
https://buffalonews.com/2019/04/27/tesla-cars-and-owners-all-charged-up-for-test-drives/,Tesla cars and owners charged up for test drives - Buffalo News,Drivers in the Buffalo Niagara region had the chance to zip around in a Tesla electric vehicle Saturday. Tesla Owners Club New York State...,https://s3.amazonaws.com/bncore/wp-content/uploads/2019/04/1012772384-Tesla-KIRKHAM13.jpg
https://www.wsws.org/en/articles/2019/04/27/amzn-a27.html,Amazon posts record $3.6 billion profit in first three months of 2019 - World Socialist Web Site,Amazon plans to increase the exploitation of workers in the US and internationally by implementing free one day shipping for Prime subscribers to ensure ever-bigger profits.,https://www.wsws.org/asset/92abf644-0a7a-4dd2-a45c-28de7411f495/image.jpg
https://www.fool.com.au/2019/04/28/3-investing-picks-for-first-time-investors/,3 companies to buy for first time investors - Motley Fool Australia,Balance risk and reward with companies like Xero FPO NZX (ASX: XRO) and ResMed Inc. (CHESS) (ASX: RMD),https://www.fool.com.au/wp-content/uploads/2017/10/Time-is-Money-16.9.jpg
https://finance.yahoo.com/news/mario-gabelli-disney-bob-iger-underpaid-141651333.html,Billionaire investor Mario Gabelli: Disney CEO Bob Iger is actually underpaid - Yahoo Finance,"GAMCO CEO Mario Gabelli, the legendary value investor, disagrees with the assertion that Disney CEO Bob Iger is overpaid.",https://s.yimg.com/uu/api/res/1.2/ctkF2p4_lw4Ed5SGgS2_0Q--~B/aD0zNzEyO3c9NTU2ODtzbT0xO2FwcGlkPXl0YWNoeW9u/https://img.huffingtonpost.com/asset/5cc212c8240000d30b522e36.jpeg
https://cleantechnica.com/2019/04/27/tesla-production-deliveries-sales-what-was-the-question/,"Tesla Production, Deliveries, Sales ... What Was The Question? - CleanTechnica",It is not often that the Wall Street analysts prove Elon Musk right by themselves being wrong within just a few days,https://cleantechnica.com/files/2019/04/Tesla-Model-3-Seat-Factory-Fremont-Cleantechnica-0-570x290.png
https://wgntv.com/2019/04/27/e-coli-outbreak-from-tainted-ground-beef-expands/,E. coli outbreak from tainted ground beef expands - WGN TV Chicago,"An outbreak of E. coli from tainted ground beef has expanded to sicken 177 people in 10 states, the U.S. Centers for Disease Control and Prevention said Friday.

Of those infected, 21 have been hospitalized. No deaths have been reported. Those infected range…",https://tribwgntv.files.wordpress.com/2019/04/gettyimages-148291302.jpg?quality=85&strip=all
https://www.nytimes.com/2019/04/27/us/kids-2-rocking-sleeper-recall.html,"700,000 Rocking Baby Sleepers Are Recalled After 5 Infant Deaths - The New York Times","The children’s product company Kids II will offer refunds for the sleepers, which were sold nationwide by retailers including Walmart, Target and Toys “R” Us.",https://static01.nyt.com/images/2019/04/27/us/27xp-rocker/27xp-rocker-facebookJumbo.jpg
https://www.kcrg.com/content/news/Ford-Justice-Dept-opens-probe-into-emissions-certification-509158121.html,Ford: Justice Dept. opens probe into emissions certification - KCRG,Ford says the Justice Department has opened a criminal investigation into its U.S. emissions certification process.,https://media.graytvinc.com/images/ford+logo9.jpg
https://www.mirror.co.uk/news/world-news/sas-strike-travel-chaos-brit-14809667,SAS strike: Travel chaos for holidaymakers as airline cancels 587 flights - Mirror Online,"Around 170,000 people are expected to be affected by the strike sparked by demands over pay and working hours",https://i2-prod.mirror.co.uk/incoming/article14809689.ece/ALTERNATES/s1200/0_Norwegian-SAS-pilot-strike-Gardermoen-Norway-26-Apr-2019.jpg
https://seekingalpha.com/article/4257418-reit-rally-resumes-earnings-season-heats,REIT Rally Resumes As Earnings Season Heats Up - Seeking Alpha,"Following the worst week of the year for REITs, the sector bounced-back on a busy week of economic data. REITs have climbed in fourteen of the seventeen weeks o",https://static1.seekingalpha.com/uploads/2019/4/1723581_15563386865660_rId9.jpg
https://cleantechnica.com/2019/04/27/current-tesla-model-3-options-your-guide/,Current Tesla Model 3 Options — Your Guide (For Now) - CleanTechnica,"The prices shown here are subject to change, so if you're in the market for a Model 3, this handy guide can help — but it's always important to check directly with Tesla for the latest updates",https://cleantechnica.com/files/2019/04/Tesla-Model-3-Model-S-red-white-and-blue-570x434.jpg
https://www.theaustralian.com.au/weekend-australian-magazine/hyundai-kona-electric/news-story/9401b20e71db4b7af5c835f6d012dbe6,Hyundai Kona Electric review: the first electric compact SUV - The Australian,"Subscribe to The Australian to get unrestricted digital access, home paper delivery, Apps for iPad and Android, member only +Rewards and much more...",
https://www.caradvice.com.au/751321/the-weeks-top-news-stories-april-28-2019/,"The week's top news stories: April 28, 2019 - CarAdvice","The automotive news wheel is always turning. If you’re not constantly checking CarAdvice – which you should be doing, by the way – it can be easy for some headlines to slip through the cracks.To make...","https://media.caradvice.com.au/image/private/c_fill,q_auto,f_auto,w_960,h_500/zblfcwetts5pimkwymd7.jpg"
https://ripplecoinnews.com/ripple-welcomes-sbi-holdings-ceo-yoshitaka-kitao-as-board-member,Ripple Welcomes SBI Holdings CEO Yoshitaka Kitao As Board Member - Ripple Coin News,"While Ripple’s native currency, XRP is struggling to surge higher, Ripple isn’t left behind to take the venture to a next level. Following the success of Quarter 1 2019, Ripple likely strengthened the firm with SBI Holding’s CEO, Yoshitaka Kitao as one of its…",https://ripplecoinnews.com/wp-content/uploads/2019/04/SBI-Holdings-Japan-1000x600.jpg
https://ethereumworldnews.com/analysts-flip-bearish-bitcoin-expect-collapse-4200/,"Analysts Flip Bearish On Bitcoin (BTC), Expect Collapse To $4,200 - Ethereum World News","Bitcoin May Be On The Verge Of A Plunge, Analysts WarnSave for yesterday's price action, the movement in the v",https://ethereumworldnews.com/wp-content/uploads/2019/04/aleksi-raisa-1490108-unsplash-1-1024x668.jpg
https://seekingalpha.com/article/4257410-oil-prices-races,Oil Prices Are Off To The Races - Seeking Alpha,The struggle to contain rising oil prices on world markets is just beginning as the US lifts exemptions on the purchase of Iranian oil. Saudi Arabia was furious,https://static.seekingalpha.com/images/marketing_images/oil_gas/pumping_gasoline.jpeg
https://www.wxyz.com/news/kfcs-chickendales-have-a-spicy-gift-for-moms-this-mothers-day,News KFC's Chickendales have a spicy gift for moms this Mother's Day Fatima Bangura 9:52 - WXYZ Detroit,KFC is putting their crispy twist on the popular Las Vegas male dance troupe Chippendales -- with the introduction of Chickendales.,https://ewscripps.brightspotcdn.com/dims4/default/69bdff7/2147483647/strip/true/crop/800x420+0+0/resize/1200x630!/quality/90/?url=https%3A%2F%2Fewscripps.brightspotcdn.com%2F1d%2Fac%2F1d2784da4a54b17b25d39c360348%2Fkfc.jpg
https://www.hulldailymail.co.uk/news/uk-world-news/lottery-results-live-lotto-saturday-2806714,Lottery results Live: Winning Lotto and Thunderball numbers for Saturday April 27 - Hull Daily Mail,"The lotto and Thunderball numbers for Saturday, April 27",https://i2-prod.hulldailymail.co.uk/incoming/article758437.ece/ALTERNATES/s1200/National-Lottery-new-logo.jpg
https://www.japantimes.co.jp/news/2019/04/27/national/crime-legal/carlos-ghosns-release-bail-part-wider-trend-japans-criminal-justice-system/,Carlos Ghosn's release on bail is part of a wider trend in Japan's criminal justice system - The Japan Times,"The rate of bail approval increased from roughly 15 percent in 2007 to about 32 percent in 2017, according to the Japan Bail Support Association.",https://cdn.japantimes.2xx.jp/wp-content/uploads/2019/04/n-bail-a-20190428-870x578.jpg
https://cleantechnica.com/2019/04/27/tesla-model-3-thumps-bmw-m3-model-s-x-upgrade-tesla-death-anniversary-cleantechnica-top-20/,Tesla Model 3 Thumps BMW M3 ... Model S & X Upgrade ... Tesla Death Anniversary — #CleanTechnica Top 20 - CleanTechnica,"The most popular CleanTechnica stories of the past week included a Tesla Model 3 Performance thumping a BMW M3 on the track, some breaking news about a Tesla Model S & X upgrade from Tesla, our idea for a Tesla 11 Year Death Anniversary. For more, scroll past…",https://cleantechnica.com/files/2019/03/tesla-fremont-factory-tesla-model-3-body-parts-press-570x431.jpg
https://globalnews.ca/news/5212235/victoria-mayor-oil-sands-trip/,Victoria mayor not yet convinced about oilsands future after Alberta trip - Global News,Mayor Helps was invited to tour the oilsands by Calgary city councillor Ward Sutherland.,https://shawglobalnews.files.wordpress.com/2019/04/victoria-mayor-oil-sands-e1556408700307.jpg?quality=70&strip=all&w=720&h=379&crop=1
https://www.cbc.ca/news/canada/british-columbia/kelowna-rcmp-warn-of-puppy-fraud-after-residents-conned-out-of-cash-1.5113997,Kelowna RCMP warn of puppy fraud after residents conned out of cash - CBC.ca,"Kelowna RCMP are issuing a warning about ""puppy fraud"" after two residents were conned out of hundreds of dollars.",https://i.cbc.ca/1.4312315.1506632288!/fileImage/httpImage/image.jpg_gen/derivatives/16x9_620/puppy.jpg
https://thehill.com/policy/energy-environment/440987-london-marathon-replacing-thousands-of-plastic-water-bottles-with,London Marathon replacing thousands of plastic water bottles with biodegradable seaweed pouches | TheHill - The Hill,"The organizers behind the London Marathon will use edible, biodegradable seaweed pouches containing water in place of thousands plastic bottles during the race on Sunday in a push toward sustainability.",https://thehill.com/sites/default/files/ooho_seaweed_pouches_youtube.png
https://japantoday.com/category/crime/Tokyo-court-retracts-plan-to-start-Ghosn-trial-in-Sept,Tokyo court retracts plan to start Ghosn's trial in Sept - Japan Today,"The Tokyo District Court has retracted its plan to start the trial for former Nissan Motor Co Chairman Carlos Ghosn in September, without proposing a new time frame, sources close to the matter said Friday. The move, which could mean the trial will not start …",
https://www.bloomberg.com/news/articles/2019-04-27/how-sainsbury-s-project-solar-crashed-down-to-earth,How Sainsbury’s Project Solar Crashed Down to Earth - Bloomberg,,
https://www.timescolonist.com/news/local/strong-winds-force-cancellation-of-ferry-sailings-limited-service-in-evening-1.23804622,Strong winds force cancellation of ferry sailings; limited service in evening - Times Colonist,Strong winds at Tsawwassen ferry terminal Saturday forced B.C. Ferries to cancel several sailings on the Swartz Bay-Tsawwassen route. But it hoped to offer a scaled-back service in the evening.   . . .,https://images.glaciermedia.ca/polopoly_fs/1.23804788.1556414140!/fileImage/httpImage/image.jpg_gen/derivatives/facebookogimage_560_292/04282019-ferries-jpg.jpg
https://www.cbc.ca/news/canada/prince-edward-island/pei-gas-price-increase-irac-1.5113903,Gas up 5 cents a litre on P.E.I. - CBC.ca,"The price of gas, diesel and furnace oil went up Saturday on P.E.I..",https://i.cbc.ca/1.5113907.1556365856!/fileImage/httpImage/image.JPG_gen/derivatives/16x9_620/gas-price.JPG
https://www.9news.com.au/world/why-the-secondbiggest-diamond-found-in-botswana-is-not-worth-as-much-as-youd-think/71684863-d37f-45a7-a64c-92938800fccb,"Why the newly discovered, second-biggest diamond ever is not worth as much as you'd think - 9news.com.au","<p>The recent discovery of the second-biggest diamond in history - a staggering 1,758-carat stone - is a remarkable find, but there's a debate over its real market value.</p>",http://prod.static9.net.au/fs/1f020b62-1681-4fbd-9f43-c4f5902f50fc
https://cointelegraph.com/news/bitcoin-pushes-over-5-300-as-most-top-cryptos-see-gains,"Bitcoin Pushes Over $5,300 as Most Top Cryptos See Gains - Cointelegraph","Most of the top 20 cryptocurrencies are reporting slight to moderate gains on the day as bitcoin holds over the $5,300 mark again.",https://images.cointelegraph.com/images/740_aHR0cHM6Ly9zMy5jb2ludGVsZWdyYXBoLmNvbS9zdG9yYWdlL3VwbG9hZHMvdmlldy8xZDFmZDM3ZjA0ODg5OGM0MmViZTVjZGVjMjc2NjI1OS5qcGc=.jpg
https://oilprice.com/Energy/Energy-General/Rosneft-Sees-No-Oil-Deficit-Looming-As-Iran-Sanction-Waivers-End.html,Rosneft Sees No Oil Deficit Looming As Iran Sanction Waivers End - OilPrice.com,Rosneft CEO Igor Sechin has said that his company does not expect that the end of Iran sanction waivers will spark a deficit in oil markets,https://d32r1sh890xpii.cloudfront.net/article/718x300/da91e87a0f6663d47d4f5530ead16d27.jpg
https://www.marketwatch.com/story/ceo-of-pot-producer-cronos-talks-about-altria-deal-weed-drinks-and-the-rise-of-cbd-2019-04-27,"CEO of pot producer Cronos talks about Altria deal, weed drinks and the rise of CBD - MarketWatch",Cronos Group Inc. is one of two of Canada’s cannabis producers to ink multi-billion dollar deals with big American companies.,http://s.marketwatch.com/public/resources/MWimages/MW-GZ960_gorens_ZG_20181207175604.jpg
https://www.jsonline.com/story/news/politics/2019/04/27/trump-wants-work-tony-evers-foxconn-jobs-campaign-says/3601733002/,"Donald Trump wants to work with Tony Evers on getting 13,000 Foxconn jobs, campaign says - Milwaukee Journal Sentinel",The president has been at the center of the Foxconn project since the deal was first struck between former Gov. Scott Walker and Foxconn chairman and CEO Terry Gou.,"https://www.gannett-cdn.com/presto/2019/04/17/PMJS/9a786eac-ada9-4937-a272-4dafdf35e517-MJS_trump_18_hoffman.jpg_trump.JPG?crop=4731,2661,x0,y669&width=3200&height=1680&fit=bounds"
https://www.fool.com/taxes/2019/04/27/just-paid-the-irs-heres-how-the-government-spends.aspx,Just Paid the IRS? Here's How the Government Spends Your Money - The Motley Fool,Find out where the federal government uses tax revenue.,https://g.foolcdn.com/editorial/images/520429/capitol-gettyimages-491753396.jpg
https://news.sky.com/story/police-bust-gang-behind-fake-lego-brand-lepin-seizing-toys-worth-23m-11705123,Police bust gang behind fake Lego brand Lepin - seizing toys worth £23m - Sky News,Knock-off toys were being copied from Lego blueprints and sent to a factory in Shenzhen to be made before being sold across China.,https://e3.365dm.com/19/04/1600x900/skynews-lepin-fake-lego_4651882.jpg?20190427152917
https://dailymemphian.com/article/4718/Amazon-Prime-One-Day-Will-it-hurt-or-help-FedEx,Amazon Prime One-Day: Will it hurt or help FedEx? - The Daily Memphian,"Amazon says it will roll out one-day delivery as the standard for Amazon Prime customers over multiple quarters, and that it will need help from 'external transportation partners.'&nbsp;",https://dailymemphian.com/api/image/9574/1200
https://www.news.com.au/finance/business/retail/how-radio-boss-phil-leahy-went-from-depressed-and-bankrupt-to-millionaire/news-story/7e760340dec181ad3103224983592e2e,Phil Leahy: How Kiss FM vice chairman went from bankrupt to millionaire - NEWS.com.au,"Phil Leahy had a long, successful career in the radio business — so when his company folded and he was forced to declare bankruptcy, the failure hit him hard.",https://cdn.newsapi.com.au/image/v1/765168f5ce3bfe8b7551810976cc1723?width=650
https://www.investing.com/news/economy-news/3-things-under-the-radar-this-week-1848428,3 Things Under the Radar This Week By - Investing.com,3 Things Under the Radar This Week,https://i-invdn-com.akamaized.net/news/LYNXNPEF3025Q_L.jpg
https://calgaryherald.com/opinion/columnists/varcoe-facing-some-static-transalta-moves-forward-with-brookfield-deal,"Varcoe: Facing some static, TransAlta moves forward with Brookfield deal - Calgary Herald","Working for more than a century in Alberta’s electricity industry, TransAlta Corp. is used to facing some static — and it did so again Friday.Despite resistance from one large investor,…",https://postmediacalgaryherald2.files.wordpress.com/2019/04/transalta002.jpg
https://www.nzherald.co.nz/business/news/article.cfm?c_id=3&objectid=12225693,Huge warning sign for Australian economy - New Zealand Herald,This plunging number means something has gone horribly wrong with Australia's economy.,https://www.nzherald.co.nz/resizer/7XUdPFRXcOK-MnOUSuEgass2PoU=/1200x0/smart/filters:quality(70)/arc-anglerfish-syd-prod-nzme.s3.amazonaws.com/public/WU536UNEHZDR5G5UMITO3PDXQ4.jpg
https://www.newsbtc.com/2019/04/27/despite-tether-concerns-notable-analysts-bullish-bitcoin/,"Despite Tether Concerns, Notable Analysts Remain Bullish On Bitcoin (BTC) - newsBTC","What many thought would never happen did on Thursday. Just days after Tether Limited, the company behind the USDT stablecoin, minted $300 million worth of",https://www.newsbtc.com/wp-content/uploads/2019/02/shutterstock_719677471-1100x733.jpg
https://sputniknews.com/russia/201904271074521286-russia-oil-commission/,Russia Probes Violations Related to Oil Quality - Energy Ministry - Sputnik International,"MOSCOW (Sputnik) - Russian Energy Minister Alexander Novak has established an interministerial commission that will be tasked with carrying out an investigation into a contamination of Russian oil coming through the Druzhba pipeline, the Russian Energy Minist…",https://cdn4.img.sputniknews.com/images/104593/92/1045939245.jpg
https://cleantechnica.com/2019/04/28/non-stop-engineering-innovation-are-the-lifeblood-of-tesla/,Non-Stop Engineering & Innovation Are The Lifeblood Of Tesla - CleanTechnica,"Tesla is, at its core, an engineering company. The company as we know it today was founded on the building blocks of lithium-ion batteries and electric motors. Having an early interest and exposure to supercapacitors, Elon Musk saw the potential with lithium-…",https://cleantechnica.com/files/2019/03/20190308_1019360-570x367.jpg
https://www.philly.com/news/steel-furnace-party-philadelphia-do-attend-20190427.html,Furnace Party: Viral letter inspires real party in Brewerytown - Philly.com,"Hundreds of people gathered at a vacant lot in Breweryton Saturday, heeding a request made in a viral letter. Philadelphia's Furnace Party was a hit. And the man behind it all was revealed.",https://www.philly.com/resizer/-LKie9jgmDCDreZFLlFXrf5udVc=/1200x0/center/middle/www.philly.com/resizer/-wrD2azGk30VPZnspBbLN512t-w=/1200x0/center/middle/arc-anglerfish-arc2-prod-pmn.s3.amazonaws.com/public/IL6YHBMPKZCBDMHCG65HSZTOWA.jpg
https://www.13abc.com/content/news/Ohio-payday-loan-law-takes-effect-509160901.html,Ohio payday loan law takes effect - 13abc Action News,It caps interest rates and limits fees charged by the short-term lending industry.,https://media.graytvinc.com/images/1280x960_60603P00-SDSBM.jpg
https://www.thesun.co.uk/news/8954416/mcdonalds-kfc-drive-thru-smartphones-pay-fined-points/,McDonald’s and KFC drive-thru motorists using smartphones to pay could be fined £200 and given six penalty po - The Sun,The punishment for using a phone behind the wheel used to be £30 in 2003,https://www.thesun.co.uk/wp-content/uploads/2019/04/NINTCHDBPICT000485865285.jpg?strip=all&quality=100&w=1200&h=800&crop=1
https://www.fool.ca/2019/04/27/why-everyone-should-buy-this-reit-after-its-earnings-report/,Why Everyone Should Buy This REIT After its Earnings Report - The Motley Fool Canada,"There was some important takeaways from Choice Properties Real Estate Investment Trust's (TSX:CHP.UN) earnings report, and most of it good news.",https://yw553ftvhw1iqegz29fycoyw-wpengine.netdna-ssl.com/wp-content/uploads/2018/12/Business-Concept.jpg
https://www.fool.com.au/2019/04/28/3-quality-asx-shares-to-make-you-rich/,3 quality ASX shares to make you rich - Motley Fool Australia,Webjet Limited (ASX:WEB) shares are one of three that I think could make you rich over the long term...,https://www.fool.com.au/wp-content/uploads/2017/02/business-man-with-money-16-9.jpg
https://www.autoevolution.com/news/muhammad-ali-used-to-own-this-alfa-romeo-spider-veloce-now-it-can-be-yours-134148.html,"Muhammad Ali Used To Own This Alfa Romeo Spider Veloce, Now It Can Be Yours - autoevolution","Even though there are better-handling roadsters from that particular era, the Alfa Romeo Spider Veloce II is in a league of its own as far as styling is concerned. Muhammad Ali used to own this 1976 example, originally bought for his wife together with a Roll…",https://s1.cdn.autoevolution.com/images/news/muhammad-ali-used-to-own-this-alfa-romeo-spider-veloce-now-it-can-be-yours-134148-7.jpg
https://www.digitaltrends.com/mobile/best-walkie-talkie-apps-for-android-and-ios/,Chat away with the best walkie-talkie apps for Android and iOS - Digital Trends,"There are times when sending a text message isn't the most efficient way to communicate, and when phoning just isn't worth it. In those moments, an old-fashioned walkie-talkie would be extremely useful. Well why not do that? These are the best walkie-talkie a…",https://icdn3.digitaltrends.com/image/best-walkie-talkie-apps-2-1200x630-c-ar1.91.jpg
http://www.arabnews.com/node/1488891/business-economy,Saudi real estate firm to buy mortgages worth $200m - Arab News,"LONDON: The Saudi Real Estate Refinance Co. (SRC) said on Saturday it had agreed to buy SR750 million ($200 million) worth of mortgages from local banks and mortgage financing companies. The agreements, signed during last week’s Financial Sector Conference in…",http://www.arabnews.com/sites/default/files/2019/04/27/1556881-806475697.jpg
https://www.thetimes.co.uk/article/corrupt-practices-investigation-in-us-pushes-glencore-into-reverse-9l9n68t30,'Corrupt practices' investigation in US pushes Glencore into reverse - The Times,Glencore was among the biggest fallers in the FTSE 100 yesterday as investors shunned the miner and commodities trader after it was revealed that it was under investigation by a regulator in the...,http://www.thetimes.co.uk/imageserver/image/methode%2Ftimes%2Fprod%2Fweb%2Fbin%2F1c6344ae-6858-11e9-adc2-05e1b87efaea.jpg?crop=1500%2C844%2C0%2C78
https://www.opb.org/news/article/camera-microphone-in-flight-entertainment-ban-merkley/,Oregon Sen. Jeff Merkley Wants To Outlaw Cameras On Airplane Entertainment Systems - OPB News,"Next time you're on a plane, take a closer-look at the in-flight entertainment system: You might notice a small camera pointing directly at you. Sen. Jeff Merkley wants to ban them.",https://images3.opb.org/c_fill%2Ch_300%2Cq_90%2Cw_400/ap_650372377796_1556408426484.jpg
https://vancouversun.com/news/local-news/high-winds-in-metro-vancouver-prompt-alert-ferry-delays,"High winds in Metro Vancouver prompt alert, ferry delays - Vancouver Sun",Environment Canada said winds of up to 80 km/h were expected in Metro Vancouver on Saturday.,https://postmediavancouversun2.files.wordpress.com/2019/04/guants.jpg
https://cabinradio.ca/15450/news/yellowknife/delta-boeing-767-diverts-to-yzf-for-medical-emergency/,Delta Boeing 767 diverts to YZF for medical emergency - Cabin Radio,A flight from Amsterdam to Seattle paid an unscheduled visit to Yellowknife on Friday. A female passenger is in a stable condition at the city's hospital.,https://i0.wp.com/cabinradio.ca/wp-content/uploads/2019/04/A-file-photo-of-a-Delta-Air-Lines-Boeing-767.jpg?resize=1280%2C800&ssl=1
https://www.newsbtc.com/2019/04/28/ethereum-eth-price-dip-underway/,Ethereum (ETH) Price Larger Dip Underway: Bulls Losing Grip - newsBTC,"Ethereum price declined below important support levels versus the US Dollar and bitcoin. ETH is currently correcting higher, but it is likely to struggle near $160, $162 and $165.",https://www.newsbtc.com/wp-content/uploads/2018/04/techanalysis-eth3.jpg
https://news.cgtn.com/news/3d3d514d79497a4d34457a6333566d54/index.html,Chinese Police busts 'fake Lego business' of 30 million USD - CGTN,"Chinese anti IP infringement law is not to be toyed with, a lesson that a gang of suspected counterfeiters may have learned after its millions of yuan business of making fake Lego was busted.",https://news.cgtn.com/news/3d3d514d79497a4d34457a6333566d54/img/0e571f9060f7411f87fc809781a51884/0e571f9060f7411f87fc809781a51884.jpg
