url,title,description,urlToImage,date
https://moneymaven.io/mishtalk/economics/speech-synthesized-from-brain-activity-AfResSaR40OhT7G-Aul8Fw/,Speech Synthesized From Brain Activity - MishTalk,Scientists are working on creating speech from thought. They can do it now with 70% accuracy.,https://s3-us-west-2.amazonaws.com/maven-user-photos/mishtalk/economics/zmfATcSa4EegwR7v_znq6Q/cHorIQSFEEG9K7myfqbJEw,2019-04-27
https://www.bbc.com/news/newsbeat-48077012,'Creativity peaks in your 20s and 50s' - BBC News,A new study finds that there are two creative peaks in our lifetime.,https://ichef.bbci.co.uk/news/1024/branded_news/17035/production/_106616249_creative.jpg,2019-04-27
https://www.businessinsider.com/what-measles-looks-like-2019-4,Photos reveal what it looks like to get the measles when there are no vaccines - Business Insider,"A measles vaccine was developed in the early 1960s, and the virus was declared eliminated from the US in 2000. But experts are worried it may be back.",https://amp.businessinsider.com/images/5cc38adcb14bf416fd7d187d-320-160.jpg,2019-04-27
https://www.itv.com/news/2019-04-27/what-is-body-dysmorphia/,What is body dysmorphia? - ITV News - ITV News,"With the news that cosmetic beauty clinics will now screen customers for mental health problems ahead of undergoing procedures, one particular condition has been highlighted.

Body dysmorphic disorder is one condition that beauty clinics are being trained to …",https://news.images.itv.com/image/file/1842745/img.jpg,2019-04-27
https://www.bbc.co.uk/news/newsbeat-48077012,'Creativity peaks in your 20s and 50s' - BBC News,A new study finds that there are two creative peaks in our lifetime.,https://ichef.bbci.co.uk/news/1024/branded_news/17035/production/_106616249_creative.jpg,2019-04-27
https://news.sky.com/story/us-universities-quarantine-1-000-people-over-measles-outbreak-11704661,"US universities quarantine 1,000 people over measles outbreak - Sky News",Those quarantined are believed to have been exposed to two people with the infection who visited the university campuses.,https://e3.365dm.com/19/04/1600x900/skynews-measles-outbreak-vaccine_4651467.jpg?20190427054241,2019-04-27
https://www.cbc.ca/news/canada/british-columbia/kelowna-amputee-awareness-walk-1.5111694,Kelowna man wants people to help him learn to walk again after recent amputation - CBC.ca,Kelowna man Ralph Zaiser is inviting people to come walk with him this Saturday as he learns how again after his right leg was amputated below the knee.,https://i.cbc.ca/1.5112813.1556327197!/fileImage/httpImage/image.JPG_gen/derivatives/16x9_620/ralph-zaiser.JPG,2019-04-27
https://www.adelaidenow.com.au/news/south-australia/adelaide-man-graeme-klemm-had-no-pulse-so-he-swapped-a-battery-bag-for-a-new-heart/news-story/1b00af3d633fdd27f5f3421fcd89069c,Adelaide man Graeme Klemm had no pulse so he swapped a battery bag for a new heart - The Advertiser,"Subscribe to The Advertiser to get unrestricted digital access, home paper delivery, Apps for iPad and Android, member only +Rewards and much more...",,2019-04-27
https://medicalxpress.com/news/2019-04-parents-older-healthier-newborns-social.html,"Parents of older, healthier newborns with less social support less resilient - Medical Xpress","Parents of older, healthier newborns who had less social support were less resilient during their child's hospitalization in the neonatal intensive care unit (NICU), a finding that correlates with more symptoms of depression and anxiety, according to Children…",https://3c1703fe8d.site.internapcdn.net/newman/gfx/news/2019/parentsofold.jpg,2019-04-27
https://www.foxnews.com/health/kentucky-cheerleader-died-strep,"Kentucky cheerleader, 13, who died after falling ill at competition had 'underlying strep infection,' famil... - Fox News","Lilliana Schalck, a Kentucky cheerleader who died after she felt ill at a cheerleading competition in February, was suffering from a strep infection, a coroner’s report stated.",https://static.foxnews.com/foxnews.com/content/uploads/2019/04/694940094001_6006720192001_6006707243001-vs.jpg,2019-04-27
https://www.bbc.com/news/health-48066362,Cosmetic procedures: Firms warned over 'duty of care' - BBC News,"Too many providers are ""operating as a law unto themselves"", England's top doctor says.",https://ichef.bbci.co.uk/news/1024/branded_news/14CBC/production/_106608158_gettyimages-1134260959.jpg,2019-04-27
https://www.unilad.co.uk/health/guy-cures-hay-fever-by-stinging-himself-with-nettles-every-week/,Guy ‘Cures Hay Fever’ By Stinging Himself With Nettles Every Week - UNILAD,,,2019-04-27
https://www.news-medical.net/news/20190427/Childrens-NICU-reduces-unintended-extubations-by-6025-over-10-years.aspx,Children's NICU reduces unintended extubations by 60% over 10 years - News-Medical.net,"A quality-improvement project at the neonatal intensive care unit at Children's National that included standardized taping methods, bedside review of events within 72 hours and reducing how often newborns received chest X-rays reduced unintended extubations b…",https://www.news-medical.net/image.axd?picture=2016%2f3%2fChildren_playing_sunset_-_Zurijeta_8c5bdac77e44431bb1bfec67b9c87208-620x480.jpg,2019-04-27
https://www.mamamia.com.au/sister-relationship/,"""My personal trainer sister uninvited me from a family BBQ because I'm a size 16."" - Mamamia",Sister relationship: A personal trainer disinvited her size 16 sister from her BBQ because she thought it would look bad on her.,https://cdn.mamamia.com.au/wp/wp-content/uploads/2019/04/27122505/BBQ-SF.jpg,2019-04-27
https://www.foxbusiness.com/healthcare/economic-cost-measles-outbreak,The cost of this century's worst measles outbreak - Fox Business,"One measles case could cost state health departments close to $50,000.",https://a57.foxnews.com/static.foxbusiness.com/foxbusiness.com/content/uploads/2019/04/0/0/Measles-feat.jpg?ve=1&tl=1,2019-04-27
https://www.keyt.com/news/santa-barbara-s-county/santa-barbara-county-public-health-looking-for-woman-who-may-have-been-exposed-to-rabid-bat/1072821823,Santa Barbara County Public Health looking for woman who may have been exposed to rabid bat - KEYT,Santa Barbara County Public Health officials are asking for the public's help to locate a woman who may have been exposed to a rabid bat.,https://media.keyt.com/npg-keyt-media-us-east-1/photo/2016/11/03/rabies_1478195372334_4449302_ver1.0_1280_720.jpg,2019-04-27
https://www.pbs.org/newshour/show/california-expands-its-quarantine-as-u-s-deals-with-worst-measles-outbreak-since-2000,Calif. expands quarantine amid spreading measles outbreak - PBS NewsHour,"State and local officials are taking strong steps in response to the largest U.S. measles outbreak since 2000. In California, staff and students at UCLA and California State-Los Angeles were required to stay home after an outbreak there. Dr. Anthony S. Fauci,…",https://d3i6fh83elv35t.cloudfront.net/static/2019/04/Outbreak-1024x665.jpg,2019-04-27
https://www.thesun.co.uk/fabulous/8952767/woman-21-too-embarrassed-to-look-in-the-mirror-after-mystery-allergy-causes-all-over-body-rash-daily-hives-and-facial-swelling/,"Woman, 21, ‘too embarrassed to look in the mirror’ after mystery allergy causes all-over body rash, daily hiv - The Sun","Shauna Campbell, 21, first broke out in small red patches in 2017 and initially thought it might be due to her laundry detergent",https://www.thesun.co.uk/wp-content/uploads/2019/04/pjimage-351.jpg?strip=all&quality=100&w=1200&h=800&crop=1,2019-04-27
https://www.thetelegraphandargus.co.uk/news/17600519.bradford-family-is-raising-money-for-crohns-and-colitis-uk/,Bradford family is raising money for Crohn’s and Colitis UK - Bradford Telegraph and Argus,A BRADFORD family is hoping to raise awareness and understanding of Crohn’s disease after their own personal experience of the impact it can have.,https://www.thetelegraphandargus.co.uk/resources/images/9769627/,2019-04-27
http://www.kelownadailycourier.ca/life/article_50860b38-6860-11e9-86d1-5f427f65a7ef.html,Keto diet not meant for healthy adults | Life - The Daily Courier,"Keto is a word you’ve probably heard quite often, especially around the subject of weight loss.",https://bloximages.newyork1.vip.townnews.com/kelownadailycourier.ca/content/tncms/custom/image/be8fa678-1ebd-11e7-b8ad-f3f097d2c224.gif,2019-04-27
https://www.irishtimes.com/news/ireland/irish-news/sending-child-to-school-without-vaccination-reprehensible-says-harris-1.3874031,"Sending child to school without vaccination ‘reprehensible’, says Harris - The Irish Times",Minister says doctors should help in fight against pseudoscience that was costing lives,https://www.irishtimes.com/image-creator/?id=1.3874030&origw=1440,2019-04-27
https://www.tvnz.co.nz/one-news/world/trigger-makes-us-reach-junk-food-in-times-stress-revealed,The trigger that makes us reach for junk food in times of stress is revealed - TVNZ,Australian scientists have pinpointed the molecule in our brains that's turned on by stress.,https://www.tvnz.co.nz/content/dam/images/news/2019/04/27/trigger-to-reach-for-junk-food-during-stress-is-revealed.png.hashed.eca5133d.desktop.story.share.jpg,2019-04-27
https://www.theguardian.com/society/2019/apr/27/technology-threatens-child-development-psychology-expert-warns,"Technology cuts children off from adults, warns expert - The Guardian","UCL professor says digital world disrupts family life, risking mental health of youngsters",https://i.guim.co.uk/img/media/7c49cdf97520cbc23ed6558ffb7898629abb88b4/0_128_2007_1204/master/2007.jpg?width=1200&height=630&quality=85&auto=format&fit=crop&overlay-align=bottom%2Cleft&overlay-width=100p&overlay-base64=L2ltZy9zdGF0aWMvb3ZlcmxheXMvdG8tZGVmYXVsdC5wbmc&s=beec07651c043334cdd75e44031d15d4,2019-04-27
https://www.telegraph.co.uk/news/2019/04/27/generation-schoolboys-wiped-staff-pressured-using-children-guinea/,Tainted blood tragedy of 'guinea pig' school children: 'Nearly all the boys have died – what a waste of life' - Telegraph.co.uk,"Posing proudly with his friends in the band they formed at school, Martin Wells looks like any other teenage boy with the rest of his life ahead of him.",https://www.telegraph.co.uk/content/dam/news/2019/04/27/TELEMMGLPICT000195159627-xlarge_trans_NvBQzQNjv4BqimE03ya5t_yzTarjErKTYbBD62PaluTDSgK_Mr48PiM.jpeg,2019-04-27
https://www.dailymail.co.uk/news/article-6965793/Cancer-patient-volunteers-child-scanned-pioneering-radiotherapy-machine.html,Cancer patient volunteers as the first child to be scanned in a pioneering radiotherapy machine - Daily Mail,"Alex Burchell, 13, volunteered to be scanned in the MR Linac machine at The Royal Marsden Hospital in Sutton, to help doctors prepare to treat children.",https://i.dailymail.co.uk/1s/2019/04/27/01/12778148-0-image-a-31_1556326632538.jpg,2019-04-27
https://www.castanet.net/edition/news-story-254654-1135-.htm,Are you really doing keto? - FIT Talk With Tania - Castanet.net,"Keto is a word you've probably heard quite often, especially around weight loss.",https://www.castanet.net/content/2019/4/taniapic_p3382738.jpg,2019-04-27
https://www.news-medical.net/news/20190427/Study-examines-barriers-in-HPV-vaccination-and-strategies-to-improve-them.aspx,Study examines barriers in HPV vaccination and strategies to improve them - News-Medical.net,"Pediatricians and nurse practitioners report using several strategies to improve human papillomavirus vaccination, yet also perceive barriers, according to a national American Academy of Pediatrics Pediatric Research in Office Settings network study.",https://www.news-medical.net/image.axd?picture=2018%2f7%2fshutterstock_689215504_aa172f48b2a94017b930750da6a268cf-620x480.jpg,2019-04-27
https://www.heraldsun.com.au/news/victoria/breakthrough-cannabis-treatment-for-sick-young-patients-to-calm-agressive-behaviour/news-story/fd19b69f3fe3ad80fa2988fcc8941f2e,Breakthrough cannabis treatment for sick young patients to calm agressive behaviour - Herald Sun,Victorian children as young as eight are being treated with medicinal cannabis to try and curb their extreme behavioural issues.,https://cdn.newsapi.com.au/image/v1/af9874465a3b21a82ae6559553250720,2019-04-27
https://www.thesun.co.uk/fabulous/8935489/i-had-an-intense-itch-in-my-leg-for-three-years-and-was-horrified-to-learn-it-was-stage-four-cancer/,I had an intense itch in my leg for three years and was horrified to learn it was stage four cancer - The Sun,"Rebecca McDonald, 30, also suffered pain in her shoulder when she drank alcohol and noticed a lump on her neck",https://www.thesun.co.uk/wp-content/uploads/2019/04/Rebecca_OP2.jpg?strip=all&quality=100&w=1200&h=800&crop=1,2019-04-27
https://www.idahostatesman.com/news/nation-world/article229766964.html,Nearly 700 from LA universities still in measles quarantine - Idaho Statesman,Nearly 700 people possibly exposed to measles at two Los Angeles universities are still quarantined three days after health officials ordered the precautions to contain the spread of the highly contagious disease.,https://www.mcclatchy-wires.com/incoming/k0nlaz/picture229746354/alternates/LANDSCAPE_1140/Measles_California_18378.jpg,2019-04-27
https://lex18.com/news/2019/04/27/coroner-strep-infection-caused-sudden-death-of-13-year-old-nky-cheerleader/,Coroner: Strep Infection Caused Sudden Death Of 13-Year-Old NKY Cheerleader - LEX18 Lexington KY News,"FORT THOMAS, Ky. (WLWT) – A 13-year-old Northern Kentucky cheerleader died suddenly as a result of a strep infection, a coroner confirmed Friday. Lilliana Schalck, a Highlands Middle School student, died suddenly in February while participating with private c…",https://s3.amazonaws.com/cordillera-network/wp-content/uploads/sites/4/2019/02/24154216/northern-kentucky-cheerleader.png,2019-04-27
https://www.boston.com/news/local-news/2019/04/26/east-boston-elementary-school-student-tests-positive-for-the-mumps,East Boston elementary school student tests positive for the mumps - Boston.com,,https://www.boston.com/wp-content/uploads/2019/04/Screen-Shot-2019-04-27-at-8.45.56-AM-850x478.png,2019-04-27
https://triblive.com/local/westmoreland/westmoreland-walks-hosts-spa-day-for-women-with-breast-cancer/,Westmoreland Walks hosts spa day for women with breast cancer - TribLIVE - Tribune-Review,"Melissa Kelly keeps one thing in mind as she battles her breast cancer diagnosis — her kids. The 47-year-old Derry Township resident was diagnosed with HER2-positive breast cancer for the second time late last year, after enduring a double mastectomy when she…",https://triblive.com/wp-content/uploads/2019/04/1079344_web1_IMG_0412.jpg,2019-04-27
https://news.sky.com/story/botox-customers-to-be-screened-for-mental-health-issues-11704620,Botox customers to be screened for mental health issues - Sky News,Clinicians will be trained to spot conditions such as body dysmorphic disorder before going ahead with cosmetic procedures.,https://e3.365dm.com/16/04/1600x900/istock-000019561033-medium-1-1-2048x1536_3447337.jpg?20160412094131,2019-04-27
https://www.thechronicleherald.ca/news/potential-measles-exposure-at-qeii-306235/,Potential measles exposure at QEII - TheChronicleHerald.ca,"The Nova Scotia Health Authority says there’s been a potential exposure to measles at the Halifax Infirmary’s emergency department.

A person travelling through Halifax visited the emergency department at the QEII Health Sciences Centre",https://www.thechronicleherald.ca/static/overrides/thechronicleherald/dist/img/meta-logo.png,2019-04-27
https://kotaku.com/a-video-game-developed-to-detect-alzheimer-s-disease-se-1834331632,A Video Game Developed To Detect Alzheimer’s Disease Seems To Be Working - Kotaku,"Sea Hero Quest is a video game developed in partnership with Germany’s Deutsche Telekom, game studio Glitchers and several European universities and it is designed to identify individuals who might have early and mild symptoms of dementia that medical tests a…","https://i.kinja-img.com/gawker-media/image/upload/s--pNjtUHY9--/c_fill,fl_progressive,g_center,h_900,q_80,w_1600/v9penf70jyzyhvg9aysr.jpg",2019-04-27
https://www.theguardian.com/society/2019/apr/27/opioid-painkillers-addiction-warning-uk-matt-hancock,Opioid painkillers to carry prominent addiction warnings - The Guardian,Health secretary Matt Hancock promises action after 60% increase in prescriptions in 10 years,https://i.guim.co.uk/img/media/750f1e7850f95d99aa056f11dade1639ba98e82d/0_0_2560_1536/master/2560.jpg?width=1200&height=630&quality=85&auto=format&fit=crop&overlay-align=bottom%2Cleft&overlay-width=100p&overlay-base64=L2ltZy9zdGF0aWMvb3ZlcmxheXMvdG8tZGVmYXVsdC5wbmc&s=4d0d323694db92bc50035a0efb118bb2,2019-04-27
https://www.timminstoday.com/local-news/beyond-local-this-citizen-science-initiative-will-help-identify-ticks-this-season-1392038,BEYOND LOCAL: This citizen-science initiative will help identify ticks this season - TimminsToday,Read the full story and comment on TimminsToday.,https://vmcdn.ca/f/files/kamloopsmatters/images/stock-photos/nature/tick-season.jpg;w=630,2019-04-27
https://www.stuff.co.nz/life-style/well-good/teach-me/112298832/milk-duct-image-not-quite-accurate-but-not-something-to-be-scared-of,"Milk duct image not quite accurate, but 'not something to be scared of' - Stuff.co.nz",A photo of milk ducts has been a hit on social media and here is why everyone is freaking out.,https://resources.stuff.co.nz/content/dam/images/1/u/u/y/d/2/image.related.StuffLandscapeSixteenByNine.1420x800.1uuyc0.png/1556398268882.jpg,2019-04-27
https://www.news-medical.net/news/20190427/Study-looks-into-history-and-resurgence-of-milk-sharing-practices.aspx,Study looks into history and resurgence of milk sharing practices - News-Medical.net,A new study examines the history and resurgence of milk sharing.,https://www.news-medical.net/image.axd?picture=2016%2f6%2fBreast_milk_-_Mukhina_Viktoriia-2000_c3f24a01ac934e0e823904f74dcd22e9-620x480.jpg,2019-04-27
https://kpax.com/breaking-news/2019/04/26/cases-of-whooping-cough-confirmed-in-florence-lolo/,"Cases of whooping cough confirmed in Florence, Lolo - KPAX-TV","Just days after Missoula health officials diagnosed several cases of whooping cough in the community, students at two more schools have now tested positive for the disease. The Ravalli County Public Health Department says one student in the Florence School Di…",https://s3.amazonaws.com/cordillera-network/wp-content/uploads/sites/13/2019/04/24093809/Health-Watch.jpg,2019-04-27
https://www.stgeorgeutah.com/news/archive/2019/04/26/cgb-county-mosquito-crews-battle-deadliest-insect-on-earth-1-west-nile-illness-reported-in-nevada/,County mosquito crews battle deadliest insect on earth; 1 West Nile illness reported in Nevada - St George News,"SOUTHERN UTAH —  Agencies across Southern Utah and surrounding areas got an early start in the battle against an insect that remains the deadliest creature on the planet thanks to a freeze in February, while Nevada reported its first human case of West Nile v…",https://www.stgeorgeutah.com/wp-content/uploads/2019/04/stock-mosquito-fi.jpg,2019-04-27
https://www.youtube.com/watch?v=ObzoJu2ZW5s,20th Annual Summit Autism Walk - WKBW Buffalo,,,2019-04-27
https://www.sootoday.com/around-ontario/beyond-local-this-citizen-science-initiative-will-help-identify-ticks-this-season-1392038,BEYOND LOCAL: This citizen-science initiative will help identify ticks this season - SooToday,"If you are bitten by a tick that is infected with Lyme disease, a single dose of antibiotics can prevent an infection from developing, if administered within 72 hours of tick removal",https://vmcdn.ca/f/files/kamloopsmatters/images/stock-photos/nature/tick-season.jpg;w=630,2019-04-27
https://www.bbc.co.uk/news/health-48067478,Obesity and depression 'hand-in-hand' in children - BBC News,"From the age of seven, obesity and emotional problems are closely linked, a UK study suggests.",https://ichef.bbci.co.uk/news/1024/branded_news/DA0D/production/_106612855_gettyimages-912876174.jpg,2019-04-27
https://www.whitsundaytimes.com.au/news/how-to-choose-quality-help-for-a-loved-ones-reside/3713095/,How to choose quality aged care - Whitsunday Times,Finding an aged care facility for loved ones can be stressful and done at the worst time. This is what to avoid to make it as stress free as possible.,https://media.apnarm.net.au/media/images/2019/04/28/imagev1470335407c83dc0c7eedf105ea364278-2xv8kjgwutzgudzf7s2_ct300x300.jpg,2019-04-27
https://www.sunshinecoastdaily.com.au/news/brisbane-mum-karen-cantwell-develops-app-that-trac/3712940/,App keeps track of where the kids really are - Sunshine Coast Daily,A BRISBANE mum has developed technology to make it easy for concerned parents to track their kids through a smart watch and an app.,https://media.apnarm.net.au/media/images/2019/04/27/imagev1306a5319d22c33cacbc0926f89224867-md3gkmfsh117n2ad7s2_ct300x300.jpg,2019-04-27
https://medicalxpress.com/news/2019-04-hie-heart-variability-stressed-newborns.html,"In HIE, lower heart rate variability signals stressed newborns - Medical Xpress","In newborns with hypoxic-ischemic encephalopathy (HIE), lower heart rate variability correlates with autonomic manifestations of stress shortly after birth, underscoring the value of this biomarker, according to Children's research presented during the Pediat…",https://3c1703fe8d.site.internapcdn.net/newman/gfx/news/hires/2019/inhielowerhe.jpg,2019-04-27
https://www.news-medical.net/news/20190427/No-safe-amount-of-alcohol-during-pregnancy-suggests-study.aspx,"No safe amount of alcohol during pregnancy, suggests study - News-Medical.net",An international group of researchers has taken one of the first major steps in finding the biological changes in the brain that drive fetal alcohol spectrum disorder.,https://www.news-medical.net/image.axd?picture=2014%2f6%2fPregnancy-620x480.jpg,2019-04-27
https://www.popsugar.com/fitness/Mediterranean-Diet-Instant-Pot-Recipes-45901722,Your Instant Pot Will Come in Handy For All These Mediterranean-Friendly Recipes - POPSUGAR,"Once you've gotten in the swing of using your Instant Pot for quick, healthy dinners, it's hard to imagine how you survived those busy weeknights without one.",https://media1.popsugar-assets.com/files/thumbor/-yHfcCD6OQW6i74CDiTMIjpY4vg/0x1:1334x2542/fit-in/1200x630/filters:rotate-!270!-:format_auto-!!-:strip_icc-!!-/2019/04/24/964/n/1922729/506ce8c65cc0de7c4234f5.71329041_.jpg,2019-04-27
https://abc7.com/teen-cheerleaders-sudden-death-was-caused-by-strep-autopsy/5273688/,Teen cheerleader's sudden death was caused by strep: Autopsy - KABC-TV,"Eighth-grader Lilliana Schalck died suddenly on Feb. 23, 2019.",https://s.abcnews.com/images/US/lilliana-schalck1-ht-ml-190227_hpMain_v12x5_16x9_992.jpg?w=1600,2019-04-27
https://www.thehealthsite.com/news/alcohol-consumption-during-pregnancy-can-cause-cognitive-impairments-in-your-child/,Alcohol consumption during pregnancy can cause cognitive impairments in your child - TheHealthSite,"A new study published in the journal Chaos: An Interdisciplinary Journal of Nonlinear Science, has revealed that exposure to alcohol while in womb may cause Fetal Alcohol Spectrum Disorder in teenage.",https://www.thehealthsite.com/wp-content/uploads/2019/04/Pregnancy.jpg,2019-04-27
https://medicalxpress.com/news/2019-04-barriers-vaccination-immunocompromised-children.html,New research examines barriers to vaccination in immunocompromised children - Medical Xpress,"A new study examines the barriers to vaccination of immunocompromised children (ICC). Findings from the study will be presented during the Pediatric Academic Societies (PAS) 2019 Meeting, taking place on April 24—May 1 in Baltimore.",https://b98584f181.site.internapcdn.net/tmpl/v6/img/medx308px.png,2019-04-27
https://www.dailymail.co.uk/health/article-6967059/Food-allergies-dont-make-meals-nightmare-says-DR-MIKE-DILKES.html,Food allergies don't have to make meals out a nightmare says DR MIKE DILKES - Daily Mail,"DR MIKE DILKES: People with allergies can still enjoy a meal out, providing appropriate precautions are taken. It goes without saying that food labels should be read carefully and questions asked.",https://i.dailymail.co.uk/1s/2019/04/27/20/12798166-0-image-a-25_1556394204834.jpg,2019-04-27
https://abcnews.go.com/Technology/wireStory/700-la-universities-measles-quarantine-62677311,Nearly 700 from LA universities still in measles quarantine - ABC News,"Get breaking national and world news, broadcast video coverage, and exclusive interviews. Find the top news online at ABC news.",https://s.abcnews.com/images/Technology/WireAP_6c3df7ae0100453fbe5de85881a6dee6_16x9_992.jpg,2019-04-27
https://www.washingtonpost.com/national/health-science/if-air-at-home-seems-to-bother-you-try-to-remove-the-sources-of-irritants-first/2019/04/26/c37c7276-6054-11e9-9ff2-abc984dc9eec_story.html,"If air at home seems to bother you, try to remove the sources of irritants first - Washington Post",Most people don’t need purifiers unless they have a health condition that would benefit.,https://www.washingtonpost.com/resizer/bvUsKIu2SxkzK0XZbZpoYfGlkEI=/1484x0/arc-anglerfish-washpost-prod-washpost.s3.amazonaws.com/public/Y6IJHXTB5UI6TPZE3NFZ7NRKUI.jpg,2019-04-27
https://www.thetimes.co.uk/article/health-secretary-adds-addiction-warning-to-opioid-painkillers-xlb7xl5p3,Health secretary adds addiction warning to opioid painkillers - The Times,"Powerful painkillers taken by millions of Britons must carry prominent “cigarette-style” warnings on their labels about addiction risks, Matt Hancock will announce today. The health secretary is to...",http://www.thetimes.co.uk/imageserver/image/methode%2Fsundaytimes%2Fprod%2Fweb%2Fbin%2F4e369fcc-691f-11e9-a60b-90525fa8943d.jpg?crop=2667%2C1500%2C0%2C0,2019-04-27
