url,title,description,urlToImage,date
https://www.mirror.co.uk/news/world-news/cheerleader-13-feeling-unwell-competition-14818671,"Cheerleader, 13, feeling unwell at competition dies in hospital just hours later - Mirror Online",Lilliana Schalck's devastated father revealed how she complained of feeling unwell before she was due to perform at national cheerleading competition,https://i2-prod.mirror.co.uk/incoming/article14819725.ece/ALTERNATES/s1200/0_THP_CHP_270419SLUG_6046JPG.jpg,2019-04-27
https://www.youtube.com/watch?v=C5TWeeJXpjk,"Tucson Heart and Stroke walk, a mission to fund research - KGUN9","The Tucson heart and stroke walk is raising awareness, and funds for research efforts made by the American Heart Association.",https://i.ytimg.com/vi/C5TWeeJXpjk/maxresdefault.jpg,2019-04-27
https://www.todayonline.com/world/scientists-create-speech-brain-signals,Scientists create speech from brain signals - TODAYonline,,https://www.todayonline.com/sites/default/files/styles/new_app_article_detail/public/photos/43_images/prosthetic_voice.jpg?itok=WYq1Qk3d,2019-04-27
https://www.vernonmorningstar.com/community/vernon-spreads-awareness-for-autism/,Vernon spreads awareness for autism - Vernon Morning Star,<p>The 6th Annual Autism Walk took place at Polson Park Saturday afternoon. </p>,https://www.vernonmorningstar.com/wp-content/uploads/2019/04/16593586_web1_190501-VMS-autism-awareness_1-1024x683.jpg,2019-04-27
https://www.koamnewsnow.com/news/national-news/it-could-be-any-day-now-why-how-you-die-matters/1072878578,'It could be any day now': Why how you die matters - KoamNewsNow.com,"It's approaching 1 a.m. in Bilborough, a suburb of the British city of Nottingham. Peter Naylor, 70, is slumped in his bed, only yards from the front door of his small bungalow.",https://static.lakana.com/mmm-global-us-east-1/photo/2019/04/26/seniors%20hospice%20care%20DO%20NOT%20REUSE_1556338633370.jpg.jpg.jpg_38219249_ver1.0_1280_720.jpg,2019-04-27
https://www.moreechampion.com.au/story/6093327/obese-told-to-walk-to-work-to-live-longer/,Obese told to walk to work to live longer - Moree Champion,"Obese people who switch their car for a more active commute could cut their chances of an early death, new research suggests. Adults with a body mass index ab...",https://nnimgt-a.akamaihd.net/transform/v1/crop/frm/silverstone-feed-data/8d6db3c4-6c0d-40ac-8c41-76d1e7e7549b.jpg/r0_74_800_526_w1200_h678_fmax.jpg,2019-04-27
https://www.canberratimes.com.au/story/6093274/parents-fail-to-admit-kids-are-overweight/,Parents fail to admit kids are overweight - The Canberra Times,"Parents often underestimate how fat their children are - but so do family doctors. Mothers and fathers also prefer to use terms such as ""big boned"", ""thick"" o...",https://nnimgt-a.akamaihd.net/transform/v1/crop/frm/silverstone-feed-data/5d700343-a1f6-4823-b4dd-edc9876feccf.jpg/r0_74_800_526_w1200_h678_fmax.jpg,2019-04-27
https://www.northernstar.com.au/news/brisbane-mum-karen-cantwell-develops-app-that-trac/3712940/,App keeps track of where the kids really are - Northern Star,A BRISBANE mum has developed technology to make it easy for concerned parents to track their kids through a smart watch and an app.,https://media.apnarm.net.au/media/images/2019/04/27/imagev1306a5319d22c33cacbc0926f89224867-md3gkmfsh117n2ad7s2_ct300x300.jpg,2019-04-27
https://www.news-medical.net/news/20190427/Researchers-examine-the-barriers-to-vaccination-in-immunocompromised-children.aspx,Researchers examine the barriers to vaccination in immunocompromised children - News-Medical.net,"A new study examines the barriers to vaccination of immunocompromised children. Findings from the study will be presented during the Pediatric Academic Societies 2019 Meeting, taking place on April 24 - May 1 in Baltimore.",https://www.news-medical.net/image.axd?picture=2016%2f3%2fChildren_playing_sunset_-_Zurijeta_8c5bdac77e44431bb1bfec67b9c87208-620x480.jpg,2019-04-27
https://www.miamiherald.com/news/health-care/article229760639.html,35 more lots of heart and blood pressure medication recalled for possible carcinogen - Miami Herald,"Teva Pharmaceuticals recalled 35 lots of heart and blood pressure medication losartan made for Golden State Medical Supply, a supplier of military and mail order pharmacies, for having possible carcinogen NMBA",https://www.miamiherald.com/latest-news/3wi2xp/picture229763794/alternates/LANDSCAPE_1140/Pill_Bottle_Spilled.jpg,2019-04-27
https://boston.cbslocal.com/2019/04/27/mumps-east-boston-otis-elementary-school-student-positive/,Third-Grader In East Boston Tests Positive For Mumps - CBS Boston,"A third-grader at Otis Elementary School in Boston has tested positive for the mumps, the school principal told parents Friday.",https://cbsboston.files.wordpress.com/2014/03/measles.jpg?w=625,2019-04-27
https://www.foxnews.com/health/florida-fisherman-recovering-flesh-eating-bacteria-hook,Florida fisherman recovering from 'flesh-eating' bacteria after getting struck with fish hook - Fox News,"Mike Walton, of Ozona, was fishing with friends off the coast of Palm Harbor in the Gulf of Mexico when a hook caught him in the hand.",https://media2.foxnews.com/BrightCove/694940094001/2019/04/27/694940094001_6030637040001_6030641125001-vs.jpg,2019-04-27
https://www.dailymail.co.uk/health/article-6967063/DR-MIKE-DILKES-reveals-need-know-combating-hay-fever.html,DR MIKE DILKES reveals everything you need to know about combating hay fever - Daily Mail,"DR MIKE DILKES: By far the most common allergies are those triggered by particles in the air that we breathe. From dog hair to pollen, these inhaled allergies affect up to a third of adults globally.",https://i.dailymail.co.uk/1s/2019/04/27/17/12794662-0-image-a-153_1556384036124.jpg,2019-04-27
https://www.mirror.co.uk/lifestyle/health/meet-marathon-runners-going-extra-14791345,Meet the marathon runners going the extra 26.2 miles after health struggles - Mirror Online,"Del, Issy and Ben have had very different health battles and now they're fighting fit for the marathon",https://i2-prod.mirror.co.uk/incoming/article14728344.ece/ALTERNATES/s1200/1_Issy-McNeileJPG.jpg,2019-04-27
https://www.youtube.com/watch?v=jlx82nnUT48,Peppermint helps people with non-cardiac chest pain; difficulty swallowing - ANI News,"New Delhi, Apr 28 (ANI): Peppermint could help treat difficulty in swallowing food and non-cardiac chest pain, as per a study. ""Peppermint oil is an establis...",https://i.ytimg.com/vi/jlx82nnUT48/hqdefault.jpg,2019-04-27
https://www.nynganobserver.com.au/story/6093327/obese-told-to-walk-to-work-to-live-longer/?cs=12,Obese told to walk to work to live longer - Nyngan Observer,"Obese people who switch their car for a more active commute could cut their chances of an early death, new research suggests. Adults with a body mass index ab...",https://nnimgt-a.akamaihd.net/transform/v1/crop/frm/silverstone-feed-data/8d6db3c4-6c0d-40ac-8c41-76d1e7e7549b.jpg/r0_74_800_526_w1200_h678_fmax.jpg,2019-04-27
https://fox13now.com/2019/04/27/woman-contracts-lyme-disease-after-tick-bite-on-hike-in-central-utah/,Woman contracts Lyme disease after tick bite on hike in central Utah - KSTU FOX 13 Salt Lake City,"AMERICAN FORK, Utah -- Bonnie Smith was hiking with her family in an area between Nephi and Delta on April 24.

Everything was fine until she woke up the next morning.

“Really painful, achy joints, muscles and really, really weak,” Smith said. “I don’t hav…",https://localtvkstu.files.wordpress.com/2019/04/promo380677992.jpg?quality=85&strip=all&w=1200,2019-04-27
https://www.dailymail.co.uk/news/article-6967273/Florida-Man-lucky-alive-contracting-rare-flesh-eating-bacterial-disease-Mexico.html,Florida Man 'lucky to be alive' after contracting a rare flesh-eating bacterial disease in Mexico - Daily Mail,"Mike Walton has now left a Tampa hospital where he was treated for bacterial infection, necrotizing fasciitis, which he contracted when he cut his hand on a hook while reeling in a catch.",https://i.dailymail.co.uk/1s/2019/04/27/23/12801338-0-image-a-2_1556403211788.jpg,2019-04-27
https://www.prevention.com/weight-loss/diets/a27292801/jillian-michaels-slams-keto-diet-side-effects/,Jillian Michaels Slams Keto Diet Side Effects: “It Is Bad for Your Overall Health” - Prevention.com,She emphasizes that “you can achieve all the good stuff with none of the bad stuff.”,"https://hips.hearstapps.com/hmg-prod.s3.amazonaws.com/images/jillian-michaels-attends-kiis-fms-jingle-ball-2018-news-photo-1075439142-1556375878.jpg?crop=1.00xw:0.336xh;0,0.0867xh&resize=1200:*",2019-04-27
https://www.theguardian.pe.ca/living/gifford-jones-death-and-the-stupidity-factor-306252/,GIFFORD-JONES: Death and the Stupidity Factor - The Guardian,What’s a great medical tragedy? It’s being diagnosed with a disease for which there is no cure. Possibly an even greater tragedy is dying from what’s been called the “Stupidity Factor.” These cases occur because patients,https://www.theguardian.pe.ca/media/photologue/photos/cache/35329337_l_medium.jpg,2019-04-27
https://www.adelaidenow.com.au/news/south-australia/young-woman-contracts-measles-in-adelaides-west-sa-health-warn-others-in-same-area/news-story/f722912ebf513562a07e1e2e6bee0801,"Young woman contracts measles in Adelaide’s west, north — SA Health warn others in same area - The Advertiser","A young woman has contracted the measles, and health authorities are warning people who visited locations in Adelaide’s north and west to be on the lookout for symptoms.",https://content.api.news/v3/images/bin/7cd64ce6b130a018e26b8d0eb9c74e98,2019-04-27
https://www.gleninnesexaminer.com.au/story/6093327/obese-told-to-walk-to-work-to-live-longer/?cs=12,Obese told to walk to work to live longer - Glen Innes Examiner,"Obese people who switch their car for a more active commute could cut their chances of an early death, new research suggests. Adults with a body mass index ab...",https://nnimgt-a.akamaihd.net/transform/v1/crop/frm/silverstone-feed-data/8d6db3c4-6c0d-40ac-8c41-76d1e7e7549b.jpg/r0_74_800_526_w1200_h678_fmax.jpg,2019-04-27
https://www.gleninnesexaminer.com.au/story/6093327/obese-told-to-walk-to-work-to-live-longer/,Obese told to walk to work to live longer - Glen Innes Examiner,"Obese people who switch their car for a more active commute could cut their chances of an early death, new research suggests. Adults with a body mass index ab...",https://nnimgt-a.akamaihd.net/transform/v1/crop/frm/silverstone-feed-data/8d6db3c4-6c0d-40ac-8c41-76d1e7e7549b.jpg/r0_74_800_526_w1200_h678_fmax.jpg,2019-04-27
http://www.wafb.com/2019/04/27/louisiana-reports-first-death-related-hepatitis-outbreak/,Louisiana reports first death related to Hepatitis A outbreak - WAFB,The Louisiana Department of Health reported the first death related to an ongoing Hepatitis A outbreak across the state. East Baton Rouge Parish and Livingston Parish reported the highest number of cases for surrounding parishes.,http://www.wafb.com/resizer/MpuhQ5tUmAS-I4bnI2Ld6Xhxyos=/1200x0/arc-anglerfish-arc2-prod-raycom.s3.amazonaws.com/public/WXVQ33S4RJHV5FN54PR2KWQTGE.jpg,2019-04-27
https://www.themorningbulletin.com.au/news/brisbane-holistic-vet-finds-growing-demand-for-dog/3712938/,Vegan diet a bit ruff on dogs - Morning Bulletin,A vegan diet has become so popular every man and his (or her) dog are trying it out – literally.,https://media.apnarm.net.au/media/images/2019/04/27/imagev100ccdd70411162ad144b2f558d708256-4lmnfgdrgnvaj2ad7s2_ct300x300.jpg,2019-04-27
https://www.guyraargus.com.au/story/6093327/obese-told-to-walk-to-work-to-live-longer/,Obese told to walk to work to live longer - The Guyra Argus,"Obese people who switch their car for a more active commute could cut their chances of an early death, new research suggests. Adults with a body mass index ab...",https://nnimgt-a.akamaihd.net/transform/v1/crop/frm/silverstone-feed-data/8d6db3c4-6c0d-40ac-8c41-76d1e7e7549b.jpg/r0_74_800_526_w1200_h678_fmax.jpg,2019-04-27
https://patch.com/maryland/pikesville/maryland-adds-highest-rate-measles-eradication,Measles In Maryland Add To Record-Setting Year - Patch.com,"Federal officials issue stern warnings about the need for vaccines as measles cases in Maryland, nationwide continue to climb.",https://cdn20.patchcdn.com/users/57041/20190427/054649/styles/T800x600/public/measles-cases-20190426131138-61091000.jpg,2019-04-27
https://www.dailymercury.com.au/news/north-queensland-digger-dies-in-anzac-day-tragedy-/3712953/,Local Qld digger dies in Anzac Day tragedy - Daily Mercury,A 34-year-old former North Queensland army veteran found dead in his hotel room on Anzac Day spent years battling “demons” after returning from Afghanistan.,https://media.apnarm.net.au/media/images/2019/04/27/imagev184f4d40548dec7d9820629ae106ffab0-jdafrpvh6emm85ad7s2_ct300x300.jpg,2019-04-27
https://m.whitsundaytimes.com.au/news/brisbane-holistic-vet-finds-growing-demand-for-dog/3712938/,Vegan diet a bit ruff on dogs - Whitsunday Times,A vegan diet has become so popular every man and his (or her) dog are trying it out – literally.,https://media.apnarm.net.au/media/images/2019/04/27/imagev100ccdd70411162ad144b2f558d708256-4lmnfgdrgnvaj2ad7s2_ct300x300.jpg,2019-04-27
https://www.news-medical.net/news/20190427/Filled-opioid-prescriptions-are-relatively-rare-in-Medicaid-enrolled-children-finds-study.aspx,"Filled opioid prescriptions are relatively rare in Medicaid-enrolled children, finds study - News-Medical.net",A new study describes trends in filled opioid prescriptions by patient and clinical characteristics for Medicaid-enrolled children.,https://www.news-medical.net/image.axd?picture=2016%2f3%2fChildren_playing_sunset_-_Zurijeta_8c5bdac77e44431bb1bfec67b9c87208-620x480.jpg,2019-04-27
https://vision.org.au/radio/news/millions-of-aussies-at-risk-of-heart-disease/,Millions of Aussies at Risk of Heart Disease - Vision Christian Media,The data is from the Australian Bureau of Statistics National Health Survey 2017/18,https://vision.org.au/radio/wp-content/uploads/sites/6/2018/08/missing_1533416090.jpg,2019-04-27
https://www.coffscoastadvocate.com.au/news/how-to-choose-quality-help-for-a-loved-ones-reside/3713095/,How to choose quality aged care - Coffs Coast Advocate,Finding an aged care facility for loved ones can be stressful and done at the worst time. This is what to avoid to make it as stress free as possible.,https://media.apnarm.net.au/media/images/2019/04/28/imagev1470335407c83dc0c7eedf105ea364278-2xv8kjgwutzgudzf7s2_ct300x300.jpg,2019-04-27
https://www.mirror.co.uk/news/uk-news/man-cures-hay-fever-rubbing-14777864,Man 'cures' his hay fever - by rubbing stinging nettles on skin once a week - Mirror Online,Goran Pavlovic hasn't suffered from hay fever in three years - and puts this down to his painful remedy,https://i2-prod.mirror.co.uk/incoming/article14782563.ece/ALTERNATES/s1200/0_THP_CHP_270419SLUG_5950JPG.jpg,2019-04-27
https://www.walesonline.co.uk/news/uk-news/4-unusual-signs-you-risk-16186453,4 unusual signs you may be at risk of Parkinson's disease - WalesOnline,Research into Parkinson's disease has begun to shed light on some of the changes and symptoms that happen way before patients start to shake and have trouble moving,https://i2-prod.manchestereveningnews.co.uk/incoming/article16186766.ece/ALTERNATES/s1200/1_occupied.jpg,2019-04-27
https://www.medicalnewsbulletin.com/how-chemotherapy-breast-cancer-heart-function/,How does chemotherapy for breast cancer affect heart function? - Medical News Bulletin,A recent study in Circulation investigated the mechanisms underlying the negative effects of chemotherapy for breast cancer on heart function.,https://i1.wp.com/www.medicalnewsbulletin.com/wp-content/uploads/2019/04/chemotherapy-for-breast-cancer-min.jpg?fit=696%2C464&ssl=1,2019-04-27
https://www.theguardian.com/society/2019/apr/28/sheffield-sleep-problems-families-nhs-programme,NHS sleep programme ‘life changing’ for 800 Sheffield children each year - The Guardian,"Avoiding phones, TV and fizzy drinks part of successful programme to help families suffering severely disturbed nights",https://i.guim.co.uk/img/media/d22532097a53c8958738f2d9b950fdc90b1a6acd/1012_369_6342_3806/master/6342.jpg?width=1200&height=630&quality=85&auto=format&fit=crop&overlay-align=bottom%2Cleft&overlay-width=100p&overlay-base64=L2ltZy9zdGF0aWMvb3ZlcmxheXMvdG8tZGVmYXVsdC5wbmc&s=e04d1863baa436f0d7f1cd2ce2fa6246,2019-04-27
https://www.mirror.co.uk/news/uk-news/over-counter-codeine-sales-could-14792627,Over-the-counter codeine sales could be banned in new addiction crackdown - Mirror Online,Packets of pills will carry warnings about drug dependency and drugs like co-codamol are to be prescription-only,https://i2-prod.mirror.co.uk/incoming/article14791583.ece/ALTERNATES/s1200/0_PAY-0_Codeine-Phosphate-30-mg-tablet-packet-Image-shot-062012-Exact-date-unknown.jpg,2019-04-27
https://metro.co.uk/2019/04/27/botox-clinics-to-screen-patients-for-mental-health-problems-9326843/,Botox clinics to screen patients for mental health problems - Metro.co.uk,One in every 50 people are thought to suffer from body dysmorphia.,https://i1.wp.com/metro.co.uk/wp-content/uploads/2019/04/SEI_64469413_1556360837.jpg?quality=90&strip=all&w=1200&h=630&crop=1&zoom=1&ssl=1,2019-04-27
https://advocator.ca/news/cdc-identifies-a-kissing-bug-in-delaware%E2%80%8B/9782,CDC identifies a ‘kissing bug’ in Delaware​ - Advocator,"Share The “kissing bug”, also known as triatomine, holds within a disease that can evolve into chronic health problems and even death, in extreme cases, and it spreads the disease in an alarming way. The bug bears a parasite called Trypanosoma cruzi (sometime…",https://i0.wp.com/advocator.ca/wp-content/uploads/2019/04/CDC-identifies-a-kissing-bug-in-Delaware​.jpg?fit=800%2C450&ssl=1,2019-04-27
https://www.premiumtimesng.com/health/health-news/327235-new-who-report-indicates-global-rise-in-measles.html,New WHO report indicates global rise in measles - Premium Times,"Although the African region saw a decline in number of cases in 2018, it remains the region with the highest burden of the disease.",https://i2.wp.com/media.premiumtimesng.com/wp-content/files/2017/09/WHO.jpg?fit=1023%2C575&ssl=1,2019-04-27
https://7news.com.au/news/public-health/sa-health-issue-measles-warning-after-woman-travels-to-goodlife-gym-c-82079,SA Health issue measles warning after woman travels to Goodlife gym - 7NEWS,Health authorities said the 22-year-old travelled to a series of locations while suffering from the infectious disease.,https://images.7news.com.au/publication/C-82079/72ef02d508f8a7ab2b5a096f4ec68385044dffed-16x9-x0y0w1301h731.png?imwidth=1024,2019-04-27
https://www.eadt.co.uk/news/lyme-disease-suffolk-countryside-2019-1-6019771,Stay tick free in Suffolk and avoid catching lyme disease with doctors advice | Latest Suffolk and Essex News - East Anglian Daily Times,"Suffolk is known for being a high risk tick area, but countryside fans can avoid getting bitten by ticks and catching Lyme disease by following a few simple tips.",https://www.eadt.co.uk/polopoly_fs/1.6019773!/image/image.jpg,2019-04-27
https://koaa.com/news/covering-colorado/2019/04/27/pueblo-helps-raise-money-for-ms-with-30th-annual-walk-ms-event/,Pueblo helps raise money for MS with 30th annual “Walk MS” event - KOAA 5,"News 5's Rob Quirk, who has a personal connection to the disease, was on hand to take part in the ""Walk MS"" event.",https://s3.amazonaws.com/cordillera-network/wp-content/uploads/sites/11/2019/04/27180100/poster-2019-04-27T175958.104.jpg,2019-04-27
https://www.todayonline.com/singapore/new-treatment-buys-more-time-late-stage-lung-cancer-patients-its-costly,"New treatment buys more time for late-stage lung cancer patients, but it's costly - TODAYonline",,https://www.todayonline.com/sites/default/files/styles/new_app_article_detail/public/photos/43_images/20190426_bk_jeffreyleong4.jpg?itok=F_gyH428,2019-04-27
https://www.gizmodo.com.au/2019/04/peanut-immunotherapy-may-actually-increase-your-risk-of-serious-allergic-reactions/,Peanut Immunotherapy May Actually Increase Your Risk Of Serious Allergic Reactions - Gizmodo Australia,"A promising therapy for certain food allergies may be riskier than hoped, according to a new review.  It found that patients with a peanut allergy given oral immunotherapy — a treatment that exposes them to small doses of the food over time — were more likely…","https://i.kinja-img.com/gawker-media/image/upload/c_lfill,w_768,q_90/ip45iaxyiwzffw0uerdy.jpg",2019-04-27
https://triblive.com/news/health-now/pittsburgh-area-doctors-sound-alarm-about-deadly-fungal-superbug/,Pittsburgh-area doctors sound alarm about deadly fungal superbug - TribLIVE - Tribune-Review,"A deadly fungus that is outsmarting major antifungal medications is slowly spreading across the United States, prompting infectious-disease doctors in Western Pennsylvania to prepare for its eventual arrival. The fungus, called Candida auris, has been confirm…",https://triblive.com/wp-content/uploads/2019/04/1067595_web1_VND-candidaauris02.jpg,2019-04-27
https://www.newsandstar.co.uk/news/17600657.mums-marathon-for-breast-cancer/,Mum's marathon for breast cancer - News & Star,A MUM will pound the streets of the capital in the London Marathon to raise cash for a breast cancer charity. after she was diagnosed with the…,https://www.newsandstar.co.uk/resources/images/9769912/,2019-04-27
https://www.youtube.com/watch?v=tViO2l3w_KM,Immunization Week observed in Tubusereia Village - EMTV Online,This week the Central Provincial Administration with representatives from the National Department of Health and World Health Organization launched and observ...,https://i.ytimg.com/vi/tViO2l3w_KM/hqdefault.jpg,2019-04-27
https://eurekalert.org/pub_releases/2019-04/pas-nrr042619.php,New research reviews the state of vaccine safety science - EurekAlert,A new systematic review provides a succinct summary of the scientific evidence for and/or against causal associations for 47 adverse events following immunization (AEFI). Findings from the study will be presented during the Pediatric Academic Societies (PAS) …,https://www.eurekalert.org/images/EurekAlert_StackedLogo_RGB.jpg,2019-04-27
https://www.mirror.co.uk/news/politics/nhs-scrap-morning-cereals-part-14792273,NHS to scrap morning cereals as part of plan to cut £400k off breakfast costs - Mirror Online,NHS Supply will no longer routinely stock breakfast cereals Weetabix and Bran Flakes because of rising prices,https://i2-prod.mirror.co.uk/incoming/article11348549.ece/ALTERNATES/s1200/Tray-of-food-on-hospital-bed.jpg,2019-04-27
https://www.modbee.com/news/state/california/article229721499.html,California college quarantines in place as lack of vaccinations leads to measles outbreak - Modesto Bee,"There have been 38 confirmed cases of measles in California in 2019, and UCLA and Cal State students were placed in quarantines after students and staff may have been exposed to the disease.",https://cf-images.us-east-1.prod.boltdns.net/v1/jit/5502557042001/00eaac7a-3e33-4870-b690-3b49cd7b2623/main/1280x720/1m8s362ms/match/image.jpg,2019-04-27
https://www.theguardian.com/society/2019/apr/28/save-420-thousand-pounds-a-year-on-breakfasts-nhs-told,"Save £420,000 a year on breakfasts, NHS told - The Guardian",New scheme will help hospitals cut back without compromising nutrition,https://i.guim.co.uk/img/media/7a8be00be6a705dc9f2c35194e7a56b101944c55/0_153_4928_2958/master/4928.jpg?width=1200&height=630&quality=85&auto=format&fit=crop&overlay-align=bottom%2Cleft&overlay-width=100p&overlay-base64=L2ltZy9zdGF0aWMvb3ZlcmxheXMvdG8tZGVmYXVsdC5wbmc&s=079f793969df94c30214934490015b44,2019-04-27
https://www.theguardian.com/lifeandstyle/2019/apr/28/are-cleaning-gurus-sweeping-an-epidemic-under-the-carpet,Are cleaning gurus sweeping an epidemic under the carpet? - The Guardian,"Repetitive tasks can help with anxiety, but can we trust them to safeguard women’s mental health? By Eva Wiseman",https://i.guim.co.uk/img/media/f27f707c309ab5bd504fed6909725f255d1af873/218_37_4354_2613/master/4354.jpg?width=1200&height=630&quality=85&auto=format&fit=crop&overlay-align=bottom%2Cleft&overlay-width=100p&overlay-base64=L2ltZy9zdGF0aWMvb3ZlcmxheXMvdG8tb3BpbmlvbnMucG5n&s=2001d8f3e27c7ecccdbb34e91e93c16e,2019-04-27
https://www.wellandgood.com/good-sweat/this-is-how-much-you-should-be-moving-for-a-good-nights-sleep-according-to-science/,"This is how much you should be moving for a good night’s sleep, according to science - Well+Good",Yet another reason to hit the gym.,https://www.wellandgood.com/wp-content/uploads/2019/04/GettyImages-546434403.jpg,2019-04-27
https://www.journalpioneer.com/living/gifford-jones-death-and-the-stupidity-factor-306252/,GIFFORD-JONES: Death and the Stupidity Factor - The Journal Pioneer,What’s a great medical tragedy? It’s being diagnosed with a disease for which there is no cure. Possibly an even greater tragedy is dying from what’s been called the “Stupidity Factor.” These cases occur because patients,https://www.journalpioneer.com/media/photologue/photos/cache/35329337_l_medium.jpg,2019-04-27
https://www.theepochtimes.com/kentucky-teen-cheerleaders-sudden-death-caused-by-strep-infection_2897208.html,Kentucky Teen Cheerleader’s Sudden Death Caused by Strep Infection - The Epoch Times,"A 13-year-old cheerleader mysteriously died after a cheerleading competition, two months later, an autopsy report reveals that the cause of her death",https://www.theepochtimes.com/assets/uploads/2013/12/hospital-shutterstock-145172908-WEBONLY.jpg,2019-04-27
