url,title,description,urlToImage
https://www.youtube.com/watch?v=HQVwR-g3XK8,CCHD confirms no cases of whooping cough in Cascade County - KRTV NEWS,,
https://www.thecragandcanyon.ca/news/local-news/north-vancouver-doctors-painful-ambulance-ride-led-to-ketamine-on-board/wcm/f761f545-9cf2-48ec-b0c1-ad610b3db4d7,North Vancouver doctor's painful ambulance ride led to ketamine on board - The Crag and Canyon,An emergency room physician designed a research study on ketamine while in the back of an ambulance,https://postmediavancouversun2.files.wordpress.com/2019/04/ketamine.jpg
https://ottawacitizen.com/news/world/hundreds-of-ucla-cal-state-students-staff-under-quarantine-amid-measles-outbreak/wcm/198ed5a4-1a72-4d86-b00d-a53a1a92ab42,"Hundreds of UCLA, Cal State students, staff under quarantine amid measles outbreak - Ottawa Citizen",LOS ANGELES — A quarantine order was issued Thursday for hundreds of students and staff at two Los Angeles universities who may have been exposed to measles and either have not been vaccinate…,https://postmediacanoe.files.wordpress.com/2019/04/la409-ap.jpg
http://www.fox13news.com/news/local-news/flesh-eating-bacteria-nearly-kills-pinellas-man,"Flesh-eating bacteria nearly kills Pinellas County man - FOX 13 News, Tampa Bay","Fisherman Mike Walton is home from the hospital, nursing a nasty wound after almost losing his life to a flesh-eating bacteria.",https://media.fox13news.com/media.fox13news.com/photo/2019/04/25/Man_feels_lucky_to_be_alive_after_battli_1_7172558_ver1.0_640_360.jpg
https://www.youtube.com/watch?v=eDe_T9o-EFQ,Malaria Vaccine With Proven Success Will Treat Children in Malawi - Inhabitat,,
https://www.thestar.com/news/canada/2019/04/25/ottawa-opioid-users-find-hope-in-program-that-promises-safe-drug-supply.html,Ottawa opioid users find hope in program that promises safe drug supply - Toronto Star,"The program began about a year ago as Ottawa faced the enormity of the opioid epidemic, with numerous daily overdoses and frequent deaths, and it's aimed at exceptionally high-risk opioid users.",https://images.thestar.com/twvmdx8prHUigqt9X__vSKBPA0I=/1200x761/smart/filters:cb(1556221878898)/https://www.thestar.com/content/dam/thestar/news/canada/2019/04/25/ottawa-opioid-users-find-hope-in-program-that-promises-safe-drug-supply/katrina.jpg
https://www.youtube.com/watch?v=V8ZMXMmzlnE,CDC warns about dangerous 'kissing bugs' in the Carolinas - WCNC,The CDC said the insects carry a parasite that can be transmitted to humans and attack the heart.,https://i.ytimg.com/vi/V8ZMXMmzlnE/hqdefault.jpg
http://www.cairnspost.com.au/news/world/world-health-organisation-issues-strict-guidelines-for-children-screen-time/video/c7afc875ce8947187c05ed487ab03bcc,World Health Organisation issues strict guidelines for children screen time - The Cairns Post,The World Health Organisation has urged parents to ban children under the age of two from watching television or staring at iPads or smartphones. Parents are being advised to limit screen time to no more than an hour a day for children aged two to four. The i…,https://content.api.news/v3/images/bin/9d63f011c6ce6cb7077a01b9106533da
https://www.hulldailymail.co.uk/news/health/patients-cant-beverley-gp-surgery-2796323,Patients can't get into Beverley GP surgery because it can't recruit doctors - Hull Daily Mail,North Beverley Medical Practice has struggled to fill vacancies after two GPs left last year,https://i2-prod.hulldailymail.co.uk/incoming/article2796339.ece/ALTERNATES/s1200/0_North-Bev.jpg
https://www.cbc.ca/news/world/la-universities-measles-1.5111730,L.A. universities quarantined amid measles outbreak - CBC.ca,Hundreds of students and staff at two Los Angeles universities have been placed under quarantine because they may have been exposed to measles.,https://i.cbc.ca/1.5111758.1556238172!/fileImage/httpImage/image.jpg_gen/derivatives/16x9_620/measles-california.jpg
https://vancouversun.com/news/local-news/north-vancouver-doctors-painful-ambulance-ride-led-to-ketamine-on-board,North Vancouver doctor's painful ambulance ride led to ketamine on board - Vancouver Sun,An emergency room physician designed a research study on ketamine while in the back of an ambulance,https://postmediavancouversun2.files.wordpress.com/2019/04/ketamine.jpg
https://www.stcatharinesstandard.ca/news-story/9302827-niagara-s-opiate-crisis-insane-says-former-addict/,"Niagara's opiate crisis 'insane,' says former addict - StCatharinesStandard.ca",The “shame and the guilt” that was weighing Scott Cronkwright down during his opiate addiction is what started his road to recovery.,https://dynamicmedia.zuza.com/zz/m/original_/9/4/94cf0997-5ae0-40be-ab28-1f21a7ea84fc/B88612942Z.1_20190425155823_000_GQUH0TKT.3-0_Super_Portrait.jpg
http://www.adelaidenow.com.au/news/world/world-health-organisation-issues-strict-guidelines-for-children-screen-time/video/c7afc875ce8947187c05ed487ab03bcc,World Health Organisation issues strict guidelines for children screen time - The Advertiser,The World Health Organisation has urged parents to ban children under the age of two from watching television or staring at iPads or smartphones. Parents are being advised to limit screen time to no more than an hour a day for children aged two to four. The i…,https://content.api.news/v3/images/bin/9d63f011c6ce6cb7077a01b9106533da
https://www.wdbj7.com/content/news/Hepatitis-A-sees-increase-in-cases-509079451.html,Hepatitis A sees increase in Virginia cases - WDBJ7,The commonwealth has reported a 132% increase in cases between January 1 and April 19th compared to that same time period last year.,https://media.graytvinc.com/images/hep.jpg
https://www.news10.com/news/national/untreatable-form-of-lyme-disease-could-affect-2m-americans-by-2020/1953837993,Untreatable form of Lyme disease could affect 2M Americans by 2020 - NEWS10 ABC,The number of untreatable cases of Lyme disease could affect thousands of Americans.,https://media.news10.com/nxs-wtentv-media-us-east-1/photo/2016/07/15/lyme-ticks_39092647_ver1.0_1280_720.jpg
https://www.youtube.com/watch?v=vv3OJYT6qRs,"Measles reported in Pinellas County, second case this year in Florida - 10News WTSP",,
https://app.secure.griffith.edu.au/news/2019/04/26/test-improves-the-odds-when-cancer-strikes-the-brain/,Test improves the odds when cancer strikes the brain - Griffith News,Treatment reverses resistance to commonly used brain cancer drug.,https://app.secure.griffith.edu.au/news/wp-content/uploads/2019/04/doctor-840127_1920-1200x1200.jpg
https://coach.nine.com.au/2019/04/26/10/47/weight-gain-stress-eating,Feeling stressed? You might gain more weight from overeating than you normally would - 9Coach,Beware comfort foods,http://prod.static9.net.au/fs/573c6c86-18a9-4686-9987-fec9ef0fdba7
https://www.sunshinecoastdaily.com.au/news/10-cases-of-whooping-cough-in-townsville-prompt-he/3711476/,Whooping cough cases prompt warning - Sunshine Coast Daily,HOSPITALS are urging all pregnant women and parents to be aware of the symptoms of whooping cough and ensure they and their children are vaccinated.,https://media.apnarm.net.au/media/images/2019/01/10/imagev16173ab71843ac8973362a532af0b0688-ufid26bedzfvq4qulr2_ct300x300.jpg
http://www.goldcoastbulletin.com.au/news/world/world-health-organisation-issues-strict-guidelines-for-children-screen-time/video/c7afc875ce8947187c05ed487ab03bcc,World Health Organisation issues strict guidelines for children screen time - Gold Coast Bulletin,The World Health Organisation has urged parents to ban children under the age of two from watching television or staring at iPads or smartphones. Parents are being advised to limit screen time to no more than an hour a day for children aged two to four. The i…,https://content.api.news/v3/images/bin/9d63f011c6ce6cb7077a01b9106533da
https://eurekalert.org/pub_releases/2019-04/dumc-sim042519.php,Study in mice uncovers an unknown pathway for breast cancer tumors to recur - EurekAlert,"Experimenting in mice, the researchers tracked a series of events that enable a small reservoir of treatment-resistant cancer cells to awake from dormancy, grow and spread.",https://www.eurekalert.org/multimedia/pub/web/199335_web.jpg
https://www.ky3.com/content/news/Missouri-Department-of-Conservation-reports-new-positive-CWD-tests-509072671.html,Missouri Department of Conservation reports new positive CWD tests - KY3,"CWD is a deadly illness in white-tailed deer and other members of the deer family, called cervids.",https://media.graytvinc.com/images/Deer+Hunting+MGN3.jpg
https://www.accuweather.com/en/weather-news/sick-and-tired-of-the-flu-the-cdc-has-some-good-news/70008109,Sick and tired of the flu? The CDC has some good news - AccuWeather.com,,
https://www.scarymommy.com/born-before-1989-measles-vaccine/,Born Before 1989? You Might Need Another Dose Of Measles Vaccine - Scary Mommy,Most people born after 1989 got a double dose but anyone who wasn't might want to talk to their doctor.,https://www.scarymommy.com/wp-content/uploads/2019/04/measles-vaccine-silo.jpg?fit=1200%2C630
https://www.hit.com.au/story/world-health-experts-want-screen-time-ban-for-young-kids-129597,World Health Experts Want Screen Time Ban For Young Kids - Hit 107,"The World Health Organisation is urging parents to keep smart phones and screens away from young children, with kids under two to be given little-to-no access to screen time.",https://cdn-img.scalabs.com.au/3IGeOtCm9lrwNrKL4-kU4kMxAvcHhTZqusrIw7dxDjU/aHR0cHM6Ly9zdy1o/aXQtcHJkLnNjYWRp/Z2l0YWwuaW8vbWVk/aWEvMzU0MTcva2lk/c19sYXB0b3AuanBn/P3ByZXNldD1tcnBy/ZXZhcnRpY2xl
https://www.itnews.com.au/news/health-apps-may-not-disclose-sharing-your-personal-information-524304,Health apps may not disclose sharing your personal information - iTnews,Black Dog Institute report finds privacy shortfall.,https://i.nextmedia.com.au/News/20190426115856_terms_and_conditions_privacy_policy.jpg
https://www.themercury.com.au/news/tasmania/tassie-landmarks-to-be-lit-up-to-raise-awareness-of-cruel-disease/news-story/d6cf94f2cf33e05a472eaae331e82647,Tassie landmarks to be lit up to raise awareness of cruel disease - The Mercury,"Subscribe to The Mercury to get unrestricted digital access, home paper delivery, Apps for iPad and Android and much more...",
https://www.youtube.com/watch?v=FIlkC4NtgkA,Quarantine orders issued at UCLA - ABC News,"Health officials issued quarantine orders at UCLA and Cal State, Los Angeles to prevent the spread of measles, with more than 100 students and faculty member...",https://i.ytimg.com/vi/FIlkC4NtgkA/maxresdefault.jpg
https://www.thelancet.com/journals/lancet/article/PIIS0140-6736(19)30420-9/fulltext,Oral immunotherapy for peanut allergy (PACE): a systematic review and meta-analysis of efficacy and safety - The Lancet,"In patients with peanut allergy, high-certainty evidence shows that available peanut
oral immunotherapy regimens considerably increase allergic and anaphylactic reactions
over avoidance or placebo, despite effectively inducing desensitisation. Safer peanut
al…",https://www.thelancet.com/cms/attachment/89a49c33-facf-4adf-91ac-afac195548b5/gr2.jpg
https://www.goldcoastbulletin.com.au/news/world/world-health-organisation-issues-strict-guidelines-for-children-screen-time/video/c7afc875ce8947187c05ed487ab03bcc,World Health Organisation issues strict guidelines for children screen time - Gold Coast Bulletin,The World Health Organisation has urged parents to ban children under the age of two from watching television or staring at iPads or smartphones. Parents are being advised to limit screen time to no more than an hour a day for children aged two to four. The i…,https://content.api.news/v3/images/bin/9d63f011c6ce6cb7077a01b9106533da
https://www.nytimes.com/2019/04/25/us/measles-outbreak-los-angeles-ucla.html,"Amid Measles Outbreak, Quarantine Is Ordered at U.C.L.A. and California State-Los Angeles - The New York Times",More than 200 university students and employees in Los Angeles County may have been exposed to measles and were given quarantine orders this week.,https://static01.nyt.com/images/2019/04/25/health/25xp-quarantine/25xp-quarantine-facebookJumbo.jpg
https://www.imperial.ac.uk/news/190994/imperial-launches-worlds-first-centre-psychedelics,Imperial launches world's first Centre for Psychedelics Research | Imperial News - Imperial College London,The first formal centre for psychedelic research in the world will launch at Imperial College London today.,https://www.imperial.ac.uk/ImageCropToolT4/imageTool/uploaded-images/newseventsimage_1556206431444_mainnews2012_x1.jpg
https://www.economist.com/science-and-technology/2019/04/27/screening-for-lung-cancer-is-a-controversial-idea,Screening for lung cancer is a controversial idea - The Economist,But the evidence now suggests it can work,https://cdn.static-economist.com/sites/default/files/images/print-edition/20190427_STD001_0.jpg
https://www.dailymail.co.uk/health/article-6961053/Unvaccinated-students-LA-BANNED-classes-21-days-amid-growing-measles-outbreak.html,Unvaccinated students in LA will be BANNED from classes for 21 days amid growing measles outbreak - Daily Mail,"California, which imposed some of the nation's strictest vaccination rules after a short-lived measles outbreak in 2014, is seeing a spike in cases, largely tied to people with measles in airports.",https://i.dailymail.co.uk/1s/2019/04/25/21/12353474-0-image-a-4_1556223279296.jpg
https://www.dailymail.co.uk/health/article-6960327/Mother-19-diagnosed-untreatable-brain-cancer-months-giving-birth-dies.html,"Mother, 19, who was diagnosed with untreatable brain cancer months before giving birth dies - Daily Mail","Dana Scatton, of Pennsylvania, was seven months pregnant in December 2017 when a brain scan revealed she had diffuse intrinsic pontine glioma (DIPG).",https://i.dailymail.co.uk/i/newpix/2018/03/13/20/4A299C3300000578-0-image-a-7_1520973078214.jpg
https://www.youtube.com/watch?v=P8RAvo7Ifu8,Child with rash tests negative for measles in Wilbraham - WWLP-22News,,
https://hackaday.com/2019/04/25/scientists-create-speech-from-brain-signals/,Scientists Create Speech From Brain Signals - Hackaday,"One of the things that makes us human is our ability to communicate. However, a stroke or other medical impairment can take that ability away without warning. Although Stephen Hawking managed to do…",https://hackaday.com/wp-content/uploads/2019/04/brain-implant-featured.jpg
https://globalnews.ca/news/5204335/london-ont-researchers-confirm-new-method-of-hiv-transmission-and-provide-prevention-technique/,"London, Ont. researchers confirm new method of HIV transmission and provide prevention technique - Global News","New studies are showing for the first time that HIV can be transmitted through sharing equipment used to prepare drugs, but also how this transmission can be prevented.",https://shawglobalnews.files.wordpress.com/2019/04/cook-your-wash.png?w=720&h=379&crop=1
https://kmph.com/news/local/ucla-and-csu-los-angeles-under-quarantine-for-measles,UCLA and CSU Los Angeles under quarantine for measles - KMPH Fox 26,LOS ANGELES (AP) &mdash; A quarantine order was issued Thursday for hundreds of students and staff at two Los Angeles universities who may have been exposed to measles and either have not been vaccinated or can't verify that they have immunity. Measles in the…,http://static-11.sinclairstoryline.com/resources/media/f55b029a-6e6d-409b-81d4-1dcb1ff15411-large16x9_measlesMGN.jpg?1556228896319
https://www.prrecordgazette.com/health/local-health/vancouver-island-soccer-player-recovering-after-scary-flesh-eating-disease-fight/wcm/042bbe32-e854-4657-a567-52229a22c099,Vancouver Island soccer player recovering after flesh-eating-disease fight - Peace River Record Gazette,"The disease is rare, but if it takes hold, it has a fatality rate of about 26 per cent.",https://postmediavancouversun2.files.wordpress.com/2019/04/flesheating-1.jpg
http://www.27east.com/news/article.cfm/Hampton-Bays/590561/Measles-Case-Reported-In-Hampton-Bays,Measles Case Reported In Hampton Bays - Hampton Bays - 27east.com,Suffolk County Department of Health Services officials are urging anyone who visited the BNB bank on Montauk Highway in Hampton,http://www.27east.com/assets/Article/590561/infographic-measles-contagious.JPG
https://www.thisisinsider.com/man-got-rare-flesh-eating-bacteria-after-fishing-hook-prick-2019-4,A Florida man almost lost his hand after he was pricked with a fishing hook contaminated with rare 'flesh-eating' bacteria - INSIDER,"Mike Walton, a Florida resident, went fishing with friends this weekend. On the trip, he got pricked by a hook and got ""flesh-eating"" bacteria.",https://amp.thisisinsider.com/images/5cc1fc3ebd1e2732391183b2-960-480.jpg
https://thesector.com.au/2019/04/26/sit-less-play-more-who-releases-guidelines-for-children-under-five/,"Sit less, play more; WHO releases guidelines for children under five - The Sector","To grow up healthy, the World Health Organisation (WHO) has said, children need to sit less, and play more. The WHO guidelines cover physical activity, sedentary behaviour and sleep for children from birth to five years of age, and were released earlier this …",https://sector.imgix.net/wp-content/uploads/2019/04/annie-spratt-282807-unsplash-1.jpg?auto=format%2Ccompress
https://www.gizmodo.com.au/2019/04/people-born-before-1989-may-need-another-measles-vaccine/,People Born Before 1989 May Need Another Measles Vaccine - Gizmodo Australia,The U.S. is in the middle of the worst outbreak of measles since the disease was naturally eradicated from the county in 2000. But while the majority of victims are children whose parents decided not to vaccinate them or people who have chosen to go unvaccina…,"https://i.kinja-img.com/gawker-media/image/upload/c_lfill,w_768,q_90/lhjezrymkwaphrjtb66p.jpg"
https://www.sciencedaily.com/releases/2019/04/190425122351.htm,Study in mice uncovers an unknown pathway for breast cancer tumors to recur: The finding suggests immune cells could be targeted using existing therapies - Science Daily,"Experimenting in mice, the researchers tracked a series of events that enable a small reservoir of treatment-resistant cancer cells to awake from dormancy, grow and spread.",
http://www.winknews.com/2019/04/25/flesh-eating-bacteria-infects-florida-fisherman/,Flesh-eating bacteria infects Florida fisherman - Wink News,Flesh-eating bacteria infects Florida fisherman. He was stuck by a fish hook while fishing about 20 miles (32 kilometers) off the coast of Palm Harbor.,https://cdn.winknews.com/wp-content/uploads/2019/04/Man-fishes.-Credit-Taylor-Grote-Unsplash.jpg
https://www.wmur.com/article/flu-responsible-for-40-deaths-in-nh-this-season/27276253,Flu responsible for 40 deaths in NH this season - WMUR Manchester,"The longest flu season in 10 years has been linked to 40 deaths in New Hampshire, health officials said Thursday.","https://kubrick.htvapps.com/vidthumb/e1e362d7-1bf8-4b17-912e-ab6a47bbc3f7/e1e362d7-1bf8-4b17-912e-ab6a47bbc3f7_image.jpg?crop=0.790xw:0.788xh;0.153xw,0&resize=1200:*"
https://www.staradvertiser.com/2019/04/25/breaking-news/third-case-of-rat-lungworm-confirmed-on-hawaii-island/,Third case of rat lungworm confirmed on Big Island - Honolulu Star-Advertiser,The state has confirmed a third case of rat lungworm disease on Hawaii island.,https://www.staradvertiser.com/wp-content/uploads/2019/04/web1_20190425_brk_rld01.jpg
https://www.bbc.co.uk/news/av/uk-wales-48053076/prep-cardiff-anti-hiv-drug-user-wants-end-to-stigma,PrEP: Cardiff anti-HIV drug user wants end to stigma - BBC News,Pre-exposure prophylaxis is taken daily or on demand in order to prevent HIV infection.,https://ichef.bbci.co.uk/news/1024/branded_news/6227/production/_106472152__mg_7041.jpg
https://www.youtube.com/watch?v=pHqNgWkLzUM,new case of rat lungworm on Hawaii Island - KHON2 News,,
https://www.youtube.com/watch?v=B2-8pVJYsbU,Launch of World Malaria Day in Port Moresby - EMTV Online,,
http://www.wsiltv.com/story/40371222/flesh-eating-bacteria-infects-man-fishing-in-gulf-of-mexico,Flesh-eating bacteria infects man fishing in Gulf of Mexico - WSIL TV,"TAMPA, Fla. (ABC NEWS) -- A Florida man has been hospitalized after contracting a life-threatening flesh-eating bacteria while fishing out in the Gulf of Mexico.",https://WSIL.images.worldnow.com/images/18343287_G.jpg?lastEditedDate=20190425193059
https://www.youtube.com/watch?v=rcjOJYnrXIw,Man With Down Syndrome Hugs Friends After Heart Transplant - Inside Edition,,
https://www.abc.net.au/news/2019-04-26/flinders-medical-centre-runs-out-of-flu-vaccines-for-staff/11048208,Flu vaccine shortage at Flinders Medical Centre as spike in cases continues - ABC News,A shortage of free flu vaccines intended for frontline health staff at an Adelaide hospital comes amidst concerns about a spiralling number of influenza cases across the nation.,https://www.abc.net.au/news/image/9676976-16x9-700x394.jpg
https://thebigsmoke.com.au/2019/04/26/measles-overjoyed-so-many-people-are-giving-second-chance/,Measles overjoyed that so many people are giving it a second chance - The Big Smoke Australia,"The measles has taken to the internet, earnestly thanking the anti-vaccination crowd for giving it a second chance. Naw.",https://thebigsmoke.com.au/wp-content/uploads/Measles-1-770x432.jpg
https://futurism.com/the-byte/doctors-autonomous-surgery-robot-heart,"Surgeons Just Sent a Tiny, Autonomous Bot Into a Heart Valve - Futurism",Surgeons just used the first-ever autonomous surgery robot in an experimental operation on a pig.,https://wp-assets.futurism.com/2019/04/doctors-autonomous-surgery-robot-heart-1200x630.png
https://www.thesun.co.uk/news/8940681/baby-boy-brain-damaged-doctors-mistook-meningitis-chest-infection/,Baby boy left brain damaged after doctors ‘mistook meningitis for chest infection’ - The Sun,Doctors allegedly dismissed concerns of mum Rachel Henderson from Staffordshire — even though she matched symptoms in an A&E warning poster with her son's,https://www.thesun.co.uk/wp-content/uploads/2019/04/RR-COMP-baby1.jpg?strip=all&quality=100&w=1200&h=800&crop=1
https://kpax.com/health-news/2019/04/25/additional-pertussis-cases-reported-in-missoula-county/,Additional pertussis cases reported in Missoula County - KPAX-TV,"Missoula health officials report two more cases of whooping cough have been confirmed, bringing the total cases to eight.",https://s3.amazonaws.com/cordillera-network/wp-content/uploads/sites/13/2019/04/25081707/Missoula-City-County-Health-Department.jpg
https://www.mississauga.com/news-story/9303136-the-latest-measles-quarantine-orders-at-2-la-universities/,The Latest: Measles quarantine orders at 2 LA universities - mississauga.com,The Latest: Measles quarantine orders at 2 LA universities,https://www.mississauga.com/Contents/Images/Communities/Mississauga_1200x630.png
https://toronto.citynews.ca/2019/04/25/breaking-the-silence-around-infertility-and-pregnancy-loss/,Breaking the silence around infertility and pregnancy loss - CityNews,"Sixteen percent, or one in six couples in Canada experience infertility – a number that has doubled since the 1980s as per government records. In 2007, Fertility Matters Canada launched Canadian Infertility Awareness Week – between April 22 and 28 this year –…",https://toronto.citynews.ca/wp-content/blogs.dir/sites/10/2019/04/25/Infertility-and-pregnancy-loss-1024x683.jpg
https://www.news-medical.net/news/20190426/Study-finds-identical-alcohol-relapse-rates-among-all-patients-regardless-of-sobriety-period.aspx,Study finds identical alcohol relapse rates among all patients regardless of sobriety period - News-Medical.net,"For decades, patients with liver disease related to alcohol use have been told they must be sober for six months before they can get a liver transplant.",https://www.news-medical.net/image.axd?picture=2018%2f7%2fSelection_of_alcoholic_drinks_on_rustic_wood_background_-_Oleksandra_Naumenko_A1_fe979bdaef3943969b200bceaf42b174-620x480.jpg
https://www.themandarin.com.au/107603-psychedelics-to-treat-mental-illness-australian-researchers-are-giving-it-a-go/,Psychedelics to treat mental illness? Australian researchers are giving it a go - The Mandarin,Australia needs a paradigm shift in the way we treat mental illness. Scientific research is increasingly pointing to psychedelic drugs like psilocybin and MDMA (commonly known as Ecstasy) as viable options.,https://www.themandarin.com.au/content/uploads/2019/04/file-20190423-175548-1sbsss8.jpg
https://www.cnn.com/2019/04/25/health/california-universities-measles-quarantine/index.html,Measles quarantine issued at two California universities - CNN,A measles quarantine was ordered Thursday at UCLA and Cal State LA in an effort to try to prevent the spread of the highly contagious disease. The order was issued as the nation remains gripped in the worst measles outbreak since 2000.,https://cdn.cnn.com/cnnnext/dam/assets/190425224938-measles-quarantine-ucla-cal-state-la-vpx-00003828-super-tease.jpg
https://www.thetimes.co.uk/article/fishing-game-app-beats-tests-in-spotting-alzheimer-s-risk-kh8smw8zr,Fishing game app beats tests in spotting Alzheimer's risk - The Times,A specially designed mobile phone game can identify people at risk of Alzheimer’s disease where memory tests are ineffective. Sea Hero Quest has been downloaded and played by more than 4.3 million...,http://www.thetimes.co.uk/imageserver/image/methode%2Ftimes%2Fprod%2Fweb%2Fbin%2F0827c1e2-6789-11e9-877f-447086620e98.jpg?crop=1667%2C937%2C0%2C87
