url,title,description,urlToImage,date
https://www.express.co.uk/life-style/health/1118777/kissing-bug-chagas-disease-symptoms-signs-infection,Kissing bug WARNING: Deadly Chagas disease recently diagnosed - are YOU at risk? - Express,"CHAGAS DISEASE, a deadly parasitic disease that could cause sudden death, could be spread by ‘kissing bug’ insects - and a new case has recently been diagnosed. These are the signs and symptoms you should be watching out for. Are you at risk of the parasite?",https://cdn.images.express.co.uk/img/dynamic/11/750x445/1118777.jpg,2019-04-25
https://nationalpost.com/news/scientists-develop-method-to-restore-speech-to-those-who-have-had-it-stolen,Scientists develop method to restore speech to those who have had it stolen - National Post,The ability to decipher speech intentions through brain signals and not through physical movements like blinking is a major breakthrough,https://nationalpostcom.files.wordpress.com/2019/04/ucsfvideo.jpg,2019-04-25
https://www.kcrg.com/content/news/Blood-sucking-kissing-bug-reported-throughout-southern-US-moving-north-509056611.html,"Blood-sucking 'kissing bug' reported throughout southern US, moving north - KCRG",The Centers for Disease Control and Prevention is warning against a blood-sucking bug that can spread a potentially deadly disease.,https://media.graytvinc.com/images/2LBBJ3BZSBCX3C4AUMPMXYMWVE.jpg,2019-04-25
https://www.abcactionnews.com/news/region-pinellas/measles-case-confirmed-in-pinellas-county-one-of-two-cases-in-florida,"Measles case confirmed in Pinellas County, one of two cases in Florida - ABC Action News",The Florida Department of Health in Pinellas County is investigating a measles case involving a 72-year-old man who traveled to Asia recently.,https://ewscripps.brightspotcdn.com/dims4/default/3bed44f/2147483647/strip/true/crop/1000x525+0+19/resize/1200x630!/quality/90/?url=https%3A%2F%2Fewscripps.brightspotcdn.com%2F4f%2F56%2Fd6c298fc4a4ba885278dcd6fbd8b%2Fmeasles-1000-563.png,2019-04-25
https://www.theguardian.pe.ca/news/israel-reports-highly-pathogenic-h5n8-bird-flu-at-turkey-farm-305365/,Israel reports highly pathogenic H5N8 bird flu at turkey farm - The Guardian,"PARIS (Reuters) - Israel has reported an outbreak of highly pathogenic H5N8 bird flu at a turkey farm in the northern region of Hazafon, the World Organisation for Animal Health (OIE) said on Thursday, citing a report from Israel's agriculture",https://www.theguardian.pe.ca/static/overrides/theguardian/dist/img/meta-logo.png,2019-04-25
https://gizmodo.com/people-born-before-1989-may-need-another-measles-vaccin-1834304231,People Born Before 1989 May Need Another Measles Vaccine - Gizmodo,The U.S. is in the middle of the worst outbreak of measles since the disease was naturally eradicated from the county in 2000. But while the majority of victims are children whose parents decided not to vaccinate them or people who have chosen to go unvaccina…,"https://i.kinja-img.com/gawker-media/image/upload/s--6UNrNAJ1--/c_fill,fl_progressive,g_center,h_900,q_80,w_1600/lhjezrymkwaphrjtb66p.jpg",2019-04-25
https://tonic.vice.com/en_us/article/xwnxkw/cdc-finally-clarifies-its-opioid-painkiller-restrictions,"After Leaving Millions in Agony, the CDC Is Finally Clarifying Its Painkiller Restrictions - VICE",The agency issued a critical clarification of its guidelines for opioid prescribing.,"https://video-images.vice.com/articles/5cc1c62e1fe57a000702fdb9/lede/1556205282263-bottle-of-pills.jpeg?crop=0.9878987898789878xw:1xh;center,center&resize=1200:*",2019-04-25
https://www.kcci.com/article/what-year-you-were-born-could-determine-if-you-need-another-shot-of-the-measles-vaccine/27270585,What year you were born could determine if you need another shot of the measles vaccine - KCCI Des Moines,The outbreak might have Americans wondering if they should get the vaccination or if they are covered.,"https://kubrick.htvapps.com/htv-prod-media.s3.amazonaws.com/images/lead-s029329791-300-1494294315.jpg?crop=1.00xw:0.561xh;0,0.0606xh&resize=1200:*",2019-04-25
https://www.wsj.com/articles/scientists-tackle-connecticuts-tick-problem-11556204400,Scientists Tackle Connecticut’s Tick Problem - The Wall Street Journal,"Researchers at the Connecticut Agricultural Experiment Station are for the first time actively collecting ticks statewide to test for organisms that cause human diseases, including Lyme disease.",https://images.wsj.net/im-69389/social,2019-04-25
https://www.nbc29.com/story/40367363/virginia-dept-of-health-warns-residents-of-increase-in-hepatitis-a-cases,Virginia Dept. of Health Warns Residents of Increase in Hepatitis A Cases - NBC 29 News,Virginia has reported a 132% increase in cases of HAV between Jan. 1 and April 19 compared to the same time period in 2018.,https://WVIR.images.worldnow.com/images/18341509_G.jpeg?lastEditedDate=1556185287000,2019-04-25
https://news.sky.com/story/polio-vaccination-worker-shot-dead-in-pakistan-11703316,Polio vaccination worker shot dead by gunmen on motorbike in Pakistan - Sky News,"The Taliban claims the vaccine is part of a foreign plot to sterilise Muslims, and that those administering it are Western spies.",https://e3.365dm.com/19/04/1600x900/skynews-chaman-pakistan-polio_4650081.jpg?20190425150442,2019-04-25
https://www.dailymail.co.uk/news/article-6958353/Tragedy-estate-agent-23-dies-undiagnosed-meningitis-infection.html,"Tragedy estate agent, 23, dies due to undiagnosed meningitis infection - Daily Mail","Tragic Abigail Harris of Cheltenham, Gloucetershire, unknowingly had a bacterial form of meningitis, an infection of the lining that surrounds the brain and spinal cord.",https://i.dailymail.co.uk/1s/2019/04/25/09/12697802-0-image-a-4_1556181918924.jpg,2019-04-25
https://www.cnn.com/2019/04/25/health/nurse-hepatitis-outbreak-washington-hospital/index.html,"Drug-using nurse probably responsible for hepatitis outbreak at hospital, report says - CNN","A nurse who admitted using drugs meant for patients has been identified as the likely source of a hepatitis C outbreak at a hospital in Washington state, according to a report from the Centers for Disease Control and Prevention.",https://cdn.cnn.com/cnnnext/dam/assets/180705174839-hepatitis-super-tease.jpg,2019-04-25
https://www.thechronicleherald.ca/living/why-the-most-common-developmental-disability-in-canada-is-misdiagnosed-or-missed-and-the-devastating-results-305488/,Why the most common developmental disability in Canada is misdiagnosed or missed — and the devastating results - TheChronicleHerald.ca,"FASD is associated with a bewildering number of symptoms. But as Vanessa Hrvatin writes, the biggest barrier to early detection and treatment may be social not biological. 

This is the second in three-part series,  by Postmedia’s",https://www.thechronicleherald.ca/media/photologue/photos/cache/httpsapipddataservicescomlistsfeed6fa4e00b-4591-473d-a003-a875540c882a_medium,2019-04-25
https://www.journalpioneer.com/news/israel-reports-highly-pathogenic-h5n8-bird-flu-at-turkey-farm-305365/,Israel reports highly pathogenic H5N8 bird flu at turkey farm - The Journal Pioneer,"PARIS (Reuters) - Israel has reported an outbreak of highly pathogenic H5N8 bird flu at a turkey farm in the northern region of Hazafon, the World Organisation for Animal Health (OIE) said on Thursday, citing a report from Israel's agriculture",https://www.journalpioneer.com/static/overrides/journalpioneer/dist/img/meta-logo.png,2019-04-25
https://www.businessinsider.co.za/what-is-chagas-disease-kissing-bugs-2019-4,A dangerous parasitic illness spread by 'kissing bugs' that bite people's faces at night is continuing to spread in the US - Business Insider South Africa,"Triatoma sanguisuga, a bug that bites people's face and spreads parasites,is spreading in the US.",http://cdn.24.co.za/files/Cms/General/d/8787/3285f0d4c4a6491480341fba2148a797.jpg,2019-04-25
https://www.courier-journal.com/story/news/education/2019/04/25/kentucky-teacher-sickouts-matt-bevin-child-shot-comment/3574640002/,Matt Bevin blames Kentucky teacher sickouts for child's shooting - Courier Journal,"Gov. Matt Bevin appeared to be referring to a shooting in Louisville's Shively neighborhood on March 12, during which a 7-year-old girl was shot.","https://www.gannett-cdn.com/presto/2019/03/07/PLOU/c84c7945-6750-4c00-a31d-fac6115c5b22-MattBevin.JPG?crop=5331,2999,x0,y322&width=3200&height=1680&fit=bounds",2019-04-25
https://www.wesh.com/article/flesh-eating-bacteria-florida-fisherman/27271316,Florida fisherman contracts Flesh-eating bacteria - WESH 2 Orlando,A Florida man is being treated for flesh-eating bacteria he contracted while fishing in the Gulf of Mexico.,"https://kubrick.htvapps.com/htv-prod-media.s3.amazonaws.com/images/bacteria-1477573757.png?crop=1.00xw:0.994xh;0,0&resize=1200:*",2019-04-25
https://www.nbcnews.com/health/health-news/many-drivers-who-test-positive-marijuana-have-child-car-survey-n998496,"Many drivers who test positive for marijuana have a child in the car, survey finds - NBCNews.com","Nearly one in seven Washington state drivers traveling with kids tested positive for THC, the psychoactive ingredient in marijuana, researchers reported.",https://media2.s-nbcnews.com/j/newscms/2019_16/2828546/190419-cannabis-worker-ac-1049p_f12c736232b767634f6bccc3c0f9389d.nbcnews-fp-1200-630.jpg,2019-04-25
https://www.cbc.ca/news/thenational/national-today-newsletter-polio-pakistan-pei-election-work-1.5107180,"Polio vaccination plan triggers killings, arson, public hysteria in Pakistan - CBC.ca","A closer look at the day's most notable stories with The National's Jonathon Gatehouse: polio vaccination teams attacked, clinic torched in Pakistan; with more provinces leaning Conservative, federal politicians face interesting times; Japan and France have l…",https://i.cbc.ca/1.5110704.1556208015!/fileImage/httpImage/image.jpg_gen/derivatives/16x9_620/pakistan-controversy-polio-vaccination.jpg,2019-04-25
https://www.ghanaweb.com/GhanaHomePage/NewsArchive/Ghana-can-become-a-malaria-free-country-First-Lady-741386,Ghana can become a malaria-free country – First Lady - GhanaWeb,"Ghana’s First Lady, Mrs. Rebecca Akufo-Addo has charged stakeholders to prioritize and...",https://cdn.ghanaweb.com/imagelib/pics/80739725.jpg,2019-04-25
https://koaa.com/your-healthy-family/2019/04/25/your-healthy-family-april-is-oral-cancer-awareness-month/,Your Healthy Family: April is oral cancer awareness month - KOAA 5,A thorough oral cancer screening should be happening at your dentist's office.,https://s3.amazonaws.com/cordillera-network/wp-content/uploads/sites/11/2019/04/25111634/oral-cancer-1.jpg,2019-04-25
https://nationalpost.com/feature/why-the-most-common-developmental-disability-in-canada-is-misdiagnosed-or-missed-and-the-devastating-results,Why the most common developmental disability in Canada is misdiagnosed or missed — and the devastating results - National Post,"FASD is associated with a bewildering number of symptoms. But as Vanessa Hrvatin writes, the biggest barrier to early detection and treatment may be social not biological. Photography by Leah Henne…",https://nationalpostcom.files.wordpress.com/2019/04/photo2-2500px.jpg,2019-04-25
http://www.pressdemocrat.com/news/9528468-181/allergy-alert-historic-levels-of,Allergy alert: Historic levels of grass pollen headed this way - Santa Rosa Press Democrat,"Sneezing much? Lots of rain followed by warm weather has led to a bumper crop of pollen, making local allergy sufferers miserable.",https://www.pressdemocrat.com/csp/mediapool/sites/dt.common.streams.StreamServer.cls?STREAMOID=5CnqQ43asP8rcGPrvh5TC8$daE2N3K4ZzOUsqbU5sYtQ_jettfeHN13qS3vYacRFWCsjLu883Ygn4B49Lvm9bPe2QeMKQdVeZmXF$9l$4uCZ8QDXhaHEp3rvzXRJFdy0KqPHLoMevcTLo3h8xh70Y6N_U_CryOsw6FTOdKL_jpQ-&CONTENTTYPE=image/jpeg,2019-04-25
https://www.inverse.com/article/55194-solar-energy-how-a-cup-of-coffee-could-create-low-cost-efficient-cells,Solar Energy: How a Cup of Coffee Could Create Low-Cost Efficient Cells - Inverse,"Researchers at the University of California, Los Angeles and China-based solar energy firm Solargiga Energy have boosted the efficiency of perovskite solar cells from 17 percent to more than 20 percent by using caffeine molecules. This discovery could help th…",https://fsmedia.imgix.net/a6/be/d6/be/7efb/4205/ba53/27a8c1f7045d.jpeg?rect=0%2C849%2C4335%2C2166&auto=format%2Ccompress&w=1200,2019-04-25
https://www.cnn.com/2019/04/25/health/kissing-bug-delaware-case-cdc-study-trnd/index.html,'Kissing bug' case in Delaware raises summer concerns - CNN,"A bloodsucking ""kissing bug"" bit a Delaware girl on the face last summer while she was watching television, and now the US Centers for Disease Control and Prevention is calling the incident the first confirmed identification of the bug in the state.",https://cdn.cnn.com/cnnnext/dam/assets/151106121746-chagas-triatomine-super-tease.jpg,2019-04-25
https://wtvr.com/2019/04/25/hepatitis-a-virus-warning/,"Hepatitis A virus outbreak hits Virginia, cases up 132% - WTVR CBS 6 News","""We want everyone to know how the infection is spread, be able to recognize the symptoms, and take actions to prevent the spread of hepatitis A.""",https://localtvwtvr.files.wordpress.com/2017/09/web-1200x630-breaking-news-ambulance080617-aj.jpg?quality=85&strip=all,2019-04-25
https://www.yahoo.com/lifestyle/took-man-9-years-get-lung-disease-diagnosed-154232707.html,It took this man 9 years to get his lung disease diagnosed - Yahoo Lifestyle,"Ken Benson says he complained to several doctors about having shortness of breath for nine years — and not much was done about it. “I kept switching doctors, hoping to find an answer,” he says.",https://s.yimg.com/uu/api/res/1.2/gwwPF7GQMXev2vWN40kh2Q--~B/aD04MDU7dz0xNTAwO3NtPTE7YXBwaWQ9eXRhY2h5b24-/http://media.zenfs.com/en/homerun/feed_manager_auto_publish_494/d324f8bd4b5c94b6cc5901704b7ff1ff,2019-04-25
https://www.cnbc.com/2019/04/25/california-scientists-found-a-way-to-translate-thoughts-into-speech.html,California scientists have found a way to translate thoughts into computer-generated speech - CNBC,"A computer that aims to translate thoughts into natural sounding speech has been hailed by its developers as an ""exhilarating"" breakthrough.",https://fm.cnbc.com/applications/cnbc.com/resources/img/editorial/2019/04/25/105872191-1556202555964electrode-array-hand.1910x1000.png,2019-04-25
https://www.birminghammail.co.uk/news/midlands-news/baby-meningitis-sent-home-hospital-16180073,Baby with meningitis sent home from hospital after doctors dismissed illness as a chest infection - Birmingham Live,Good Hope Hospital sent 11 month old baby home diagnosing a chest infection. He was later brain damaged from meningitis,https://i2-prod.birminghammail.co.uk/incoming/article16181702.ece/ALTERNATES/s1200/0_Freddie-ODriscoll.jpg,2019-04-25
https://metro.co.uk/2019/04/25/brain-switch-makes-us-crave-junk-food-revealed-9318449/,The brain 'switch' that makes us crave junk food has been revealed - Metro.co.uk,"Finally, there may be an answer to why we like pizza over lettuce.",https://i1.wp.com/metro.co.uk/wp-content/uploads/2019/04/GettyImages-904136898_1556202023.jpg?quality=90&strip=all&w=1200&h=630&crop=1&zoom=1&ssl=1,2019-04-25
https://globalnews.ca/news/5197344/seasonal-allergies-treatment/,‘Don’t suffer in silence’: How to treat your seasonal allergies - Global News,What works for you will depend on what you're allergic to and the severity of your reactions.,https://shawglobalnews.files.wordpress.com/2019/04/natural-allergy-remedies.jpg?quality=70&strip=all&w=720&h=379&crop=1,2019-04-25
https://www.businessinsider.com.au/brain-fog-causes-2019-4,8 things that could be causing your brain fog - Business Insider Australia,"Although it seems like a condition on its own, brain fog is actually a symptom of a variety of other medical conditions. It’s characterised by a series of issues including trouble concentrating, forgetfulness, lack of motivation, and confusion.",https://static.thisisinsider.com/image/5cc1d01f0ff30d15cd38de73-640.jpg,2019-04-25
https://www.sciencedaily.com/releases/2019/04/190425104323.htm,An army of micro-robots can wipe out dental plaque - Science Daily,"A swarm of micro-robots, directed by magnets, can break apart and remove dental biofilm, or plaque, from a tooth. The innovation arose from a cross-disciplinary partnership among dentists, biologists, and engineers.",/images/2019/04/190425104323_1_540x360.jpg,2019-04-25
https://arstechnica.com/science/2019/04/nasa-safety-panel-offers-more-detail-on-dragon-anomaly-urges-patience/,"NASA safety panel offers more detail on Dragon anomaly, urges patience - Ars Technica","""Firing of eight SuperDracos resulted in an anomaly.""",https://cdn.arstechnica.net/wp-content/uploads/2019/04/46386616995_4dbca8e71c_k-760x380.jpg,2019-04-25
https://medicalxpress.com/news/2019-04-body-clock.html,Researchers discover how eating feeds into the body clock - Medical Xpress,"New research has found it is not just what you eat, but when you eat that is important, knowledge which could improve the health of shift workers and people suffering from jet lag.",https://3c1703fe8d.site.internapcdn.net/newman/gfx/news/hires/2019/mrcresearche.jpg,2019-04-25
https://www.dailymail.co.uk/health/article-6959193/Health-Secretary-Matt-Hancock-wont-rule-BANNING-unvaccinated-children-schools.html,Health Secretary Matt Hancock won't rule out BANNING unvaccinated children from schools - Daily Mail,"Mr Hancock said in an interview on talkRADIO this morning that he 'wouldn't rule anything out' with regards to following in the footsteps of France and the US, which require the vaccine by law.",https://i.dailymail.co.uk/1s/2019/04/25/12/12704362-0-image-a-5_1556192297208.jpg,2019-04-25
https://www.liverpoolfc.com/news/community/347528-autism-hour-at-lfc-s-anfield-store,Autism Hour at LFC's Anfield store - Liverpool FC,Liverpool FC will take extra steps to make its Anfield store 'autism-friendly' for 60 minutes on the last Thursday of every month.,https://d3j2s6hdd6a7rg.cloudfront.net/v2/uploads/media/default/0001/47/thumb_46308_default_news_size_5.jpeg,2019-04-25
https://nationalpost.com/pmn/news-pmn/canada-news-pmn/ottawa-opioid-users-find-hope-in-program-that-promises-safe-drug-supply,Ottawa opioid users find hope in program that promises safe drug supply - National Post,OTTAWA — Katrina Adams has thought about getting a tattoo for all of her friends who have died in the past two years from opioid overdoses but she doesn’t think she has enough room on h…,https://nationalpostcom.files.wordpress.com/2019/04/skp201-the-canadian-press.jpg,2019-04-25
https://www.ctvnews.ca/health/researchers-discover-another-way-hiv-can-spread-among-drug-users-1.4395087,Researchers discover another way HIV can spread among drug users - CTV News,"Sharing needles isn’t the only way to spread HIV among drug users, according to Ontario researchers who have discovered a new method of transmission involving the equipment used to prepare the drugs before injection.",https://www.ctvnews.ca/polopoly_fs/1.4392625.1556114711!/httpImage/image.jpg_gen/derivatives/landscape_620/image.jpg,2019-04-25
https://www.cambridgetimes.ca/news-story/9302552-measles-cases-up-in-california-spread-by-overseas-travel/,"Measles cases up in California, spread by overseas travel - Cambridge Times","Measles cases up in California, spread by overseas travel",https://www.cambridgetimes.ca/Contents/Images/Communities/cambridge_1200x630.png,2019-04-25
https://www.pinchercreekecho.com/news/scientists-develop-method-to-restore-speech-to-those-who-have-had-it-stolen/wcm/5e5dc1b0-0796-480f-be36-2ff0ff6f0acf,LISTEN: Scientists develop method to restore speech to those who have had it stolen - Pincher Creek Echo,The ability to decipher speech intentions through brain signals and not through physical movements like blinking is a major breakthrough,https://nationalpostcom.files.wordpress.com/2019/04/ucsfvideo.jpg,2019-04-25
https://www.standard-freeholder.com/health/diet-fitness/fitness-column-progress-depends-on-lifestyle-adjustments-and-perseverance/wcm/fe7972c7-40a0-4c65-bca8-9cefba54f1cd,Fitness column: Progress depends on lifestyle adjustments and perseverance - Standard Freeholder,Breaking News: A KR Personal Training client recently lost 16 pounds in a little over a month working out twice a week. With the help of protocols formulated over the past 30 years she reached and …,https://postmediaedmontonjournal2.files.wordpress.com/2019/04/871070868.jpg,2019-04-25
https://www.prevention.com/health/a27272690/kissing-bugs-chagas-disease-cdc-report/,What are Kissing Bugs? Delaware Girl Bitten by Blood-Sucking Insect - Prevention.com,"The name sounds innocent, but the insect can spread a deadly infection.","https://hips.hearstapps.com/hmg-prod.s3.amazonaws.com/images/chagas-disease-brazil-rio-de-janeiro-oswaldo-cruz-institute-news-photo-129374499-1556209979.jpg?crop=0.808xw:0.619xh;0.0881xw,0.307xh&resize=1200:*",2019-04-25
https://www.thewhig.com/health/walking-for-a-cure/wcm/f8a8c955-e796-46a5-bd71-576dca52a65e,Walking for a cure - The Kingston Whig-Standard,"In 1996 Shawna Johnson, a 29-year-old Drumheller resident was diagnosed with Multiple Sclerosis. The disease, which affects the central nervous system, was a blow to the otherwise active Johnson. &…",https://nexus.prod.postmedia.digital/wp-content/uploads/2019/04/MS-Walk.jpg,2019-04-25
https://www.ecowatch.com/babies-electronic-screens-who-2635528352.html,WHO: Don't Expose Babies to Electronic Screens - EcoWatch,"Children under 12 months old should not be exposed to electronic screens at all, according to the World Health Organization. Parents were urged to ensure kids get enough exercise to encourage good habits later in life.",https://ecowatchroar-img.rbl.ms/simage/https%3A%2F%2Fassets.rbl.ms%2F19419634%2F980x.jpg/2000%2C2000/rEi29UllHwXRLcGa/img.jpg,2019-04-25
https://www.youtube.com/watch?v=DcaFUrIupvo,MEASLES OUTBREAK: International travel fueling California's measles outbreak - KPIX CBS SF Bay Area,International travel fueling California's measles outbreak,https://i.ytimg.com/vi/DcaFUrIupvo/maxresdefault.jpg,2019-04-25
https://www.whitsundaytimes.com.au/news/no-screen-time-for-children-under-two-parents-told/3711443/,"No screen time for children under two, parents told - Whitsunday Times",The World Health Organisation has released extra­ordinary guidelines warning parents to ban their babies and toddlers aged under two from watching TV or staring at iPads or smart phones.,https://media.apnarm.net.au/media/images/2019/04/25/imagev1743e3ab2da63e652d887f9ec762d8016-u56yvwj6dtdwyvaz6s2_ct300x300.jpg,2019-04-25
https://www.stuff.co.nz/life-style/well-good/112265699/bad-memories-and-cringeworthy-mistakes-fester-for-insomniacs,Bad memories and cringeworthy mistakes fester for insomniacs - Stuff.co.nz,Dutch scientists suggest an inability to process emotional distress as they sleep is keeping insomniacs awake at night.,https://resources.stuff.co.nz/content/dam/images/1/u/u/8/x/4/image.related.StuffLandscapeSixteenByNine.1420x800.1uu8rn.png/1556219381584.jpg,2019-04-25
https://www.sciencedaily.com/releases/2019/04/190425104104.htm,Gonorrhoea cases on the rise across Europe - Science Daily,"Following a decline in notification rates in 2016, the number of gonorrhoea cases has gone up by 17% across the reporting EU/EEA countries with more than 89,000 confirmed diagnoses in 2017 -- equivalent to 240 cases a day.",/images/2019/04/190425104104_1_540x360.jpg,2019-04-25
https://losangeles.cbslocal.com/2019/04/25/measles-quarantine-ucla-cal-state-los-angeles/,"UCLA, Cal State LA To Quarantine Students Who Cannot Prove They Had Measles Vaccination - CBS Los Angeles","Health officials at UCLA and Cal State LA are working with county health officials to issue quarantine orders for students who cannot provide evidence of measles immunizations, officials announced Thursday.",https://cbsla.files.wordpress.com/2015/06/gettyimages-462420480.jpg?w=1500,2019-04-25
https://www.usatoday.com/story/news/health/2019/04/25/blood-pressure-medication-recall-kroger-losartan-may-have-carcinogen/3573377002/,Yet another lot of blood pressure medication recalled — this time for a possible carcinogen - USA TODAY,Legacy Pharmaceutical Packaging will recall one more lot of the heart and blood pressure drug losartan sent to Kroger Co. pharmacies.,https://www.gannett-cdn.com/-mm-/9e1f6e2ee20f44aa1f3be4f71e9f3e52b6ae2c7e/c=0-110-2121-1303/local/-/media/2019/03/25/USATODAY/usatsports/pills_gettyimages-932555698.jpg?width=3200&height=1680&fit=crop,2019-04-25
https://www.nytimes.com/2019/04/25/world/asia/polio-vaccine-pakistan.html,Polio Vaccinator Is Shot and Killed in Pakistan - The New York Times,The woman was part of a vaccination campaign. Another worker in her team was injured. A total of three polio workers have been killed this week as unfounded rumors against vaccines spread.,https://static01.nyt.com/images/2019/04/25/world/25pakistan/25pakistan-facebookJumbo.jpg,2019-04-25
https://www.itv.com/news/2019-04-25/what-are-the-signs-and-symptoms-of-measles-and-how-can-children-and-adults-be-vaccinated/,What are the signs and symptoms of measles and how can children and adults be vaccinated? - ITV News,"The number of measles cases in England is on the rise, almost trebling from 259 cases in England in 2017, to 966 in 2018.

Between 2010 and 2017, more than half a million youngsters in the UK were not given the jab to protect against the virus.

It&#39;s a vi…",https://news.images.itv.com/image/file/1840665/img.jpg,2019-04-25
