url,title,description,urlToImage,date
https://www.cnet.com/news/this-free-chrome-extension-can-simplify-your-gmail/,This free Chrome extension can 'Simplify' your Gmail - CNET,"The changes aren't big, but they make your inbox look a bit more like mobile Gmail.",https://cnet2.cbsistatic.com/img/w7P9c8H2--rVd5rpoJiwSn7iAV0=/756x567/2019/04/26/6f5b8022-925a-4342-bd00-68d5a4eb3085/gettyimages-991350808.jpg,2019-04-26
https://www.usatoday.com/story/tech/talkingtech/2019/04/26/leaks-apple-designs-what-new-iphone-11-looks-like/3588248002/,This is what your next iPhone design could look like - USA TODAY,A website out of India has published renders of what it says the iPhone 11 (or X1) might look like and include,"https://www.gannett-cdn.com/presto/2019/04/26/USAT/01ef552f-a2d2-4a34-9de7-26ac6f604491-iPhone-XI-5K1.jpg?crop=5119,2879,x0,y0&width=3200&height=1680&fit=bounds",2019-04-26
https://www.androidpolice.com/2019/04/26/sonys-smartphone-shipments-dropped-50-last-year/,Sony's smartphone shipments dropped 50% last year - Android Police,"It's no secret that Sony's mobile division has been struggling for years. Every quarter, the financials consistently show losses under the Mobile Communications section, and the Q4 2018 and FY2018 results are no different. That said, the mobile division is an…",https://www.androidpolice.com/wp-content/uploads/2019/03/sony-xperia-10-cameras-728x485.jpg,2019-04-26
https://www.theverge.com/2019/4/26/18518346/google-meet-microsoft-edge-chromium-browser-block,Google isn’t blocking Microsoft’s new Edge browser - The Verge,Google’s Meet service suddenly stopped working on Microsoft’s new Chromium Edge browser. Google says it will officially support the browser once it’s generally available.,https://cdn.vox-cdn.com/thumbor/zecX0cPldoJGxd8xivCIx07sXlA=/0x146:2040x1214/fit-in/1200x630/cdn.vox-cdn.com/uploads/chorus_asset/file/10745895/acastro_180427_1777_0001.jpg,2019-04-26
https://www.polygon.com/2019/4/26/18518480/fortnite-siphon-competitive-esports-casual-controversy,"Fortnite’s beloved update actually made people play less, Epic says - Polygon","Epic Games explains why it undid a Fortnite update that was heavily embraced by the competitive community, stating that the changes made the game too intense for casual players.",https://cdn.vox-cdn.com/thumbor/UnFw3A3A1WA23KGGMiJ7REKeIc4=/0x63:1045x610/fit-in/1200x630/cdn.vox-cdn.com/uploads/chorus_asset/file/16194750/Screen_Shot_2019_04_26_at_2.53.01_PM.png,2019-04-26
https://wccftech.com/ace-combat-7-season-pass-aircraft/,Ace Combat 7 Shows Off the Futuristic Aircraft Included in its Season Pass - Wccftech,"Get ready to return to the danger zone, because the Ace Combat 7: Skies Unknown Season Pass will be delivering fresh high-flying action soon. The new content includes three additional futuristic aircraft that have appeared in previous Ace Combat games – the A…",https://cdn.wccftech.com/wp-content/uploads/2019/04/WCCFacecombat73.jpg,2019-04-26
https://www.iphoneincanada.ca/news/app-lets-you-spy-alexa-smart-devices/,New Mac App Lets You Spy on All Your Smart Devices Including Alexa - iPhone in Canada,The app not only tracks the data each smart device transmits but also who receives it.,https://cdn.iphoneincanada.ca/wp-content/uploads/2019/04/iot.png,2019-04-26
https://www.techradar.com/news/apple-airpods-2019-vs-beats-powerbeats-the-battle-of-apples-true-wireless-earbuds,Apple AirPods (2019) vs Beats Powerbeats: the battle of Apple’s true wireless earbuds - TechRadar,"Same wireless tech, different design",https://cdn.mos.cms.futurecdn.net/4UhTgZg5KTRFPMMxU95zG8-1200-80.jpg,2019-04-26
https://mobilesyrup.com/2019/04/26/three-apple-industrial-designers-leave-company/,Three Apple industrial designers to exit the company - MobileSyrup,"The designers are leaving a time of great change in the California-based company, with it moving towards producing self-driving cars and augmented reality equipment.",https://cdn.mobilesyrup.com/wp-content/uploads/2019/04/iphone-xs-header-29-1024x522.jpg,2019-04-26
https://www.laptopmag.com/reviews/laptops/hp-chromebook-x360-14-g1,HP Chromebook x360 14 G1 - Full Review and Benchmarks - Laptop Mag,"The HP Chromebook x360 14 G1 is an impressive laptop with long battery life and an excellent keyboard, but it's not a great value.",https://img.purch.com/o/aHR0cDovL2Nkbi5sYXB0b3BtYWcuY29tL2ltYWdlcy91cGxvYWRzLzU2ODEvZy9saHAtY2hyb21lYm9vay14MzYwLTE0LTAwMS5qcGc=,2019-04-26
https://9to5google.com/2019/04/26/alphabet-scoop-051/,"Alphabet Scoop 051: More Google Pixel 3a leaks + Avengers feature, Google I/O 2019 tidbits - 9to5Google","This week we talk about even more Google Pixel 3a leaks and its feature in the latest Avengers movie, some Google I/O tidbits, Galaxy Fold drama, and more. Alphabet Scoop is available on Google Pla…",https://9to5google.com/wp-content/uploads/sites/4/2019/04/Alphabet-Scoop-16-9-By-9to5Google.jpg?quality=82&strip=all&w=1600,2019-04-26
https://www.youtube.com/watch?v=d28vs82uOFg,"Best iPhone Lenses: Moment, Sandmarc, Olloclip, RhinoShield, and others tested - Macworld",,,2019-04-26
https://www.androidpolice.com/2019/04/26/leaked-google-pixel-3a-and-3a-xl-renders-confirm-what-we-already-knew/,[Update: New 'purple' render] Leaked Google Pixel 3a and 3a XL renders confirm what we already knew - Android Police,"In just a few weeks, during its I/O developer conference, Google will announce the long-awaited cheaper Pixel phones. In typical Google fashion, the 3a and 3a XL have already been the subject of full in-the-flesh leaks (more than once) so by this point we kno…",https://www.androidpolice.com/wp-content/uploads/2019/04/AH-Google-Pixel-3A-and-3A-XL-728x410.jpg,2019-04-26
https://www.polygon.com/2019/4/26/18518204/days-gone-impressions-combat-gameplay-ps4,Playing Days Gone? You’ll have to make the best of it. - Polygon,"Days Gone for PlayStation 4 is like a lot of other open-world adventure games, except they do a better job of telling you you’re a unique hero living in fascinating times. Days Gone is only nominally a biker-gang fantasy. But I kind of knew that it would be. …",https://cdn.vox-cdn.com/thumbor/JVn7ZLVXcdlM_1wRRgVHklMgCzA=/0x38:1919x1043/fit-in/1200x630/cdn.vox-cdn.com/uploads/chorus_asset/file/16194824/jwayyepmsjnqoscmodjv.png,2019-04-26
https://www.theverge.com/2019/4/26/18517949/luminary-podcast-startup-network-pull-shows,These are all the podcast networks and creators who pulled their shows from Luminary - The Verge,Podcast startup Luminary launched while major networks and independent creators pulled their shows from the player over various concerns.,https://cdn.vox-cdn.com/thumbor/OMI0_5vueHmEGBZZT1DmyZImS30=/0x146:2040x1214/fit-in/1200x630/cdn.vox-cdn.com/uploads/chorus_asset/file/16181956/akrales_190422_3386_0015.jpg,2019-04-26
https://www.theverge.com/2019/4/26/18518439/google-app-developer-ban-downloads-fake-click-factory-do-global-baidu,Google bans app developer with 600 million downloads for being a fake click factory - The Verge,"Google is banning a popular Chinese developer from its Google Play Store and systematically removing dozens of its apps, after BuzzFeed and security researchers discovered that the developer was committing ad fraud and abusing user permissions. The Chinese de…",https://cdn.vox-cdn.com/thumbor/en7ZPdI0OD28KmWdFWiAZrKEMwE=/0x146:2040x1214/fit-in/1200x630/cdn.vox-cdn.com/uploads/chorus_asset/file/13284987/wjoel_180413_1777_android_003.jpg,2019-04-26
https://www.phoronix.com/vr.php?view=27789,NVIDIA GeForce GTX 1650 Linux Gaming Performance & Benchmarks Review - Phoronix,,,2019-04-26
https://appleinsider.com/articles/19/04/26/apples-airpods-2----one-month-later,Apple's AirPods 2 -- One month later - AppleInsider,"The AirPods are a now-iconic piece of tech that finally received a long-awaited update just weeks ago. AppleInsider has now spent a month jamming out to Apple's wireless earbuds, to see if the upgrade truly was worth the wait.",https://photos5.appleinsider.com/gallery/30783-50762-AirPods-03-xl.jpg,2019-04-26
https://kotaku.com/riot-files-motions-to-block-former-employees-from-takin-1834335897,Riot Files Motions To Block Current Employees From Taking Legal Action - Kotaku,"Months after five current and former employees filed lawsuits last fall and earlier this year alleging gender discrimination against League of Legends publisher Riot Games, Riot yesterday made motions to force two of those women into private arbitration, whic…","https://i.kinja-img.com/gawker-media/image/upload/s--o1QWcfJC--/c_fill,fl_progressive,g_center,h_900,q_80,w_1600/fnfck411v2eysok0ncoy.png",2019-04-26
https://www.foxnews.com/tech/report-amazon-plans-hi-res-music-streaming-service,"Amazon plans hi-res music streaming service, report says - Fox News","It looks as though Amazon's next move to better compete in the online music marketplace is a new, high-resolution streaming service.",https://static.foxnews.com/foxnews.com/content/uploads/2019/04/463521-amazon-music.jpg,2019-04-26
https://wccftech.com/google-bans-developer-with-half-a-billion-app-downloads-from-play-store-for-alleged-fraud/,Google Bans Developer With Half a Billion App Downloads From Play Store for Alleged Fraud - Wccftech,"Google is fairly vigilant when it comes to the Play Store. Previously, the company had banned several apps that ‘generated’ fake IDs and even some cryptocurrency apps. It is not often that Google targets a particular developer but instead focuses on multiple …",https://cdn.wccftech.com/wp-content/uploads/2017/02/Screen-Shot-2017-02-09-at-2.00.51-AM.png,2019-04-26
https://www.dailymail.co.uk/sciencetech/article-6963769/Pilotless-plane-concept-developed.html,Pilotless plane concept being developed - Daily Mail,Online travel agency Kiwi.com has partnered with Czech aero technologies company Zuri to develop a concept that could fly completely unmanned and carry four people at once.,https://i.dailymail.co.uk/1s/2019/04/26/16/12759652-0-image-a-40_1556292434752.jpg,2019-04-26
https://www.motor1.com/news/346799/bentley-porsche-alfa-drag-race/,"Bentley Bentayga, Porsche Cayenne Turbo, Alfa Stelvio Q Drag Race - Motor1.com",Which performance SUV wins over a half mile.,https://cdn.motor1.com/images/mgl/XgGy2/s3/bentley-bentayga-alfa-romeo-stelvio-porsche-cayenne-turbo-race.jpg,2019-04-26
https://screenrant.com/world-war-z-streamers-scared/,World War Z Is Too Much For These Streamers To Handle - Screen Rant,A new World War Z trailer shows internet streamers' reactions to the co-op zombie madness!,https://static1.srcdn.com/wordpress/wp-content/uploads/2019/04/World-War-Z-Key-Art-Logo.jpg,2019-04-26
https://www.polygon.com/2019/4/26/18518509/mortal-kombat-11-switch-impressions-review-comparison,"MK11 on Switch comparisons, impressions, and review - Polygon",Comparing it with other versions reveals understandable trade-offs and underlying problems.,https://cdn.vox-cdn.com/thumbor/BmB3GbKGeN5L2QkFLQpRdUEn9ro=/126x0:1155x539/fit-in/1200x630/cdn.vox-cdn.com/uploads/chorus_asset/file/16194994/MK_11_Switch_screenshot_7_copy.jpg,2019-04-26
https://mobilesyrup.com/2019/04/26/google-chrome-74-android-dark-mode-translate-shortcut/,"Google Chrome 74 brings dark mode, Translate shortcut to Android - MobileSyrup","Android users are getting yet another Google app with dark mode. This time around, it's Google Chrome going dark.",https://cdn.mobilesyrup.com/wp-content/uploads/2018/09/google-chrome-1024x522.jpg,2019-04-26
https://www.theverge.com/2019/4/26/18518418/cox-elite-gamer-gaming-internet-fortnite-apex-legends-overwatch,Cox wants gamers to pay $15 more for ‘elite’ internet that isn’t faster - The Verge,"Internet provider Cox is offering a $15-per-month service that it dubs Cox Elite Gamer, an internet bill add-on that the company claims will optimize the connection between players and video game servers for hugely popular titles like Fortnite, Apex Legends, …",https://cdn.vox-cdn.com/thumbor/9ryQR1_61zTvMLwKGK5GBGKet0A=/0x146:2040x1214/fit-in/1200x630/cdn.vox-cdn.com/uploads/chorus_asset/file/13736451/akrales_190201_3192_0240.jpg,2019-04-26
https://www.engadget.com/2019/04/26/fifa-19-echampions-league-group-stages/,'FIFA 19' eChampions League group stages are underway - Engadget,The in-person group stages of the very first 'FIFA 19' UEFA eChampions league have begun.,https://o.aolcdn.com/images/dims?thumbnail=1200%2C630&quality=80&image_uri=https%3A%2F%2Fo.aolcdn.com%2Fimages%2Fdims%3Fcrop%3D1600%252C1067%252C0%252C0%26quality%3D85%26format%3Djpg%26resize%3D1600%252C1067%26image_uri%3Dhttps%253A%252F%252Fs.yimg.com%252Fos%252Fcreatr-uploaded-images%252F2019-04%252F1c4835b0-6844-11e9-9dff-4425d4831860%26client%3Da1acac3e1b3290917d92%26signature%3D8334d5f8cbec5ad3fb7c86fa6281d9ffa0536090&client=amp-blogside-v2&signature=ec04f71653b24927c4dad28ae9495709fc6eb6ef,2019-04-26
https://www.polygon.com/destiny-2-guide-walkthrough/2019/4/26/18518223/destiny-2-xur-location-and-items-april-26-29,Where to find Destiny 2’s Xur for April 26-29 - Polygon,Xur is carrying his regular stash of Exotics this week. Here’s where you can find him.,https://cdn.vox-cdn.com/thumbor/QApUM1q1QUVgouMovAz9VLl6Qj0=/0x38:1920x1043/fit-in/1200x630/cdn.vox-cdn.com/uploads/chorus_asset/file/9253051/Xur_Destiny_2_.jpg,2019-04-26
https://www.bbc.co.uk/news/technology-48068912,'Extremist' Google algorithms concern ex-police chief - BBC News,Google insists that its search software is not used to promote contentious online material.,https://ichef.bbci.co.uk/news/1024/branded_news/11731/production/_103937417_mediaitem103937416.jpg,2019-04-26
https://www.gamesradar.com/mortal-kombat-11-patch-notes-update/,"Mortal Kombat 11 patch notes: A gift of in-game currencies, easier Towers of Time, and bug fixes - GamesRadar",Here's everything that's happening in the latest Mortal Kombat 11 update,https://cdn.mos.cms.futurecdn.net/67Mv3BnZanniTDhAGWj8FN-1200-80.jpg,2019-04-26
https://www.gamesindustry.biz/articles/2019-04-26-riot-says-women-waived-right-to-sue-when-they-were-hired,Riot says women waived right to sue when they were hired - GamesIndustry.biz,League of Legends maker wants to enforce private arbitration clauses for gender discrimination claims,https://images.eurogamer.net/2019/articles/2019-04-26-20-54/lolpatch.jpg,2019-04-26
https://www.datacenterknowledge.com/google-alphabet/how-google-s-anthos-different-aws-and-azure-hybrid-clouds,How Google's Anthos Is Different from AWS and Azure Hybrid Clouds - Data Center Knowledge,Google takes a fundamentally different approach to the on-prem portion of hybrid cloud.,https://www.datacenterknowledge.com/sites/datacenterknowledge.com/files/sundar%20pichai%20google%20anthos%20next19.jpg,2019-04-26
https://www.youtube.com/watch?v=O9F_p0PbAE8,Mortal Kombat 11 | All Fatalities - Fanbyte,Subscribe to Fanbyte for more awesome gaming content daily! ► https://goo.gl/a7BXRs A compilation of every fatality from Mortal Kombat 11! Follow us on other...,https://i.ytimg.com/vi/O9F_p0PbAE8/maxresdefault.jpg,2019-04-26
https://dotesports.com/league-of-legends/news/yuumis-bio-has-been-revealed-shes-a-cat-looking-for-her-owner,Yuumi's bio has been revealed—she's a cat looking for her... - Dot Esports,She's just a feline travelling the world with her trusty book.,https://dotesports-media.nyc3.cdn.digitaloceanspaces.com/wp-content/uploads/2019/04/26125542/yuumiyuumi.jpg,2019-04-26
https://www.androidpolice.com/2019/04/26/google-fi-app-dips-its-toes-into-a-dark-theme-with-new-widget-behavior/,Google Fi app dips its toes into a dark theme with new widget behavior - Android Police,"A black pall is being cast on many an app these days. But for many users, dark theming brings power savings on OLED displays and an eye-friendly nighttime aesthetic. So, for Google Fi subscribers who interface with its corresponding app, the latest update mig…",https://www.androidpolice.com/wp-content/uploads/2019/04/google-fi-dark-widget-hero-alt-329x329.png,2019-04-26
https://hexus.net/tech/reviews/graphics/129935-msi-geforce-gtx-1650-aero-itx-oc/,Review: MSI GeForce GTX 1650 Aero ITX OC - Graphics - HEXUS,Small-form-factor done right.,https://hexus.net/media/uploaded/2019/4/4d27967f-b1ab-4aee-b8d6-6f1111f5d357.png,2019-04-26
http://www.pushsquare.com/news/2019/04/a_plague_tale_innocence_channels_the_last_of_us_in_new_ps4_gameplay_video,A Plague Tale: Innocence Channels The Last of Us in New PS4 Gameplay Video - Push Square,The rats of us,http://images.pushsquare.com/news/2019/04/a_plague_tale_innocence_channels_the_last_of_us_in_new_ps4_gameplay_video/large.jpg,2019-04-26
https://arstechnica.com/gadgets/2019/04/intel-stockpiling-10nm-chips-warns-that-14nm-shortages-will-continue/,"Intel stockpiling 10nm chips, warns that 14nm shortages will continue - Ars Technica","After years of problems, the company has finally had some good news about 10nm.",https://cdn.arstechnica.net/wp-content/uploads/2016/01/skylake-die-640x215.jpg,2019-04-26
https://www.youtube.com/watch?v=Nz8zOhUEdgE,Starlink: Battle for Atlas: Crimson Moon Exclusive Star Fox Gameplay - Nintendo Minute - Nintendo,"Hi, today we’re journeying through the wonderous world of space to check out the new Crimson Moon update in Starlink. It’s really fun to play as Slippy Toad ...",https://i.ytimg.com/vi/Nz8zOhUEdgE/maxresdefault.jpg,2019-04-26
https://kotaku.com/well-that-about-wraps-it-up-for-3ds-1834341535,"Well, That About Wraps It Up For 3DS - Kotaku","Nintendo’s not willing to call the 3DS “dead” yet, but the company’s latest briefing has made the whole thing feel like Weekend At Bernie’s.","https://i.kinja-img.com/gawker-media/image/upload/s--ZPR0frmi--/c_fill,fl_progressive,g_center,h_900,q_80,w_1600/h7fonwglqdqxywgurjae.png",2019-04-26
https://www.dexerto.com/overwatch/overwatch-player-manages-recreate-portal-workshop-579203,Overwatch player manages to recreate Portal in the Workshop - Dexerto,Players are still going hard in the new Workshop mode.,https://s3.dexerto.com/thumbnails/_thumbnailLarge/Overwatch-Workshop-Portals-Tracer.jpg,2019-04-26
https://gamerant.com/destiny-2-xur-exotic-weapon-armor-april-26/,"Destiny 2: Xur Exotic Armor, Weapon, and Recommendations for April 26 - Game Rant","We have the scoop for Destiny 2 players on where to find Xur, what exotic items he has for sale on April 26 and whether any are worth spending Legendary Shards.",https://cdn.gamerant.com/wp-content/uploads/destiny-2-xur-738x410.jpg.optimal.jpg,2019-04-26
https://fortniteinsider.com/fortnite-audio-features-and-fixes-coming-in-season-9/,Fortnite Battle Royale Audio Features and Fixes Coming in Season 9 - Fortnite Insider,"Epic have announced the new features they will be adding to the audio in Fortnite as well as issues they are aware of. Epic Games update Fortnite on a weekly basis and in these updates, they tend to add new items and files, but more importantly, bug fixes are…",https://fortniteinsider.com/wp-content/uploads/2019/04/Fortnite-Audio-Improvements-in-Season-9.jpg,2019-04-26
https://www.techadvisor.co.uk/new-product/mobile-phone/oneplus-7-pro-3689847/,"OnePlus 7 & OnePlus 7 Pro release date, price & spec rumours - Tech Advisor","'Faster and smoother' than ever before, OnePlus 7, 7 Pro and 7 Pro 5G will arrive on 14 May, with the Pro model starting at €749. Here's everything we know about the OnePlus 7.",https://cdn2.techadvisor.co.uk/cmsdata/features/3689847/oneplus_7_pro_thumb800.jpg,2019-04-26
https://www.youtube.com/watch?v=vOR3YmS1_Ww,Google Home Hub vs. Amazon Echo Show: Which one is better? - CNET,,,2019-04-26
https://bgr.com/2019/04/26/gmail-app-for-mac-and-windows-simplfy/,This free app strips away all the junk to give you the Gmail experience you actually want - BGR,"Google’s most popular services always seem to follow a familiar pattern. When they’re first released, they’re wonderfully simple and minimalistic alternatives to cluttered, overwh…",https://boygeniusreport.files.wordpress.com/2019/04/gmail-simplify.png,2019-04-26
https://wccftech.com/review/nvidia-geforce-gtx-1650-graphics-card-review-msi-gaming-x-and-gigabyte-gaming-oc/,NVIDIA GeForce GTX 1650 4 GB GDDR5 Graphics Card Review Ft. MSI Gaming X and Gigabyte Gaming OC – Is Entry Level ($150 US) Turing Worth It? - Wccftech,"Today, I will be testing NVIDIA's newly launched GeForce GTX 1650 in two custom flavors from MSI (Gaming X) and Gigabyte (Gaming OC).",https://cdn.wccftech.com/wp-content/uploads/2019/04/DSC_0073-Custom-740x493.jpg,2019-04-26
https://www.youtube.com/watch?v=ijC-T_Htk_4,Risk of Rain 2 Early Access Review - IGN,IGN's Risk of Rain 2 reviewed in early access by James Duggan. Top 4 Co-Op Games at PAX East 2019! https://www.youtube.com/watch?v=5HUtk7VODog Subscribe to I...,https://i.ytimg.com/vi/ijC-T_Htk_4/maxresdefault.jpg,2019-04-26
https://venturebeat.com/2019/04/26/sensor-tower-the-elder-scrolls-blades-pulls-in-over-1-5-million-on-ios/,Sensor Tower — The Elder Scrolls: Blades pulls in over $1.5 million on iOS - VentureBeat,"Mobile players are clearly hungry for console-quality RPGs. Elder Scrolls: Blades makes almost $50,000 a day from in-game spending.",https://venturebeat.com/wp-content/uploads/2019/04/Elder-Scrolls-Blade_ipad.jpg?w=1200&strip=all,2019-04-26
https://www.cnbc.com/2019/04/26/sensing-threat-wall-street-banks-partner-with-tech-giants-like-apple.html,"Sensing threat, Wall Street banks partner with tech giants like Apple - CNBC","As technology companies move into consumer finance, Wall Street banks face the dilemma of beating them or joining them.",https://image.cnbcfm.com/api/v1/image/105875560-1556302395067gettyimages-1132776582.jpeg?v=1556313097,2019-04-26
https://kotaku.com/playstation-now-has-gotten-a-lot-better-1834339936,PlayStation Now Has Gotten A Lot Better - Kotaku,"PlayStation Now used to be a pricey way to stream the PlayStation’s back catalogue of games, which was only useful for people with good internet and no bandwidth caps. Last September the company added an option to download certain games directly, allowing use…","https://i.kinja-img.com/gawker-media/image/upload/s---H1SgJb---/c_fill,fl_progressive,g_center,h_900,q_80,w_1600/mfyripdxql6p1kokpfer.png",2019-04-26
https://www.cnn.com/2019/04/26/perspectives/amazon-echo-listening-alaimo/index.html,The real danger of Alexa listening to our convos - CNN,"Kara Alaimo writes that the scary thing isn't just that Amazon is listening in on our homes, but that it is gathering so much data about us -- and we can't be certain that these insights won't be used for nefarious purposes.",https://cdn.cnn.com/cnnnext/dam/assets/181130154523-amazon-echo-plus-super-tease.jpg,2019-04-26
https://www.motor1.com/news/346789/honda-civic-type-r-video/amp/,Updated Honda Civic Type R Spied In Action At The 'Ring - Motor1.com,It looks like Honda has two variants of the Civic Type R on the way.,https://cdn.motor1.com/images/mgl/VoMNR/s3/honda-civic-type-r-spy-video.jpg,2019-04-26
https://www.vulture.com/2019/04/luminary-debut-podcast-controversy.html,How Luminary’s Messy Debut Ended Up Roiling the Podcast Industry - Vulture,"The buzzy new startup launched this week, and immediately upset the industry at large. What happened?",https://pixel.nymag.com/imgs/daily/vulture/2019/04/26/26-luminary.w1200.h630.jpg,2019-04-26
http://www.gamasutra.com/view/news/341580/Citing_arbitration_clauses_Riot_Games_moves_to_block_employee_lawsuits.php,"Citing arbitration clauses, Riot Games moves to block employee lawsuits - Gamasutra","Riot Games has filed motions that aim to force two employees involved in an ongoing lawsuit against the company into private arbitration,",http://gamasutra.com/db_area/images/news/2019/Apr/341580/league556.jpg,2019-04-26
https://www.techradar.com/news/windows-10-update-will-do-away-with-password-expiry-policies,Windows 10 update will do away with password expiry policies - TechRadar,Latest configuration baseline settings for Windows 10 and Windows 10 Server will do away with password expiration policies,https://cdn.mos.cms.futurecdn.net/HzfTwHEzBA9A9kRKnEG48o-1200-80.jpg,2019-04-26
https://9to5google.com/2019/04/26/google-play-store-ban-do-global/,Google reportedly bans Play Store developer w/ over 600 million installs due to ad fraud scheme - 9to5Google,"Google is apparently in the process of one of its largest Play Store bans ever. A report today details how Google is banning DO Global, generator of over half a billion combined installs, from the …",https://9to5google.com/wp-content/uploads/sites/4/2019/01/google_play_store_1.jpg?quality=82&strip=all&w=1600,2019-04-26
https://www.destructoid.com/risk-of-rain-2-plans-to-wrap-up-early-access-in-spring-2020-551603.phtml,Risk of Rain 2 plans to wrap up Early Access in spring 2020 - Destructoid,Risk of Rain 2 plans to wrap up Early Access in spring 2020,https://destructoid.com//ul/551603-Risk-of-Rain-2-plans-to-wrap-up-Early-Access-in-spring-2020.jpg,2019-04-26
https://9to5google.com/2019/04/26/google-podcasts-sleep-timer/,Google Podcasts for Android begins rolling out sleep timer - 9to5Google,"Earlier this month, the Google app beta revealed work on a sleep timer for Google Podcasts. We successfully enabled it last week, and it’s now beginning to roll out to end users, along with s…",https://9to5google.com/wp-content/uploads/sites/4/2018/06/google_podcasts_icon.jpg?quality=82&strip=all&w=1600,2019-04-26
