url,title,description,urlToImage,date
https://www.theverge.com/good-deals/2019/4/25/18516350/google-pixel-3-xl-sale-price-store,Google Pixel 3 and Pixel 3 XL are $200 off - The Verge,"Google’s 2018 flagship Android phones, the Pixel 3 and Pixel 3 XL, are $200 off at the Google Store. This is a good chance to save, and it may be a while until we see another deal if Google announces the rumored Pixel 3a midrange phone at Google I/O 2019.",https://cdn.vox-cdn.com/thumbor/1UafLJaCmbUfec50oAhTN_50n8g=/0x156:2040x1224/fit-in/1200x630/cdn.vox-cdn.com/uploads/chorus_asset/file/13278393/jbareham_181010_2989_0163.jpg,2019-04-25
https://gizmodo.com/verizon-announces-official-prices-for-the-galaxy-s10-5g-1834304106,Verizon Announces Official Prices for the Galaxy S10 5G and It Sure Ain't Cheap - Gizmodo,"Featuring a massive 6.7-inch screen, a big 4,600 mAh battery, bonus 3D time-of-flight sensor, and of course a built-in 5G modem, we knew the Galaxy S10 5G wasn’t going to be cheap. But now that Verizon has officially announced pricing for the S10 5G, we final…","https://i.kinja-img.com/gawker-media/image/upload/s--wMHwemiU--/c_fill,fl_progressive,g_center,h_900,q_80,w_1600/xo9qvopo1cxduwffa63x.jpg",2019-04-25
https://techcrunch.com/2019/04/25/adobe-shows-off-new-color-palette-experiment-for-illustrator/,Adobe shows off new color palette experiment for Illustrator - TechCrunch,Adobe today used the OFFF festival in Barcelona to show off an experimental feature for its Illustrator vector drawing application. The basic idea here is to allow Illustrator users to easily experiment with color palettes based on photos and other images. Th…,https://techcrunch.com/wp-content/uploads/2019/04/2019-04-24_1947.png?w=742,2019-04-25
"https://www.guru3d.com/articles-pages/corsair-ironclaw-rgb-wireless-mouse-review,1.html",Corsair IronClaw RGB Wireless mouse review - Article - Guide - Review - guru3d.com,"Corsair updated one of their rodents, meet IronClaw RGB mouse now in a wireless version. Designed with a comfortable fit and some pretty iCUE related features this critter might be just what the doct... Article - Guide - Review",http://www.guru3d.com/articles_teaserimage/1584,2019-04-25
https://www.engadget.com/2019/04/25/steam-epic-games-store-revenue-share-sweeney-challenge/,Epic Games throws down an ultimatum for Steam - Engadget,Tim Sweeney is ready to retreat if Steam changes its longstanding revenue-share policy.,https://o.aolcdn.com/images/dims?thumbnail=1200%2C630&quality=80&image_uri=https%3A%2F%2Fo.aolcdn.com%2Fimages%2Fdims%3Fcrop%3D1600%252C898%252C0%252C0%26quality%3D85%26format%3Djpg%26resize%3D1600%252C899%26image_uri%3Dhttp%253A%252F%252Fmedia.zenfs.com%252Fen-GB%252Fhomerun%252Fengadget_uk_662%252F64ce002c3c3278d1e75b8f552bf92441%26client%3Da1acac3e1b3290917d92%26signature%3D8187adacf2325b43ee80c45b28d083db06f0d3b6&client=amp-blogside-v2&signature=03e8774bdc8a6d27fa178376d2be7824a8c289ea,2019-04-25
https://www.slashgear.com/harry-potter-wizards-unite-beta-live-flipping-pokemon-go-25574753/,Harry Potter Wizards Unite beta LIVE: Flipping Pokemon GO - SlashGear,"It’s time to get prepared to switch to a new game, all ye Pokemon GO enthusiasts. Now that the Pokemon GO universe is packed to the absolute brim with different sorts of Pokemon, and the game…",https://edge.slashgear.com/wp-content/uploads/2019/04/wutime_harrypotterwizardsunite_logo.jpg,2019-04-25
https://www.eventhubs.com/news/2019/apr/25/netherrealm-studios-addresses-mortal-kombat-11-issues-towers-time-and-krypt-latest-kombat-kast-patch-and-rewards-coming-soon/,NetherRealm Studios addresses Mortal Kombat 11 issues with Towers of Time and The Krypt in latest Kombat Kast; patch and rewards coming soon - EventHubs,"Mortal Kombat 11 launched earlier this week to mostly strong, positive reviews though players were quick to point out issues with the title's in-game economy and some of the game's modes which the developers have quickly taken to ...",https://media.eventhubs.com/images/2019/04/25-netherrealm-studios-addresses-mortal-kombat-11-issues-towers-timt.png,2019-04-25
https://dotesports.com/league-of-legends/news/riot-releases-yuumi-teaser-trailer-that-might-have-revealed-her-abilities,Riot releases Yuumi teaser trailer that might have revealed her... - Dot Esports,Yuumi is on a magical journey in search of her master.,https://dotesports-media.nyc3.cdn.digitaloceanspaces.com/wp-content/uploads/2019/04/25121253/YuumiBook.png,2019-04-25
https://www.androidcentral.com/google-assistant-can-now-tell-you-story-your-phone-just-time-national-tell-story-day,"Google Assistant can now tell you a story on your phone, just in time for National Tell a Story Day - Android Central",This Saturday is National Tell a Story Day and starting today Google Assistant can tell you stories on your Android or iOS phone.,https://www.androidcentral.com/sites/androidcentral.com/files/styles/large/public/article_images/2019/04/google-assistant-tell-me-a-story-1.jpg?itok=2wFG6mvf,2019-04-25
https://www.gamespot.com/articles/new-assassins-creed-comic-coming-this-fall-and-it-/1100-6466446/,"New Assassin's Creed Comic Coming This Year, And It Takes The Series To A New Location - GameSpot","Titan Comics has announced a new graphic novel based on Ubisoft's popular stealth-action series, and this one is set in Russia.",https://static.gamespot.com/uploads/screen_kubrick/1578/15787979/3526214-assassinscreed-thefall%26thechain-tp.jpg,2019-04-25
https://www.youtube.com/watch?v=Oy9rzlK7MFc,Atelier Lulua: The Scion of Arland - Combat Highlight Trailer - Gematsu,,,2019-04-25
https://www.youtube.com/watch?v=WNVsrC69NaE,"So much Nintendo news, so little time - Engadget",,,2019-04-25
https://www.rockpapershotgun.com/2019/04/25/epic-store-would-end-exclusives-if-steam-gave-devs-larger-cut-ceo-claims/,"Epic Store would end exclusives if Steam gave devs larger cut, CEO claims - Rock Paper Shotgun","The Epic Games Store would halt its plan of paying for games to stay off Steam if Valve would only take a smaller cut, Epic's CEO has claimed. HMMMMMM.",https://assets.rockpapershotgun.com/images/2019/04/borderlands-3-b.jpg,2019-04-25
https://www.droid-life.com/2019/04/25/mario-kart-tour-beta-2019/,"Mario Kart Tour Launch Set for Summer 2019, Sign-Up to Beta Test Now - Droid Life","It was a year ago when we learned Nintendo was planning to launch a Mario Kart title for Android. We've been very patient since then. Finally, Nintendo has announced beta details and has provided a rough timeline for when the game is set to launch -- Summer o…",https://www.droid-life.com/wp-content/uploads/2018/02/Mario-Kart-Arcade-GP-DX-600x315.jpg,2019-04-25
https://www.youtube.com/watch?v=ksdk6jlcpM8,Sony Z9G 8K HDR LED TV Hands On Review: Sony's 8K Future Burns Bright - Digital Trends,,,2019-04-25
https://www.theverge.com/2019/4/25/18516117/dyson-v11-torque-drive-animal-review-cordless-vacuum,Dyson’s new $700 vacuum uses a screen to fight range anxiety - The Verge,"The Dyson V11 Torque Drive cordless vacuum has an LCD for displaying suction mode, remaining battery life, and more. It makes Dyson’s latest feel slightly more like a gadget than household cleaner.",https://cdn.vox-cdn.com/thumbor/glYKGzCHSZ2njBdMigJVyw1npuQ=/0x521:4608x2934/fit-in/1200x630/cdn.vox-cdn.com/uploads/chorus_asset/file/16191233/625C0207_C994_4BA0_A4B8_BD1D8A1E8F80.jpeg,2019-04-25
https://techcrunch.com/2019/04/25/kiwis-food-delivery-bots-are-rolling-out-to-12-new-colleges/,Kiwi’s food delivery bots are rolling out to 12 more colleges - TechCrunch,"If you're a student at UC Berkeley, the diminutive rolling robots from Kiwi are probably a familiar sight by now, trundling along with a burrito inside to deliver to a dorm or apartment building. Now students at a dozen more campuses will be able to join this…",https://techcrunch.com/wp-content/uploads/2019/04/kiwi-campus-robot-1.jpg?w=618,2019-04-25
https://arstechnica.com/gadgets/2019/04/password1-password2-password-3-no-more-microsoft-drops-password-expiration-rec/,"Password1, Password2, Password3 no more: Microsoft drops password expiration rec - Ars Technica","For years, Microsoft's baseline security policy has expired passwords after 60 days.",https://cdn.arstechnica.net/wp-content/uploads/2015/09/password-640x215.jpg,2019-04-25
https://www.ign.com/articles/2019/04/25/deal-alert-mortal-kombat-11-is-already-on-sale-for-almost-20-off,Deal Alert: Mortal Kombat 11 is Already on Sale for Almost 20% Off - IGN,"Don't pass up Mortal Kombat 11 while these $10 off sales are happening. PS4, Switch, and Xbox One included.",https://assets1.ignimgs.com/2019/04/25/mkthumb-1556210903862_1280w.jpg,2019-04-25
https://variety.com/2019/gaming/news/cox-elite-gamer-service-1203197817/,Cox Cable Testing Gamer Network Service to Reduce Lag - Variety,"UPDATED: Cox Cable is testing a new “Elite Gamer Service” that is designed to speed up connections between gamers and games, but which the company says doesn’t prioritize internet…",https://pmcvariety.files.wordpress.com/2019/04/overwatch-doomfist.jpg?w=700&h=393&crop=1,2019-04-25
https://www.destructoid.com/don-t-expect-new-titanfall-games-anytime-soon-551459.phtml,Don't expect new Titanfall games anytime soon - Destructoid,Don't expect new Titanfall games anytime soon,https://destructoid.com//ul/551459-ApexLegendsTitanfall.jpg,2019-04-25
https://www.theregister.co.uk/2019/04/25/slack_feature_update/,"Turn on, tune in, cash out: Hipster chat plat Slack whacks beardie millennials with features - The Register",But is it enough to combat the Microsoft juggernaut?,https://regmedia.co.uk/2018/05/03/fedorahathipster.jpg,2019-04-25
http://www.nintendolife.com/news/2019/04/random_walmart_is_selling_a_bundle_of_300_switch_consoles_for_usd76506,Random: Walmart Is Selling A Bundle Of 300 Switch Consoles For $76506 - Nintendo Life,Erm... you what?,http://images.nintendolife.com/news/2019/04/random_walmart_is_selling_a_bundle_of_300_switch_consoles_for_usd76506/large.jpg,2019-04-25
https://www.pcgamer.com/imperator-rome-review/,Imperator: Rome review - PC Gamer,A brilliant grand strategy game full of squabbling nobles.,https://cdn.mos.cms.futurecdn.net/E6bCLshNxD6ZarcsiLzFLA-1200-80.jpg,2019-04-25
https://www.factmag.com/2019/04/25/moog-matriarch-synth-launched/,"Moog launches new semi-modular analog synth, Matriarch - FACT",A high-end counterpart to last year's Grandmother synth.,https://s3.amazonaws.com/factmag-images/wp-content/uploads/2019/04/matriarch-250419-1200x630.jpg,2019-04-25
https://9to5google.com/2019/04/25/android-distribution-dashboard/,Google’s Android distribution data feed has been ‘under maintenance’ for 6 months… is it dead? - 9to5Google,"For years, Google published monthly data on Android’s version distribution. How many Android phones in the world were running an Android version that was released many, many years ago? The an…",https://9to5google.com/wp-content/uploads/sites/4/2019/04/android_q_pixel_3_1.jpg?quality=82&strip=all&w=1600,2019-04-25
https://kotaku.com/respawn-details-its-plan-to-keep-apex-legends-fresh-bu-1834307802,"Respawn Details Its Plan To Keep Apex Legends Fresh, But Avoid Employee Burnout - Kotaku","Respawn Entertainment’s battle royale game Apex Legends came out of the gate with a bang. Now that the initial burst of excitement has slowed down, the development studio has released a roadmap for the future. Its aim is to please players, but also avoid empl…","https://i.kinja-img.com/gawker-media/image/upload/s--6qSdOvNu--/c_fill,fl_progressive,g_center,h_900,q_80,w_1600/ktalrcyfz2axzykc0bj3.jpg",2019-04-25
https://heroichollywood.com/mortal-kombat-batman-rocksteady/,Mortal Kombat Director Teases 'Next Masterpiece' From Rocksteady - Heroic Hollywood,"Mortal Kombat co-creator Ed Boon teased the ""next masterpiece"" from Rocksteady, the video game developer best known for the 'Batman: Arkham' series.",https://heroichollywood.com/wp-content/uploads/2019/03/Batman-Arkham-Henry-Cavill.jpg,2019-04-25
https://dailyhive.com/vancouver/google-earth-vancouver-timelapse-video-2019,Google Earth releases timelapse of Vancouver over the last 35 years (VIDEO) - Daily Hive,"Google Earth has released an updated version of its Timelapse, which compiles images of Earth taken from space into an interactive experience.",https://images.dailyhive.com/20190425102236/Screen-Shot-2019-04-25-at-10.17.43-AM.jpg,2019-04-25
https://www.youtube.com/watch?v=qWjz2aU7Hng,How to play Fortnite's Endgame LTM - PCGamesN,"With the much anticipated release of Avengers Endgame, Fortnite have joined forces with Marvel to give you your very own Endgame LTM. Join us as we fight Tha...",https://i.ytimg.com/vi/qWjz2aU7Hng/maxresdefault.jpg,2019-04-25
https://www.cnet.com/news/screen-time-is-rising-and-its-ruining-us-here-are-11-ways-to-cut-back/,Screen time is rising and it's ruining us. Here are 11 ways to cut back - CNET,"Here's how I did it. (And you can, too.)",https://cnet2.cbsistatic.com/img/3CoZwVUg4Iz_XlbSF_3mOigPmNc=/756x567/2019/04/24/299ddbf5-f5a5-4389-8cc9-75adb19748cc/gettyimages-558175165.jpg,2019-04-25
https://www.androidcentral.com/does-galaxy-tab-s5e-come-stylus-box,Does the Galaxy Tab S5e come with a stylus in the box? - Android Central,"Some of the best Samsung tablets include support for the S Pen, but there are still other options released that don't include this. Does the Galaxy Tab S5e fall under the S Pen side, or will you have to get a third-party one?",https://www.androidcentral.com/sites/androidcentral.com/files/styles/large/public/article_images/2019/04/samsung-galaxy-tab-s5e-hero.jpg?itok=E1U6_aso,2019-04-25
https://www.polygon.com/reviews/2019/4/25/18516072/steamworld-quest-review-nintendo-switch,SteamWorld Quest review: a must-own Nintendo Switch RPG - Polygon,The latest game in Image & Form’s SteamWorld universe mixes steampunk fantasy with the satisfying complexity of a deck-building RPG. SteamWorld Quest: Hand of Gilgamech was released April 25 on Switch for $24.99.,https://cdn.vox-cdn.com/thumbor/Z7FdNoYjTEYF9XBfb34PRMI8R7U=/0x38:1920x1043/fit-in/1200x630/cdn.vox-cdn.com/uploads/chorus_asset/file/16190823/steamworld.jpg,2019-04-25
https://www.techradar.com/news/cox-launches-first-gaming-optimized-internet-service-and-its-worrying,"Cox launches first gaming-optimized internet service, and it's worrying - TechRadar",Gamers could be the first victims of new anti-net neutrality laws,https://cdn.mos.cms.futurecdn.net/LoEHiALAxDBqGEiWWsM8JS-1200-80.jpg,2019-04-25
https://www.engadget.com/2019/04/25/wirecutters-best-deals-sonos-one-gen-1-sale/,Wirecutter's best deals: The Sonos One (Gen 1) drops to $150 - Engadget,Shop today's picks to smarten up your home audio system and your garage,https://o.aolcdn.com/images/dims?thumbnail=1200%2C630&quality=80&image_uri=https%3A%2F%2Fo.aolcdn.com%2Fimages%2Fdims%3Fresize%3D2000%252C2000%252Cshrink%26image_uri%3Dhttps%253A%252F%252Fs.yimg.com%252Fos%252Fcreatr-uploaded-images%252F2019-04%252F320ae280-678b-11e9-bf6a-4215c6e281d9%26client%3Da1acac3e1b3290917d92%26signature%3D7ff7fdcf8ed94f0ec3b9c6a2090d99e3323ed1f1&client=amp-blogside-v2&signature=fd6b9f9d6a72e94a688c6736b6d6ff3b34db963e,2019-04-25
https://www.theverge.com/2019/4/25/18516474/google-employee-harassment-discrimination-report-changes,Google is changing how employees can report harassment and discrimination - The Verge,"After pledging to make cultural changes following a mass walkout of employees last year, Google said that it will change how employees can report harassment and discrimination allegations.",https://cdn.vox-cdn.com/thumbor/zecX0cPldoJGxd8xivCIx07sXlA=/0x146:2040x1214/fit-in/1200x630/cdn.vox-cdn.com/uploads/chorus_asset/file/10745895/acastro_180427_1777_0001.jpg,2019-04-25
https://www.wired.com/story/galaxy-fold-breaking-display-ifixit/,The Galaxy Fold's Breaking Display Won't Be Easy to Fix - WIRED,"iFixit tore down the ambitious device, revealing what might turn out to be systematic problems.",https://media.wired.com/photos/5cc1f8d85cf77c51c0996835/191:100/pass/samsungfold-1137455431.jpg,2019-04-25
https://techcrunch.com/2019/04/25/apple-patches-ios-app-store-bug-that-was-preventing-app-downloads/,Apple patches iOS App Store bug that was preventing app downloads - TechCrunch,"Apple is rolling out a fix for an App Store bug that was preventing users from downloading new iOS apps or app updates. The issue, which impacted an unknown number of users, involved a Terms & Conditions dialog box that would continue to pop up even when user…",https://techcrunch.com/wp-content/uploads/2018/07/apple-ios-app-store1.jpg?w=750,2019-04-25
https://www.phonearena.com/news/Google-Earth-Timelapse-mobile-launch_id115595,Google Earth Timelapse arrives on mobile - Phone Arena,"The zoomable time-lapse video feature that allows Google Earth users to see how the planet's surface has changed in the last 35 years, Google Earth Timelapse is now available on mobile....",https://i-cdn.phonearena.com/images/article/115595-two_lead/Google-Earth-Timelapse-arrives-on-mobile.jpg,2019-04-25
https://9to5google.com/2019/04/25/2019-google-play-award-nominees/,2019 Google Play Award nominees revealed with winners announced at I/O - 9to5Google,"For the past several years, the Google Play Awards have recognized the top apps and games for Android. The nominees for 2019’s nine categories were announced today, with winners set to be rev…",https://9to5google.com/wp-content/uploads/sites/4/2019/04/2019-google-play-award-nominees.jpg?quality=82&strip=all&w=1600,2019-04-25
https://appleinsider.com/articles/19/04/25/new-ipad-pro-models-with-better-antenna-tech-on-the-way-for-2020-with-5g-in-2021-says-ming-chi-kuo,"New iPad Pro models with better antenna tech on the way for 2020, with 5G in 2021 says Ming-Chi Kuo - AppleInsider","Apple will be using an ""LCP Soft Board"" in its next generation of iPad Pro models, according to Ming-Chi Kuo, the first time the company will be using the technology in the product line, one that could potentially help improve the tablet's wireless communicat…",https://photos5.appleinsider.com/gallery/30768-50712-28544-44577-11-inch-iPad-Pro-l-xl.jpg,2019-04-25
https://www.neowin.net/news/microsoft-announces-new-features-coming-in-xbox-one-version-1905/,Microsoft announces new features coming in Xbox One version 1905 - Neowin,"With a new feature update for the Xbox One family of consoles on the way, Microsoft today announced the new features coming, and Insiders will be able to get their first taste of them tomorrow.",https://cdn.neow.in/news/images/uploaded/2016/11/1478547458_xbox-insider-program_story.jpg,2019-04-25
https://www.theregister.co.uk/2019/04/25/microsoft_password_expiration/,"Microsoft: Yo dawg, we heard you liked Windows password expiry policies. So we expired your expiry policy - The Register",Password resets reset. Too bad Uncle Sam hasn't got the message yet,https://regmedia.co.uk/2017/06/26/shutterstock_reset_password.jpg,2019-04-25
https://www.eurogamer.net/articles/2019-04-25-atlus-mysterious-persona-5-s-is-a-warriors-style-action-game-for-ps4-and-switch,Atlus' mysterious Persona 5 S is a Warriors-style action game for PS4 and Switch - Eurogamer.net,Surprise!,https://cdn.gamer-network.net/2018/articles/2018-03-20-10-55/welcome-to-the-new-eurogamer-1521543305513.jpg,2019-04-25
https://www.youtube.com/watch?v=orxsLBtk7Og,Oppo Reno hands-on: Shark fin! - 9to5Google,Hands-on with the Shark Fin camera on the Oppo Reno 10x zoom edition! Subscribe ► http://bit.ly/9to5G | Read full article ► https://wp.me/p9SZ9T-1cbX 🆓 Get a...,https://i.ytimg.com/vi/orxsLBtk7Og/maxresdefault.jpg,2019-04-25
https://www.youtube.com/watch?v=TdsJ9e17qCI,Galaxy S10+ vs Note9: Does Samsung's flagship still stack up? - Android Police,Thanks to dbrand for supporting the channel: http://dbrand.com/AP Want to sponsor the next Android Police video? Get in touch: videosponsor@androidpolice.com...,https://i.ytimg.com/vi/TdsJ9e17qCI/maxresdefault.jpg,2019-04-25
https://mobilesyrup.com/2019/04/25/nintendo-closed-beta-test-mario-kart-tour/,Nintendo is launching a closed beta test for Mario Kart Tour - MobileSyrup,Nintendo has announced it is now accepting applications for a closed beta test of Mario Kart Tour that is set to run from May 22nd to June 4th.,https://cdn.mobilesyrup.com/wp-content/uploads/2019/04/mario-kart-tour-1.jpg,2019-04-25
https://mobilesyrup.com/2019/04/25/google-assistant-read-a-story/,You can now ask Google Assistant to read you a story - MobileSyrup,Need a bedtime story to help you nod off? Google's got you. Just ask Assistant to read you a story and relax.,https://cdn.mobilesyrup.com/wp-content/uploads/2017/11/google-assistant-one-plus-3t-3-4-1024x576.jpg,2019-04-25
https://www.youtube.com/watch?v=zzDuBF6H4tk,5 Beginner Friendly Characters to Pick in Mortal Kombat 11 - SegmentNext,"If you haven't played Mortal Kombat before, MK 11 can be intimidating fighting at first. However, like most fighting games, Mortal Kombat 11 has some beginne...",https://i.ytimg.com/vi/zzDuBF6H4tk/maxresdefault.jpg,2019-04-25
https://www.theverge.com/2019/4/25/18516424/apex-legends-respawn-avoid-crunch-content-updates-speed-game-industry-overwork,Apex Legends developer won’t rush updates so that it can ‘avoid crunch’ - The Verge,"Respawn, developer of the hit battle royale game Apex Legends, says that it won’t rush out fast-paced content updates so that the studio can avoid overwork and crunch.",https://cdn.vox-cdn.com/thumbor/iO46KPqq7ayEEvtAzeG5Mdao2Bc=/0x75:3840x2085/fit-in/1200x630/cdn.vox-cdn.com/uploads/chorus_asset/file/15994741/APEX_Legends_Screenshot_Season1_Octane_Execution.png,2019-04-25
https://www.youtube.com/watch?v=to4tgUCplr4,Astro Gaming C40 TR Controller Review - PCMag,"The Astro Gaming C40 TR Controller is one of the most powerful, customizable gamepads you can buy for the PC and PS4. https://www.pcmag.com/review/367763/ast...",https://i.ytimg.com/vi/to4tgUCplr4/maxresdefault.jpg,2019-04-25
https://www.notebookcheck.net/Leaked-email-hints-at-new-Samsung-Galaxy-Fold-release-date.419294.0.html,Leaked email hints at new Samsung Galaxy Fold release date - Notebookcheck.net,"The Samsung Galaxy Fold was supposed to see an official release tomorrow (April 26, 2019). However, as many of us know by now, teething problems uncovered by reviewers have postponed the launch of this next-gen smartphone. A tweet allegedly referencing an AT&…",https://www.notebookcheck.net/fileadmin/Notebooks/News/_nc3/Galaxy_Fold_review_units.jpg,2019-04-25
https://www.engadget.com/2019/04/25/apex-legends-update-pace-avoids-crunch/,Respawn spaces out 'Apex Legends' content updates to avoid crunch - Engadget,"Respawn has outlined how it will deliver 'Apex Legends' updates, including a refusal to make workers endure crunch sessions.",https://o.aolcdn.com/images/dims?thumbnail=1200%2C630&quality=80&image_uri=https%3A%2F%2Fo.aolcdn.com%2Fimages%2Fdims%3Fcrop%3D5184%252C3455%252C0%252C0%26quality%3D85%26format%3Djpg%26resize%3D1600%252C1067%26image_uri%3Dhttps%253A%252F%252Fs.yimg.com%252Fos%252Fcreatr-images%252F2019-04%252F0d7dc430-6788-11e9-afed-17a1da0d0822%26client%3Da1acac3e1b3290917d92%26signature%3D36d02f9f99ce1a22a3ce3c7589545d90f1a09f99&client=amp-blogside-v2&signature=edf5b031f97ca915088c7051eb13190f358df8af,2019-04-25
https://dotesports.com/overwatch/news/players-are-fixing-overwatchs-community-problems-using-workshop,Players are fixing Overwatch's community problems using... - Dot Esports,Tired of getting teabagged? Workshop has the solution.,https://dotesports-media.nyc3.cdn.digitaloceanspaces.com/wp-content/uploads/2019/04/25133426/OVR_Archives2019_005_png_jpgcopy-1024x576.jpg,2019-04-25
https://www.ign.com/articles/2019/04/25/daily-deals-apple-iphone-x-with-airpods-2-and-apple-watch-for-1k-new-2019-msi-gtx-1660-ti-laptop-with-32gb-ram-for-1499,"Daily Deals: Apple iPhone X with AirPods 2 and Apple Watch for $1K, New 2019 MSI GTX 1660 Ti Laptop with 32GB RAM for $1499 - IGN","Pichu and Pokemon Trainer Amiibo Back in Stock, 17% off Mortal Kombat 11, Xbox One X From $359.99, 55&quot; Samsung 4K Smart TV for $399, and More.",https://assets1.ignimgs.com/2019/04/25/blogroll-0425-1556216634985_1280w.jpg,2019-04-25
https://pokemongohub.net/post/news/research-breakthroughs/,May/June Research Breakthrough and Egg Pool Shakeup Announced - Pokemon GO Hub,Research Breakthroughs for May and June and a massive Egg Pool shakeup have just been announced. Read about all the happenings inside.,https://pokemongohub.net/wp-content/uploads/2019/04/research-may-header.jpg,2019-04-25
https://www.theverge.com/2019/4/25/18516134/detective-pikachu-movie-psydcuk-build-a-bear-snubbull-stuffed-animal,You can now build a Psyduck to bring to Detective Pikachu - The Verge,"One of Pokémon’s most underrated creatures, Psyduck, is coming to Build-A-Bear. Psyduck is being added as a tie-in with Detective Pikachu.",https://cdn.vox-cdn.com/thumbor/mYlHMXQSV_5y3dNLNUq4m6NnMWw=/0x286:1200x914/fit-in/1200x630/cdn.vox-cdn.com/uploads/chorus_asset/file/16191257/Psyduck_1__1_.jpg,2019-04-25
https://www.youtube.com/watch?v=bq17ofaTrg8,Samsung Galaxy Fold delayed due to screen breaks (Alphabet City) - CNET,"You'll have to wait a little longer for Samsung's flexible phone. Meanwhile, Google is accused of retaliation by certain employees. All that and your comment...",https://i.ytimg.com/vi/bq17ofaTrg8/maxresdefault.jpg,2019-04-25
https://upcomer.com/story/1415888/super-smash-bros/report-rick-fox-to-leave-echo-fox-due-to-rampant-racism-from-fellow-shareholder,Report: Rick Fox to leave Echo Fox due to rampant racism from fellow shareholder - Upcomer,"Rick Fox plans to leave Echo Fox entirely, due to alleged racial abuse from a shareholder in the ...",https://cdn.upcomer.com/esports/content/3295-28917708527_419ba5615a_k.jpg,2019-04-25
