url,title,description,urlToImage,date
https://www.digitalspy.com/tech/best-tech-deals/a27280416/days-gone-price-review-collectors-edition-ps4-deal-of-the-day/,How to get Days Gone on PS4 for under £25 - DigitalSpy.com,Save a few quid on the latest zombie shooter.,"https://hips.hearstapps.com/digitalspyuk.cdnds.net/16/24/1465875989-screen-shot-2016-06-14-at-044607.png?crop=1xw:0.9701834862385321xh;center,top&resize=1200:*",2019-04-26
https://www.autocar.co.uk/car-news/new-cars/aston-martin-reveal-manual-vantage-amr-imminently,Aston Martin to reveal manual Vantage AMR imminently - Autocar,"Aston will revive its racing-inspired special with a manual gearbox, expected to be shown in the coming days",https://www.autocar.co.uk/sites/autocar.co.uk/files/images/car-reviews/first-drives/legacy/d5d5kwgu8aal0v7.jpg,2019-04-26
https://gizmodo.com/nintendos-vr-upgrade-for-zelda-messed-me-up-1834212436,Nintendo's VR Upgrade for Zelda Messed Me Up - Gizmodo,"Despite being made of cardboard, Nintendo’s Labo VR Kit is a surprisingly excellent virtual reality upgrade for the Switch, bolstered by an excellent roster of games and VR experiences. Nintendo has just extended its Labo VR Kit support to its A-list titles T…","https://i.kinja-img.com/gawker-media/image/upload/s--Q_2gXjG_--/c_fill,fl_progressive,g_center,h_900,q_80,w_1600/gzirwwqnovskjpsvmbzq.jpg",2019-04-26
https://www.xda-developers.com/android-pie-recent-app-smart-selection-android-one/,Android Pie’s Recent App Smart Selection feature could come to Android One smartphones - XDA Developers,"Android Pie's Recent App Smart Selection feature is currently a Pixel-exclusive feature, but it could soon be available on Android One devices too! Read on.",https://www.xda-developers.com/files/2019/04/android-one-green-logo.png,2019-04-26
https://www.slashgear.com/windows-10-may-2019-update-wont-install-with-usb-sd-card-attached-25574831/,"Windows 10 May 2019 update won’t install with USB, SD card attached - SlashGear",Microsoft’s handling of Windows 10’s new system of rolling updates has become the most painful and most derided part of the latest version of the operating system. Every major update is…,https://edge.slashgear.com/wp-content/uploads/2019/04/windows-10-install.jpg,2019-04-26
https://gadgets.ndtv.com/mobiles/news/xiaomi-new-phone-snapdragon-730-launch-in-india-manu-kumar-jain-2029105,Xiaomi Teases India Smartphone Launch With New Snapdragon 700-Series SoC - NDTV,Xiaomi Global Vice President and India chief Manu Kumar Jain has teased the launch of a new phone with an all-new Snapdragon SoC.,https://i.gadgets360cdn.com/large/xiaomi_reuters_1556265058561.JPG,2019-04-26
https://www.ausgamers.com/games/days-gone/review/,Days Gone Review - AusGamers,"Our Days Gone Review - for an in-depth, unbiased review of the latest and greatest video games, read on.",,2019-04-26
https://gadgets.ndtv.com/mobiles/news/oppo-a7-price-in-india-cut-rs-12990-rs-14990-3gb-4gb-ram-variants-specifications-2028961,"Oppo A7 Price Cut in India for Both 3GB, 4GB RAM Variants - Gadgets 360","Oppo A7 price in India starts at Rs. 12,990 for the 3GB RAM variant along with 64GB of inbuilt storage.",https://i.gadgets360cdn.com/large/oppo_a7_1556265583136.jpg,2019-04-26
https://www.forbes.com/sites/forbes-finds/2019/04/26/7-must-have-gadgets-for-men-who-love-tech/,7 Must-Have Gadgets For Men Who Love Tech - Forbes,"If you're looking for some new gadgets the men in your life might love, look no further. From the DJI Mavic Pro drone to a beer-freshener, this list has it all.",https://thumbor.forbes.com/thumbor/600x315/https%3A%2F%2Fblogs-images.forbes.com%2Fforbes-finds%2Ffiles%2F2019%2F04%2Famazonecho.jpg,2019-04-26
http://www.pushsquare.com/news/2019/04/sony_financials_suggest_the_ps5_wont_release_before_april_2020,Sony Financials Suggest the PS5 Won't Release Before April 2020 - Push Square,Makes sense to us,http://images.pushsquare.com/news/2019/04/sony_financials_suggest_the_ps5_wont_release_before_april_2020/large.jpg,2019-04-26
https://www.pcgamer.com/mortal-kombat-11-review/,Mortal Kombat 11 review - PC Gamer,Mortal Kombat 11 sets the standard for storytelling in fighting games.,https://cdn.mos.cms.futurecdn.net/o6smpPSAsEnhLbF5Ab6Ekn-1200-80.jpg,2019-04-26
https://www.destructoid.com/nintendo-is-very-happy-with-its-mobile-arm-completely-disrespects-miitomo-551555.phtml,"Nintendo is very happy with its mobile arm, completely disrespects Miitomo - Destructoid","Nintendo is very happy with its mobile arm, completely disrespects Miitomo",https://destructoid.com//ul/551555-Mii.jpg,2019-04-26
https://techcrunch.com/2019/04/26/amazon-is-prepping-a-high-fidelity-tidal-competitor/,Amazon is prepping a high-fidelity TIDAL competitor - TechCrunch,"Amazon is prepping a high-fidelity music streaming service for a launch by year-end, according to a report from Music Business Worldwide — a site which also accurately reported Amazon’s recent launch of the free, ad-supported Amazon Music service for Echo dev…",https://techcrunch.com/wp-content/uploads/2018/09/amazon_hardware-6762.jpg?w=600,2019-04-26
https://www.hollywoodreporter.com/heat-vision/days-gone-director-q-a-nothing-comes-easy-game-1203697,'Days Gone' Director Q&A: 'Nothing Comes Easy in this Game' - Hollywood Reporter,"Jeff Ross details the ""action survival"" aspects of the project and explains what sets Deacon apart from other Apocalyptic protagonists: ""He’s not somebody that people really believe in.""",https://cdn1.thr.com/sites/default/files/2019/04/dg_-_review_screens_3_copy-h_2019_0.jpg,2019-04-26
https://www.techspot.com/news/79820-leaked-intel-roadmap-shows-10nm-desktop-cpus-wont.html,Leaked Intel roadmap shows its 10nm desktop CPUs won't arrive until 2022 - TechSpot,The leaked roadmap comes courtesy of Dutch site Tweakers. Bear in mind that we can’t 100 percent guarantee its authenticity.,https://static.techspot.com/images2/news/ts3_thumbs/2019/04/2019-04-26-ts3_thumbs-770.png,2019-04-26
https://fortniteinsider.com/epic-games-to-address-fortnites-field-of-view-siphon-changes-and-more/,"Epic Games to address Fortnite's Field of View, Siphon Changes and More - Fortnite Insider",Epic Games will address a numbers of Fortnite topics including field of view and Siphon settings in a blog post.  Siphon settings were added into the Fortnite Battle Royale default playlists in the v7.40 update. Siphon setings provided players with 50 health …,https://fortniteinsider.com/wp-content/uploads/2018/12/Siphon-Solo-Fortnite-LTM.jpeg,2019-04-26
https://www.theverge.com/2019/4/26/18517926/oneplus-7-pro-three-rear-cameras,The OnePlus 7 Pro will have three cameras on the back - The Verge,"The OnePlus 7 Pro will have three rear cameras, according to a recent tweet from the company. The latest OnePlus phone is scheduled to be unveiled on May 14th.",https://cdn.vox-cdn.com/thumbor/-L6u0occtd_58SjbnwFONoV74vc=/0x23:1800x965/fit-in/1200x630/cdn.vox-cdn.com/uploads/chorus_asset/file/16193784/oneplus.jpg,2019-04-26
https://www.eurogamer.net/articles/2019-04-26-warhammer-underworlds-online-is-a-faithful-recreation-of-the-great-board-game,Warhammer Underworlds Online is a faithful recreation of the great board game - Eurogamer.net,Praise Sigmar.,https://cdn.gamer-network.net/2019/articles/2019-04-26-09-48/-1556268509933.jpg,2019-04-26
https://www.dailymail.co.uk/sciencetech/article-6963719/Plague-toxic-caterpillars-hits-UK.html,Plague of toxic caterpillars hits the UK - Daily Mail,"Each caterpillar has 63,000 hairs and health experts have warned that you don't even need to be in direct contact with them to be affected. They have so far reported in London and the South-East.",https://i.dailymail.co.uk/1s/2019/04/26/14/12754306-0-image-a-31_1556285038961.jpg,2019-04-26
https://www.zdnet.com/article/think-gmails-too-cluttered-its-ex-designer-has-made-a-chrome-extension-to-fix-it/,Think Gmail's too cluttered? Its ex-designer has made a Chrome extension to fix it - ZDNet,The new Simplify Chrome extension promises to declutter Gmail and hide its branding.,https://zdnet3.cbsistatic.com/hub/i/r/2019/04/16/6b2625d0-984c-4fe2-960f-75cf4866b586/thumbnail/770x578/10b2e348c876a018d5e3b549c66c4e4e/gmail-becomes-first-major-email-provider-5cb470a5dd173300b739f100-1-apr-16-2019-15-30-02-poster.jpg,2019-04-26
https://variety.com/2019/gaming/news/nintendo-switch-online-nearly-10-million-1203198704/,"Nintendo Switch Online at 9.8 Million Accounts, ‘Tetris 99’ Popular - Variety","Nintendo Switch Online has exceeded 9.8 million global accounts, according to a financial briefing from Nintendo, released on Friday. Nintendo president Shuntaro Furukawa reported on the outlook fo…",https://pmcvariety.files.wordpress.com/2019/04/switch-online.png?w=693&h=393&crop=1,2019-04-26
https://www.youtube.com/watch?v=32_f-QIrSlQ,"ASUS Chromebook Flip C434 Review: Big, Expensive, Great - Engadget","We called the last Flip the best Chromebook you could buy, and two years later ASUS is back with a new model. While this is still a great laptop, we're not q...",https://i.ytimg.com/vi/32_f-QIrSlQ/maxresdefault.jpg,2019-04-26
https://www.techradar.com/news/your-android-phone-can-now-read-you-a-bed-time-story,Your Android phone can now read you a bed-time story - TechRadar,But you don't get to choose what,https://cdn.mos.cms.futurecdn.net/md9XBTGaDor5rkk7wX2bxL-1200-80.jpg,2019-04-26
https://www.ign.com/articles/2019/04/26/playstation-5-will-not-launch-before-april-2020,PlayStation 5 Will Not Launch Before April 2020 - IGN,Sony's next-gen console won't launch this financial year.,https://assets1.ignimgs.com/2019/01/09/beyond-ps5-blogroll-1-1547068336627_1280w.jpg,2019-04-26
https://www.youtube.com/watch?v=qvc6ClF4-FE,Zelda: Breath of the Wild VR Makes Me Feel Physically Sick - Nintendo Life,"Zelda VR is finally here, and it's not so hot if you're a human with inner ears. Super Mario Odyssey VR Thoughts: COMING SOON Check out our full site: http:/...",https://i.ytimg.com/vi/qvc6ClF4-FE/maxresdefault.jpg,2019-04-26
https://www.gamesradar.com/titanfall-3-plans-have-been-delayed-so-respawn-can-work-on-apex-legends/,Titanfall 3 plans have been delayed so Respawn can work on Apex Legends - GamesRadar,Wave goodbye to seeing BT-7274 anytime soon,https://cdn.mos.cms.futurecdn.net/qdPeSekFx8TzDHnza2cu2e-1200-80.jpg,2019-04-26
https://www.polygon.com/2019/4/26/18518041/steamworld-quest-pc-rpg-genre-image-and-form,SteamWorld Quest: Why don’t more franchises take risks like this? - Polygon,"We explore Image & Form’s SteamWorld series, which seems way more willing to experiment than most franchises out there. The latest entry, SteamWorld Quest: Hand of Gilgamech, was released April 25 on Nintendo Switch.",https://cdn.vox-cdn.com/thumbor/2QvA42sS2pLGxlmdUSmR1QxgS0w=/0x38:1920x1043/fit-in/1200x630/cdn.vox-cdn.com/uploads/chorus_asset/file/16193992/07.jpg,2019-04-26
https://www.engadget.com/2019/04/26/watch-sea-of-thieves-on-mixer-to-get-free-dlc/,Watch 'Sea of Thieves' on Mixer to get free DLC - Engadget,You can get the Obsidian Six for free if you're patient.,https://o.aolcdn.com/images/dims?thumbnail=1200%2C630&quality=80&image_uri=https%3A%2F%2Fo.aolcdn.com%2Fimages%2Fdims%3Fresize%3D2000%252C2000%252Cshrink%26image_uri%3Dhttps%253A%252F%252Fs.yimg.com%252Fos%252Fcreatr-uploaded-images%252F2019-04%252F5ad37ca0-6807-11e9-a4fd-86795d99eeb0%26client%3Da1acac3e1b3290917d92%26signature%3D7be4723ab32f833c0e06d95948dfd378f98db9e1&client=amp-blogside-v2&signature=0f1ee3039d0c7a4e71baa2cfa9c230be5461ea45,2019-04-26
https://www.theverge.com/2019/4/26/18517803/openai-musenet-artificial-intelligence-ai-music-generation-lady-gaga-harry-potter-mozart,OpenAI’s MuseNet generates AI music at the push of a button - The Verge,"OpenAI’s MuseNet is a new online tool that uses AI to generate songs with up to 10 different instruments. It can create music in as many as 15 different styles, imitating composers like Mozart and artists like Lady Gaga.",https://cdn.vox-cdn.com/thumbor/uzDpgsmHicx-63Y04TFzjsKjYZ8=/0x146:2040x1214/fit-in/1200x630/cdn.vox-cdn.com/uploads/chorus_asset/file/16125019/acastro_190416_1777_music_ai_0001.0.jpg,2019-04-26
https://bgr.com/2019/04/26/fast-wireless-charger-amazon-prime-deal-13/,"Get a fast wireless charging stand with 4,100 5-star ratings for $13 - BGR","If you can get a decent fast wireless charger for around $20 or less, you can pat yourself on the back knowing that you got a good deal. If you can get a top-rated fast wireless charger with 4,100 …",https://boygeniusreport.files.wordpress.com/2019/02/anker-powerwave-fast-wireless-charger.jpg?quality=98&strip=all,2019-04-26
https://www.theguardian.com/science/2019/apr/26/scientific-journal-snubs-academic-over-sleeping-beauty-metaphor,Scientific journal snubs academic over Sleeping Beauty metaphor - The Guardian,Professor Ton van Raan told use of phrase for ignored work is culturally insensitive,https://i.guim.co.uk/img/media/70d4a9c7963169625b84d094dde388353f623229/0_48_512_307/master/512.jpg?width=1200&height=630&quality=85&auto=format&fit=crop&overlay-align=bottom%2Cleft&overlay-width=100p&overlay-base64=L2ltZy9zdGF0aWMvb3ZlcmxheXMvdGctZGVmYXVsdC5wbmc&s=f0e81227e5bea2fc3123f20e3e70ab26,2019-04-26
https://www.eurogamer.net/articles/2019-04-26-best-nintendo-switch-games-deals,Best Nintendo Switch games deals - Eurogamer.net,Wynaut treat yourself?,https://cdn.gamer-network.net/2019/articles/2019-04-26-14-56/best-nintendo-switch-games-deals-1556286972847.jpg,2019-04-26
https://twinfinite.net/2019/04/capcom-video-very-best-game/,"Capcom Commits to ""Delivering the Very Best in Video Game Entertainment"" in New Video - Twinfinite","Today Capcom released a new video focusing on giving an overview of the company and of its gaming business, including future plans.",https://twinfinite.net/wp-content/uploads/2019/04/Capcom-Logo.jpg,2019-04-26
https://www.cnbc.com/2019/04/26/pubg-creator-went-from-welfare-to-making-a-billion-dollar-video-game.html,From playing video games while broke on welfare to creating billion-dollar game 'PlayerUnknown's Battlegrounds' - CNBC,"Six years ago, Brandan Greene was 37, divorced and making $300 a month. He started playing video games to entertain himself without spending lots of money and got inspired. His game PlayerUnknown's Battlegrounds brought in an estimated $1 billion in revenue i…",https://fm.cnbc.com/applications/cnbc.com/resources/img/editorial/2019/04/11/105846347-1554994752139brendangreeneheadshot.1910x1000.jpeg,2019-04-26
https://mobilesyrup.com/2019/04/26/sony-playstation-5-launch-2020-rumours/,Sony says PlayStation 5 won't launch in the next 12 months - MobileSyrup,"Sony has confirmed that the PlayStation 5 will not release anytime within the next 12 months, meaning that a fall 2020 launch is likely.",https://cdn.mobilesyrup.com/wp-content/uploads/2019/04/playstation-header-3-1024x522.jpg,2019-04-26
https://www.cnet.com/news/galaxy-fold-life-with-the-screen-crease-notch-and-air-gap/,"Galaxy Fold: Life with the screen crease, notch and air gap - CNET",We know about the Fold's screen problems. Now let's talk about the screen itself.,https://cnet2.cbsistatic.com/img/wESdn5CtxH6SK6gndsaJJNtvzI8=/756x567/2019/04/24/6341271c-ab4e-48a2-acbc-deedf677f1f3/galaxy-fold-3.jpg,2019-04-26
https://www.techradar.com/news/ps5-wont-launch-before-mid-2020,PS5 won't launch before mid-2020 - TechRadar,Sony's next-gen console is a while off yet,https://cdn.mos.cms.futurecdn.net/b563a91d751f7a1d32abaaf1bf9122a7-1200-80.png,2019-04-26
https://www.zdnet.com/article/apple-prepares-fix-for-crippling-app-store-bug/,Apple prepares fix for crippling App Store bug - ZDNet,The problem is a weird one.,https://zdnet4.cbsistatic.com/hub/i/r/2019/04/26/8f2dc380-a2b5-4548-82f0-d91b0e4f840c/thumbnail/770x578/994f70508b3673929162a6e45ba3494e/2019-04-26-12-45-40.jpg,2019-04-26
https://gonintendo.com/stories/334119-nintendo-outlines-e3-2019-plans,Nintendo outlines E3 2019 plans - GoNintendo,Nintendo outlines E3 2019 plans,https://gonintendo.com/system/stories/promo_images/000/334/119/original/download.png?1556246141,2019-04-26
https://www.ign.com/articles/2019/04/26/even-more-confusing-death-stranding-details-revealed,Even More Confusing Death Stranding Details Revealed - IGN,Hideo Kojima has revealed more details about Death Stranding at the Tribeca Film Festival.,https://assets2.ignimgs.com/2016/09/13/deathstrandingjpg-e07666_1280w.jpg,2019-04-26
https://www.cnet.com/news/windows-10-your-phone-getting-phone-notifications-syncing/,Windows 10's Your Phone getting Android notification syncing - CNET,No more missing mom's texts because you were working hard,https://cnet4.cbsistatic.com/img/0cYB2tafZpagPj_I1C2mRAng22A=/756x567/2019/04/26/e62a5745-e1b5-494e-9e41-cbe7f8c0985e/your-phone-notification-sync-screenshot.jpg,2019-04-26
https://www.psu.com/news/sony-video-game-streaming-strategy/,Sony Will Discuss Its Game Streaming Strategy Next Month - PlayStation Universe,"Sony will reveal its video game streaming strategy next month, according to information gleaned from a recent earnings call.",https://www.psu.com/app/uploads/2019/04/playstation-now-game-streaming.jpg,2019-04-26
https://fortniteintel.com/guardians-of-the-galaxy-star-lord-skin-image-leaked/16530/,Guardians of the Galaxy 'Star Lord' skin image leaked - FortniteINTEL,"The Fortnite X Avengers crossover event began on April 25th and shortly thereafter, a leak revealed that Guardians of the Galaxy skins were inbound. Images of the Star Lord skin have been leaked as of April 26th. The Guardians of the Galaxy are Marvel’s secon…",https://fortniteintel.com/wp-content/uploads/2019/04/fortbanner.jpg,2019-04-26
https://www.androidcentral.com/should-you-buy-google-wifi-2019,Should you buy a Google Wifi in 2019? - Android Central,Considering a new Google Wifi system? Here are a few reasons why that's a great idea.,https://www.androidcentral.com/sites/androidcentral.com/files/styles/large/public/field/image/2017/01/google-wifi-hero-01-8o11.jpg?itok=XT4wq-ec,2019-04-26
http://www.nintendolife.com/news/2019/04/mario_tennis_aces_gets_free_week-long_demo_7-day_online_subscription_included,"Mario Tennis Aces Gets Free Week-Long Demo, 7-Day Online Subscription Included - Nintendo Life",Try it out!,http://images.nintendolife.com/news/2019/04/mario_tennis_aces_gets_free_week-long_demo_7-day_online_subscription_included/large.jpg,2019-04-26
https://www.express.co.uk/entertainment/gaming/1118905/PS-Plus-May-2019-free-PS4-games-leaked-Metal-Gear-Survive-Darksiders-PlayStation,PlayStation Plus LEAK: May 2019 PS Plus free games leaked ahead of Sony reveal - Express,PLAYSTATION Plus subscribers may have found out the May 2019 free PS4 games lineup early.,https://cdn.images.express.co.uk/img/dynamic/143/750x445/1118905.jpg,2019-04-26
https://www.youtube.com/watch?v=nFHtvkU8CNc,Apple iPhone XS Max vs Samsung Galaxy S10+ - Pocket-lint,,,2019-04-26
https://www.iphoneincanada.ca/news/alleged-iphone-11-max-leak-3d-renders/,"Alleged 'iPhone 11 Max' Leaks in 3D Renders, Revealing New Mute Switch Design [VIDEO] - iPhone in Canada",More 3D renders have surfaced allegedly revealing Apple’s iPhone 11 Max design.,https://cdn.iphoneincanada.ca/wp-content/uploads/2019/04/iPhone-XI-VS-iPhone-XI-Max-5K1-min-1068x601.jpg,2019-04-26
https://mobilesyrup.com/2019/04/26/google-pixel-3-avengers-endgame/,Google Pixel 3 featured in Avengers: Endgame scene - MobileSyrup,"The Iron Man suit isn't the only high-end tech featured in the Avengers: Endgame, as the Google Pixel 3 is also used by one of the film's superheroes.",https://cdn.mobilesyrup.com/wp-content/uploads/2019/04/avengers-endgame-stark-1024x522.jpg,2019-04-26
https://www.youtube.com/watch?v=NgQVlC0n7fk,Super Mario Odyssey VR on Switch is Just OK - Nintendo Life,"It's not amazing, but there's nothing all that wrong with it either. Mario's first VR foray is OK. Zelda: Breath of the Wild VR Thoughts: https://youtu.be/qv...",https://i.ytimg.com/vi/NgQVlC0n7fk/maxresdefault.jpg,2019-04-26
https://lifehacker.com/remove-gmails-clutter-with-the-chrome-extension-simplif-1834309296,Remove Gmail's Clutter With the Chrome Extension 'Simplify' - Lifehacker,"Chrome: Sometimes, the very best hacks are the simplest. And it’s no surprise that the Chrome extension Simplify is one of my new favorites, because it takes all the clutter baked into Gmail and Thanos-snaps it into oblivion.","https://i.kinja-img.com/gawker-media/image/upload/s--IwuEL_It--/c_fill,fl_progressive,g_center,h_900,q_80,w_1600/bqpniugywb4o5l6fglf5.jpg",2019-04-26
https://www.cnbc.com/2019/04/26/jeff-bezos-blue-origin-shackleton-photo-tweet-may-be-lunar-outpost.html,Blue Origin tweeted a cryptic photo of explorer Shackleton's ship – here's what it likely means - CNBC,"Blue Origin, the space company founded by Amazon chairman Jeff Bezos, shared a cryptic photo of famed explorer Ernest Shackleton's expedition in a tweet on Friday.",https://fm.cnbc.com/applications/cnbc.com/resources/img/editorial/2018/05/01/105174989-GettyImages-665033912.1910x1000.jpg,2019-04-26
https://www.droid-life.com/2019/04/26/yo-here-is-the-pixel-3a-in-somewhat-sort-of-barely-or-almost-purple/,"Yo, Here is the Pixel 3a in Somewhat, Sort of, Barely, or Almost... - Droid Life","Yesterday, it was the Pixel 3a in white. Today, it's the Pixel 3a in some version of purple. Since this is a Google phone and they like to be cheeky with color names, let's take some guesses as to what they'll call this. Somewhat Purple? Sort of Purple? Almos…",https://www.droid-life.com/wp-content/uploads/2019/04/Pixel-3a-Purple-1-600x315.jpg,2019-04-26
https://www.anandtech.com/show/14277/intel-cpu-shortages-will-persist-throughout-q3-2019,Intel: CPU Shortages Will Persist Throughout Q3 2019 - AnandTech,"Although Intel invested some additional $1.5 billion to boost its 14 nm fab output last year, it looks like its supply problems are not...",https://images.anandtech.com/doci/14277/intel_semiconductor_microprocessor_penryn_678x452.jpg,2019-04-26
https://www.eurogamer.net/articles/2019-04-26-best-xbox-and-ps4-deals-out-right-now,Big Xbox and PS4 discounts out right now - Eurogamer.net,Shinobig deal.,https://cdn.gamer-network.net/2019/articles/2019-04-26-16-31/best-xbox-and-ps4-deals-out-right-now-1556292683160.jpg,2019-04-26
https://gearpatrol.com/2019/04/26/astellkern-kann-cube/,This Is the New King of Portable Hi-Fi Players - Gear Patrol,"The Kann Cube is Astell&Kern's newest portable hi-fi player. It's essentially an upgraded, much more powerful version of the Kann.",https://cdn.gearpatrol.com/wp-content/uploads/2019/04/Astell-Kern-KANN-CUBE-gear-patrol-feature.jpg,2019-04-26
https://www.trueachievements.com/n37418/poll-whats-your-most-anticipated-xbox-game-of-may-2019,Poll: What's Your Most Anticipated Xbox Game of May 2019? - TrueAchievements,"Another month is coming to an end, so it's time we look ahead to May's releases. Once again it's a slim month, but RAGE 2 is the big hitter and A Plague Tale could end up being the underdog to watch...",https://www.trueachievements.com/customimages/carousel/090754.jpg,2019-04-26
https://www.rockpapershotgun.com/2019/04/26/risk-of-rain-2-forecasts-five-big-updates-and-a-spring-launch/,Risk Of Rain 2 forecasts five big updates and a spring launch - Rock Paper Shotgun,"Risk Of Rain 2 has been out in early access for a month now, and developers Hopoo have outlined their plans for launch. Five big updates, and v1.0 in Spring",https://assets.rockpapershotgun.com/images/2019/04/Risk-Of-Rain-2.jpg,2019-04-26
https://www.techradar.com/news/bowers-and-wilkins-formation-range-high-end-wireless-sound-at-a-luxury-price,Bowers and Wilkins' Formation range: wireless speakers that actually sound awesome - TechRadar,Audiophile quality sound without the wires,https://cdn.mos.cms.futurecdn.net/Y9duqwvb8f6KArRxjwEpZk-1200-80.jpg,2019-04-26
https://www.dexerto.com/overwatch/overwatch-player-designs-explosive-new-hero-in-the-workshop-577578,Overwatch player designs explosive new hero in the Workshop - Dexerto,The new Workshop feature is already being used to create new hero prototypes in Overwatch.,https://s3.dexerto.com/thumbnails/_thumbnailLarge/overwatch-workshop-hero-prototype.jpg,2019-04-26
https://www.gizmodo.co.uk/2019/04/ifixit-galaxy-fold-teardown-disappears/,iFixit's Galaxy Fold Teardown Disappears After Samsung Request - Gizmodo UK,"Because that'll make people lose interest, right?",https://media.gizmodo.co.uk/wp-content/uploads/2019/04/ete9wfsaoavfxwclgc2n.jpg,2019-04-26
https://www.youtube.com/watch?v=mOysyBoTL-4,AirPods 2: One Month Later - AppleInsider,"The AirPods 2 have been out for a month now, and while the AirPods form factor and overall design didn't really change from the first generation AirPods, min...",https://i.ytimg.com/vi/mOysyBoTL-4/maxresdefault.jpg,2019-04-26
https://www.youtube.com/watch?v=Vf_hDufo3mU,The Elder Scrolls 6 | 6 things we basically know already - PCGamesN,,,2019-04-26
https://www.youtube.com/watch?v=1rY4FgF6qBw,BOXBOY! + BOXGIRL! - The Story So Far - Nintendo Switch - Nintendo,,,2019-04-26
https://www.youtube.com/watch?v=8m1d8IQlkFg,Rage 2: 90 Seconds of Spectacular Kills - IGN First - IGN,,,2019-04-26
