url,title,description,urlToImage,date
https://www.engadget.com/2019/04/26/amazon-music-streaming-high-fidelity-tidal-spotify-apple-music/,Amazon may be working on a high-fidelity music streaming service - Engadget,"Amazon might be working on a high-fidelity Tidal competitor, which could arrive this year for around $15 per month.",https://o.aolcdn.com/images/dims?thumbnail=1200%2C630&quality=80&image_uri=https%3A%2F%2Fo.aolcdn.com%2Fimages%2Fdims%3Fcrop%3D959%252C640%252C0%252C0%26quality%3D85%26format%3Djpg%26resize%3D1600%252C1068%26image_uri%3Dhttps%253A%252F%252Fs.yimg.com%252Fos%252Fcreatr-uploaded-images%252F2019-04%252F08e21030-6831-11e9-bfbf-524f3954274f%26client%3Da1acac3e1b3290917d92%26signature%3D9d2555f00911f20ebc5a324b2139a768658fcd9e&client=amp-blogside-v2&signature=a6758338b88a96f8fa859706e1c2afe2ea651a40,2019-04-26
https://www.youtube.com/watch?v=gXN6_t-OGSw,Windows 10 Sets feature is DEAD … for Now - Windows Central,In this episode: - Microsoft Paint is here to stay in Windows 10. https://www.windowscentral.com/microsoft-paint-here-stay-windows-10 - Hands-on with Windows...,https://i.ytimg.com/vi/gXN6_t-OGSw/maxresdefault.jpg,2019-04-26
https://www.engadget.com/2019/04/26/google-bans-app-developer-do-global-play-store-ad-fraud/,Google bans developer with half a billion app downloads from Play Store - Engadget,Google bans major Chinese app developer DO Mobile from Play Store over ad fraud scheme.,https://o.aolcdn.com/images/dims?thumbnail=1200%2C630&quality=80&image_uri=https%3A%2F%2Fo.aolcdn.com%2Fimages%2Fdims%3Fresize%3D2000%252C2000%252Cshrink%26image_uri%3Dhttps%253A%252F%252Fs.yimg.com%252Fos%252Fcreatr-uploaded-images%252F2019-04%252Fd6182e70-6842-11e9-9faf-b5ba1b9a09bf%26client%3Da1acac3e1b3290917d92%26signature%3D6a5e52232157d141288f9edd3a1509e5aecbae61&client=amp-blogside-v2&signature=860948edbb510106d88e12a841ed45d02ef8c539,2019-04-26
https://www.xda-developers.com/honor-view20-and-huawei-p30-pro-ar-measure-emui/,Honor View20 and Huawei P30 Pro get the AR Measure app with EMUI 9.0.1.173/9.1.0.140 - XDA Developers,Huawei P30 Pro and the Honor View20 (Chinese variant) are getting AR Measure app which uses the time of flight camera to measure distances from far away.,https://www.xda-developers.com/files/2019/04/huawei-p30-pro-4.jpg,2019-04-26
https://piunikaweb.com/2019/04/26/stylish-clever-and-hilarious-galaxy-s10-wallpapers-that-embrace-punch-hole-cameras/,[Cont. updated] Handpicked Samsung Galaxy S10 hole punch wallpapers - PiunikaWeb,Here's a list of over 100 amazing S10 / S10 plus / S10e wallpapers that cleverly absorb camera holes or cut out into their design.,https://piunikaweb.com/wp-content/uploads/2019/04/samsung-galaxy-s10-cutout-wallpapers-feature-image.jpg,2019-04-26
https://www.macrumors.com/2019/04/26/iphone-xi-xi-max-renders-cashkaro-onleaks/,'iPhone XI' and 'iPhone XI Max' Expected to Be Slightly Thicker and Feature Redesigned Mute Switch - Mac Rumors,"Indian blog CashKaro has collaborated with OnLeaks to share new renders of the so-called ""iPhone XI"" and ""iPhone XI Max,"" providing a...",https://cdn.macrumors.com/article-new/2019/04/iPhone-XI-vs-iPhone-XI-Max-1.jpg?retina,2019-04-26
https://arstechnica.com/information-technology/2019/04/cox-internet-now-charges-15-extra-for-faster-access-to-online-game-servers/,Cox Internet now charges $15 extra for faster access to online game servers - Ars Technica,Cox is reselling a PC-only game service—there's no net neutrality issue here.,https://cdn.arstechnica.net/wp-content/uploads/2019/04/cox-elite-gamer-screenshot-760x380.jpg,2019-04-26
https://www.gamespot.com/articles/sony-officially-confirms-ps5-again-as-ps4-sales-ne/1100-6466500/,"Sony Officially Confirms PS5 Again, As PS4 Sales Near 100 Million - GameSpot","Sony acknowledges in its earnings report that it experienced an ""increase in development expenses"" due to work on a next-generation console.",https://static.gamespot.com/uploads/screen_kubrick/1179/11799911/3527008-ps5.jpg,2019-04-26
https://www.theverge.com/2019/4/26/18518182/amazon-music-service-cd-quality-hi-fi-tidal-competitor-unlimited-prime-price,Amazon is reportedly prepping a new high-fidelity music streaming service - The Verge,"Amazon is planning to launch a new high-fidelity music streaming service with better-than-CD-quality audio. The new service is expected to cost around $15 a month, and it would sit alongside Amazon’s existing music services.",https://cdn.vox-cdn.com/thumbor/lELWBatzcWR2gu__MFPTwk7puOg=/0x146:2040x1214/fit-in/1200x630/cdn.vox-cdn.com/uploads/chorus_asset/file/13443481/acastro_181114_1777_amazon_hq2_0006.jpg,2019-04-26
https://variety.com/2019/gaming/news/playstation-now-use-increase-1203198747/,"PlayStation Now Has 700,000 Users, Use Contributed to Sony’s Increase in Sales - Variety",PlayStation Now’s continued growth was one of the factors that led to Sony’s ¥2.3 trillion yen ($20.7 billion USD) in sales for its Game and Network Services segment in the 2018 fiscal …,https://pmcvariety.files.wordpress.com/2019/04/image-13.png?w=700&h=393&crop=1,2019-04-26
https://www.rockpapershotgun.com/2019/04/26/respawn-prioritising-apex-legends-updates-over-more-titanfall/,Respawn prioritising Apex Legends updates over more Titanfall - Rock Paper Shotgun,"Apex Legends devs are prioritising updates over making more Titanfall and, in a nod to reports about Fortnite, say they don't want to crunch to blast content.",https://assets.rockpapershotgun.com/images/2019/02/apex-legends-hands-on-3.jpg,2019-04-26
https://www.gamespot.com/articles/xbox-hardware-sales-slipping-as-software-subscript/1100-6466504/,"Xbox Hardware Sales Slips As Software, Subscriptions Make Up Gap - GameSpot","The latest Microsoft financials show Xbox One may be hitting a saturation point, but strong software sales helped grow the games division.",https://static.gamespot.com/uploads/screen_kubrick/1585/15855271/3527056-3523604-the-xbox-one-all-digital-edition.jpg,2019-04-26
https://www.dexerto.com/general/is-the-playstation-network-down-uk-users-reporting-major-psn-outages-on-april-26-578724,Is the Playstation Network down? Users reporting major PSN outages on April 26 - Dexerto,Users in the UK and Europe have reported a large numbers of outages.,https://s3.dexerto.com/thumbnails/_thumbnailLarge/psn-down-april-26.jpg,2019-04-26
https://www.gamerevolution.com/guides/531549-destiny-2-xur-location-today-inventory-exotics-april-26,Destiny 2 Xur Location | Where is Xur Today and What is He Selling? (April 26) - Game Revolution,"Xur today sees out April with not only a new Destiny 2 Xur location for the week, but also a fresh set of Exotics in his inventory. Find out where he is and what he's selling today, April 26, with our handy guide.",https://cdn2-www.gamerevolution.com/assets/uploads/2019/04/Destiny-2_20190419180247-1-e1556295850674.jpg,2019-04-26
https://www.androidauthority.com/samsung-tablets-2019-980219/,You can buy three new Samsung tablets starting today - Android Authority,In the market for some Samsung tablets? You have three new choices starting now.,https://cdn57.androidauthority.net/wp-content/uploads/2019/04/Samsung-Galaxy-View-2-920x470.jpg,2019-04-26
https://www.gamesradar.com/hideo-kojima-talks-konami-breakup-i-thought-i-had-lost-everything/,"Hideo Kojima talks Konami breakup: ""I thought I had lost everything"" - GamesRadar",Starting from scratch on Death Stranding,https://cdn.mos.cms.futurecdn.net/gnVk6TmRjXzuLTxc9qBLha-1200-80.jpg,2019-04-26
https://www.xboxachievements.com/news/news-32688-Respawn-Focusing-on-Apex-Legends-Updates-Means-a-Longer-Wait-for-a-New-Titanfall.html,Respawn Focusing on Apex Legends Updates Means a Longer Wait for a New Titanfall - XboxAchievements,,,2019-04-26
https://www.thesun.co.uk/money/8947346/inside-7-5million-mansion-that-comes-with-its-own-cinema-spa-and-a-river-running-through-it/,"Inside £7.5million mansion that comes with its own cinema, spa and a river running through it - The Sun","Lower Chilland House has its its own cinema, spa and swimming pool and even a lap pool",https://www.thesun.co.uk/wp-content/uploads/2019/04/SM-COMP-HOUSE3.jpg?strip=all&quality=100&w=1200&h=800&crop=1,2019-04-26
https://www.realhomes.com/buying-guides/best-streaming-devices,"The best streaming devices 2019: Google Chromecast, Amazon Fire TV, Apple TV and more - Real Homes",Browse our pick of the best,https://cdn.mos.cms.futurecdn.net/QgPTN6WBrg8VAhzhwkDMLg-1200-80.jpg,2019-04-26
https://www.dualshockers.com/persona-q2-new-cinema-labyrinth-3ds-dlc/,Persona Q2: New Cinema Labyrinth Highlights Side Characters and Plethora of Day One DLC - DualShockers,Atlus unveiled a new character-focused trailer and a ton of day one DLC for Nintendo 3DS exclusive Persona Q2: New Cinema Labyrinth today.,https://cdn3.dualshockers.com/wp-content/uploads/2018/11/persona-q2-aigis-p3-hero.jpg,2019-04-26
https://kotaku.com/players-are-creating-amazing-things-with-overwatch-s-ne-1834333827,Players Are Creating Amazing Things With Overwatch’s New Workshop Tools - Kotaku,"Earlier this week, Blizzard added a Workshop to Overwatch that makes it possible to modify in-game scripts to create all sorts of new custom modes. Players have wasted no time in doing some really cool stuff with it.","https://i.kinja-img.com/gawker-media/image/upload/s--nRsXegBG--/c_fill,fl_progressive,g_center,h_900,q_80,w_1600/sqyfwkgf4gozwplbc9jy.png",2019-04-26
https://mobilesyrup.com/2019/04/26/oneplus-7-pro-camera-teaser/,OnePlus 7 Pro teaser reveals triple main cameras - MobileSyrup,"It's confirmed, the OnePlus 7 Pro will feature triple main cameras.",https://cdn.mobilesyrup.com/wp-content/uploads/2019/04/oneplus-6t-review-header-1024x522.jpg,2019-04-26
https://gematsu.com/2019/04/persona-q2-new-cinema-labyrinth-returning-heroes-trailer-launch-day-dlc-announced,"Persona Q2: New Cinema Labyrinth 'Returning Heroes' trailer, launch day DLC announced - Gematsu",Atlus has released a new trailer for Persona Q2: New Cinema Labyrinth dubbed “Returning Heroes” and announced the full list of downloadable content available day and date with the game’s release in the west. The list of launch downloadable content includes: S…,https://gematsu.com/wp-content/uploads/2019/04/PQ2_05-26-19.jpg,2019-04-26
https://www.youtube.com/watch?v=BpeMkgiKoWI,15 Beginners Tips And Tricks Days Gone Doesn't Tell You - GamingBolt,,,2019-04-26
https://www.theverge.com/2019/4/26/18518177/august-view-doorbell-issue-shipment-stop-testing-refund,August stops selling View doorbell less than three weeks after launch - The Verge,"August started selling its first battery-operated doorbell camera, the View, earlier this month, but it’s already halting shipments and providing refunds to customers due to performance issues.",https://cdn.vox-cdn.com/thumbor/8V47fMV-9KfwXKFNJwSvqz8q-_I=/0x292:2040x1360/fit-in/1200x630/cdn.vox-cdn.com/uploads/chorus_asset/file/16016733/dseifert_190407_3348_3603.jpg,2019-04-26
https://www.destructoid.com/sony-says-that-the-ps5-is-not-coming-in-the-next-12-months-551560.phtml,Sony says that the PS5 is not coming in the next 12 months - Destructoid,Sony says that the PS5 is not coming in the next 12 months,https://destructoid.com//ul/551560-AA2.jpg,2019-04-26
https://techcrunch.com/2019/04/26/nintendo-and-sony-temper-console-expectations-ahead-of-e3/,Nintendo and Sony temper console expectations ahead of E3 - TechCrunch,"E3’s just over a month away, and per usual, the news in the lead up has offered more insight into what we won’t be hearing about at the big gaming show. Late last year, Sony announced that it would be skipping its big annual press conference at the event. The…",https://techcrunch.com/wp-content/uploads/2017/01/img_7103.jpg?w=600,2019-04-26
https://www.androidpolice.com/2019/04/26/chrome-74-adds-translate-shortcut-improves-accessibility-and-more-apk-download/,"Chrome 74 adds Translate shortcut, improves accessibility, and more [APK Download] - Android Police","In this crazy world we live in, it's comforting to know that some things will never change — the sky is blue, the sun rises in the east, and Google releases a new version of Chrome (roughly) every six weeks. Chrome v74 is now available on desktop and mobile",https://www.androidpolice.com/wp-content/uploads/2019/04/chrome-dark-mode-hero.jpg,2019-04-26
http://www.nintendolife.com/reviews/nintendo-switch/nintendo_labo_toy-con_04_vr_kit,Review: Nintendo Labo Toy-Con 04: VR Kit - Entry-Level VR With Some Trademark Nintendo Charm And Polish - Nintendo Life,The Starter's the best part of this virtual meal,http://images.nintendolife.com/reviews/nintendo-switch/nintendo_labo_toy-con_04_vr_kit/large.jpg,2019-04-26
https://fortniteinsider.com/fortnite-competitive-development-update-siphon-material-change-stretched-res-fov/,"Fortnite Competitive Development Update - Siphon / Material Change, Stretched Res & FOV - Fortnite Insider","Epic have just released a blog on changes that will be made in competitive. Epic strive to make Fortnite entertaining for everyone and giving the opportunity to all to be able to have a real chance of winning through skill, strategy and luck. They have just r…",https://fortniteinsider.com/wp-content/uploads/2019/04/Fortnite_blog_fortnite-competitive-development-update_08BR_CompetitiveDevelopmentBlog_NewsHeader-1920x1080-24c7672e60acc27bc530580f736032f228e10212.jpg,2019-04-26
https://www.techradar.com/news/google-pixel-3a-leak-teases-a-new-color,Google Pixel 3a leak teases a new color - TechRadar,Subtle yet stylish,https://cdn.mos.cms.futurecdn.net/KC3b5wyzm6PQQqVZypNBZd-1200-80.jpg,2019-04-26
https://www.neowin.net/news/sony-could-launch-the-playstation-5-in-mid-2020/,Sony could launch the PlayStation 5 in mid 2020 - Neowin,,,2019-04-26
https://www.dsogaming.com/videotrailer-news/here-are-8-minutes-of-new-gameplay-footage-from-a-plague-tale-innocence/,Here are 8 minutes of new gameplay footage from A Plague Tale: Innocence - DSOGaming,"Focus Home Interactive has released a new video, showing 8 minutes of brand new gameplay footage from A Plague Tale: Innocence.",,2019-04-26
https://www.ign.com/articles/2019/04/26/daily-deals-alienware-geforce-gtx-1070-laptops-from-876-alienware-34-3440x1440-gsync-gaming-monitor-for-688,"Daily Deals: Alienware GeForce GTX 1070 Laptops from $876, Alienware 34"" 3440x1440 GSYNC Gaming Monitor for $688 - IGN","Aienware GTX 1070 Laptops From $876, Alienware 34&quot; 3440x1440 GSYNC IPS Gaming Monitor for $688, $400 off Newest Apple MacBook, 13% off New Apple AirPods 2, Xbox One X + NBA 2K19 + 2nd Controller for $380.",https://assets1.ignimgs.com/2019/04/26/blogroll-0426-1556302915402_1280w.jpg,2019-04-26
https://www.destructoid.com/playstation-s-golden-week-sale-is-stacked-with-ps4-ps3-and-vita-deals-551582.phtml,"PlayStation's Golden Week sale is stacked with PS4, PS3, and Vita deals - Destructoid","PlayStation's Golden Week sale is stacked with PS4, PS3, and Vita deals",https://destructoid.com//ul/551582-PlayStation-Golden-Week-sale-PS4-PS3-Vita-deals.jpg,2019-04-26
https://www.gamespot.com/reviews/days-gone-review-freaks-and-deacs/1900-6417130/,Days Gone Review - Freaks And Deacs - GameSpot,"Days Gone has its exciting moments, but it fails to say anything interesting or meaningful about its story and characters.",https://static.gamespot.com/uploads/screen_kubrick/1575/15759911/3526526-days-gone-review-thumb-nologo.jpg,2019-04-26
https://techcrunch.com/2019/04/26/plex-adds-more-tidal-powered-features-including-artist-tv-for-playing-music-videos/,"Plex adds more TIDAL-powered features, including ‘Artist TV’ for playing music videos - TechCrunch","Media center app Plex today is rolling out new features to expand upon its partnership with TIDAL, the streaming music service it began working with last November. Before, Plex subscribers could fill in the missing albums from artists in their library by way …",https://techcrunch.com/wp-content/uploads/2015/07/plex-logo.jpg?w=711,2019-04-26
https://www.riftherald.com/lol-gameplay/2019/4/26/18516114/yuumi-kit-abilities-new-support-champion-cat,Yuumi champion kit reveal: The Magical Cat attaches to allies - The Rift Herald,Latch on to your allies and shoot projectiles,https://cdn.vox-cdn.com/thumbor/EohIK_QrWihTWBIReOygPhR4o7c=/0x0:5000x2618/fit-in/1200x630/cdn.vox-cdn.com/uploads/chorus_asset/file/16194188/Yuumi_Splash_0.jpg,2019-04-26
https://bgr.com/2019/04/26/philips-hue-outdoor-light-discount-amazon/,A new Philips Hue smart light was just discounted for the first time ever - BGR,There is no question that the best Philips Hue sale on the web right now is the one that gets you Philips Hue white LED light bulbs for $10.25 a piece when you buy a 4-pack. You can also save a lit…,https://boygeniusreport.files.wordpress.com/2019/04/philips-hue-outdoor-smart-pathway-light.jpg?quality=98&strip=all,2019-04-26
https://www.polygon.com/2019/4/26/18267690/fallout-76-bethesda-community-players,Why Fallout 76 still has a committed player base - Polygon,"Fallout 76 has been a controversial game, but it’s not dead, and things are definitely better now than at launch. In fact, the game still has a committed fan base that loves the spinoff for the adventures it offers in Appalachia.",https://cdn.vox-cdn.com/thumbor/CF8jtM2x9tfcSc3vuh9dc7CM8d8=/0x146:2040x1214/fit-in/1200x630/cdn.vox-cdn.com/uploads/chorus_asset/file/11525057/fallout_helmet_3.0.jpg,2019-04-26
https://variety.com/2019/gaming/news/league-of-legends-yuumi-1203198752/,"‘League of Legends’ Adds Newb-Friendly Hero Yuumi, The Magical Cat - Variety","“League of Legends” is adding a new character to the game in the form of Yuumi, the Magical Cat. Yuumi is a magical cat hailing from Bandle City, once a girdle enchantress’s famil…",https://pmcvariety.files.wordpress.com/2019/04/yuumi_splash_final-1.jpg?w=700&h=393&crop=1,2019-04-26
https://dotesports.com/league-of-legends/news/riot-releases-champion-trailer-for-yuumi-the-magical-cat,"Riot releases champion trailer for Yuumi, the Magical... - Dot Esports",The curious kitten seems to be quite the champion.,https://dotesports-media.nyc3.cdn.digitaloceanspaces.com/wp-content/uploads/2019/04/26121655/yuumi.jpg,2019-04-26
https://gizmodo.com/in-its-race-to-be-first-samsung-screwed-itself-1834330086,"In Its Race to Be First, Samsung Screwed Itself - Gizmodo","The Samsung Galaxy Fold may be an incredible step forward in phone engineering, but it is unfinished. That became clear when, earlier this week, Samsung announced it was delaying the release of the phone. What was available to reviewers, analysts, influencers…","https://i.kinja-img.com/gawker-media/image/upload/s--DeFzRN4W--/c_fill,fl_progressive,g_center,h_900,q_80,w_1600/p3mqztpr8z8qnix7mzl2.jpg",2019-04-26
https://www.gamespot.com/articles/playstation-5-details-revealed-ps5-specs-psvr-supp/1100-6466281/,"PlayStation 5 Details Revealed: PS5 Specs, PSVR Support, PS4 Backwards Compatibility, And More - GameSpot","While its release is still far out, Sony's lead systems architect, Mark Cerny, has divulged some details about the next-generation PlayStation console.",https://static.gamespot.com/uploads/screen_kubrick/43/434805/3523350-playstation-5.jpg,2019-04-26
https://www.thurrott.com/windows/windows-10/205679/new-windows-10-insider-preview-build-brings-your-phone-improvements,New Windows 10 Insider Preview Build Brings Your Phone Improvements - Thurrott.com,Microsoft today released a new Windows 10 20H1 build to Windows Insiders in the Fast ring that adds new Your Phone functionality.,https://www.thurrott.com/wp-content/uploads/sites/2/2019/04/notfications-win10.jpg,2019-04-26
https://www.phonearena.com/news/Motorola-Moto-G7-Power-Tmobile-launch_id115614,Motorola's Moto G7 Power goes on sale at T-Mobile - Phone Arena,"The Un-carrier will charge exactly $237.50 for the Moto G7 Power, but customers will also be given the option to buy it for $9.50/month (with $9.50 down) for 24 months on T-Mobile's no-interest EI...",https://i-cdn.phonearena.com/images/article/115614-two_lead/Motorolas-Moto-G7-Power-goes-on-sale-at-T-Mobile.jpg,2019-04-26
https://bgr.com/2019/04/26/best-free-iphone-apps-apr-26-ipad-ios/,7 paid iPhone apps on sale for free on April 26th - BGR,"Before you head out to enjoy some rest and relaxation this weekend, we’ve got one more roundup for you to enjoy covering the best paid iPhone and iPad apps that are on sale for free. You&#821…",https://boygeniusreport.files.wordpress.com/2019/04/free-apps-apr-26.jpg?quality=98&strip=all,2019-04-26
https://www.ign.com/articles/2019/04/26/league-of-legends-to-add-yuumi-the-magical-cat-a-champion-for-newcomers,"League of Legends to Add Yuumi the Magical Cat, a Champion for Newcomers - IGN","League of Legends will soon be adding a new champion named Yuumi that is aimed at helping newcomers, and possibly best of all is that she is an incredibly cute magical cat.",https://assets1.ignimgs.com/2019/04/26/yuumi-1556284916228_1280w.jpg,2019-04-26
https://9to5google.com/2019/04/26/hp-2-in-1-chromebook-deals-philips-hue-more/,"HP 2-in-1 Chromebook hits all-time low, plus deals on Philips Hue Outdoor Lighting, Tile Trackers, more - 9to5Google","Today’s best deals from 9to5Toys include a new all-time low on the HP 2-in-1 Chromebook, Philips Hue Outdoor lights, Tile Mate trackers, and more.",https://9to5google.com/wp-content/uploads/sites/4/2019/04/hp-X2-12-F014DX-e1556214939555.jpg?quality=82&strip=all&w=1600,2019-04-26
https://www.thesixthaxis.com/2019/04/26/psn-down/,"[UPDATE] “External, internet-wide issues” are affecting the PlayStation Network - TheSixthAxis",,,2019-04-26
https://www.theregister.co.uk/2019/04/26/windows_10_storage/,"The difference between October and May? About 16GB, says Microsoft: Windows 10 1903 will need 32GB of space - The Register",Storage requirements embiggened in Redmond's upcoming OS emission,https://regmedia.co.uk/2016/09/27/shutterstock_burger.jpg,2019-04-26
https://www.trustedreviews.com/news/philips-hue-sale-huge-discounts-deals-available-on-both-indoor-and-outdoor-smart-lighting-3706067,Philips Hue Sale: Huge Discounts Available on both Indoor and Outdoor Smart Lighting - TrustedReviews,"You can score some serious discounts across the Philips Hue indoor and outdoor range, but you better act fast, these deals are selling out quickly.",https://ksassets.timeincuk.net/wp/uploads/sites/54/2019/04/Philips-Hue-Deals.png,2019-04-26
https://www.theguardian.com/lifeandstyle/2019/apr/26/older-skin-not-flattered-by-hand-dryers,Older skin not flattered by hand dryers - The Guardian,"Letters: Susan Treagus doesn’t want to see the skin on the back of her hands flapping about in an air jet, Marian Nyman objects to the noise, while Lesley Matthews favours the shaking method",https://i.guim.co.uk/img/media/ee976f88c258ee088948b1fbef7ba3f3a9ab6f86/50_1204_2834_1700/master/2834.jpg?width=1200&height=630&quality=85&auto=format&fit=crop&overlay-align=bottom%2Cleft&overlay-width=100p&overlay-base64=L2ltZy9zdGF0aWMvb3ZlcmxheXMvdGctZGVmYXVsdC5wbmc&s=fd152aec763db54ac38ee40d466f0f27,2019-04-26
https://www.destructoid.com/modders-have-already-added-mortal-kombat-11-s-story-npcs-to-the-roster-551577.phtml,Modders have already added Mortal Kombat 11's story NPCs to the roster - Destructoid,Modders have already added Mortal Kombat 11's story NPCs to the roster,https://destructoid.com//ul/551577-MK11mod_header.jpg,2019-04-26
https://www.dualshockers.com/a-plague-tale-innocence-gameplay-trailer/,New A Plague Tale: Innocence Trailer Gives an Uncut Look at Gameplay - DualShockers,"Focus Home Interactive has put out a new gameplay trailer for A Plague Tale: Innocence, which shows how players can interact and use the dreaded rat swarm.",https://cdn3.dualshockers.com/wp-content/uploads/2018/03/A_Plague_Tale-Innocence-03-1024x576.jpg,2019-04-26
https://www.engadget.com/2019/04/26/gmail-simplify-chrome-extension/,Former Gmail designer builds Chrome extension to declutter your inbox - Engadget,The free Chrome extension is meant to streamline your inbox.,https://o.aolcdn.com/images/dims?thumbnail=1200%2C630&quality=80&image_uri=https%3A%2F%2Fo.aolcdn.com%2Fimages%2Fdims%3Fcrop%3D1600%252C1067%252C0%252C0%26quality%3D85%26format%3Djpg%26resize%3D1600%252C1067%26image_uri%3Dhttps%253A%252F%252Fs.yimg.com%252Fos%252Fcreatr-uploaded-images%252F2019-04%252F089fceb0-683f-11e9-b6ff-c4dd17dffbc0%26client%3Da1acac3e1b3290917d92%26signature%3D66d3fc65f5aa297d2f3676cb94bc26e40f46718d&client=amp-blogside-v2&signature=c08d540c60530fab124a4e1cfffe80077602d442,2019-04-26
https://www.engadget.com/2019/04/26/tobii-aware-uses-eye-tracking-for-privacy/,Tobii uses eye tracking to keep people from peeking at your screen - Engadget,"Tobii's software now uses eye tracking to hide the contents of your screen, switch monitors and more.",https://o.aolcdn.com/images/dims?thumbnail=1200%2C630&quality=80&image_uri=https%3A%2F%2Fo.aolcdn.com%2Fimages%2Fdims%3Fresize%3D2000%252C2000%252Cshrink%26image_uri%3Dhttps%253A%252F%252Fs.yimg.com%252Fos%252Fcreatr-uploaded-images%252F2019-04%252Ffef3b5f0-685e-11e9-9817-92576547607b%26client%3Da1acac3e1b3290917d92%26signature%3D4105203d7f80a8f9352612cc7b5646eea6f8b2c1&client=amp-blogside-v2&signature=db21631a935e82abc131796d3861f6dd42742836,2019-04-26
https://arstechnica.com/gadgets/2019/04/windows-10-may-2019-update-bumps-hardware-specs-needs-32gb-storage/,Systems with small disks won't be able to install Windows 10 May 2019 update - Ars Technica,Both 32- and 64-bit requirements have been increased.,https://cdn.arstechnica.net/wp-content/uploads/2019/04/hard-disk-platter-760x380.jpg,2019-04-26
