url,title,description,urlToImage,date
0,https://toofab.com/2019/04/24/lil-xan-annie-amith-pregnant-miscarriage/,"Lil Xan Isn't Sure Girlfriend Annie Smith Was Ever Pregnant Either, Asked for Miscarriage Receipts - TooFab","The rapper says he's ""suspicious"" of Smith's pregnancy, but adds he ""wants to give her the benefit of the doubt.""",https://toofab.akamaized.net/2019/04/24/xan-gf-main-insta-1200x630.jpg,https://www.cnet.com/news/bond-25-rami-malek-hints-villain-daniel-craig/,Bond 25: Rami Malek confirms he'll be the villain - CNET,We have our first details about the casting for Daniel Craig's last outing as James Bond.,https://cnet4.cbsistatic.com/img/q5ujiKeyZ_F-hCpJc2FKTPjUbDs=/0x0:750x600/756x567/2019/04/25/6e112215-3510-45be-99f8-96c3565be2f5/d4-6fmhxkaaielg.jpg,2019-04-25
1,https://www.cnn.com/2019/04/24/entertainment/the-office-leaving-netflix-trnd/index.html,Netflix may have to say goodbye to 'The Office' and 'Friends' - CNN,"Some of the greatest American sitcoms of our generation, from ""The Office"" to ""Friends,""  could be leaving Netflix, the Wall Street Journal reports.",https://cdn.cnn.com/cnnnext/dam/assets/180626092834-16-2000s-tv-stream-super-tease.jpg,https://www.theverge.com/2019/4/25/18511549/game-of-thrones-got-season-8-hbo-final-daenerys-targaryen-jon-snow-final-battle-iron-throne,The fear of Daenerys Targaryen is setting up Game of Thrones’ final battle - The Verge,"Game of Thrones’ Daenerys Targaryen has been a fearsome queen-in-the-making since the end of the show’s first season, but her Westerosi allies are only recently starting to realize it. Reminding them in the latest episode, “A Knight of the Seven Kingdoms,” is…",https://cdn.vox-cdn.com/thumbor/yvCRhaU1cMcwMp2C2ohe5ppQX-w=/0x350:4928x2930/fit-in/1200x630/cdn.vox-cdn.com/uploads/chorus_asset/file/16183102/86862ba71646c3bf35704393a138745314f7f3b9162de972383299a09deff127998b1e8bf1eaae3526907f2e18d85aa5.jpg,2019-04-25
2,https://www.cnet.com/how-to/when-to-pee-during-avengers-endgame-bathroom-break/,When to take a bathroom pee break during Avengers: Endgame - CNET,"It's the longest MCU film yet, so if you don't plan ahead, these are the safest scenes to make a run for it (no plot spoilers!).",https://cnet4.cbsistatic.com/img/XY--BA66ex6BjHmLUtBocq7ZnUg=/2019/04/23/1019054d-b117-498c-a781-2c41b4a3f57d/avengers-endgame-group-shot.jpg,https://io9.gizmodo.com/the-new-men-in-black-international-trailer-introduces-1834295747,The New Men in Black: International Trailer Introduces the Movie's Shapeshifting Villains - Gizmodo,"Men in Black: International tells the story of how a woman spends years trying to find the titular secret organization after she has a chance encounter with MiB agents as a young girl and manages to walk away without having her memory erased. Ultimately, she’…","https://i.kinja-img.com/gawker-media/image/upload/s--YVM16o79--/c_fill,fl_progressive,g_center,h_900,q_80,w_1600/d0xi2yvr7yed4b5tukcn.png",2019-04-25
3,https://perezhilton.com/emipre-jussie-smollett-open-letter/,'Empire' Cast Pens Open Letter Asking Jussie Smollett Be Brought Back For Season Six - But Will It Happen?? - PerezHilton.com,"The Empire cast wants Jussie Smollett back on the show! Gearing up for their sixth season of the popular and always-dramatic TV show, the cast is putting on quite the unified front today after penning and publishing an open letter in which they specifically r…",https://perezhilton.com/wp-content/uploads/2019/04/empire-cast-jussie-smollett-860x696.jpg,https://www.express.co.uk/entertainment/gaming/1118705/Fortnite-8-50-PATCH-NOTES-update-Avengers-Endgame-LTM-rules-game-mode,"Fortnite 8.50 PATCH NOTES for Avengers Endgame update: Captain America, Iron Man and more - Express","FORTNITE fans can now download update 8.50, as Epic Games releases a lengthy list of patch notes during server downtime.",https://cdn.images.express.co.uk/img/dynamic/143/750x445/1118705.jpg,2019-04-25
4,https://www.vulture.com/article/jeopardy-quiz-james-holzhauer-got-wrong.html,Can You Answer the Jeopardy! Clues James Holzhauer Couldn’t? - Vulture,Take this quiz to find out.,https://pixel.nymag.com/imgs/daily/vulture/2019/04/24/24-james-holzhauer.w1200.h630.jpg,https://birthmoviesdeath.com/2019/04/25/the-mcu-thus-far,The MCU Thus Far - Birth.Movies.Death.,A video tribute to eleven years of Marvel movies.,https://s3.birthmoviesdeath.com/images/made/BMD-Endgame-Cover-Full-2_1050_591_81_s_c1.jpg,2019-04-25
5,https://www.foxnews.com/entertainment/ken-kercheval-dallas-star-dead-83,"Ken Kercheval, 'Dallas' star, dead at 83 - Fox News","Ken Kercheval, known for his role as Cliff Barnes on the hit show ""Dallas,"" has died. He was 83.",https://static.foxnews.com/foxnews.com/content/uploads/2019/04/Ken-Kercheval-Dallas.jpg,https://www.stereogum.com/2041248/new-prince-album-originals-compiles-demos-of-songs-he-gave-to-other-artists/news/,Prince 'Originals' Album Coming In June: See The Tracklist - Stereogum,"Prince spent the entirety of the '80s cranking out hit after hit, and he didn't even keep all of his best songs for himself. Prince was, of course, a vastly prolific songwriter, and he nurtured a whole supporting cast of all-star proteges: Morris Day & The Ti…",https://static.stereogum.com/uploads/2019/04/Prince-Originals-1556199148-608x608.jpg,2019-04-25
6,https://www.cnn.com/2019/04/24/us/bill-cosby-attacks-trial-judge/index.html,"Bill Cosby wants bail while he pursues an appeal, and accuses his trial judge of standing in the way - CNN","Actor Bill Cosby wants to be released on bail while he appeals his conviction for aggravated indecent assault, and his lawyers say in a motion filed Wednesday that his trial judge ""trampled"" on his rights.",https://cdn.cnn.com/cnnnext/dam/assets/180925170646-bill-cosby-mugshot-super-tease.jpg,https://thehollywoodunlocked.com/blac-chyna-enrolls-in-harvard-business-schools-analytics-course/,Blac Chyna Enrolls In Harvard Business School's Analytics Course - The Hollywood Unlocked,"Blac Chyna Enrolls In Harvard Business School’s Analytics Course On Monday, Blac Chyna shared a message to fans explaining that she was fully aware of how her actions have affected the way people perceived her. In her post, she said she was ready to become a …",https://thehollywoodunlocked.com/wp-content/uploads/2019/04/7B2A0A47-A80D-4C06-850F-7D08C79AD2A8-1000x600.jpeg,2019-04-25
7,https://pitchfork.com/reviews/tracks/fka-twigs-cellophane/,“Cellophane” by FKA twigs Review - Pitchfork,"The spare, gorgeous ballad is her first new solo music in over three years.",https://media.pitchfork.com/photos/5cc0d0686ec6081c9472c4c9/1:1/w_500/Cellophane.jpg,https://www.aol.com/article/entertainment/2019/04/25/oscar-nominee-mourns-death-of-model-wife-37-the-saddest-and-toughest-time-of-our-lives/23717092/,"Oscar nominee mourns death of model wife, 37: 'The saddest and toughest time of our lives' - AOL","Demian Bichir announced the death of his wife, Canadian actress and model Stefanie Sherk, in a heartfelt message on Instagram.",https://o.aolcdn.com/images/dims3/GLOB/crop/2829x1857+0+121/resize/1028x675!/format/jpg/quality/85/https%3A%2F%2Fs.yimg.com%2Fos%2Fcreatr-images%2F2019-04%2Fa87414b0-675d-11e9-b77c-2f9d3d629351,2019-04-25
8,https://www.wrestlinginc.com/news/2019/04/big-drop-in-viewership-for-this-week-wwe-smackdown-653444/,Big Drop In Viewership For This Week's WWE SmackDown - Wrestling Inc.,Big Drop In Viewership For This Week's WWE SmackDown,https://i1.ytimg.com/vi/p9mKyB5pU7I/maxresdefault.jpg,https://nypost.com/2019/04/25/veterans-want-kate-smith-statue-to-be-relocated-to-new-jersey/,Veterans stand up for Kate Smith amid outcry over 'racist' song - New York Post ,"Veterans in a New Jersey town want to give a statue of Kate Smith a new home after it was booted by the Philadelphia Flyers, insisting that “Miss Patriotism” deserves to be honored. The American Le…",https://thenypost.files.wordpress.com/2019/04/kate-smith-statue-1.jpg?quality=90&strip=all&w=1200,2019-04-25
9,https://www.youtube.com/watch?v=Bq4weXxsDbg,Madonna Live & Exclusive: 'Medellín' Video World Premiere! | MTV - MTV,Watch an exclusive Q&A with Madonna and the world premiere of her new video “Medellín” featuring Maluma on April 24 at 4p EDT! #Madonna #Maluma #MTV Subscrib...,https://i.ytimg.com/vi/Bq4weXxsDbg/hqdefault.jpg,https://pagesix.com/2019/04/25/robert-de-niros-all-male-table-raises-eyebrows-at-tribeca-film-festival-lunch/,Robert De Niro's mostly male table raises eyebrows at Tribeca Film Festival lunch - Page Six,Robert De Niro surrounded himself with only men and Tribeca Film Festival co-founder Jane Rosenthal.,https://nyppagesix.files.wordpress.com/2019/04/de-niro-rosenthal.jpg?quality=90&strip=all&w=1200,2019-04-25
10,https://pagesix.com/2019/04/24/north-west-has-a-meltdown-over-kim-kardashians-snakeskin-boots/,North West has a meltdown over Kim Kardashian's snakeskin boots - Page Six,“Sooooo Miss North dressed herself and thought she was ready for the day until I explained she couldn’t wear my boots.”,https://nyppagesix.files.wordpress.com/2019/04/north-west.jpg?quality=90&strip=all&w=1200,https://www.rollingstone.com/culture/culture-features/corey-feldman-expose-pedophilia-hollywood-darkest-secrets-825375/,Corey Feldman Wants to Expose Hollywood’s Darkest Secrets. Why Isn’t Anybody Listening? - Rolling Stone,Why Isn’t Anybody Listening?,https://www.rollingstone.com/wp-content/uploads/2019/04/R1327_FEA_Feldman_A1.jpg,2019-04-25
11,https://www.cheatsheet.com/entertainment/why-baby-sussex-will-only-change-the-line-of-succession-for-some-royals.html/,Why Baby Sussex Will Only Change the Line of Succession for Some Royals - The Cheat Sheet,Where is Baby Sussex in the line of succession?,https://www.cheatsheet.com/wp-content/uploads/2016/05/cs-logo.png,https://www.rollingstone.com/tv/tv-features/deadwood-rides-again-movie-set-visit-milch-825534/,‘Deadwood’ Rides Again - Rolling Stone,"On the set of HBO’s ‘Deadwood’ movie, creator David Milch, Ian McShane, Timothy Olyphant and more look back on the legendary series and grapple with Milch’s Alzheimer’s diagnosis",https://www.rollingstone.com/wp-content/uploads/2019/04/deadwood-lead1.jpg,2019-04-25
12,https://hollywoodlife.com/2019/04/24/kandi-burruss-todd-tucker-call-out-daughter-riley-sexy-outfit-instagram-pic/,"Kandi Burruss & Todd Tucker Call Out Daughter, 16, For Sexy Outfit In New Pic: ‘What Do You Have On?’ - Hollywood Life","Kandi Burruss and husband Todd Tucker couldn't help but leave playful parental comments on two new Instagram pics that their 16-year-old daughter, Riley, posted of herself wearing a button-down mini dress.",https://pmchollywoodlife.files.wordpress.com/2019/04/kandi-burruss-todd-tucker-ftr.jpg,https://www.buzzfeed.com/eleanorbate/brie-larson-captain-marvel-post-credits-scene,"Brie Larson Had No Idea What She Was Filming In The ""Captain Marvel"" End Credits Scene - BuzzFeed","""They gave me a piece of paper that was a full page of dialogue and action, but all of it was redacted except for my one line.""","https://img.buzzfeed.com/buzzfeed-static/static/2019-04/25/8/enhanced/buzzfeed-prod-web-03/original-2945-1556196873-3.jpg?crop=1023:536;1,2",2019-04-25
13,https://variety.com/2019/music/news/justin-bieber-ariana-grande-address-coachella-lip-synch-controversy-1203197026/,Justin Bieber and Ariana Grande Address Coachella Lip-Sync Controversy - Variety,"When Justin Bieber joined Ariana Grande on stage at the Coachella Festival Sunday night to perform his hit “Sorry,” there was little doubt in anyone’s mind about whether it was co…",https://pmcvariety.files.wordpress.com/2019/04/rexfeatures_10214594a-e1556135409842.jpg?w=700&h=393&crop=1,http://nbcmontana.com/news/entertainment/prince-harry-attends-public-event-as-royal-baby-wait-goes-on,Prince Harry attends public event as royal baby wait goes on - NBC Montana,,,2019-04-25
14,https://www.foxnews.com/entertainment/nicole-kidman-shows-skin-vanity-fair-photo-shoot,"Nicole Kidman, 51, shows some skin during steamy Vanity Fair photo shoot - Fox News",Nicole Kidman bared more than just her soul for her May cover story with Vanity Fair.,https://static.foxnews.com/foxnews.com/content/uploads/2018/09/nicole-kidman-cannes-2017-ap.jpg,https://www.hollywoodreporter.com/heat-vision/james-bond-25-cast-revealed-rami-malek-confirmed-1204624,James Bond 25 Cast Revealed: Rami Malek Confirmed - Hollywood Reporter,"Rami Malek is officially revealed as the chief villain, while 'Fleabag' creator Phoebe Waller-Bridge is confirmed as having joined the writing team.",https://cdn1.thr.com/sites/default/files/2015/11/spectre-first-look-1_rgb_-_h_2015.jpg,2019-04-25
15,https://www.bustle.com/p/which-game-of-thrones-place-you-should-live-in-based-on-your-sign-17142574,Here's Where You Would Live In 'Game Of Thrones' Based On Your Sign - Bustle,"I’ll be honest: On my list of Fictional Worlds I Wish I Could Live In, the Seven Kingdoms don’t rank very highly for me. People, uh, have a tendency to die horrible, bloody deaths there, so you’ll forgive me if I’d rather check out, say, Narnia or…",https://imgix.bustle.com/uploads/image/2019/4/24/9b97b533-4806-49a3-95ec-0f1083849c77-e3d29a51af7c4245b1595df7d8efa831fffe07fc08641c7b1d79bc807ca13b7649a5d88263d095d0737dbd4a8e451d9e32316b220729f7b7b5af2eb4df121783.jpg?w=1200&h=630&q=70&fit=crop&crop=faces&fm=jpg,https://www.rollingstone.com/music/music-news/bruce-springsteen-western-stars-album-827040/,Bruce Springsteen Details New Solo Album ‘Western Stars’ - Rolling Stone,"“This record is a return to my solo recordings featuring character-driven songs,” Springsteen says of June album",https://www.rollingstone.com/wp-content/uploads/2019/04/SPRINGSTEEN_WS_photo2.jpg,2019-04-25
16,https://hollywoodlife.com/2019/04/24/kailyn-lowry-response-david-eason-overweight-bikini-pics-tweets/,Kailyn Lowry Fires Back After David Eason Calls Her ‘Overweight’ In Bikini Pics: ‘He Can’t Change Who He Is’ - Hollywood Life,What a clap back! Kailyn Lowry defended herself against 'Teen Mom 2' co-star Jenelle Evans' husband David Eason after he fat-shamed her.,https://pmchollywoodlife.files.wordpress.com/2019/04/kailyn-lowry-david-rason-fires-back-ftr.jpg,https://www.yahoo.com/news/harry-meghan-newest-royal-baby-could-american-093629522.html,Harry and Meghan: Newest royal baby could be an American - Yahoo News,"LONDON (AP) — What would the founding fathers think? Almost 250 years after the United States launched a revolution to rid itself of the British royal family, the next royal baby could be an American.",https://s.yimg.com/uu/api/res/1.2/zjmODlHZywqH6eMgFzaaRg--~B/aD0yODMyO3c9Mzk5NjtzbT0xO2FwcGlkPXl0YWNoeW9u/http://media.zenfs.com/en_us/News/ap_webfeeds/f4a621f00cb4462dbc8431e9558fc4f7.jpg,2019-04-25
17,http://www.brooklynvegan.com/blood-on-the-dance-floors-music-removed-from-spotify-because-of-hate-content/,Blood on the Dance Floor's music removed from Spotify due to hate content - Brooklyn Vegan,"The removal follows numerous allegations of rape and sexual assault made against frontman Jesus David Torres, aka Dahvie Vanity, by 21 different women and teenage girls in series of harrowing reports",http://www.brooklynvegan.com/files/2019/04/bloodonthedancefloor.jpg?w=1200&h=0&zc=1&s=0&a=t&q=89,https://www.cnn.com/2019/04/24/entertainment/the-office-leaving-netflix-trnd/index.html,Netflix may have to say goodbye to 'The Office' and 'Friends' - CNN,"Some of the greatest American sitcoms of our generation, from ""The Office"" to ""Friends,""  could be leaving Netflix, the Wall Street Journal reports.",https://cdn.cnn.com/cnnnext/dam/assets/180626092834-16-2000s-tv-stream-super-tease.jpg,2019-04-25
18,https://relix.com/blogs/detail/album-premiere-anders-osborne/,Album Premiere: Anders Osborne 'Buddha and the Blues' - Relix,The next few weeks will be extraordinarily busy for New Orleans resident Anders Osborne. Along with a series of area gigs (including an appearance at the,https://dk5gvgp9n495wcv3tirfvl85-wpengine.netdna-ssl.com/wp-content/uploads/2019/04/z-s4ErkM-700x700.png,https://www.bbc.com/news/entertainment-arts-48050242,R. Kelly loses civil court case after missing hearing - BBC News,The singer failed to respond to a lawsuit brought by a woman who accused him of sexual abuse.,https://ichef.bbci.co.uk/news/1024/branded_news/13810/production/_106588897_kellyreu.jpg,2019-04-25
19,https://www.cosmopolitan.com/entertainment/celebs/a27258312/game-of-thrones-season-eight-episode-three-teaser-photos/,"Wait, Who TF Is Lurking Behind Sansa in These New 'Game of Thrones' Teaser Photos? - Cosmopolitan.com",*Sweats profusely.*,"https://hips.hearstapps.com/hmg-prod.s3.amazonaws.com/images/a34f6f24fad69ae25e98840a8bced2172c4523f46a15976a553f81a42f8d4ab72ee54ef2d1df0db67c2eb4b708ce0042-1556132063.jpg?crop=1.00xw:0.752xh;0,0.0433xh&resize=1200:*",https://www.malaymail.com/news/showbiz/2019/04/25/madonna-and-maluma-tie-the-knot-in-new-medellin-video-video/1746934,Madonna and Maluma tie the knot in new ‘Medellin’ video (VIDEO) - Malay Mail,"LOS ANGELES, April 25 — Yesterday, the 60-year-old pop star unveiled the visual of her Maluma-assisted single in a live event hosted by MTV. Directed by Diana Kunst and Mau Morgo, the six-minute video shows Madonna impersonating her eye-patched alter ego Mada…",https://media.malaymail.com/resize_cache/uploads/articles/2019/2019-04/MADONNA_MALUMA_MEDELLIN_VIDEO-seo.jpg,2019-04-25
20,https://www.express.co.uk/news/royal/1118397/meghan-markle-baby-thomas-announcement-travel-plans-doria-uk-royal,Meghan Markle baby news: Thomas Markle ANNOUNCEMENT over travel plans to meet grandchild - Express,"MEGHAN Markle’s father Thomas will not travel to the UK to visit his grandchild as he has been “iced out” of the Royal Family, sources close to him have claimed.",https://cdn.images.express.co.uk/img/dynamic/106/750x445/1118397.jpg,https://www.digitalspy.com/movies/a27268173/rocketman-taron-egerton-richard-madden-sex-scene-electric/,"Rocketman's Taron Egerton talks ""electric"" sex scene with Richard Madden in Elton John biopic - DigitalSpy.com","That sex scene is definitely not cut, then.","https://hips.hearstapps.com/hmg-prod.s3.amazonaws.com/images/taron-egerton-rocketman-1553284971.jpg?crop=1xw:0.8888888888888888xh;center,top&resize=1200:*",2019-04-25
21,https://news.sky.com/story/former-dallas-star-ken-kercheval-dies-aged-83-11702860,Former Dallas star Ken Kercheval dies aged 83 - Sky News,"When Dallas viewers asked Ken Kercheval when his character was ""finally going to get JR"", he always answered: ""This Friday night!""",https://e3.365dm.com/19/04/1600x900/skynews-ken-kercheval-dallas_4649627.jpg?20190424230434,https://metro.co.uk/2019/04/25/sacked-emmerdale-actress-shila-iqbals-last-episode-airing-9318086/,When is sacked Emmerdale actress Shila Iqbal's last episode airing? - Metro.co.uk,When will we see the last of Aiesha Richards?,https://i1.wp.com/metro.co.uk/wp-content/uploads/2019/04/GettyImages-1138475848-e1556194356942_1556200395.jpg?quality=90&strip=all&w=1200&h=630&crop=1&zoom=1&ssl=1,2019-04-25
22,https://www.digitalspy.com/tv/reality-tv/a27259398/love-island-caroline-flack-pull-out-of-filming/,Caroline Flack reveals why she nearly had to miss Love Island filming - DigitalSpy.com,Nothing a bum massage can't solve!,"https://hips.hearstapps.com/digitalspyuk.cdnds.net/18/44/1540861730-carole1.jpg?crop=1.00xw:0.307xh;0,0.0268xh&resize=1200:*",https://heatworld.com/celebrity/news/mrs-hinch-hospital-baby-update/,Mrs Hinch updates fans on baby's health following hospital dash - Heat World,"Mrs Hinch has delighted her fans as she took to Instagram to update them on her unborn baby's health, following her being kept in hospital overnight due to an illness.","https://cdn.onebauer.media/one/media/5cc1/b718/3a36/485c/03a7/b9e1/mrs-hinch-baby.JPG?quality=50&width=960&height=540&ratio=16-9&resizeStyle=aspectfill&crop=18,0,442,755&resize=crop&format=jpg",2019-04-25
23,https://news.sky.com/video/zac-efron-on-becoming-ted-bundy-11702789,Efron and Cole on new serial killer film - Sky News,,https://e3.365dm.com/19/04/1600x900/skynews-zac-efron-lily-cole_4649539.jpg?20190424221113,https://www.independent.co.uk/environment/chris-packham-bbc-crows-dead-bird-shooting-ban-farmers-a8885971.html,Crows hanged outside BBC presenter Chris Packham's home amid farmer anger at bird shooting ban - The Independent,"Blue Planet Live and Springwatch presenter successfully campaigned against licences which allowed shooting of birds including pigeons, jays and crows",https://static.independent.co.uk/s3fs-public/thumbnails/image/2019/04/25/13/screen-shot-2019-04-25-at-13.17.50.png,2019-04-25
24,https://www.billboard.com/articles/columns/pop/8508638/madonna-maluma-medellin-video-cha-cha,"Madonna Seduces Maluma in Rowdy, Cha-Cha-Inspired 'Medellín' Video: Watch - Billboard","The visual stars Madonna as her alter ego, Madame X, and the Colombian singer as her paramour.",https://www.billboard.com/files/media/maluma-madonna-medellin-MV-2019-billboard-1548.jpg,https://www.dailymail.co.uk/femail/article-6959205/Body-language-expert-reveals-Harry-Kates-bond-suggests-rift-brothers.html,Body language expert reveals what Harry and Kate's bond means for rift - Daily Mail,Body language expert Judi James believes today's friendly display between Prince Harry and Kate at Westminster Abbey could signify that the rumoured rift is between the royal brothers.,https://i.dailymail.co.uk/1s/2019/04/25/14/12707820-0-image-a-63_1556197717022.jpg,2019-04-25
25,https://www.bbc.co.uk/news/world-us-canada-48043765,Charity 'Sunshine' Tillemann-Dick: Opera singer with transplanted lungs dies - BBC News,The 35-year-old singer performed across the world despite undergoing two double-lung transplants.,https://ichef.bbci.co.uk/news/1024/branded_news/E9B4/production/_106582895_857264_511616755547536_1369065848_o.jpg,https://www.thesun.co.uk/tvandshowbiz/8937644/game-of-thrones-episode-3-spoilers-teaser-image-sansa-armour-jamie-brienne-battle/,Game Of Thrones episode 3 spoilers: Sansa Stark wears armour as Jaime Lannister and Brienne fight side by - The Sun,Cynical fans anticipate that several beloved characters will be killed off in the upcoming episode of the show,https://www.thesun.co.uk/wp-content/uploads/2019/04/RR-COMP-GOT4.jpg?strip=all&quality=100&w=1200&h=800&crop=1,2019-04-25
26,https://www.dailymail.co.uk/tvshowbiz/article-6956609/Game-Thrones-releases-episode-3-snaps-featuring-Sansa-Stark-armor-Battle-Winterfell.html,Game Of Thrones releases episode 3 snaps featuring Sansa Stark in armor before Battle of Winterfell - Daily Mail,HBO released six images from the upcoming Game Of Thrones episode 3 of the 8th and final season on Wednesday.,https://i.dailymail.co.uk/1s/2019/04/24/21/12677650-0-image-a-10_1556138961218.jpg,https://www.screendaily.com/news/rami-malek-confirmed-as-new-cast-unveiled-for-bond-25/5138780.article,Rami Malek confirmed as new cast unveiled for 'Bond 25' | News - Screen International,"Also announced today were Ana De Armas, David Dencik, Dali Benssalah and Lashana Lynch.",https://d1nslcd7m2225b.cloudfront.net/Pictures/2000x2000fit/5/5/2/1301552_ramimalekcwikicommonsdominickd_621668.jpg,2019-04-25
27,https://www.irishmirror.ie/showbiz/celebrity-news/simon-cowell-says-louis-tomlinson-14576684,Simon Cowell says Louis Tomlinson can take time off from X Factor after sister's death - Irish Mirror,Simon Cowell says there's no pressure for pop star Louis Tomlinson to get back to work after the loss of his sister Félicité,https://i2-prod.mirror.co.uk/incoming/article13519925.ece/ALTERNATES/s1200/3_X-Factor-2018.jpg,https://www.dailymail.co.uk/tvshowbiz/article-6959189/Holly-Willoughby-Phillip-Schofield-left-hysterics-Vanessa-Feltz-fakes-ORGASM.html,Holly Willoughby and Phillip Schofield left in hysterics after Vanessa Feltz fakes an ORGASM - Daily Mail,"Holly Willoughby and Phillip Schofield were left in hysterics on Thursday's This Morning, after Vanessa Feltz replicated an orgasm.",https://i.dailymail.co.uk/1s/2019/04/25/12/12704786-0-image-a-136_1556193212211.jpg,2019-04-25
28,https://www.dailymail.co.uk/tvshowbiz/article-6956605/Mrs-Hinchs-Sophie-Hinchliffe-reveals-shes-rushed-hospital-notice.html,Mrs Hinch's Sophie Hinchliffe reveals she's been rushed to hospital 'until further notice' - Daily Mail,"The pregnant cleaning Queen, 29, who has 2.4million Instagram followers, insisted to her worried fans that her unborn baby, who she calls mini Hinch, is 'doing fine'.",https://i.dailymail.co.uk/1s/2019/04/24/21/12677678-0-image-a-28_1556138957067.jpg,https://www.digitaltveurope.com/2019/04/25/bbc-submits-iplayer-plans-to-ofcom/,BBC submits iPlayer plans to Ofcom - Digital TV Europe,The BBC has submitted its plans to make more box-sets and more content available for longer on its iPlayer service to Ofcom following completion of the public interest test ordered by the regulator.,https://www.digitaltveurope.com/files/2019/04/624.jpg,2019-04-25
