url,title,description,urlToImage,date
117,https://www.eonline.com/news/1035416/a-complete-timeline-of-the-ongoing-drama-surrounding-britney-spears-well-being-and-conservatorship,A Complete Timeline of the Ongoing Drama Surrounding Britney Spears - E! NEWS,The singer was placed under the supervision of her father in 2007,"https://akns-images.eonline.com/eol_images/Entire_Site/2018825/rs_600x600-180925135414-600-spears.cm.92518.jpg?fit=around|600:467&crop=600:467;center,top&output-quality=90",https://nypost.com/2019/04/25/why-april-25th-is-the-perfect-date-miss-congeniality-goes-viral/,Why April 25th is the perfect date: 'Miss Congeniality' goes viral - New York Post ,"Just a reminder: All you need today is a light jacket. Yes, that is a legit Twitter alert for Thursday, April 25. The “trending moment” hails from the 2000 Sandra Bullock flick “M…",https://thenypost.files.wordpress.com/2019/04/perfect-date-miss.jpg?quality=90&strip=all&w=1200,2019-04-25
118,https://pagesix.com/2019/04/24/taylor-swift-helped-design-her-time-100-gala-dress/,Taylor Swift helped design her Time 100 Gala dress - Page Six,"“That bolero didn’t come from me, it was her,” J. Mendel’s Gilles Mendel told Page Six Style.",https://nyppagesix.files.wordpress.com/2019/04/taylor-swift-time-100-gala-2019-lead.jpg?quality=90&strip=all&w=1200,https://www.today.com/popculture/riverdale-says-farewell-luke-perry-poignant-scene-last-episode-t152865,‘Riverdale' says farewell to Luke Perry with poignant scene in last episode - Today Show,"Luke Perry's final scene as Fred Andrews on the CW's ""Riverdale"" has aired. In the episode, Perry consoles on-screen son Archie.",https://media1.s-nbcnews.com/j/newscms/2019_17/1429590/tdy_luke_perry_main_190425_2c2af7b7a5df0b843a7ce49a95552498.social_share_1200x630_center.jpg,2019-04-25
119,https://variety.com/2019/tv/news/bryan-cogman-game-of-thrones-spinoff-1203197045/,‘Game of Thrones’: Bryan Cogman Confirms His Spinoff Isn’t Happening - Variety,"SPOILER ALERT: Do not keep reading unless you’ve seen “Game of Thrones” Season 8 Episode 2, titled “A Knight of the Seven Kingdoms.” Veteran “Game of Thrones” writer Bryan Cogman has co…",https://pmcvariety.files.wordpress.com/2019/04/game-of-thrones-season-8-1.jpg?w=700&h=393&crop=1,https://pagesix.com/2019/04/25/tamron-hall-gives-birth-to-baby-boy/,Tamron Hall gives birth to a baby boy named Moses - Page Six,She revealed this year that she secretly got married.,https://nyppagesix.files.wordpress.com/2019/04/tamron.jpg?quality=90&strip=all&w=1200,2019-04-25
120,https://www.cnn.com/2019/04/24/media/abigial-disney-executive-pay/index.html,Disney heir calls on company to give 50% of exec bonuses to lowest-paid employees - CNN,Abigail Disney is doubling down on her criticism of executive pay at her family's company.,https://cdn.cnn.com/cnnnext/dam/assets/190422075604-abigail-disney-bob-iger-split-super-tease.jpg,https://news.avclub.com/chadwick-boseman-leads-a-manhunt-in-the-trailer-for-gri-1834297067,Chadwick Boseman leads a manhunt in the trailer for gritty cop thriller 21 Bridges - The A.V. Club,"Marvel stalwarts (and Avengers: Endgame directors) Joe and Anthony Russo produced 21 Bridges, a throwback cop thriller starring Black Panther himself, Chadwick Boseman. Now, following the healthy dose of buzz generated by the Cinemacon debut of its trailer, y…","https://i.kinja-img.com/gawker-media/image/upload/s--lGykzkFG--/c_fill,fl_progressive,g_center,h_900,q_80,w_1600/bptq2mtwds3vdvb34h1h.png",2019-04-25
121,https://www.cnn.com/2019/04/24/entertainment/jennifer-garner-beautiful-people/index.html,Jennifer Garner nabs cover of People's 'Beautiful People' issue - CNN,"Jennifer Garner's response to being selected as the cover person for People magazine's ""Beautiful"" issue was so typically Jennifer Garner. She said it was flattering, but she didn't seem super comfortable with the honor.",https://cdn.cnn.com/cnnnext/dam/assets/180131185557-jennifer-garner-super-tease.jpg,https://www.kcra.com/article/today-in-history-for-april-25-ella-fitzgerald-is-born/27268832,Today in History for April 25: Ella Fitzgerald is born - KCRA Sacramento,There’s a lot to look back on in history for April 25. Here are some notable moments.,"https://kubrick.htvapps.com/htv-prod-media.s3.amazonaws.com/images/ella-fitzgerald-1556197073.jpg?crop=1.00xw:0.793xh;0,0&resize=1200:*",2019-04-25
122,https://www.dailymail.co.uk/tvshowbiz/article-6956641/Zac-Efron-claims-impossible-separate-role-serial-killer-Ted-Bundy.html,Zac Efron claims it was 'impossible to separate himself' from the role of serial killer Ted Bundy - Daily Mail,"Zac Efron has revealed he found it 'impossible' to detach himself from the role of serial killer Ted Bundy, while shooting his latest film Extremely Wicked, Shockingly Evil and Vile.",https://i.dailymail.co.uk/1s/2019/04/24/21/12677426-0-image-a-35_1556137229666.jpg,https://www.theguardian.com/film/2019/apr/25/mads-mikkelsen-one-word-wrong-and-youre-a-dead-person,Mads Mikkelsen: ‘One word wrong and you're a dead person’ - The Guardian,"The star of Hannibal, The Hunt and new film Arctic doubts frank conversation is possible in the wake of #MeToo. But is he really also sceptical about climate change?",https://i.guim.co.uk/img/media/0c3a1bf51334fd4768b448f4790ad6c16ce0e7b5/579_48_1472_883/master/1472.jpg?width=1200&height=630&quality=85&auto=format&fit=crop&overlay-align=bottom%2Cleft&overlay-width=100p&overlay-base64=L2ltZy9zdGF0aWMvb3ZlcmxheXMvdGctZGVmYXVsdC5wbmc&s=bb5ec23669c1119e08a3a05d799aa4b2,2019-04-25
123,https://metro.co.uk/2019/04/24/friends-star-courteney-cox-reaches-emotional-big-bang-theorys-kaley-cuoco-touching-message-9314866/,Friends' Courteney Cox reaches out to The Big Bang Theory's Kaley Cuoco - Metro.co.uk,What a babe!,https://i1.wp.com/metro.co.uk/wp-content/uploads/2019/04/SEC_64119426_1556136825.jpg?quality=90&strip=all&w=1200&h=630&crop=1&zoom=1&ssl=1,https://www.itv.com/news/2019-04-25/dead-crows-hung-outside-chris-packhams-house-following-bird-shooting-curb/,Dead crows hung outside Chris Packham's house following bird shooting curb - ITV News,"Dead crows have been left hanging outside the home of Chris Packham after he backed a legal challenge which resulted in restrictions on shooting ‘pest’ birds.

The BBC Springwatch presenter said on Thursday that he had contacted police following the incident.",https://news.images.itv.com/image/file/1840947/img.jpg,2019-04-25
124,https://www.digitalspy.com/tv/reality-tv/a27258153/rylan-clark-neal-new-huge-eurovision-2019-role/,Rylan Clark-Neal bags a huge Eurovision 2019 role - DigitalSpy.com,London calling!,"https://hips.hearstapps.com/digitalspyuk.cdnds.net/17/05/1486122733-rylan-bots.jpg?crop=1.00xw:1.00xh;0,0&resize=1200:*",https://www.dailymail.co.uk/tvshowbiz/article-6959505/Bond-Girl-Ana-Armas-unknown-Cuban-actress-shared-sizzling-snaps-bagging-role.html,‘Bond Girl’ Ana de Armas was unknown Cuban actress who shared sizzling snaps before bagging role - Daily Mail,"Cuban-Spanish actress Ana de Armas, 30, has been confirmed as the brand new Bond Girl.",https://i.dailymail.co.uk/1s/2019/04/25/16/12712900-0-image-a-184_1556204863844.jpg,2019-04-25
125,https://www.nme.com/news/ariana-grande-defends-justin-bieber-criticisms-coachella-cameo-2480342,“People don’t know how it feels to be under such scrutiny”: Ariana Grande defends Justin Bieber over criticisms of Coachella cameo - NME Live,Ariana Grande has defended Justin Bieber after he hit out at a critic's response to his recent Coachella cameo.,https://ksassets.timeincuk.net/wp/uploads/sites/55/2019/04/GettyImages-1144297041.jpg,https://news.sky.com/story/live-new-james-bond-cast-and-film-details-to-be-revealed-11703070,Rami Malek to play a Bond villain in next 007 film - Sky News,Follow live as Sky News covers the launch of the hugely anticipated 25th James Bond film as Daniel Craig returns as 007.,https://e3.365dm.com/19/04/1600x900/skynews-rami-malek-james-bond-villain_4650018.jpg?20190425141057,2019-04-25
126,https://metro.co.uk/2019/04/24/emmerdale-spoilers-maya-stepney-to-kill-liv-flaherty-as-child-abuse-is-exposed-9291874/,Emmerdale spoilers: Maya to kill Liv as child abuse is exposed? - Metro.co.uk,Liv's in danger,https://i2.wp.com/metro.co.uk/wp-content/uploads/2019/04/liv-and-maya-1c60_1556137746.png?w=1200&h=630&crop=1&quality=90&strip=all&zoom=1&ssl=1,https://www.digitalspy.com/tv/ustv/a27267705/game-of-thrones-spin-off-definitely-scrapped-bryan-cogman/,One of the Game of Thrones spin-offs has definitely been scrapped - DigitalSpy.com,"""HBO decided to go a different way.""","https://hips.hearstapps.com/hmg-prod.s3.amazonaws.com/images/jon-snow-game-of-thrones-episode-3-1556195969.jpg?crop=1xw:0.8894536213468869xh;center,top&resize=1200:*",2019-04-25
127,https://www.digitalspy.com/tv/reality-tv/a27256140/love-island-megan-barton-hanson-plastic-surgery/,Love Island's Megan Barton-Hanson opens up about being trolled for having plastic surgery - DigitalSpy.com,"Megan Barton Hanson says she had ""procedures done solely for me"".","https://hips.hearstapps.com/hmg-prod.s3.amazonaws.com/images/megan-barton-hanson-1550085751.jpg?crop=1.00xw:0.504xh;0,0.112xh&resize=1200:*",https://www.mirror.co.uk/news/uk-news/key-detail-missing-prince-louiss-14578636,Key detail missing from Prince Louis's birthday photos - and it's a real shame - Mirror Online,Kate Middleton and Prince William shared three adorable photos of their youngest child Prince Louis to celebrate the royal tot's first birthday,https://i2-prod.mirror.co.uk/incoming/article14446480.ece/ALTERNATES/s1200/2_EMB-Prince-Louis-1st-birthday.jpg,2019-04-25
128,https://www.thesun.co.uk/fabulous/8931527/pregnant-stacey-solomon-sparks-stupid-debate-over-whether-she-can-eat-a-mr-whippy-ice-cream/,Pregnant Stacey Solomon sparks stupid debate over whether she can eat a Mr Whippy ice-cream - The Sun,The Loose Women presenter's followers warned her to avoid the treat,https://www.thesun.co.uk/wp-content/uploads/2019/04/NINTCHDBPICT000485132231.jpg?strip=all&quality=100&w=465&h=464&crop=1,https://www.dailymail.co.uk/tvshowbiz/article-6959239/Katie-Price-puts-leggy-display-visits-furniture-store-beau-Kris-Boyson-30.html,"Katie Price puts on a leggy display as she visits furniture store with beau Kris Boyson, 30 - Daily Mail",Katie Price and Kris Boyson were the picture of domestic bliss as they enjoyed a trip to the furniture store on Wednesday.,https://i.dailymail.co.uk/1s/2019/04/25/12/12704866-0-image-a-96_1556193343841.jpg,2019-04-25
129,https://www.theguardian.com/world/2019/apr/25/fan-bingbing-china-star-reappears-after-nearly-a-year-in-wilderness,'She is back!' Fan Bingbing reappears after nearly a year in wilderness - The Guardian,Actor fined for tax evasion returns to spotlight after months of rumours she had fled China or was in prison,https://i.guim.co.uk/img/media/721058218ff40de6cc3b7af744731a0af94ffd6e/0_129_2399_1439/master/2399.jpg?width=1200&height=630&quality=85&auto=format&fit=crop&overlay-align=bottom%2Cleft&overlay-width=100p&overlay-base64=L2ltZy9zdGF0aWMvb3ZlcmxheXMvdGctZGVmYXVsdC5wbmc&s=4ab795fd20377ea4978be6d5f16977f7,https://www.forces.net/news/prince-harry-attend-anzac-day-service-westminster-abbey,Prince Harry Attends Anzac Day Service At Westminster Abbey - Forces Network,The Duke of Sussex will attend the service to honour the sacrifices of Australian and New Zealand forces.,https://www.forces.net/sites/default/files/styles/cover_image/public/Prince%20Harry%20and%20Dr%20John%20Hall%20at%20Anzac%20Day%20service%20at%20Westminster%20Abbey%20cropped%20250419%20CREDIT%20PA.jpg?itok=nGJ4aqiC,2019-04-25
130,https://movieweb.com/disney-cancels-fox-movies-deal-closed/,Disney Dumps Multiple Fox Movies After Closing Merger - MovieWeb,"Alan Horn, Disney's studio chief, is currently going through the list of upcoming Fox projects to potentially axe.",https://cdn3.movieweb.com/i/article/yszJG7j4xXLuRPmAtXyWJn87YAUwWh/1200:100/Disney-Cancels-Fox-Movies-Deal-Closed.jpg,https://toofab.com/2019/04/25/chris-hemsworth-scarlett-johansson-playground-insults-endgame/,Watch Chris Hemsworth and Scarlett Johansson Insult Each Other for 5 Minutes Straight - TooFab,The two 'Avengers: Endgame' stars went head to head against each other in a brutal insult battle -- who came out on top?,https://toofab.akamaized.net/2019/04/25/hemsworth-scarjo-inset-bbcradio-1200x630.jpg,2019-04-25
131,https://411mania.com/wrestling/becky-lynch-ronda-rousey-didnt-know-handle-losing-delighted-gone/,Becky Lynch Says Ronda Rousey Didn't Know How to Handle Losing: 'I'm Delighted She's Gone' - 411mania.com,"Ronda Rousey may be taking time away from WWE, but Becky Lynch is keeping the feud going in case she ever comes back.",https://411mania.com/wp-content/uploads/2019/04/2019-04-07-5-150x150.png,https://411mania.com/wrestling/vince-mcmahon-was-reportedly-against-letting-dustin-rhodes-out-of-wwe-contract/,Vince McMahon Was Reportedly Against Letting Dustin Rhodes Out Of WWE Contract - 411mania.com,"According to the latest report, Vince McMahon had to be talked into letting Dustin Rhodes out of his WWE contract so he could go to AEW...",https://411mania.com/wp-content/uploads/2017/09/Dustin-Rhodes-Raw-91817-150x150.jpg,2019-04-25
132,https://www.thespec.com/news-story/9300636-avengers-endgame-tickets-in-hamilton-selling-for-superhero-sized-bucks/,Avengers: Endgame tickets in Hamilton selling for superhero-sized bucks - TheSpec.com,Marvel’s superhero finale Avengers: Endgame inspires ticket buying frenzy,https://dynamicmedia.zuza.com/zz/m/original_/2/f/2f1308e4-e6df-4c8d-8c9e-94680523582c/B88681575Z.1_20190424170146_000_GONIPAGG.3-0_Super_Portrait.jpg,https://www.hotnewhiphop.com/chris-brown-and-tyga-team-up-with-marshmello-to-light-it-up-new-song.1982724.html,"Chris Brown & Tyga Team Up With Marshmello To ""Light It Up"" - HotNewHipHop","Marshmello is back with another banger and this time, he brings along Chris Brown and Tyga. Even though his identity is shielded by a giant marshmallow mask, Marshmello has quickly risen to become the most popular figure in the electronic music world. The DJ …",https://www.hotnewhiphop.com/image/740x416/cover/1556199708_b3b13df8a36c00433105a4fa0038745c.jpg/7f0ac6abb13ded9363ee202dda711e2d/1556199708_a5b0fd0b27f3641a45fd004a37483a18.jpg,2019-04-25
133,https://www.mandatory.com/wrestlezone/news/1084325-aews-tony-khan-talks-cm-punk-his-five-year-plan-and-creating-a-wrestler-friendly-schedule,"AEW’s Tony Khan Talks CM Punk, His Five Year Plan, And Creating A Wrestler Friendly Schedule - Mandatory","""I believe you don't need to spend 6 days on the road to make a good living as a wrestler.""",https://www.wrestlezone.com/assets/uploads/2019/02/all-elite-wrestling-aew-1.jpg,https://www.theglobeandmail.com/arts/film/article-daniel-craig-to-star-as-james-bond-for-a-fifth-time-producers-say/,Oscar winner Rami Malek to play Bond villain in upcoming film; Daniel Craig to reprise role - The Globe and Mail,"The still untitled movie will be Craig’s fifth go-around as Britain’s most famous fictional secret agent, and will feature on-location scenes in Jamaica, the producers said",https://www.theglobeandmail.com/resizer/svqkkpAwUgyLn2AIpJ9VGLvpMu8=/1200x0/filters:quality(80)/arc-anglerfish-tgam-prod-tgam.s3.amazonaws.com/public/IKCA77VXVJB6DPYVVQYZ3OGT7Y.jpg,2019-04-25
134,https://www.ign.com/articles/2019/04/24/game-of-thrones-season-8-episode-3-length-photos-title-preview,"HBO Reveals Game of Thrones Season 8, Episode 3 Photos - IGN","Check out six new images for the next episode, as the epic Battle of Winterfell draws near.",https://assets1.ignimgs.com/2019/04/24/helen-sloan---hbo-4-1556135046368_1280w.jpg,https://www.channel3000.com/entertainment/opera-singer-charity-sunshine-tillemanndick-dies/1072297269,Opera singer Charity Sunshine Tillemann-Dick dies - Channel3000.com - WISC-TV3,"Renowned soprano Charity Sunshine Tillemann-Dick, who performed worldwide after two separate lung transplants, has died, her family said.",https://static.lakana.com/mmm-global-us-east-1/photo/2019/04/25/Opera%20singer%20Singer%20Charity%20Sunshine%20Tillemann-Dick.jpg.jpg_38197548_ver1.0_1280_720.jpg,2019-04-25
135,https://www.mandatory.com/wrestlezone/news/1084267-johnny-gargano-throws-out-first-pitch-cleveland-indians,"Johnny Gargano Throws Out First Pitch For Cleveland Indians, ‘The Lost Match Of Bret Hart & Tom Magee’ Announced For Starrcast II - Mandatory","NXT Champion Johnny Gargano throws out the first pitch for the Cleveland Indians, Conrad Thompson announces 'The Lost Match Of Bret Hart & Tom Magee' for Starrcast II.",https://www.wrestlezone.com/assets/uploads/2018/08/Johnny-Gargano.jpg,https://torontosun.com/life/relationships/ask-amy-sexy-senior-singleton-seeks-same,ASK AMY: Sexy senior singleton seeks same - Toronto Sun,"Dear Amy: After 25 years, my marriage reached a dead end, and I took the leap into singledom at age 63.I am now a vibrant, attractive divorced woman with a lot to offer. I look forward to spending …",https://postmediatorontosun.files.wordpress.com/2019/04/gettyimages-1029340842-e1555627483629.jpg,2019-04-25
136,https://www.castanet.net/news/Entertainment/254652/Britney-says-she-s-OK,Britney says she's OK - Entertainment News - Castanet.net,"Britney Spears says that though her family has been stressed lately, she's doing OK.",https://www.castanet.net/content/2019/4/NYET333-413_2018_003331_p3382716.jpg,https://www.newidea.com.au/did-prince-harry-just-reveal-meghan-markles-actual-due-date,Did Prince Harry just reveal Meghan Markle's ACTUAL due date? - New Idea,Did Prince Harry just reveal Meghan Markle's ACTUAL due date?,https://www.newidea.com.au/media/54739/harry-and-meghan-baby.jpg,2019-04-25
137,https://www.cbc.ca/news/entertainment/nora-roberts-plagiarism-suit-1.5109211,"'If you plagiarize, I will come for you:' Nora Roberts sues author cited in #CopyPasteCris uproar - CBC.ca","Best-selling novelist Nora Roberts is suing a Brazilian writer for copyright infringement, alleging that Cristiane Serruya has committed 'multi-plagiarism' on a 'rare and scandalous' level.",https://i.cbc.ca/1.5109268.1556129036!/cpImage/httpImage/image.jpg_gen/derivatives/16x9_620/quill-awards.jpg,https://www.theage.com.au/entertainment/movies/daniel-craig-to-face-off-against-rami-malek-in-james-bond-s-25th-film-20190425-p51hcx.html,Daniel Craig to face off against Rami Malek in James Bond's 25th film - The Age,"The recent Oscar-winner said in a videotaped message that he'll make sure Bond ""will not have an easy ride of it"" in Bond 25.","https://static.ffx.io/images/$zoom_0.5519,$multiply_1,$ratio_1.777778,$width_1059,$x_0,$y_0/t_crop_custom/w_800/q_86,f_auto/8c332d1e89e0295d09d4152e6c669adb1bc13677",2019-04-25
138,https://www.distractify.com/p/nicole-nafziger-weight-loss,Nicole Nafziger Weight Loss 2019 — See the '90 Day Fiancé's Transformation - Distractify,"'90 Day Fiancé' fans loved seeing Nicole and Azan together. But since Nicole has been dieting and looking to change up her weight, we wanted to check in on her weight loss progress today.",https://media.distractify.com/brand-img/_C1qXlt1k/0x0/nicole-nafziger-weight-loss-2019-1556131155169.png,https://www.news.com.au/technology/online/monkey-magic-ape-uses-smartphone-to-scroll-instagram/news-story/fc37f4855773f177aefb9453abd619c8,Watch: Ape using smartphone to scroll Instagram - NEWS.com.au,Footage of an ape using a smartphone while curiously scrolling through Instagram shows the phrase ‘even a monkey can do it’ might be a little dated.,https://cdn.newsapi.com.au/image/v1/58ed976c3120d283b3e4bdad735b2385?width=650,2019-04-25
139,https://www.news.com.au/entertainment/celebrity-life/celebrities-gone-bad/too-late-to-say-sorry-justin-bieber-responds-to-coachella-lipsynching-rumours/news-story/5f0633e60770a8a3778d2bb95687e381,Justin Bieber: Singer responds to criticism over Coachella performance with Ariana Grande - NEWS.com.au,"Justin Bieber has denied lip-synching at Coachella, as he ripped into an E! reporter for criticising his comeback performance.",https://cdn.newsapi.com.au/image/v1/f813f7f6611c65e000cdced7c4cc9f18?width=650,https://www.dailymail.co.uk/tvshowbiz/article-6957605/Lil-Xan-says-hes-suspicious-girlfriend-Annie-Smiths-claims-pregnant-miscarriage.html,Lil Xan says he's suspicious of girlfriend Annie Smith's claims she was pregnant and had miscarriage - Daily Mail,The 22-year-old rap artist told No Jumper on Tuesday that he and his girlfriend are 'in limbo or some s***' amid their 'very complicated' relationship.,https://i.dailymail.co.uk/1s/2019/04/25/04/12688646-0-image-a-45_1556163237265.jpg,2019-04-25
140,https://www.mamamia.com.au/lindy-chamberlain-children/,Lindy Chamberlain on realising her son remembered the night his sister was taken by a dingo. - Mamamia,Lindy Chamberlain's son Reagan was just four years old when a dingo entered the tent he was sleeping in and took his baby sister Azaria.,https://cdn.mamamia.com.au/wp/wp-content/uploads/2019/04/25073401/lindy-chamberlain-children-s.jpg,https://pitchfork.com/news/the-black-keys-announce-new-album-lets-rock-share-new-song-eagle-birds-listen/,"The Black Keys Announce New Album “Let’s Rock”, Share New Song “Eagle Birds”: Listen - Pitchfork",Patrick Carney calls the duo’s ninth record an “homage to electric guitar”,https://media.pitchfork.com/photos/5cc0f9d36ec6086f2872c4cd/2:1/w_790/The%20Black%20Keys_PHOTO_BY_Alysse_Gafkjen.jpg,2019-04-25
141,https://www.news.com.au/lifestyle/food/eat/melbourne-cafe-handsome-her-closing-two-years-after-introducing-man-tax/news-story/cf19a4e85e46981815e498e2d3d43ed0,Vegan cafe that charged ‘man tax’ closes in Melbourne - NEWS.com.au,"A vegan cafe in Melbourne’s north, which “became the punching bag of Melbourne” after introducing an 18 per cent “man tax”, is closing down so its owner can pursue some “hands-on” work.",https://cdn.newsapi.com.au/image/v1/459d6b9e5e1d993de601826cd6e34cac?width=650,https://www.cnbc.com/2019/04/25/how-jeopardy-champ-james-holzhauer-has-won-over-1-million-dollars.html,'Jeopardy!' champ James Holzhauer has won over $1 million—here's how he keeps winning - CNBC,"""Jeopardy!"" champ James Holzhauer is less risk-averse than your traditional contestant, says Benjamin Soltoff, a data scientist at the University of the Chicago, and that's allowed him to rack up win after win on the popular game show.",https://fm.cnbc.com/applications/cnbc.com/resources/img/editorial/2019/04/24/105869731-1556131146499ap_19108059949407.1910x1000.jpg,2019-04-25
142,https://www.theage.com.au/sport/afl/richmond-s-riewoldt-set-to-be-sidelined-again-with-knee-injury-20190424-p51gzx.html,Richmond's Riewoldt set to be sidelined again with knee injury - The Age,"Tigers' star forward to undergo scans after suffering a suspected PCL injury in win over Melbourne, while Dees lick their wounds after yet another loss.","https://static.ffx.io/images/$zoom_0.6338683670477866,$multiply_1,$ratio_1.776846,$width_1059,$x_42,$y_28/t_crop_custom/w_800/q_86,f_auto/f386513033bc7b07fd8b92a2aa9edb96d66f3c18",https://news.avclub.com/bryan-cogmans-game-of-thrones-prequel-series-axed-by-hb-1834300370,Bryan Cogman's potential Game Of Thrones prequel series axed by HBO - The A.V. Club,"Bad news for fans of last week’s lovely Game Of Thrones episode. Its writer, Bryan Cogman, has revealed that his spin-off series for HBO, one of five in consideration, will not be moving forward.","https://i.kinja-img.com/gawker-media/image/upload/s--LaKgWqZU--/c_fill,fl_progressive,g_center,h_900,q_80,w_1600/nqyuor3bmmlgtzcmo9m7.jpg",2019-04-25
143,https://variety.com/2019/tv/news/jussie-smollett-empire-married-future-unclear-1203197408/,Jussie Smollett’s ‘Empire’ Character Ties the Knot as Actor’s Future on Show Is Unclear - Variety,"SPOILER ALERT: Do not read if you have not yet watched the April 24th episode of “Empire.” Jussie Smollett’s character on “Empire” got married in TV’s first-ever black, gay …",https://pmcvariety.files.wordpress.com/2019/04/empire-jussie-smollett-final-episode.jpg?w=700&h=393&crop=1,https://www.tmz.com/2019/04/25/camille-grammer-wins-suit-against-ex-bf-assault-defamation-case/,Camille Grammer Wins Suit Against Ex-BF in Assault and Defamation Case - TMZ,"Camille Grammer got a win in court against her ex-BF, in a case involving an alleged assault and defamation claims.",https://images.tmz.com/2019/04/25/0425-camille-grammer-dimitri-charalambopoulos-tmz-getty-1200x630.jpg,2019-04-25
144,https://tvline.com/2019/04/24/luke-perry-riverdale-final-episode-fred-andrews/,'Riverdale' Recap: Luke Perry's Final Episode as Fred Andrews - TVLine,This week’s Riverdale wasn’t anything out of the ordinary for Fred Andrews… but it was a special one for Luke Perry.,https://pmctvline2.files.wordpress.com/2019/04/riverdale-luke-perry-last-episode-fred-andrews.png?w=1024,https://www.essence.com/love/tamron-hall-is-a-mom-the-tv-host-announces-the-arrival-of-her-son-moses/,"Tamron Hall Is A Mom! The TV Host Announces The Arrival Of Her Son, Moses - Essence",Roll out the red carpet for Baby Moses!,https://4cjz9s2texp5a66rp37l3uty-wpengine.netdna-ssl.com/wp-content/uploads/2017/06/image/2017/06/main/ef17_website_tamron_hall_-900x600.jpg,2019-04-25
