url,title,description,urlToImage,date
413,https://www.insidehook.com/daily_brief/sports/streaking-jeopardy-contestant-explains-his-winning-strategy,Streaking “Jeopardy” Contestant Explains His Winning Strategy - insidehook.com,"James Holzhauer revealed his strategy combines big bets, a fast buzzer and bouncing around the board so he'll know the category before his opponents do.",https://www.insidehook.com/wp-content/uploads/2019/04/Screen-Shot-2019-04-18-at-9.03.01-AM.png?fit=710%2C376,https://www.who.com.au/prince-harry-and-meghan-markle-have-faced-backlash-over-this-instagram-photo,Harry and Meghan have coped backlash over this Instagram photo - Who,The Duke and Duchess of Sussex have come under fire after posting a birthday message to Prince Louis.,https://www.who.com.au/media/36613/harry-meghan-louis.jpg,2019-04-25
414,https://www.ringsidenews.com/2019/04/25/wwe-is-tacking-more-time-onto-harpers-contract-after-release-request/,WWE Is Tacking More Time Onto Harper's Contract After Release Request - Ringside News,"Harper was not being used in WWE despite the fact that his wrist surgery was all healed up. He competed twice over WrestleMania weekend, but nothing was done with him after that so he requested his release. However, WWE has other plans.As part of the",https://www.ringsidenews.com/wp-content/uploads/2019/03/harper-9499.png,https://deadline.com/2019/04/beyond-gotham-ben-mckenzie-goes-off-script-to-focus-on-new-direction-as-fox-series-ends-1202601930/,Beyond 'Gotham': Ben McKenzie Goes Off Script To Focus On New Direction As Fox Series Ends - Deadline,"Time is running out for Jim Gordon and Gotham, and nobody is more acutely aware of that fact than Ben McKenzie, the actor who has portrayed the flinty Gordon for five seasons on the Fox series that…",https://pmcdeadline2.files.wordpress.com/2019/04/gotham-510_scn60_gr0724.jpg?w=1024,2019-04-25
415,https://www.smh.com.au/entertainment/music/after-10-years-away-ray-lamontagne-is-still-all-about-the-voice-20190425-p51h2w.html,"After 10 years away, Ray LaMontagne is still all about the voice - Sydney Morning Herald",The American singer-songwriter wisely stripped back for his first Sydney show in 10 years.,"https://static.ffx.io/images/$zoom_0.4415,$multiply_1,$ratio_1.777778,$width_1059,$x_0,$y_669/t_crop_custom/w_800/q_86,f_auto/43c178d9cf1da507cde8948e7a95ff4a78e97335",https://www.buzzfeed.com/briangalindo/how-well-do-you-remember-this-past-weekends-game-of-thrones,"How Well Do You Remember This Past Weekend's ""Game Of Thrones"" Episode? - BuzzFeed",Take this and make Ser Brienne of Tarth proud!,https://img.buzzfeed.com/buzzfeed-static/static/2019-04/25/17/tmp/buzzfeed-prod-web-06/tmp-name-2-22656-1556228035-4_dblbig.jpg,2019-04-25
416,,,,,http://filmthreat.com/reviews/avengers-endgame/,Avengers: Endgame - Film Threat,"It's not much of an exaggeration to say that Avengers: Endgame is the biggest movie ever. The biggest in terms of cast, in terms of scale, in terms of budget and the biggest build up in movie history preceded by 21 films leading to a thrilling climax. So, is …",http://filmthreat.com/app/uploads/2019/04/REV-AvengersEndgame-01.jpg,2019-04-25
417,,,,,https://www.jambase.com/article/bob-dylan-rolling-thunder-revue-the-1975-live-recordings-box-set-martin-scorsese-documentary,Bob Dylan 'Rolling Thunder Revue: The 1975 Live Recordings' Box Set & Martin Scorsese Documentary Due In June - JamBase,"Bob Dylan’s ‘Rolling Thunder Revue’ tour will be chronicled in a Martin Scorsese-directed documentary and 14-CD box set, which are both due in June.",https://www.jambase.com/wp-content/uploads/2019/04/bob-dylan-rolling-thunder-box-set-martin-scorsese-documentary-featured.jpg,2019-04-25
418,,,,,https://tvline.com/2019/04/25/jane-the-virgin-series-finale-photos-gina-rodriguez/,[PHOTOS] 'Jane the Virgin' Series Finale — Behind the Scenes - TVLine,"Here come the feels: The Jane the Virgin cast took to Instagram on Wednesday to mark the end of filming on the CW dramedy, and they definitely didn’t hide their emotions about the series wrap…",https://pmctvline2.files.wordpress.com/2019/04/jane-the-virgin-series-finale.jpg?w=620,2019-04-25
419,,,,,https://metro.co.uk/2019/04/25/emmerdale-spoilers-victoria-barton-in-danger-as-her-life-changes-forever-9318123/,Emmerdale spoilers: Victoria Barton in danger as her life changes forever - Metro.co.uk,She is left in a terrifying situation.,https://i2.wp.com/metro.co.uk/wp-content/uploads/2019/04/victoria-rape-emmerdale-4cfd_1556220278.png?w=1200&h=630&crop=1&quality=90&strip=all&zoom=1&ssl=1,2019-04-25
420,,,,,https://www.dailymail.co.uk/tvshowbiz/article-6960661/Strictlys-Katya-Jones-DEFENDS-Kevin-Clifton-professional.html,Strictly's Katya Jones DEFENDS Kevin Clifton as a 'professional' - Daily Mail,Strictly's Katya Jones lauded Kevin Clifton as a 'professional' as she threw her support behind his new romance with Stacey Dooley.,https://i.dailymail.co.uk/1s/2019/04/25/19/12720778-0-image-a-57_1556216854351.jpg,2019-04-25
421,,,,,https://loudwire.com/the-black-keys-new-track-eagle-birds-lets-rock-album/,The Black Keys Unleash New Track 'Eagle Birds' - Loudwire,"Plus, get the key details on their 'Let's Rock' album.",https://townsquare.media/site/366/files/2019/03/The-Black-Keys.jpg?w=1200&h=0&zc=1&s=0&a=t&q=89,2019-04-25
422,,,,,https://www.youtube.com/watch?v=lNZr5b0oV-M,8 Minutes of Fortnite X Avengers: Endgame Gameplay - IGN,,,2019-04-25
423,,,,,https://esportsobserver.com/report-rick-fox-exit-echo-fox/,"Report: Rick Fox Set to Leave Echo Fox, Cites Racist Comments from Shareholder - The Esports Observer","Former pro basketball player and Echo Fox founder Rick Fox is leaving the organization, according to an email reportedly sent to major shareholders. In the email, Fox cites a “recent outrageous and abhorrent display of pure racism made by a significant Echo F…",https://y4j7y8s9.ssl.hwcdn.net/wp-content/uploads/2019/04/rick-fox-rumor.png,2019-04-25
424,,,,,https://www.digitalspy.com/movies/a27272796/guardians-of-the-galaxy-chris-pratt-thrilled-james-gunn-reinstated/,"Guardians star Chris Pratt ""so thrilled"" James Gunn is back as director - DigitalSpy.com","""I really stand behind it.""","https://hips.hearstapps.com/digitalspyuk.cdnds.net/17/17/1493061199-pratt2.jpg?crop=1.00xw:0.728xh;0,0.0605xh&resize=1200:*",2019-04-25
425,,,,,https://www.abc.net.au/news/2019-04-26/game-of-thrones-list-of-shocking-deaths/11001504,A bunch of Game of Thrones characters will die in the Battle of Winterfell. How will their deaths compare to the show's biggest shocks? - ABC News,"We're rating the shocking deaths of the most-loved (and most-hated) characters from Game of Thrones, as we move towards the Battle of Winterfell.",https://www.abc.net.au/news/image/11003652-16x9-700x394.jpg,2019-04-25
426,,,,,https://honey.nine.com.au/2019/04/26/10/13/william-kate-visit-harry-meghan-at-frogmore-cottage,Prince William and Kate Middleton’s secret visit to see Meghan Markle - 9Honey,What royal feud?,http://prod.static9.net.au/fs/4631a410-2ce5-4d7b-a8f5-e5abbfa2b609,2019-04-25
427,,,,,https://www.news.com.au/world/breaking-news/avengers-movie-already-on-piracy-websites/news-story/26a2fb4aa05778c08b8cfb03ef6f45fe,Avengers movie already on piracy websites - NEWS.com.au,"Disney/Marvel's Avengers: Endgame, poised to be the hugest movie opening in history, has hit piracy networks - two days before its US premiere - with a copy evidently recorded in a Chinese movie theatre now circulating online.",https://www.news.com.au/wp-content/themes/vip/newscorpau-nca/assets/dist/img/common/placeholders/newscomau-major.png,2019-04-25
428,,,,,https://lrmonline.com/news/possible-love-interest-revealed-for-star-wars-the-rise-of-skywalker-possible-spoilers/,Possible Love Interest Revealed For Star Wars: The Rise Of Skywalker (Possible Spoilers) - LRM Online,"Alright, so this could contain eventual minor spoilers for Star Wars: The Rise of Skywalker, so if you don't want anything to do with that, then turn away",http://lrmonline.com/inc/uploads/2019/04/Screen-Shot-2019-04-12-at-1.11.17-PM.png,2019-04-25
429,,,,,https://www.slashfilm.com/drafthouse-endgame-psa/,Drafthouse Endgame PSA Wants You To Avoid Spoilers - /FILM,Alamo Drafthouse urges you not to spoil Avengers: Endgame like a jerk.,https://d13ezvd6yrslxm.cloudfront.net/wp/wp-content/images/Drafthouse-Endgame-PSA.jpg,2019-04-25
430,,,,,https://www.theaustralian.com.au/business/the-wall-street-journal/out-of-the-shadows-army-of-stealth-avengers-has-filmgoers-seeing-double/news-story/1b23b19e1e7b2d5d6e0e9609d85203b5,"Out of the shadows, army of stealth Avengers has filmgoers seeing double - The Australian","Subscribe to The Australian to get unrestricted digital access, home paper delivery, Apps for iPad and Android, member only +Rewards and much more...",,2019-04-25
431,,,,,https://www.foxnews.com/entertainment/scarlett-johansson-democratic-party-broken,"Scarlett Johansson says 'Democratic Party is broken in a lot of ways,' reveals if she'd ever run for office - Fox News","The ""Avengers: Endgame"" star recently revealed that she's not ruling the possibility of a campaign out.",https://static.foxnews.com/foxnews.com/content/uploads/2019/04/GettyImages-1138774793.jpg,2019-04-25
432,,,,,https://www.gamespot.com/articles/avengers-endgame-when-can-you-go-pee/1100-6466426/,Avengers: Endgame Pee Breaks -- We Tell You When It's Safe To Use The Bathroom - GameSpot,The concluding movie of the MCU's Infinity Saga is three hours long. We've identified the safest moments to leave the theater to relieve yourself in the bathroom.,https://static.gamespot.com/uploads/screen_kubrick/1581/15811374/3526019-infinity+war+doctor+strange.jpeg,2019-04-25
433,,,,,https://www.vox.com/culture/2019/4/25/18516720/taylor-swift-countdown-single-me-brandon-urie,"Taylor Swift’s coundown ends with a new single, “ME!” - Vox.com","Turns out for Taylor Swift, Reputation preceded “ME!”",https://cdn.vox-cdn.com/thumbor/c40f-215U36sAHs-peBYcKsws0I=/0x0:4441x2325/fit-in/1200x630/cdn.vox-cdn.com/uploads/chorus_asset/file/16192589/1144701006.jpg.jpg,2019-04-25
434,,,,,https://pagesix.com/2019/04/25/its-over-for-pete-davidson-and-kate-beckinsale/,It's over for Pete Davidson and Kate Beckinsale - Page Six,"“Even though Kate has been in Hollywood for a long time, she struggled with the attention on her relationship with Pete. He lives his life with his heart on his sleeve.”",https://nyppagesix.files.wordpress.com/2019/03/kate-pete.jpg?quality=90&strip=all&w=1200,2019-04-25
435,,,,,https://nypost.com/2019/04/25/jeopardys-james-holzhauer-wins-again-as-boring-streak-hits-16/,'Jeopardy!'s James Holzhauer wins again as 'boring' streak hits 16 - New York Post ,"When it comes to “Jeopardy!” titans, game recognizes game. James Holzhauer, a professional gambler from Las Vegas, Nev., won his 16th consecutive “Jeopardy!” match Thursday night. While the streak …",https://thenypost.files.wordpress.com/2019/04/jeopardy-james-holzhauer-brad-rutter-roger-craig.jpg?quality=90&strip=all&w=1200,2019-04-25
436,,,,,https://www.thisisinsider.com/game-of-thrones-battle-of-winterfell-what-to-expect-2019-4,What to expect on Sundays' epic 'Game of Thrones' battle episode - INSIDER,"Based on trailer details, released photos, and set interviews, we've compiled everything HBO has teased about the Battle of Winterfell on Sunday.",https://amp.thisisinsider.com/images/5cc238f70ff30d285b6e43e2-1136-568.jpg,2019-04-25
437,,,,,https://www.hotnewhiphop.com/french-montana-and-khloe-kardashian-are-friendly-but-not-dating-report-news.78359.html,"French Montana & Khloe Kardashian Are ""Friendly"" But Not Dating: Report - HotNewHipHop","French Montana and Khloe Kardashian are keeping it cordial after her baby daddy allegedly cheated on her with Jordyn Woods. If you've ever tried to sort of the web of who the Kardashians-Jenners have dated, you'd probably find yourself confused. For some reas…",https://www.hotnewhiphop.com/image/740x416/cover/1556231267_be7afc7dfd7d76f2cba04892be0a6812.jpg/86d128c66e6f0dcda4408847242b41de/1556231267_4d72d01d5a9cbe99ff451a5a8fe266cb.jpg,2019-04-25
438,,,,,https://www.dailymail.co.uk/femail/article-6960439/Grand-Designs-viewers-desperate-know-strained-couple-ambiguous-ending.html,Grand Designs viewers desperate to know if strained couple are still together after ambiguous ending - Daily Mail,Grand Designs viewers were left dying to know if a couple of 24-year-olds from Hertfordshire are still together after they expressed doubts about their relationships halfway through building a house.,https://i.dailymail.co.uk/1s/2019/04/25/22/12726434-0-image-a-189_1556227764199.jpg,2019-04-25
439,,,,,https://www.express.co.uk/celebrity-news/1119048/Stacey-Dooley-Twitter-Seann-Walsh-Rebecca-Humphries-Kevin-Clifton,Stacey Dooley reacts after Seann Walsh's actress ex Rebecca Humphries makes jibe - Express,STACEY DOOLEY chipped in after Seann Walsh’s actress ex-girlfriend Rebecca Humphries threw out a cheeky jibe about a certain type of person on Twitter.,https://cdn.images.express.co.uk/img/dynamic/79/750x445/1119048.jpg,2019-04-25
440,,,,,https://www.mandatory.com/wrestlezone/news/1084875-dean-malenko-quits-wwe-backstage-agent,Dean Malenko Quits WWE After 8 Years as a Backstage Agent - Mandatory,Dean Malenko is out of WWE after eight years of serving as a backstage agent. Could the former WCW star be headed to AEW?,https://www.wrestlezone.com/assets/uploads/2018/08/Dean-Malenko.jpg,2019-04-25
441,,,,,https://www.youtube.com/watch?v=IqLajtwQSp0,Ariana Grande Reacts To Justin Bieber Coachella Lip Sync Backlash - HollywoodLife,,,2019-04-25
442,,,,,https://www.dailymail.co.uk/tvshowbiz/article-6961117/Jennifer-Lopez-carries-script-rushed-set-Hustlers.html,Jennifer Lopez carries a script as she rushed onto the set of Hustlers - Daily Mail,"The 49-year-old pop star dressed all in white, from her striped sweatpants and sweatshirt all the way down to her phone case. Earlier she was seen with a cigarette.",https://i.dailymail.co.uk/1s/2019/04/25/21/12724536-0-image-a-70_1556224049116.jpg,2019-04-25
443,,,,,https://www.thisisinsider.com/lori-loughlin-college-admissions-scam-ignorance-plea-report-2019-4,Lori Loughlin reportedly plans to say she didn't know about the scam to get her kids into USC — even though they were admitted for a sport they don't play - Business Insider,"Lori Loughlin and her husband, Mossimo Giannulli, plan to argue they didn't know about the scam to get their daughters into USC.",https://amp.thisisinsider.com/images/5cc1f5e3d4ca47199864e792-1920-960.jpg,2019-04-25
444,,,,,https://celebrity.nine.com.au/2019/04/26/09/59/britney-spears-leaves-treatment-facility,Britney Spears leaves treatment facility - 9Honey,She was staying there for undisclosed mental health issues.,http://prod.static9.net.au/fs/6aa175c8-b766-48b8-b36b-2f54d2cf705d,2019-04-25
445,,,,,https://www.news.com.au/entertainment/movies/movie-trailers/chris-hemsworth-stars-in-actionpacked-trailer-for-men-in-black/news-story/28511af221c5b70318e080e62b23ce6c,Chris Hemsworth | Avengers: Endgame star appears in Men in Black trailer - NEWS.com.au,"He stars in one of the biggest blockbusters of the year, Avengers: Endgame, but Chris Hemsworth is already teasing his next Hollywood move.",https://cdn.newsapi.com.au/image/v1/61f988c5ebc739fc72da95cd84cc413b?width=650,2019-04-25
446,,,,,https://junkee.com/avengers-endgame-bathroom-break/202955,Avengers Endgame: The Best Time To Take A Toilet Break - Junkee,Your bladder will thank you.,https://junkee.com/wp-content/uploads/2018/12/Avengers-Endgame.png,2019-04-25
447,,,,,https://www.newidea.com.au/why-princess-beatrice-didnt-curtsy-the-queen,Royal shock: Why Princess Beatrice didn't curtsy to the Queen - New Idea,It's the royal moment that has everyone buzzing,https://www.newidea.com.au/media/54780/screen-shot-2019-04-26-at-95121-am.png,2019-04-25
448,,,,,https://www.newidea.com.au/meghan-markle-prince-harry-latest-instagram-post-royal-family-news,Meghan Markle and Prince Harry send royal fans into meltdown with latest Instagram post - New Idea,"Meghan Markle is due to give birth any day now, and for weeks fans of Prince Harry and the former actress have been waiting for with baited breath and post notifications turned on for the first news of Baby Sussex.  The Duke and Duchess sent followers into me…",https://www.newidea.com.au/media/54750/untitled-design-10.png,2019-04-25
449,,,,,https://hollywoodlife.com/2019/04/25/jonas-brothers-songs-about-sophie-turner-priyanka-chopra/,Jonas Brothers Reveal New Album Will Have ‘Love Letter’ To Sophie Turner & Ode To Priyanka Chopra - Hollywood Life,Nick and Joe Jonas are 'Burnin' Up' for Priyanka Chopra and Sophie Turner. The Jonas Brothers revealed in a new interview that two songs off 'Happiness Begins' are about their loves.,https://pmchollywoodlife.files.wordpress.com/2019/04/joe-jonas-nick-jonas-love-letter-ftr.jpg,2019-04-25
450,,,,,https://www.cnn.com/2019/04/25/entertainment/gotham-series-finale/index.html,'Gotham' finale leaps into the Dark Knight - CNN,"""Gotham"" comes to an end after five seasons. (SPOILERS)",https://cdn.cnn.com/cnnnext/dam/assets/190422125822-gotham-series-finale-super-tease.jpg,2019-04-25
451,,,,,https://www.foxnews.com/entertainment/stefanie-sherk-cause-of-death-revealed,Canadian actress and model Stefanie Sherk's cause of death revealed - Fox News,Canadian actress and model Stefanie Sherk's cause of death has been revealed.,https://static.foxnews.com/foxnews.com/content/uploads/2019/04/AP19114780699737.jpg,2019-04-25
452,,,,,https://deadline.com/2019/04/beetlejuice-broadway-review-musical-theater-alex-brightman-sophia-anne-caruso-1202601783/,"‘Beetlejuice’ Broadway Review: It’s Showtime, Ready Or Not - Deadline","Maybe if they’d said it a fourth time. Three times – “Beetlejuice! Beetlejuice! Beetlejuice!” – summons to life the stripe-coated, fright-wigged demon that made a supe…",https://pmcdeadline2.files.wordpress.com/2019/04/16817_rob-mcclure-kerry-butler-sophia-anne-caruso-alex-brightman-in-beetlejuice-photo-by-matthew-murphy-2019.jpg?w=1024,2019-04-25
453,,,,,https://www.vibe.com/2019/04/blac-chyna-not-accepted-harvard,Blac Chyna Not Accepted To Business School: Report - Vibe,,https://static.vibe.com/files/2019/04/blac-chyna-not-accepted-harvard-1556238364.jpg,2019-04-25
454,,,,,https://hollywoodlife.com/feature/who-is-zack-clayton-carpinello-jwoww-boyfriend/,Who Is Zack Clayton Carpinello? 5 Facts About JWoww's Boyfriend - Hollywood Life,"Get to know JWoww's new boyfriend, who is a 24-year-old professional wrestler!",https://pmchollywoodlife.files.wordpress.com/2019/04/zack-clayton-carpinello-jwoww-new-bf-ftr.jpg,2019-04-25
455,,,,,https://www.youtube.com/watch?v=hF0tZBGiII8,Lil Nas X Might Change His Name Because Nas Is A Legend - HipHopDX,,,2019-04-25
456,,,,,https://www.aol.com/article/entertainment/2019/04/25/blake-lively-wore-this-mall-brand-on-the-red-carpet-and-pretended-it-was-vintage/23717354/,Blake Lively wore this mall brand on the red carpet and pretended it was vintage - AOL,"Before she became a reigning fashion queen, Blake Lively was still frequenting the mall on a regular basis.",https://o.aolcdn.com/images/dims3/GLOB/legacy_thumbnail/1028x675/format/jpg/quality/85/https%3A%2F%2Fs.yimg.com%2Fos%2Fcreatr-images%2F2019-04%2Fec73e920-6798-11e9-bffe-776d4dfec5ea,2019-04-25
457,,,,,https://www.youtube.com/watch?v=PstFhISLJSE,'The Big Bang Theory' Star Melissa Rauch Talks Best Moments On The Show - TODAY,"Melissa Rauch has played Bernadette Rostenkowski on “Big Bang Theory” since 2009. As the show approaches its series finale, she reflects on her character’s b...",https://i.ytimg.com/vi/PstFhISLJSE/maxresdefault.jpg,2019-04-25
458,,,,,https://www.mirror.co.uk/tv/tv-news/eastenders-sharon-mitchell-furious-after-14626745,EastEnders' Sharon Mitchell furious after discovering Phil's shocking secret - Mirror Online,Sharon was infuriated after finding out that Phil had gambled away their future on EastEnders,https://i2-prod.mirror.co.uk/incoming/article14626730.ece/ALTERNATES/s1200/0_RLP_MDG_250419EE_17142JPG.jpg,2019-04-25
459,,,,,https://www.nme.com/news/music/the-black-keys-announce-new-album-lets-rock-single-eagle-birds-2480838,The Black Keys announce new album ‘“Let’s Rock”’ and share new single ‘Eagle Birds’ - NME Live,"The Black Keys have announced details of ‘“Let’s Rock”’, their first new album in 5 years - hear their latest single 'Eagle Birds' now.",https://ksassets.timeincuk.net/wp/uploads/sites/55/2019/04/blackkeys.jpg,2019-04-25
460,,,,,https://www.f4wonline.com/wwe-news/b-team-officially-join-wwe-smackdown-latest-roster-changes-282386,B-Team officially join WWE SmackDown in latest roster changes - Figure Four Online,WWE is continuing to make roster changes despite the Superstar Shake-up happening last week.,https://www.f4wonline.com/sites/www.f4wonline.com/files/field/image/bteam.jpg,2019-04-25
461,,,,,https://www.eonline.com/ca/news/1035684/a-bunch-of-bachelor-stars-are-doing-a-reality-series-about-life-after-the-show,A Bunch of Bachelor Stars Are Doing a Reality Series About Life After the Show - E! Online,"Ashley Iaconetti, Jared Haibon, Nick Viall and more alums will take part in the 6-episode digital series","https://akns-images.eonline.com/eol_images/Entire_Site/201878/rs_600x600-180808040927-600-Ashley-Iaconetti-Jared-Haibon-Disney-ABC-Summer-Press-LT-080818.jpg?fit=around|600:467&crop=600:467;center,top&output-quality=90",2019-04-25
462,,,,,https://style.nine.com.au/2019/04/26/09/33/north-west-style,North West has a meltdown over Kim's thigh high boots - 9Style,North West's fashion meltdown is all of us most days,http://prod.static9.net.au/fs/89dbcd23-9f78-4b88-9fce-2fe30771f06f,2019-04-25
463,,,,,https://www.newidea.com.au/married-at-first-sight-ines-basic-shock-career-change-fashion-influencer-mafs,Married At First Sight: Ines Basic's shock career change - New Idea,She made headlines for months as the resident villain on Married At First Sight. But it seems Ines Basic is ready to put her reality TV days behind her and leverage her newfound notoriety in the fashion industry instead.  The Bosnian-born bad girl has made a …,https://www.newidea.com.au/media/54798/untitled-design-13.png,2019-04-25
464,,,,,https://www.newidea.com.au/reports-prince-harry-is-meghan-markles-servant,Royal Fury: Expert reveals Prince Harry acts like Meghan Markle's 'servant' - New Idea,"A shocking new claim from Princess Diana's astrologer Debbie Frank suggests that Prince Harry would ""do anything"" for his wife Meghan Markle, insinuating he is doting to a fault.According to Frank, the Duke and Duchess of Sussex's zodiac signs make them a com…",https://www.newidea.com.au/media/54786/meghan-header.jpg,2019-04-25
465,,,,,https://www.dailymail.co.uk/tvshowbiz/article-6961475/MAFS-fans-say-Jules-Robinson-Cameron-Merchant-changed-fame.html,MAFS fans say Jules Robinson and Cameron Merchant have been 'changed by fame' - Daily Mail,Their love story captivated viewers on this year's season of Married At First Sight.,https://i.dailymail.co.uk/1s/2019/04/26/00/12729722-0-image-a-5_1556233374151.jpg,2019-04-25
466,,,,,https://www.gizmodo.com.au/2019/04/peter-parker-and-mysterio-will-be-allies-in-spider-man-far-from-home/,Peter Parker And Mysterio Will Be Allies In Spider-Man: Far From Home - Gizmodo Australia,"In Marvel’s comics, Peter Parker’s got a nasty (but endearing) habit of making friends with people who are destined to become some of Spider-Man’s mortal enemies. That quirk is just as important to the Spider-Man mythos as the radioactive spider bite, and fro…","https://i.kinja-img.com/gawker-media/image/upload/c_lfill,w_768,q_90/xgkbxy33ipzhe32ulkms.jpg",2019-04-25
467,,,,,https://www.dailymail.co.uk/tvshowbiz/article-6961263/Portia-Rossi-46-flaunts-age-defying-beauty-trendy-ensemble-New-York.html,"Portia de Rossi, 46, flaunts her age-defying beauty in a trendy ensemble in New York - Daily Mail","The former Ally McBeal star, 46, looked every inch the Hollywood glamazon as she stepped out in New York City on Wednesday",https://i.dailymail.co.uk/1s/2019/04/25/22/12727252-0-image-a-6_1556229509875.jpg,2019-04-25
468,,,,,https://hollywoodlife.com/feature/who-is-rose-hanbury/,Who Is Rose Hanbury? 5 Things On The Marchioness of Cholmondeley - Hollywood Life,"Rose Hanbury is quite connected to Prince William and Kate Middleton, and not just because of cheating rumors that linked her to the royal couple. The socialite holds her own position within the aristocratic community.",https://pmchollywoodlife.files.wordpress.com/2019/04/rose-hanbury-ftr.jpg,2019-04-25
469,,,,,https://nypost.com/2019/04/25/beetlejuice-review-musical-is-a-coke-snorting-f-bombing-disaster/,"'Beetlejuice' review: Musical is a coke-snorting, F-bombing disaster - New York Post ","If we say his name three times, will he go away? I’m not talking about the title character of “Beetlejuice,” which opened Thursday night, but Eddie Perfect. Fresh off his heinous music for “King Ko…",https://thenypost.files.wordpress.com/2019/04/beetlejuice-matthew-murphy.jpg?quality=90&strip=all&w=1200,2019-04-25
470,,,,,http://extratv.com/2019/04/25/late-night-call-why-kim-kardashians-son-saint-ended-up-in-the-e-r/,Late-Night Call! Why Kim Kardashian's Son Saint 'Ended Up in the E.R.' - Extra,Famed momager Kris Jenner is opening up about a late-night call that no grandma wants!,https://media.extratv.com/2019/04/25/kim-kardashian-saint-instagram-1200x630.jpg,2019-04-25
